quote_date,shop_code,item_id_raw,region,price,indicator_box,item_id,date,date2,date3,date4,year,month,quarter
198802,71,220303,2,.5,,220303,1,01-02-1988,01-02-1988,1988-02-01,1988,2,1
198802,67,220303,2,.58999997,,220303,1,01-02-1988,01-02-1988,1988-02-01,1988,2,1
198802,22,220303,2,.5,,220303,1,01-02-1988,01-02-1988,1988-02-01,1988,2,1
198802,24,220303,2,.46000001,,220303,1,01-02-1988,01-02-1988,1988-02-01,1988,2,1
198802,23,220303,2,.64999998,,220303,1,01-02-1988,01-02-1988,1988-02-01,1988,2,1
198802,73,220303,2,.55000001,,220303,1,01-02-1988,01-02-1988,1988-02-01,1988,2,1
198802,36,220303,2,.64999998,,220303,1,01-02-1988,01-02-1988,1988-02-01,1988,2,1
198802,21,220303,2,.75,,220303,1,01-02-1988,01-02-1988,1988-02-01,1988,2,1
198802,3,220303,2,.54000002,,220303,1,01-02-1988,01-02-1988,1988-02-01,1988,2,1
198802,25,220303,2,.60000002,,220303,1,01-02-1988,01-02-1988,1988-02-01,1988,2,1
198802,61,220303,2,.60000002,,220303,1,01-02-1988,01-02-1988,1988-02-01,1988,2,1
198802,75,220303,2,.60000002,,220303,1,01-02-1988,01-02-1988,1988-02-01,1988,2,1
198803,40,220303,2,1,,220303,2,01-03-1988,01-03-1988,1988-03-01,1988,3,1
198803,3,220303,2,.54000002,,220303,2,01-03-1988,01-03-1988,1988-03-01,1988,3,1
198803,17,220303,2,.60000002,,220303,2,01-03-1988,01-03-1988,1988-03-01,1988,3,1
198803,61,220303,2,.60000002,,220303,2,01-03-1988,01-03-1988,1988-03-01,1988,3,1
198803,36,220303,2,.64999998,,220303,2,01-03-1988,01-03-1988,1988-03-01,1988,3,1
198803,21,220303,2,.75,,220303,2,01-03-1988,01-03-1988,1988-03-01,1988,3,1
198803,24,220303,2,.46000001,,220303,2,01-03-1988,01-03-1988,1988-03-01,1988,3,1
198803,22,220303,2,.55000001,,220303,2,01-03-1988,01-03-1988,1988-03-01,1988,3,1
198803,75,220303,2,.60000002,,220303,2,01-03-1988,01-03-1988,1988-03-01,1988,3,1
198804,70,220303,2,.60000002,,220303,3,01-04-1988,01-04-1988,1988-04-01,1988,4,2
198804,3,220303,2,.57999998,,220303,3,01-04-1988,01-04-1988,1988-04-01,1988,4,2
198804,75,220303,2,.60000002,,220303,3,01-04-1988,01-04-1988,1988-04-01,1988,4,2
198804,61,220303,2,.60000002,,220303,3,01-04-1988,01-04-1988,1988-04-01,1988,4,2
198804,21,220303,2,.75,,220303,3,01-04-1988,01-04-1988,1988-04-01,1988,4,2
198804,17,220303,2,.69999999,,220303,3,01-04-1988,01-04-1988,1988-04-01,1988,4,2
198804,40,220303,2,1,,220303,3,01-04-1988,01-04-1988,1988-04-01,1988,4,2
198804,25,220303,2,.60000002,,220303,3,01-04-1988,01-04-1988,1988-04-01,1988,4,2
198804,24,220303,2,.46000001,,220303,3,01-04-1988,01-04-1988,1988-04-01,1988,4,2
198804,36,220303,2,.64999998,,220303,3,01-04-1988,01-04-1988,1988-04-01,1988,4,2
198804,23,220303,2,.64999998,,220303,3,01-04-1988,01-04-1988,1988-04-01,1988,4,2
198804,22,220303,2,.5,,220303,3,01-04-1988,01-04-1988,1988-04-01,1988,4,2
198805,17,220303,2,.69999999,,220303,4,01-05-1988,01-05-1988,1988-05-01,1988,5,2
198805,70,220303,2,.60000002,,220303,4,01-05-1988,01-05-1988,1988-05-01,1988,5,2
198805,3,220303,2,.57999998,,220303,4,01-05-1988,01-05-1988,1988-05-01,1988,5,2
198805,71,220303,2,.80000001,,220303,4,01-05-1988,01-05-1988,1988-05-01,1988,5,2
198805,36,220303,2,.64999998,,220303,4,01-05-1988,01-05-1988,1988-05-01,1988,5,2
198805,21,220303,2,.75,,220303,4,01-05-1988,01-05-1988,1988-05-01,1988,5,2
198805,73,220303,2,.55000001,,220303,4,01-05-1988,01-05-1988,1988-05-01,1988,5,2
198805,61,220303,2,.60000002,,220303,4,01-05-1988,01-05-1988,1988-05-01,1988,5,2
198805,22,220303,2,.5,,220303,4,01-05-1988,01-05-1988,1988-05-01,1988,5,2
198805,75,220303,2,.60000002,,220303,4,01-05-1988,01-05-1988,1988-05-01,1988,5,2
198805,40,220303,2,1.1,,220303,4,01-05-1988,01-05-1988,1988-05-01,1988,5,2
198805,23,220303,2,.64999998,,220303,4,01-05-1988,01-05-1988,1988-05-01,1988,5,2
198806,89,220303,2,.62,,220303,5,01-06-1988,01-06-1988,1988-06-01,1988,6,2
198806,18,220303,2,.51999998,,220303,5,01-06-1988,01-06-1988,1988-06-01,1988,6,2
198806,71,220303,2,.80000001,,220303,5,01-06-1988,01-06-1988,1988-06-01,1988,6,2
198806,17,220303,2,.69999999,,220303,5,01-06-1988,01-06-1988,1988-06-01,1988,6,2
198806,73,220303,2,.55000001,,220303,5,01-06-1988,01-06-1988,1988-06-01,1988,6,2
198806,75,220303,2,.60000002,,220303,5,01-06-1988,01-06-1988,1988-06-01,1988,6,2
198806,22,220303,2,.5,,220303,5,01-06-1988,01-06-1988,1988-06-01,1988,6,2
198806,3,220303,2,.57999998,,220303,5,01-06-1988,01-06-1988,1988-06-01,1988,6,2
198806,23,220303,2,.64999998,,220303,5,01-06-1988,01-06-1988,1988-06-01,1988,6,2
198806,24,220303,2,.40000001,,220303,5,01-06-1988,01-06-1988,1988-06-01,1988,6,2
198806,61,220303,2,.60000002,,220303,5,01-06-1988,01-06-1988,1988-06-01,1988,6,2
198806,36,220303,2,.64999998,,220303,5,01-06-1988,01-06-1988,1988-06-01,1988,6,2
198806,70,220303,2,.60000002,,220303,5,01-06-1988,01-06-1988,1988-06-01,1988,6,2
198807,22,220303,2,.5,,220303,6,01-07-1988,01-07-1988,1988-07-01,1988,7,3
198807,40,220303,2,1.1,,220303,6,01-07-1988,01-07-1988,1988-07-01,1988,7,3
198807,17,220303,2,.69999999,,220303,6,01-07-1988,01-07-1988,1988-07-01,1988,7,3
198807,25,220303,2,.60000002,,220303,6,01-07-1988,01-07-1988,1988-07-01,1988,7,3
198807,61,220303,2,.60000002,,220303,6,01-07-1988,01-07-1988,1988-07-01,1988,7,3
198807,89,220303,2,.62,,220303,6,01-07-1988,01-07-1988,1988-07-01,1988,7,3
198807,73,220303,2,.55000001,,220303,6,01-07-1988,01-07-1988,1988-07-01,1988,7,3
198807,12,220303,2,.75999999,,220303,6,01-07-1988,01-07-1988,1988-07-01,1988,7,3
198807,71,220303,2,.80000001,,220303,6,01-07-1988,01-07-1988,1988-07-01,1988,7,3
198807,3,220303,2,.57999998,,220303,6,01-07-1988,01-07-1988,1988-07-01,1988,7,3
198807,67,220303,2,.68000001,,220303,6,01-07-1988,01-07-1988,1988-07-01,1988,7,3
198807,48,220303,2,.47999999,,220303,6,01-07-1988,01-07-1988,1988-07-01,1988,7,3
198807,18,220303,2,.51999998,,220303,6,01-07-1988,01-07-1988,1988-07-01,1988,7,3
198807,70,220303,2,.60000002,,220303,6,01-07-1988,01-07-1988,1988-07-01,1988,7,3
198807,75,220303,2,.60000002,,220303,6,01-07-1988,01-07-1988,1988-07-01,1988,7,3
198807,24,220303,2,.40000001,,220303,6,01-07-1988,01-07-1988,1988-07-01,1988,7,3
198809,12,220303,2,.75999999,,220303,8,01-09-1988,01-09-1988,1988-09-01,1988,9,3
198809,48,220303,2,.47999999,,220303,8,01-09-1988,01-09-1988,1988-09-01,1988,9,3
198809,17,220303,2,.75,,220303,8,01-09-1988,01-09-1988,1988-09-01,1988,9,3
198809,18,220303,2,.55000001,,220303,8,01-09-1988,01-09-1988,1988-09-01,1988,9,3
198809,40,220303,2,1.15,,220303,8,01-09-1988,01-09-1988,1988-09-01,1988,9,3
198809,24,220303,2,.40000001,,220303,8,01-09-1988,01-09-1988,1988-09-01,1988,9,3
198809,70,220303,2,.64999998,,220303,8,01-09-1988,01-09-1988,1988-09-01,1988,9,3
198809,21,220303,2,.75,,220303,8,01-09-1988,01-09-1988,1988-09-01,1988,9,3
198809,22,220303,2,.5,,220303,8,01-09-1988,01-09-1988,1988-09-01,1988,9,3
198809,3,220303,2,.57999998,,220303,8,01-09-1988,01-09-1988,1988-09-01,1988,9,3
198809,71,220303,2,.80000001,,220303,8,01-09-1988,01-09-1988,1988-09-01,1988,9,3
198809,23,220303,2,.64999998,,220303,8,01-09-1988,01-09-1988,1988-09-01,1988,9,3
198809,89,220303,2,.62,,220303,8,01-09-1988,01-09-1988,1988-09-01,1988,9,3
198810,3,220303,2,.57999998,,220303,9,01-10-1988,01-10-1988,1988-10-01,1988,10,4
198810,18,220303,2,.55000001,,220303,9,01-10-1988,01-10-1988,1988-10-01,1988,10,4
198810,89,220303,2,.62,,220303,9,01-10-1988,01-10-1988,1988-10-01,1988,10,4
198810,40,220303,2,1.15,,220303,9,01-10-1988,01-10-1988,1988-10-01,1988,10,4
198810,17,220303,2,.75,,220303,9,01-10-1988,01-10-1988,1988-10-01,1988,10,4
198810,70,220303,2,.64999998,,220303,9,01-10-1988,01-10-1988,1988-10-01,1988,10,4
198810,22,220303,2,.5,,220303,9,01-10-1988,01-10-1988,1988-10-01,1988,10,4
198810,67,220303,2,.68000001,,220303,9,01-10-1988,01-10-1988,1988-10-01,1988,10,4
198810,71,220303,2,.80000001,,220303,9,01-10-1988,01-10-1988,1988-10-01,1988,10,4
198810,25,220303,2,.60000002,,220303,9,01-10-1988,01-10-1988,1988-10-01,1988,10,4
198810,73,220303,2,.55000001,,220303,9,01-10-1988,01-10-1988,1988-10-01,1988,10,4
198810,21,220303,2,.80000001,,220303,9,01-10-1988,01-10-1988,1988-10-01,1988,10,4
198810,48,220303,2,.47999999,,220303,9,01-10-1988,01-10-1988,1988-10-01,1988,10,4
198811,70,220303,2,.64999998,,220303,10,01-11-1988,01-11-1988,1988-11-01,1988,11,4
198811,89,220303,2,.64999998,,220303,10,01-11-1988,01-11-1988,1988-11-01,1988,11,4
198811,48,220303,2,.55000001,,220303,10,01-11-1988,01-11-1988,1988-11-01,1988,11,4
198811,22,220303,2,.5,,220303,10,01-11-1988,01-11-1988,1988-11-01,1988,11,4
198811,18,220303,2,.55000001,,220303,10,01-11-1988,01-11-1988,1988-11-01,1988,11,4
198811,23,220303,2,.64999998,,220303,10,01-11-1988,01-11-1988,1988-11-01,1988,11,4
198811,24,220303,2,.44999999,,220303,10,01-11-1988,01-11-1988,1988-11-01,1988,11,4
198811,3,220303,2,.57999998,,220303,10,01-11-1988,01-11-1988,1988-11-01,1988,11,4
198811,61,220303,2,.69999999,,220303,10,01-11-1988,01-11-1988,1988-11-01,1988,11,4
198811,75,220303,2,.64999998,,220303,10,01-11-1988,01-11-1988,1988-11-01,1988,11,4
198811,17,220303,2,.75,,220303,10,01-11-1988,01-11-1988,1988-11-01,1988,11,4
198811,67,220303,2,.68000001,,220303,10,01-11-1988,01-11-1988,1988-11-01,1988,11,4
198811,71,220303,2,.80000001,,220303,10,01-11-1988,01-11-1988,1988-11-01,1988,11,4
198811,21,220303,2,.85000002,,220303,10,01-11-1988,01-11-1988,1988-11-01,1988,11,4
198811,73,220303,2,.55000001,,220303,10,01-11-1988,01-11-1988,1988-11-01,1988,11,4
198811,12,220303,2,.75999999,,220303,10,01-11-1988,01-11-1988,1988-11-01,1988,11,4
198811,25,220303,2,.60000002,,220303,10,01-11-1988,01-11-1988,1988-11-01,1988,11,4
198811,40,220303,2,1.15,,220303,10,01-11-1988,01-11-1988,1988-11-01,1988,11,4
198812,21,220303,2,.85000002,,220303,11,01-12-1988,01-12-1988,1988-12-01,1988,12,4
198812,48,220303,2,.55000001,,220303,11,01-12-1988,01-12-1988,1988-12-01,1988,12,4
198812,22,220303,2,.5,,220303,11,01-12-1988,01-12-1988,1988-12-01,1988,12,4
198812,61,220303,2,.69999999,,220303,11,01-12-1988,01-12-1988,1988-12-01,1988,12,4
198812,89,220303,2,.64999998,,220303,11,01-12-1988,01-12-1988,1988-12-01,1988,12,4
198812,73,220303,2,.55000001,,220303,11,01-12-1988,01-12-1988,1988-12-01,1988,12,4
198812,3,220303,2,.57999998,,220303,11,01-12-1988,01-12-1988,1988-12-01,1988,12,4
198812,67,220303,2,.68000001,,220303,11,01-12-1988,01-12-1988,1988-12-01,1988,12,4
198812,25,220303,2,.60000002,,220303,11,01-12-1988,01-12-1988,1988-12-01,1988,12,4
198812,71,220303,2,.80000001,,220303,11,01-12-1988,01-12-1988,1988-12-01,1988,12,4
198812,70,220303,2,.64999998,,220303,11,01-12-1988,01-12-1988,1988-12-01,1988,12,4
198812,17,220303,2,.75,,220303,11,01-12-1988,01-12-1988,1988-12-01,1988,12,4
198812,75,220303,2,.64999998,,220303,11,01-12-1988,01-12-1988,1988-12-01,1988,12,4
198901,89,220303,2,.64999998,,220303,12,01-01-1989,01-01-1989,1989-01-01,1989,1,1
198901,40,220303,2,1.15,,220303,12,01-01-1989,01-01-1989,1989-01-01,1989,1,1
198901,48,220303,2,.47999999,,220303,12,01-01-1989,01-01-1989,1989-01-01,1989,1,1
198901,61,220303,2,.69999999,,220303,12,01-01-1989,01-01-1989,1989-01-01,1989,1,1
198901,22,220303,2,.5,,220303,12,01-01-1989,01-01-1989,1989-01-01,1989,1,1
198901,25,220303,2,.60000002,,220303,12,01-01-1989,01-01-1989,1989-01-01,1989,1,1
198901,18,220303,2,.47999999,,220303,12,01-01-1989,01-01-1989,1989-01-01,1989,1,1
198901,75,220303,2,.64999998,,220303,12,01-01-1989,01-01-1989,1989-01-01,1989,1,1
198901,21,220303,2,.75,,220303,12,01-01-1989,01-01-1989,1989-01-01,1989,1,1
198901,12,220303,2,.80000001,,220303,12,01-01-1989,01-01-1989,1989-01-01,1989,1,1
198901,17,220303,2,.75,,220303,12,01-01-1989,01-01-1989,1989-01-01,1989,1,1
198901,3,220303,2,.57999998,,220303,12,01-01-1989,01-01-1989,1989-01-01,1989,1,1
198903,48,220303,2,.47999999,,220303,14,01-03-1989,01-03-1989,1989-03-01,1989,3,1
198903,12,220303,2,.89999998,,220303,14,01-03-1989,01-03-1989,1989-03-01,1989,3,1
198903,17,220303,2,.75,,220303,14,01-03-1989,01-03-1989,1989-03-01,1989,3,1
198903,25,220303,2,.60000002,,220303,14,01-03-1989,01-03-1989,1989-03-01,1989,3,1
198903,22,220303,2,.5,,220303,14,01-03-1989,01-03-1989,1989-03-01,1989,3,1
198903,21,220303,2,.75,,220303,14,01-03-1989,01-03-1989,1989-03-01,1989,3,1
198903,3,220303,2,.57999998,,220303,14,01-03-1989,01-03-1989,1989-03-01,1989,3,1
198903,89,220303,2,.64999998,,220303,14,01-03-1989,01-03-1989,1989-03-01,1989,3,1
198903,23,220303,2,.64999998,,220303,14,01-03-1989,01-03-1989,1989-03-01,1989,3,1
198903,18,220303,2,.47999999,,220303,14,01-03-1989,01-03-1989,1989-03-01,1989,3,1
198903,75,220303,2,.64999998,,220303,14,01-03-1989,01-03-1989,1989-03-01,1989,3,1
198903,61,220303,2,.69999999,,220303,14,01-03-1989,01-03-1989,1989-03-01,1989,3,1
198904,61,220303,2,.69999999,,220303,15,01-04-1989,01-04-1989,1989-04-01,1989,4,2
198904,23,220303,2,.69999999,,220303,15,01-04-1989,01-04-1989,1989-04-01,1989,4,2
198904,12,220303,2,.89999998,,220303,15,01-04-1989,01-04-1989,1989-04-01,1989,4,2
198904,18,220303,2,.47999999,,220303,15,01-04-1989,01-04-1989,1989-04-01,1989,4,2
198904,48,220303,2,.47999999,,220303,15,01-04-1989,01-04-1989,1989-04-01,1989,4,2
198904,21,220303,2,.75,,220303,15,01-04-1989,01-04-1989,1989-04-01,1989,4,2
198904,25,220303,2,.60000002,,220303,15,01-04-1989,01-04-1989,1989-04-01,1989,4,2
198904,75,220303,2,.64999998,,220303,15,01-04-1989,01-04-1989,1989-04-01,1989,4,2
198904,22,220303,2,.5,,220303,15,01-04-1989,01-04-1989,1989-04-01,1989,4,2
198904,17,220303,2,.75,,220303,15,01-04-1989,01-04-1989,1989-04-01,1989,4,2
198904,89,220303,2,.64999998,,220303,15,01-04-1989,01-04-1989,1989-04-01,1989,4,2
198905,17,220303,2,.75,,220303,16,01-05-1989,01-05-1989,1989-05-01,1989,5,2
198905,25,220303,2,.64999998,,220303,16,01-05-1989,01-05-1989,1989-05-01,1989,5,2
198905,67,220303,2,.75,,220303,16,01-05-1989,01-05-1989,1989-05-01,1989,5,2
198905,21,220303,2,.75,,220303,16,01-05-1989,01-05-1989,1989-05-01,1989,5,2
198905,12,220303,2,.94999999,,220303,16,01-05-1989,01-05-1989,1989-05-01,1989,5,2
198905,89,220303,2,.64999998,,220303,16,01-05-1989,01-05-1989,1989-05-01,1989,5,2
198905,18,220303,2,.47999999,,220303,16,01-05-1989,01-05-1989,1989-05-01,1989,5,2
198905,61,220303,2,.69999999,,220303,16,01-05-1989,01-05-1989,1989-05-01,1989,5,2
198905,48,220303,2,.47999999,,220303,16,01-05-1989,01-05-1989,1989-05-01,1989,5,2
198905,40,220303,2,.64999998,,220303,16,01-05-1989,01-05-1989,1989-05-01,1989,5,2
198905,75,220303,2,.69999999,,220303,16,01-05-1989,01-05-1989,1989-05-01,1989,5,2
198906,40,220303,2,.64999998,,220303,17,01-06-1989,01-06-1989,1989-06-01,1989,6,2
198906,61,220303,2,.69999999,,220303,17,01-06-1989,01-06-1989,1989-06-01,1989,6,2
198906,75,220303,2,.69999999,,220303,17,01-06-1989,01-06-1989,1989-06-01,1989,6,2
198906,12,220303,2,.94999999,,220303,17,01-06-1989,01-06-1989,1989-06-01,1989,6,2
198906,21,220303,2,.75,,220303,17,01-06-1989,01-06-1989,1989-06-01,1989,6,2
198906,67,220303,2,.75,,220303,17,01-06-1989,01-06-1989,1989-06-01,1989,6,2
198906,22,220303,2,.5,,220303,17,01-06-1989,01-06-1989,1989-06-01,1989,6,2
198906,17,220303,2,.75,,220303,17,01-06-1989,01-06-1989,1989-06-01,1989,6,2
198907,75,220303,2,.69999999,,220303,18,01-07-1989,01-07-1989,1989-07-01,1989,7,3
198907,17,220303,2,.75,,220303,18,01-07-1989,01-07-1989,1989-07-01,1989,7,3
198907,18,220303,2,.47999999,,220303,18,01-07-1989,01-07-1989,1989-07-01,1989,7,3
198907,23,220303,2,.69999999,,220303,18,01-07-1989,01-07-1989,1989-07-01,1989,7,3
198907,73,220303,2,.60000002,,220303,18,01-07-1989,01-07-1989,1989-07-01,1989,7,3
198907,48,220303,2,.47999999,,220303,18,01-07-1989,01-07-1989,1989-07-01,1989,7,3
198907,40,220303,2,.64999998,,220303,18,01-07-1989,01-07-1989,1989-07-01,1989,7,3
198907,12,220303,2,.94999999,,220303,18,01-07-1989,01-07-1989,1989-07-01,1989,7,3
198907,61,220303,2,.69999999,,220303,18,01-07-1989,01-07-1989,1989-07-01,1989,7,3
198908,12,220303,2,.94999999,,220303,19,01-08-1989,01-08-1989,1989-08-01,1989,8,3
198908,18,220303,2,.47999999,,220303,19,01-08-1989,01-08-1989,1989-08-01,1989,8,3
198908,25,220303,2,.85000002,,220303,19,01-08-1989,01-08-1989,1989-08-01,1989,8,3
198908,21,220303,2,.75,,220303,19,01-08-1989,01-08-1989,1989-08-01,1989,8,3
198908,61,220303,2,.69999999,,220303,19,01-08-1989,01-08-1989,1989-08-01,1989,8,3
198908,48,220303,2,.47999999,,220303,19,01-08-1989,01-08-1989,1989-08-01,1989,8,3
198908,89,220303,2,.64999998,,220303,19,01-08-1989,01-08-1989,1989-08-01,1989,8,3
198908,73,220303,2,.60000002,,220303,19,01-08-1989,01-08-1989,1989-08-01,1989,8,3
198908,23,220303,2,.69999999,,220303,19,01-08-1989,01-08-1989,1989-08-01,1989,8,3
198908,17,220303,2,.75,,220303,19,01-08-1989,01-08-1989,1989-08-01,1989,8,3
198908,40,220303,2,.64999998,,220303,19,01-08-1989,01-08-1989,1989-08-01,1989,8,3
198908,75,220303,2,.69999999,,220303,19,01-08-1989,01-08-1989,1989-08-01,1989,8,3
198909,21,220303,2,.75,,220303,20,01-09-1989,01-09-1989,1989-09-01,1989,9,3
198909,48,220303,2,.47999999,,220303,20,01-09-1989,01-09-1989,1989-09-01,1989,9,3
198909,17,220303,2,.75,,220303,20,01-09-1989,01-09-1989,1989-09-01,1989,9,3
198909,61,220303,2,.69999999,,220303,20,01-09-1989,01-09-1989,1989-09-01,1989,9,3
198909,75,220303,2,.69999999,,220303,20,01-09-1989,01-09-1989,1989-09-01,1989,9,3
198909,40,220303,2,.64999998,,220303,20,01-09-1989,01-09-1989,1989-09-01,1989,9,3
198909,12,220303,2,.94999999,,220303,20,01-09-1989,01-09-1989,1989-09-01,1989,9,3
198909,18,220303,2,.47999999,,220303,20,01-09-1989,01-09-1989,1989-09-01,1989,9,3
198909,23,220303,2,.69999999,,220303,20,01-09-1989,01-09-1989,1989-09-01,1989,9,3
198909,89,220303,2,.64999998,,220303,20,01-09-1989,01-09-1989,1989-09-01,1989,9,3
198909,73,220303,2,.60000002,,220303,20,01-09-1989,01-09-1989,1989-09-01,1989,9,3
198910,25,220303,2,.85000002,,220303,21,01-10-1989,01-10-1989,1989-10-01,1989,10,4
198910,18,220303,2,.47999999,,220303,21,01-10-1989,01-10-1989,1989-10-01,1989,10,4
198910,73,220303,2,.60000002,,220303,21,01-10-1989,01-10-1989,1989-10-01,1989,10,4
198910,75,220303,2,.69999999,,220303,21,01-10-1989,01-10-1989,1989-10-01,1989,10,4
198910,56,220303,2,.51999998,,220303,21,01-10-1989,01-10-1989,1989-10-01,1989,10,4
198910,17,220303,2,.75,,220303,21,01-10-1989,01-10-1989,1989-10-01,1989,10,4
198910,21,220303,2,.75,,220303,21,01-10-1989,01-10-1989,1989-10-01,1989,10,4
198910,40,220303,2,.69999999,,220303,21,01-10-1989,01-10-1989,1989-10-01,1989,10,4
198910,23,220303,2,.69999999,,220303,21,01-10-1989,01-10-1989,1989-10-01,1989,10,4
198910,12,220303,2,.94999999,,220303,21,01-10-1989,01-10-1989,1989-10-01,1989,10,4
198910,61,220303,2,.69999999,,220303,21,01-10-1989,01-10-1989,1989-10-01,1989,10,4
198911,48,220303,2,.47999999,,220303,22,01-11-1989,01-11-1989,1989-11-01,1989,11,4
198911,17,220303,2,.75,,220303,22,01-11-1989,01-11-1989,1989-11-01,1989,11,4
198911,40,220303,2,.69999999,,220303,22,01-11-1989,01-11-1989,1989-11-01,1989,11,4
198911,89,220303,2,.64999998,,220303,22,01-11-1989,01-11-1989,1989-11-01,1989,11,4
198911,24,220303,2,.50999999,,220303,22,01-11-1989,01-11-1989,1989-11-01,1989,11,4
198911,73,220303,2,.60000002,,220303,22,01-11-1989,01-11-1989,1989-11-01,1989,11,4
198911,12,220303,2,.94999999,,220303,22,01-11-1989,01-11-1989,1989-11-01,1989,11,4
198911,21,220303,2,.75,,220303,22,01-11-1989,01-11-1989,1989-11-01,1989,11,4
198911,25,220303,2,.85000002,,220303,22,01-11-1989,01-11-1989,1989-11-01,1989,11,4
198911,61,220303,2,.75,,220303,22,01-11-1989,01-11-1989,1989-11-01,1989,11,4
198911,75,220303,2,.69999999,,220303,22,01-11-1989,01-11-1989,1989-11-01,1989,11,4
198911,23,220303,2,.69999999,,220303,22,01-11-1989,01-11-1989,1989-11-01,1989,11,4
198911,18,220303,2,.47999999,,220303,22,01-11-1989,01-11-1989,1989-11-01,1989,11,4
198912,24,220303,2,.50999999,,220303,23,01-12-1989,01-12-1989,1989-12-01,1989,12,4
198912,48,220303,2,.47999999,,220303,23,01-12-1989,01-12-1989,1989-12-01,1989,12,4
198912,61,220303,2,.75,,220303,23,01-12-1989,01-12-1989,1989-12-01,1989,12,4
198912,73,220303,2,.60000002,,220303,23,01-12-1989,01-12-1989,1989-12-01,1989,12,4
198912,17,220303,2,.75,,220303,23,01-12-1989,01-12-1989,1989-12-01,1989,12,4
198912,25,220303,2,.85000002,,220303,23,01-12-1989,01-12-1989,1989-12-01,1989,12,4
198912,56,220303,2,.55000001,,220303,23,01-12-1989,01-12-1989,1989-12-01,1989,12,4
198912,89,220303,2,.64999998,,220303,23,01-12-1989,01-12-1989,1989-12-01,1989,12,4
198912,18,220303,2,.47999999,,220303,23,01-12-1989,01-12-1989,1989-12-01,1989,12,4
198912,40,220303,2,.69999999,,220303,23,01-12-1989,01-12-1989,1989-12-01,1989,12,4
198912,12,220303,2,.94999999,,220303,23,01-12-1989,01-12-1989,1989-12-01,1989,12,4
198912,21,220303,2,.75,,220303,23,01-12-1989,01-12-1989,1989-12-01,1989,12,4
198912,75,220303,2,.69999999,,220303,23,01-12-1989,01-12-1989,1989-12-01,1989,12,4
199001,75,220303,2,.69999999,,220303,24,01-01-1990,01-01-1990,1990-01-01,1990,1,1
199001,24,220303,2,.52999997,,220303,24,01-01-1990,01-01-1990,1990-01-01,1990,1,1
199001,18,220303,2,.5,,220303,24,01-01-1990,01-01-1990,1990-01-01,1990,1,1
199001,61,220303,2,.75,,220303,24,01-01-1990,01-01-1990,1990-01-01,1990,1,1
199001,25,220303,2,.85000002,,220303,24,01-01-1990,01-01-1990,1990-01-01,1990,1,1
199001,23,220303,2,.69999999,,220303,24,01-01-1990,01-01-1990,1990-01-01,1990,1,1
199001,21,220303,2,.75,,220303,24,01-01-1990,01-01-1990,1990-01-01,1990,1,1
199001,22,220303,2,.5,,220303,24,01-01-1990,01-01-1990,1990-01-01,1990,1,1
199001,48,220303,2,.55000001,,220303,24,01-01-1990,01-01-1990,1990-01-01,1990,1,1
199001,40,220303,2,.69999999,,220303,24,01-01-1990,01-01-1990,1990-01-01,1990,1,1
199001,56,220303,2,.5,,220303,24,01-01-1990,01-01-1990,1990-01-01,1990,1,1
199001,89,220303,2,.64999998,,220303,24,01-01-1990,01-01-1990,1990-01-01,1990,1,1
199002,22,220303,2,.5,,220303,25,01-02-1990,01-02-1990,1990-02-01,1990,2,1
199002,48,220303,2,.55000001,,220303,25,01-02-1990,01-02-1990,1990-02-01,1990,2,1
199002,89,220303,2,.64999998,,220303,25,01-02-1990,01-02-1990,1990-02-01,1990,2,1
199002,18,220303,2,.55000001,,220303,25,01-02-1990,01-02-1990,1990-02-01,1990,2,1
199002,98,220303,2,.98000002,,220303,25,01-02-1990,01-02-1990,1990-02-01,1990,2,1
199002,56,220303,2,.5,,220303,25,01-02-1990,01-02-1990,1990-02-01,1990,2,1
199002,23,220303,2,.69999999,,220303,25,01-02-1990,01-02-1990,1990-02-01,1990,2,1
199002,12,220303,2,.69,,220303,25,01-02-1990,01-02-1990,1990-02-01,1990,2,1
199002,61,220303,2,.75,,220303,25,01-02-1990,01-02-1990,1990-02-01,1990,2,1
199002,25,220303,2,.85000002,,220303,25,01-02-1990,01-02-1990,1990-02-01,1990,2,1
199002,75,220303,2,.69999999,,220303,25,01-02-1990,01-02-1990,1990-02-01,1990,2,1
199002,40,220303,2,.69999999,,220303,25,01-02-1990,01-02-1990,1990-02-01,1990,2,1
199003,23,220303,2,.69999999,,220303,26,01-03-1990,01-03-1990,1990-03-01,1990,3,1
199003,40,220303,2,.69999999,,220303,26,01-03-1990,01-03-1990,1990-03-01,1990,3,1
199003,80,220303,2,.99000001,,220303,26,01-03-1990,01-03-1990,1990-03-01,1990,3,1
199003,24,220303,2,.52999997,,220303,26,01-03-1990,01-03-1990,1990-03-01,1990,3,1
199003,75,220303,2,.69999999,,220303,26,01-03-1990,01-03-1990,1990-03-01,1990,3,1
199003,89,220303,2,.64999998,,220303,26,01-03-1990,01-03-1990,1990-03-01,1990,3,1
199003,18,220303,2,.55000001,,220303,26,01-03-1990,01-03-1990,1990-03-01,1990,3,1
199003,73,220303,2,.75,,220303,26,01-03-1990,01-03-1990,1990-03-01,1990,3,1
199003,98,220303,2,.98000002,,220303,26,01-03-1990,01-03-1990,1990-03-01,1990,3,1
199003,48,220303,2,.55000001,,220303,26,01-03-1990,01-03-1990,1990-03-01,1990,3,1
199003,25,220303,2,.85000002,,220303,26,01-03-1990,01-03-1990,1990-03-01,1990,3,1
199003,22,220303,2,.5,,220303,26,01-03-1990,01-03-1990,1990-03-01,1990,3,1
199003,61,220303,2,.75,,220303,26,01-03-1990,01-03-1990,1990-03-01,1990,3,1
199004,22,220303,2,.5,,220303,27,01-04-1990,01-04-1990,1990-04-01,1990,4,2
199004,23,220303,2,.69999999,,220303,27,01-04-1990,01-04-1990,1990-04-01,1990,4,2
199004,17,220303,2,.75,,220303,27,01-04-1990,01-04-1990,1990-04-01,1990,4,2
199004,73,220303,2,.64999998,,220303,27,01-04-1990,01-04-1990,1990-04-01,1990,4,2
199004,24,220303,2,.55000001,,220303,27,01-04-1990,01-04-1990,1990-04-01,1990,4,2
199004,18,220303,2,.55000001,,220303,27,01-04-1990,01-04-1990,1990-04-01,1990,4,2
199004,61,220303,2,.75,,220303,27,01-04-1990,01-04-1990,1990-04-01,1990,4,2
199004,98,220303,2,1.14,,220303,27,01-04-1990,01-04-1990,1990-04-01,1990,4,2
199004,40,220303,2,.75,,220303,27,01-04-1990,01-04-1990,1990-04-01,1990,4,2
199004,12,220303,2,.80000001,,220303,27,01-04-1990,01-04-1990,1990-04-01,1990,4,2
199004,75,220303,2,.80000001,,220303,27,01-04-1990,01-04-1990,1990-04-01,1990,4,2
199004,48,220303,2,.55000001,,220303,27,01-04-1990,01-04-1990,1990-04-01,1990,4,2
199004,89,220303,2,.64999998,,220303,27,01-04-1990,01-04-1990,1990-04-01,1990,4,2
199004,25,220303,2,.85000002,,220303,27,01-04-1990,01-04-1990,1990-04-01,1990,4,2
199004,80,220303,2,.99000001,,220303,27,01-04-1990,01-04-1990,1990-04-01,1990,4,2
199005,40,220303,2,.75,,220303,28,01-05-1990,01-05-1990,1990-05-01,1990,5,2
199005,73,220303,2,.69999999,,220303,28,01-05-1990,01-05-1990,1990-05-01,1990,5,2
199005,61,220303,2,.75,,220303,28,01-05-1990,01-05-1990,1990-05-01,1990,5,2
199005,75,220303,2,.80000001,,220303,28,01-05-1990,01-05-1990,1990-05-01,1990,5,2
199005,25,220303,2,.85000002,,220303,28,01-05-1990,01-05-1990,1990-05-01,1990,5,2
199005,17,220303,2,.75,,220303,28,01-05-1990,01-05-1990,1990-05-01,1990,5,2
199005,80,220303,2,.99000001,,220303,28,01-05-1990,01-05-1990,1990-05-01,1990,5,2
199005,12,220303,2,.80000001,,220303,28,01-05-1990,01-05-1990,1990-05-01,1990,5,2
199005,18,220303,2,.62,,220303,28,01-05-1990,01-05-1990,1990-05-01,1990,5,2
199005,89,220303,2,.64999998,,220303,28,01-05-1990,01-05-1990,1990-05-01,1990,5,2
199005,23,220303,2,.69999999,,220303,28,01-05-1990,01-05-1990,1990-05-01,1990,5,2
199005,48,220303,2,.55000001,,220303,28,01-05-1990,01-05-1990,1990-05-01,1990,5,2
199005,24,220303,2,.54000002,,220303,28,01-05-1990,01-05-1990,1990-05-01,1990,5,2
199006,23,220303,2,.69999999,,220303,29,01-06-1990,01-06-1990,1990-06-01,1990,6,2
199006,75,220303,2,.80000001,,220303,29,01-06-1990,01-06-1990,1990-06-01,1990,6,2
199006,25,220303,2,.85000002,,220303,29,01-06-1990,01-06-1990,1990-06-01,1990,6,2
199006,22,220303,2,.5,,220303,29,01-06-1990,01-06-1990,1990-06-01,1990,6,2
199006,80,220303,2,.99000001,,220303,29,01-06-1990,01-06-1990,1990-06-01,1990,6,2
199006,56,220303,2,.5,,220303,29,01-06-1990,01-06-1990,1990-06-01,1990,6,2
199006,89,220303,2,.64999998,,220303,29,01-06-1990,01-06-1990,1990-06-01,1990,6,2
199006,61,220303,2,.75,,220303,29,01-06-1990,01-06-1990,1990-06-01,1990,6,2
199006,40,220303,2,.75,,220303,29,01-06-1990,01-06-1990,1990-06-01,1990,6,2
199006,17,220303,2,.75,,220303,29,01-06-1990,01-06-1990,1990-06-01,1990,6,2
199006,24,220303,2,.55000001,,220303,29,01-06-1990,01-06-1990,1990-06-01,1990,6,2
199006,18,220303,2,.62,,220303,29,01-06-1990,01-06-1990,1990-06-01,1990,6,2
199006,73,220303,2,.69999999,,220303,29,01-06-1990,01-06-1990,1990-06-01,1990,6,2
199006,98,220303,2,1.14,,220303,29,01-06-1990,01-06-1990,1990-06-01,1990,6,2
199006,12,220303,2,.80000001,,220303,29,01-06-1990,01-06-1990,1990-06-01,1990,6,2
199006,48,220303,2,.55000001,,220303,29,01-06-1990,01-06-1990,1990-06-01,1990,6,2
199007,25,220303,2,.85000002,,220303,30,01-07-1990,01-07-1990,1990-07-01,1990,7,3
199007,75,220303,2,.80000001,,220303,30,01-07-1990,01-07-1990,1990-07-01,1990,7,3
199007,61,220303,2,.75,,220303,30,01-07-1990,01-07-1990,1990-07-01,1990,7,3
199007,80,220303,2,.99000001,,220303,30,01-07-1990,01-07-1990,1990-07-01,1990,7,3
199007,98,220303,2,1.14,,220303,30,01-07-1990,01-07-1990,1990-07-01,1990,7,3
199007,88,220303,2,.80000001,,220303,30,01-07-1990,01-07-1990,1990-07-01,1990,7,3
199007,24,220303,2,.52999997,,220303,30,01-07-1990,01-07-1990,1990-07-01,1990,7,3
199007,23,220303,2,.69999999,,220303,30,01-07-1990,01-07-1990,1990-07-01,1990,7,3
199007,89,220303,2,.64999998,,220303,30,01-07-1990,01-07-1990,1990-07-01,1990,7,3
199007,48,220303,2,.69999999,,220303,30,01-07-1990,01-07-1990,1990-07-01,1990,7,3
199007,40,220303,2,.77999997,,220303,30,01-07-1990,01-07-1990,1990-07-01,1990,7,3
199007,18,220303,2,.62,,220303,30,01-07-1990,01-07-1990,1990-07-01,1990,7,3
199008,23,220303,2,.69999999,,220303,31,01-08-1990,01-08-1990,1990-08-01,1990,8,3
199008,75,220303,2,.80000001,,220303,31,01-08-1990,01-08-1990,1990-08-01,1990,8,3
199008,12,220303,2,.74000001,,220303,31,01-08-1990,01-08-1990,1990-08-01,1990,8,3
199008,80,220303,2,.99000001,,220303,31,01-08-1990,01-08-1990,1990-08-01,1990,8,3
199008,61,220303,2,.75,,220303,31,01-08-1990,01-08-1990,1990-08-01,1990,8,3
199008,56,220303,2,.5,,220303,31,01-08-1990,01-08-1990,1990-08-01,1990,8,3
199008,18,220303,2,.62,,220303,31,01-08-1990,01-08-1990,1990-08-01,1990,8,3
199008,17,220303,2,.75,,220303,31,01-08-1990,01-08-1990,1990-08-01,1990,8,3
199008,40,220303,2,.77999997,,220303,31,01-08-1990,01-08-1990,1990-08-01,1990,8,3
199008,88,220303,2,.80000001,,220303,31,01-08-1990,01-08-1990,1990-08-01,1990,8,3
199008,24,220303,2,.55000001,,220303,31,01-08-1990,01-08-1990,1990-08-01,1990,8,3
199008,25,220303,2,.85000002,,220303,31,01-08-1990,01-08-1990,1990-08-01,1990,8,3
199008,124,220303,2,.94999999,,220303,31,01-08-1990,01-08-1990,1990-08-01,1990,8,3
199009,75,220303,2,.80000001,,220303,32,01-09-1990,01-09-1990,1990-09-01,1990,9,3
199009,56,220303,2,.5,,220303,32,01-09-1990,01-09-1990,1990-09-01,1990,9,3
199009,88,220303,2,.80000001,,220303,32,01-09-1990,01-09-1990,1990-09-01,1990,9,3
199009,48,220303,2,.69999999,,220303,32,01-09-1990,01-09-1990,1990-09-01,1990,9,3
199009,89,220303,2,.64999998,,220303,32,01-09-1990,01-09-1990,1990-09-01,1990,9,3
199009,24,220303,2,.55000001,,220303,32,01-09-1990,01-09-1990,1990-09-01,1990,9,3
199009,124,220303,2,.94999999,,220303,32,01-09-1990,01-09-1990,1990-09-01,1990,9,3
199009,18,220303,2,.62,,220303,32,01-09-1990,01-09-1990,1990-09-01,1990,9,3
199009,40,220303,2,.77999997,,220303,32,01-09-1990,01-09-1990,1990-09-01,1990,9,3
199009,25,220303,2,.85000002,,220303,32,01-09-1990,01-09-1990,1990-09-01,1990,9,3
199009,61,220303,2,.75,,220303,32,01-09-1990,01-09-1990,1990-09-01,1990,9,3
199009,12,220303,2,.79000002,,220303,32,01-09-1990,01-09-1990,1990-09-01,1990,9,3
199010,18,220303,2,.62,,220303,33,01-10-1990,01-10-1990,1990-10-01,1990,10,4
199010,17,220303,2,1,,220303,33,01-10-1990,01-10-1990,1990-10-01,1990,10,4
199010,124,220303,2,.94999999,,220303,33,01-10-1990,01-10-1990,1990-10-01,1990,10,4
199010,61,220303,2,.75,,220303,33,01-10-1990,01-10-1990,1990-10-01,1990,10,4
199010,24,220303,2,.55000001,,220303,33,01-10-1990,01-10-1990,1990-10-01,1990,10,4
199010,89,220303,2,.75,,220303,33,01-10-1990,01-10-1990,1990-10-01,1990,10,4
199010,23,220303,2,.69999999,,220303,33,01-10-1990,01-10-1990,1990-10-01,1990,10,4
199010,12,220303,2,.79000002,,220303,33,01-10-1990,01-10-1990,1990-10-01,1990,10,4
199010,75,220303,2,.80000001,,220303,33,01-10-1990,01-10-1990,1990-10-01,1990,10,4
199010,48,220303,2,.69999999,,220303,33,01-10-1990,01-10-1990,1990-10-01,1990,10,4
199010,56,220303,2,.5,,220303,33,01-10-1990,01-10-1990,1990-10-01,1990,10,4
199011,23,220303,2,.69999999,,220303,34,01-11-1990,01-11-1990,1990-11-01,1990,11,4
199011,25,220303,2,.94999999,,220303,34,01-11-1990,01-11-1990,1990-11-01,1990,11,4
199011,80,220303,2,.99000001,,220303,34,01-11-1990,01-11-1990,1990-11-01,1990,11,4
199011,24,220303,2,.55000001,,220303,34,01-11-1990,01-11-1990,1990-11-01,1990,11,4
199011,17,220303,2,1,,220303,34,01-11-1990,01-11-1990,1990-11-01,1990,11,4
199011,40,220303,2,.85000002,,220303,34,01-11-1990,01-11-1990,1990-11-01,1990,11,4
199011,75,220303,2,.80000001,,220303,34,01-11-1990,01-11-1990,1990-11-01,1990,11,4
199011,48,220303,2,.69999999,,220303,34,01-11-1990,01-11-1990,1990-11-01,1990,11,4
199011,88,220303,2,.80000001,,220303,34,01-11-1990,01-11-1990,1990-11-01,1990,11,4
199011,12,220303,2,.79000002,,220303,34,01-11-1990,01-11-1990,1990-11-01,1990,11,4
199011,56,220303,2,.5,,220303,34,01-11-1990,01-11-1990,1990-11-01,1990,11,4
199011,89,220303,2,.75,,220303,34,01-11-1990,01-11-1990,1990-11-01,1990,11,4
199011,18,220303,2,.62,,220303,34,01-11-1990,01-11-1990,1990-11-01,1990,11,4
199011,61,220303,2,.75,,220303,34,01-11-1990,01-11-1990,1990-11-01,1990,11,4
199011,124,220303,2,1.05,,220303,34,01-11-1990,01-11-1990,1990-11-01,1990,11,4
199012,56,220303,2,.5,,220303,35,01-12-1990,01-12-1990,1990-12-01,1990,12,4
199012,18,220303,2,.62,,220303,35,01-12-1990,01-12-1990,1990-12-01,1990,12,4
199012,89,220303,2,.75,,220303,35,01-12-1990,01-12-1990,1990-12-01,1990,12,4
199012,25,220303,2,.94999999,,220303,35,01-12-1990,01-12-1990,1990-12-01,1990,12,4
199012,88,220303,2,.80000001,,220303,35,01-12-1990,01-12-1990,1990-12-01,1990,12,4
199012,124,220303,2,1.05,,220303,35,01-12-1990,01-12-1990,1990-12-01,1990,12,4
199012,48,220303,2,.69999999,,220303,35,01-12-1990,01-12-1990,1990-12-01,1990,12,4
199012,12,220303,2,.79000002,,220303,35,01-12-1990,01-12-1990,1990-12-01,1990,12,4
199012,24,220303,2,.55000001,,220303,35,01-12-1990,01-12-1990,1990-12-01,1990,12,4
199012,17,220303,2,1,,220303,35,01-12-1990,01-12-1990,1990-12-01,1990,12,4
199012,22,220303,2,.60000002,,220303,35,01-12-1990,01-12-1990,1990-12-01,1990,12,4
199012,80,220303,2,.99000001,,220303,35,01-12-1990,01-12-1990,1990-12-01,1990,12,4
199101,24,220303,2,.58999997,,220303,36,01-01-1991,01-01-1991,1991-01-01,1991,1,1
199101,124,220303,2,1.05,,220303,36,01-01-1991,01-01-1991,1991-01-01,1991,1,1
199101,80,220303,2,.99000001,,220303,36,01-01-1991,01-01-1991,1991-01-01,1991,1,1
199101,88,220303,2,.80000001,,220303,36,01-01-1991,01-01-1991,1991-01-01,1991,1,1
199101,25,220303,2,.94999999,,220303,36,01-01-1991,01-01-1991,1991-01-01,1991,1,1
199101,75,220303,2,.94999999,,220303,36,01-01-1991,01-01-1991,1991-01-01,1991,1,1
199101,12,220303,2,.79000002,,220303,36,01-01-1991,01-01-1991,1991-01-01,1991,1,1
199102,25,220303,2,.94999999,,220303,37,01-02-1991,01-02-1991,1991-02-01,1991,2,1
199102,24,220303,2,.58999997,,220303,37,01-02-1991,01-02-1991,1991-02-01,1991,2,1
199102,88,220303,2,.80000001,,220303,37,01-02-1991,01-02-1991,1991-02-01,1991,2,1
199102,75,220303,2,.94999999,,220303,37,01-02-1991,01-02-1991,1991-02-01,1991,2,1
199102,88,220303,2,.75,,220303,37,01-02-1991,01-02-1991,1991-02-01,1991,2,1
199102,17,220303,2,.60000002,,220303,37,01-02-1991,01-02-1991,1991-02-01,1991,2,1
199102,12,220303,2,.79000002,,220303,37,01-02-1991,01-02-1991,1991-02-01,1991,2,1
199102,60,220303,2,.69999999,,220303,37,01-02-1991,01-02-1991,1991-02-01,1991,2,1
199102,124,220303,2,1.05,,220303,37,01-02-1991,01-02-1991,1991-02-01,1991,2,1
199102,98,220303,2,1.25,,220303,37,01-02-1991,01-02-1991,1991-02-01,1991,2,1
199102,73,220303,2,.69999999,,220303,37,01-02-1991,01-02-1991,1991-02-01,1991,2,1
199102,80,220303,2,1.05,,220303,37,01-02-1991,01-02-1991,1991-02-01,1991,2,1
199102,61,220303,2,.55000001,,220303,37,01-02-1991,01-02-1991,1991-02-01,1991,2,1
199103,24,220303,2,.58999997,,220303,38,01-03-1991,01-03-1991,1991-03-01,1991,3,1
199103,75,220303,2,.85000002,,220303,38,01-03-1991,01-03-1991,1991-03-01,1991,3,1
199103,124,220303,2,1.05,,220303,38,01-03-1991,01-03-1991,1991-03-01,1991,3,1
199103,88,220303,2,.80000001,,220303,38,01-03-1991,01-03-1991,1991-03-01,1991,3,1
199103,73,220303,2,.69999999,,220303,38,01-03-1991,01-03-1991,1991-03-01,1991,3,1
199103,25,220303,2,.94999999,,220303,38,01-03-1991,01-03-1991,1991-03-01,1991,3,1
199103,17,220303,2,.60000002,,220303,38,01-03-1991,01-03-1991,1991-03-01,1991,3,1
199103,98,220303,2,1.25,,220303,38,01-03-1991,01-03-1991,1991-03-01,1991,3,1
199103,12,220303,2,.82999998,,220303,38,01-03-1991,01-03-1991,1991-03-01,1991,3,1
199103,88,220303,2,.75,,220303,38,01-03-1991,01-03-1991,1991-03-01,1991,3,1
199103,60,220303,2,.69999999,,220303,38,01-03-1991,01-03-1991,1991-03-01,1991,3,1
199104,17,220303,2,.60000002,,220303,39,01-04-1991,01-04-1991,1991-04-01,1991,4,2
199104,60,220303,2,.69999999,,220303,39,01-04-1991,01-04-1991,1991-04-01,1991,4,2
199104,73,220303,2,.69999999,,220303,39,01-04-1991,01-04-1991,1991-04-01,1991,4,2
199104,98,220303,2,1.25,,220303,39,01-04-1991,01-04-1991,1991-04-01,1991,4,2
199104,25,220303,2,1,,220303,39,01-04-1991,01-04-1991,1991-04-01,1991,4,2
199104,58,220303,2,.64999998,,220303,39,01-04-1991,01-04-1991,1991-04-01,1991,4,2
199104,24,220303,2,.58999997,,220303,39,01-04-1991,01-04-1991,1991-04-01,1991,4,2
199104,54,220303,2,1.2,,220303,39,01-04-1991,01-04-1991,1991-04-01,1991,4,2
199104,88,220303,2,.80000001,,220303,39,01-04-1991,01-04-1991,1991-04-01,1991,4,2
199104,75,220303,2,.89999998,,220303,39,01-04-1991,01-04-1991,1991-04-01,1991,4,2
199104,124,220303,2,1.25,,220303,39,01-04-1991,01-04-1991,1991-04-01,1991,4,2
199104,73,220303,2,.75,,220303,39,01-04-1991,01-04-1991,1991-04-01,1991,4,2
199104,12,220303,2,.82999998,,220303,39,01-04-1991,01-04-1991,1991-04-01,1991,4,2
199104,23,220303,2,.89999998,,220303,39,01-04-1991,01-04-1991,1991-04-01,1991,4,2
199104,56,220303,2,.69999999,,220303,39,01-04-1991,01-04-1991,1991-04-01,1991,4,2
199105,24,220303,2,.58999997,,220303,40,01-05-1991,01-05-1991,1991-05-01,1991,5,2
199105,98,220303,2,1.25,,220303,40,01-05-1991,01-05-1991,1991-05-01,1991,5,2
199105,88,220303,2,.80000001,,220303,40,01-05-1991,01-05-1991,1991-05-01,1991,5,2
199105,73,220303,2,.85000002,,220303,40,01-05-1991,01-05-1991,1991-05-01,1991,5,2
199105,25,220303,2,1,,220303,40,01-05-1991,01-05-1991,1991-05-01,1991,5,2
199105,17,220303,2,.60000002,,220303,40,01-05-1991,01-05-1991,1991-05-01,1991,5,2
199105,58,220303,2,.64999998,,220303,40,01-05-1991,01-05-1991,1991-05-01,1991,5,2
199105,124,220303,2,1.3,,220303,40,01-05-1991,01-05-1991,1991-05-01,1991,5,2
199105,75,220303,2,.89999998,,220303,40,01-05-1991,01-05-1991,1991-05-01,1991,5,2
199105,60,220303,2,.69999999,,220303,40,01-05-1991,01-05-1991,1991-05-01,1991,5,2
199105,54,220303,2,1.2,,220303,40,01-05-1991,01-05-1991,1991-05-01,1991,5,2
199105,56,220303,2,.69999999,,220303,40,01-05-1991,01-05-1991,1991-05-01,1991,5,2
199105,88,220303,2,.85000002,,220303,40,01-05-1991,01-05-1991,1991-05-01,1991,5,2
199105,23,220303,2,.94999999,,220303,40,01-05-1991,01-05-1991,1991-05-01,1991,5,2
199105,18,220303,2,.89999998,,220303,40,01-05-1991,01-05-1991,1991-05-01,1991,5,2
199106,18,220303,2,.80000001,,220303,41,01-06-1991,01-06-1991,1991-06-01,1991,6,2
199106,17,220303,2,.64999998,,220303,41,01-06-1991,01-06-1991,1991-06-01,1991,6,2
199106,24,220303,2,.58999997,,220303,41,01-06-1991,01-06-1991,1991-06-01,1991,6,2
199106,12,220303,2,.80000001,,220303,41,01-06-1991,01-06-1991,1991-06-01,1991,6,2
199106,25,220303,2,1,,220303,41,01-06-1991,01-06-1991,1991-06-01,1991,6,2
199106,88,220303,2,.80000001,,220303,41,01-06-1991,01-06-1991,1991-06-01,1991,6,2
199106,73,220303,2,.85000002,,220303,41,01-06-1991,01-06-1991,1991-06-01,1991,6,2
199106,58,220303,2,.64999998,,220303,41,01-06-1991,01-06-1991,1991-06-01,1991,6,2
199106,73,220303,2,.75,,220303,41,01-06-1991,01-06-1991,1991-06-01,1991,6,2
199106,124,220303,2,1.3,,220303,41,01-06-1991,01-06-1991,1991-06-01,1991,6,2
199106,54,220303,2,1.15,,220303,41,01-06-1991,01-06-1991,1991-06-01,1991,6,2
199106,75,220303,2,.89999998,,220303,41,01-06-1991,01-06-1991,1991-06-01,1991,6,2
199106,23,220303,2,.94999999,,220303,41,01-06-1991,01-06-1991,1991-06-01,1991,6,2
199106,60,220303,2,.69999999,,220303,41,01-06-1991,01-06-1991,1991-06-01,1991,6,2
199106,56,220303,2,.69999999,,220303,41,01-06-1991,01-06-1991,1991-06-01,1991,6,2
199107,56,220303,2,.69999999,,220303,42,01-07-1991,01-07-1991,1991-07-01,1991,7,3
199107,60,220303,2,.69999999,,220303,42,01-07-1991,01-07-1991,1991-07-01,1991,7,3
199107,54,220303,2,1.15,,220303,42,01-07-1991,01-07-1991,1991-07-01,1991,7,3
199107,98,220303,2,.99000001,,220303,42,01-07-1991,01-07-1991,1991-07-01,1991,7,3
199107,75,220303,2,.89999998,,220303,42,01-07-1991,01-07-1991,1991-07-01,1991,7,3
199107,73,220303,2,.75,,220303,42,01-07-1991,01-07-1991,1991-07-01,1991,7,3
199107,61,220303,2,.75,,220303,42,01-07-1991,01-07-1991,1991-07-01,1991,7,3
199107,103,220303,2,.85000002,,220303,42,01-07-1991,01-07-1991,1991-07-01,1991,7,3
199107,80,220303,2,.94999999,,220303,42,01-07-1991,01-07-1991,1991-07-01,1991,7,3
199107,23,220303,2,1.1,,220303,42,01-07-1991,01-07-1991,1991-07-01,1991,7,3
199107,18,220303,2,.72000003,,220303,42,01-07-1991,01-07-1991,1991-07-01,1991,7,3
199107,73,220303,2,.85000002,,220303,42,01-07-1991,01-07-1991,1991-07-01,1991,7,3
199107,56,220303,2,.64999998,,220303,42,01-07-1991,01-07-1991,1991-07-01,1991,7,3
199107,70,220303,2,.89999998,,220303,42,01-07-1991,01-07-1991,1991-07-01,1991,7,3
199107,106,220303,2,.80000001,,220303,42,01-07-1991,01-07-1991,1991-07-01,1991,7,3
199107,58,220303,2,.64999998,,220303,42,01-07-1991,01-07-1991,1991-07-01,1991,7,3
199107,88,220303,2,.80000001,,220303,42,01-07-1991,01-07-1991,1991-07-01,1991,7,3
199107,17,220303,2,.64999998,,220303,42,01-07-1991,01-07-1991,1991-07-01,1991,7,3
199107,25,220303,2,1,,220303,42,01-07-1991,01-07-1991,1991-07-01,1991,7,3
199107,124,220303,2,1.3,,220303,42,01-07-1991,01-07-1991,1991-07-01,1991,7,3
199107,24,220303,2,.58999997,,220303,42,01-07-1991,01-07-1991,1991-07-01,1991,7,3
199108,17,220303,2,.64999998,,220303,43,01-08-1991,01-08-1991,1991-08-01,1991,8,3
199108,54,220303,2,1.2,,220303,43,01-08-1991,01-08-1991,1991-08-01,1991,8,3
199108,98,220303,2,.99000001,,220303,43,01-08-1991,01-08-1991,1991-08-01,1991,8,3
199108,124,220303,2,1.3,,220303,43,01-08-1991,01-08-1991,1991-08-01,1991,8,3
199108,88,220303,2,.80000001,,220303,43,01-08-1991,01-08-1991,1991-08-01,1991,8,3
199108,60,220303,2,.69999999,,220303,43,01-08-1991,01-08-1991,1991-08-01,1991,8,3
199108,103,220303,2,.85000002,,220303,43,01-08-1991,01-08-1991,1991-08-01,1991,8,3
199108,80,220303,2,.88999999,,220303,43,01-08-1991,01-08-1991,1991-08-01,1991,8,3
199108,70,220303,2,.89999998,,220303,43,01-08-1991,01-08-1991,1991-08-01,1991,8,3
199108,73,220303,2,.85000002,,220303,43,01-08-1991,01-08-1991,1991-08-01,1991,8,3
199108,56,220303,2,.64999998,,220303,43,01-08-1991,01-08-1991,1991-08-01,1991,8,3
199108,12,220303,2,.82999998,,220303,43,01-08-1991,01-08-1991,1991-08-01,1991,8,3
199108,75,220303,2,.89999998,,220303,43,01-08-1991,01-08-1991,1991-08-01,1991,8,3
199108,56,220303,2,.69999999,,220303,43,01-08-1991,01-08-1991,1991-08-01,1991,8,3
199108,61,220303,2,.75,,220303,43,01-08-1991,01-08-1991,1991-08-01,1991,8,3
199108,58,220303,2,.64999998,,220303,43,01-08-1991,01-08-1991,1991-08-01,1991,8,3
199108,18,220303,2,.73000002,,220303,43,01-08-1991,01-08-1991,1991-08-01,1991,8,3
199108,25,220303,2,1,,220303,43,01-08-1991,01-08-1991,1991-08-01,1991,8,3
199109,124,220303,2,1.3,,220303,44,01-09-1991,01-09-1991,1991-09-01,1991,9,3
199109,98,220303,2,.99000001,,220303,44,01-09-1991,01-09-1991,1991-09-01,1991,9,3
199109,73,220303,2,.94999999,,220303,44,01-09-1991,01-09-1991,1991-09-01,1991,9,3
199109,103,220303,2,.85000002,,220303,44,01-09-1991,01-09-1991,1991-09-01,1991,9,3
199109,18,220303,2,.69999999,,220303,44,01-09-1991,01-09-1991,1991-09-01,1991,9,3
199109,60,220303,2,.69999999,,220303,44,01-09-1991,01-09-1991,1991-09-01,1991,9,3
199109,140,220303,2,1.05,,220303,44,01-09-1991,01-09-1991,1991-09-01,1991,9,3
199109,25,220303,2,1.2,,220303,44,01-09-1991,01-09-1991,1991-09-01,1991,9,3
199109,23,220303,2,1.05,,220303,44,01-09-1991,01-09-1991,1991-09-01,1991,9,3
199109,61,220303,2,.75,,220303,44,01-09-1991,01-09-1991,1991-09-01,1991,9,3
199109,56,220303,2,.64999998,,220303,44,01-09-1991,01-09-1991,1991-09-01,1991,9,3
199109,143,220303,2,1.1,,220303,44,01-09-1991,01-09-1991,1991-09-01,1991,9,3
199109,24,220303,2,.58999997,,220303,44,01-09-1991,01-09-1991,1991-09-01,1991,9,3
199109,56,220303,2,.69999999,,220303,44,01-09-1991,01-09-1991,1991-09-01,1991,9,3
199109,17,220303,2,.64999998,,220303,44,01-09-1991,01-09-1991,1991-09-01,1991,9,3
199109,89,220303,2,.69999999,,220303,44,01-09-1991,01-09-1991,1991-09-01,1991,9,3
199109,93,220303,2,.76999998,,220303,44,01-09-1991,01-09-1991,1991-09-01,1991,9,3
199109,77,220303,2,.85000002,,220303,44,01-09-1991,01-09-1991,1991-09-01,1991,9,3
199109,70,220303,2,.89999998,,220303,44,01-09-1991,01-09-1991,1991-09-01,1991,9,3
199109,106,220303,2,.80000001,,220303,44,01-09-1991,01-09-1991,1991-09-01,1991,9,3
199109,46,220303,2,.88999999,,220303,44,01-09-1991,01-09-1991,1991-09-01,1991,9,3
199109,54,220303,2,1.2,,220303,44,01-09-1991,01-09-1991,1991-09-01,1991,9,3
199109,80,220303,2,.88999999,,220303,44,01-09-1991,01-09-1991,1991-09-01,1991,9,3
199109,41,220303,2,.69999999,,220303,44,01-09-1991,01-09-1991,1991-09-01,1991,9,3
199109,75,220303,2,.94999999,,220303,44,01-09-1991,01-09-1991,1991-09-01,1991,9,3
199110,140,220303,2,1.05,,220303,45,01-10-1991,01-10-1991,1991-10-01,1991,10,4
199110,56,220303,2,.69999999,,220303,45,01-10-1991,01-10-1991,1991-10-01,1991,10,4
199110,12,220303,2,.63999999,,220303,45,01-10-1991,01-10-1991,1991-10-01,1991,10,4
199110,75,220303,2,.94999999,,220303,45,01-10-1991,01-10-1991,1991-10-01,1991,10,4
199110,189,220303,2,.75,,220303,45,01-10-1991,01-10-1991,1991-10-01,1991,10,4
199110,70,220303,2,.89999998,,220303,45,01-10-1991,01-10-1991,1991-10-01,1991,10,4
199110,103,220303,2,.85000002,,220303,45,01-10-1991,01-10-1991,1991-10-01,1991,10,4
199110,24,220303,2,.58999997,,220303,45,01-10-1991,01-10-1991,1991-10-01,1991,10,4
199110,143,220303,2,1.1,,220303,45,01-10-1991,01-10-1991,1991-10-01,1991,10,4
199110,80,220303,2,.88999999,,220303,45,01-10-1991,01-10-1991,1991-10-01,1991,10,4
199110,89,220303,2,.69999999,,220303,45,01-10-1991,01-10-1991,1991-10-01,1991,10,4
199110,25,220303,2,1.2,,220303,45,01-10-1991,01-10-1991,1991-10-01,1991,10,4
199110,18,220303,2,.69999999,,220303,45,01-10-1991,01-10-1991,1991-10-01,1991,10,4
199110,56,220303,2,.69999999,,220303,45,01-10-1991,01-10-1991,1991-10-01,1991,10,4
199110,93,220303,2,.80000001,,220303,45,01-10-1991,01-10-1991,1991-10-01,1991,10,4
199110,46,220303,2,.88999999,,220303,45,01-10-1991,01-10-1991,1991-10-01,1991,10,4
199110,61,220303,2,.75,,220303,45,01-10-1991,01-10-1991,1991-10-01,1991,10,4
199110,73,220303,2,.94999999,,220303,45,01-10-1991,01-10-1991,1991-10-01,1991,10,4
199110,106,220303,2,.80000001,,220303,45,01-10-1991,01-10-1991,1991-10-01,1991,10,4
199110,23,220303,2,.94999999,,220303,45,01-10-1991,01-10-1991,1991-10-01,1991,10,4
199110,88,220303,2,.60000002,,220303,45,01-10-1991,01-10-1991,1991-10-01,1991,10,4
199110,41,220303,2,.69999999,,220303,45,01-10-1991,01-10-1991,1991-10-01,1991,10,4
199110,58,220303,2,.64999998,,220303,45,01-10-1991,01-10-1991,1991-10-01,1991,10,4
199110,17,220303,2,.64999998,,220303,45,01-10-1991,01-10-1991,1991-10-01,1991,10,4
199110,124,220303,2,1.45,,220303,45,01-10-1991,01-10-1991,1991-10-01,1991,10,4
199110,98,220303,2,.99000001,,220303,45,01-10-1991,01-10-1991,1991-10-01,1991,10,4
199110,54,220303,2,1.2,,220303,45,01-10-1991,01-10-1991,1991-10-01,1991,10,4
199111,61,220303,2,.75,,220303,46,01-11-1991,01-11-1991,1991-11-01,1991,11,4
199111,18,220303,2,.69999999,,220303,46,01-11-1991,01-11-1991,1991-11-01,1991,11,4
199111,124,220303,2,1.45,,220303,46,01-11-1991,01-11-1991,1991-11-01,1991,11,4
199111,75,220303,2,.94999999,,220303,46,01-11-1991,01-11-1991,1991-11-01,1991,11,4
199111,98,220303,2,.99000001,,220303,46,01-11-1991,01-11-1991,1991-11-01,1991,11,4
199111,56,220303,2,.69999999,,220303,46,01-11-1991,01-11-1991,1991-11-01,1991,11,4
199111,80,220303,2,.88999999,,220303,46,01-11-1991,01-11-1991,1991-11-01,1991,11,4
199111,73,220303,2,.94999999,,220303,46,01-11-1991,01-11-1991,1991-11-01,1991,11,4
199111,106,220303,2,.80000001,,220303,46,01-11-1991,01-11-1991,1991-11-01,1991,11,4
199111,189,220303,2,.75,,220303,46,01-11-1991,01-11-1991,1991-11-01,1991,11,4
199111,12,220303,2,.85000002,,220303,46,01-11-1991,01-11-1991,1991-11-01,1991,11,4
199111,143,220303,2,1.15,,220303,46,01-11-1991,01-11-1991,1991-11-01,1991,11,4
199111,17,220303,2,.64999998,,220303,46,01-11-1991,01-11-1991,1991-11-01,1991,11,4
199111,89,220303,2,.69999999,,220303,46,01-11-1991,01-11-1991,1991-11-01,1991,11,4
199111,24,220303,2,.58999997,,220303,46,01-11-1991,01-11-1991,1991-11-01,1991,11,4
199111,106,220303,2,.75,,220303,46,01-11-1991,01-11-1991,1991-11-01,1991,11,4
199111,41,220303,2,.69999999,,220303,46,01-11-1991,01-11-1991,1991-11-01,1991,11,4
199111,140,220303,2,1.05,,220303,46,01-11-1991,01-11-1991,1991-11-01,1991,11,4
199111,58,220303,2,.64999998,,220303,46,01-11-1991,01-11-1991,1991-11-01,1991,11,4
199111,77,220303,2,.85000002,,220303,46,01-11-1991,01-11-1991,1991-11-01,1991,11,4
199111,88,220303,2,.60000002,,220303,46,01-11-1991,01-11-1991,1991-11-01,1991,11,4
199111,103,220303,2,.85000002,,220303,46,01-11-1991,01-11-1991,1991-11-01,1991,11,4
199111,54,220303,2,1.2,,220303,46,01-11-1991,01-11-1991,1991-11-01,1991,11,4
199111,56,220303,2,.69999999,,220303,46,01-11-1991,01-11-1991,1991-11-01,1991,11,4
199111,60,220303,2,.69999999,,220303,46,01-11-1991,01-11-1991,1991-11-01,1991,11,4
199111,46,220303,2,.88999999,,220303,46,01-11-1991,01-11-1991,1991-11-01,1991,11,4
199111,93,220303,2,.80000001,,220303,46,01-11-1991,01-11-1991,1991-11-01,1991,11,4
199111,70,220303,2,.89999998,,220303,46,01-11-1991,01-11-1991,1991-11-01,1991,11,4
199111,25,220303,2,1.2,,220303,46,01-11-1991,01-11-1991,1991-11-01,1991,11,4
199112,138,220303,2,.69999999,,220303,47,01-12-1991,01-12-1991,1991-12-01,1991,12,4
199112,106,220303,2,.80000001,,220303,47,01-12-1991,01-12-1991,1991-12-01,1991,12,4
199112,70,220303,2,.89999998,,220303,47,01-12-1991,01-12-1991,1991-12-01,1991,12,4
199112,143,220303,2,1.15,,220303,47,01-12-1991,01-12-1991,1991-12-01,1991,12,4
199112,25,220303,2,1.2,,220303,47,01-12-1991,01-12-1991,1991-12-01,1991,12,4
199112,61,220303,2,.75,,220303,47,01-12-1991,01-12-1991,1991-12-01,1991,12,4
199112,111,220303,2,.85000002,,220303,47,01-12-1991,01-12-1991,1991-12-01,1991,12,4
199112,75,220303,2,.94999999,,220303,47,01-12-1991,01-12-1991,1991-12-01,1991,12,4
199112,77,220303,2,.85000002,,220303,47,01-12-1991,01-12-1991,1991-12-01,1991,12,4
199112,98,220303,2,.99000001,,220303,47,01-12-1991,01-12-1991,1991-12-01,1991,12,4
199112,106,220303,2,.75,,220303,47,01-12-1991,01-12-1991,1991-12-01,1991,12,4
199112,124,220303,2,1.45,,220303,47,01-12-1991,01-12-1991,1991-12-01,1991,12,4
199112,103,220303,2,.85000002,,220303,47,01-12-1991,01-12-1991,1991-12-01,1991,12,4
199112,56,220303,2,.69999999,,220303,47,01-12-1991,01-12-1991,1991-12-01,1991,12,4
199112,41,220303,2,.69999999,,220303,47,01-12-1991,01-12-1991,1991-12-01,1991,12,4
199112,58,220303,2,.64999998,,220303,47,01-12-1991,01-12-1991,1991-12-01,1991,12,4
199112,73,220303,2,.94999999,,220303,47,01-12-1991,01-12-1991,1991-12-01,1991,12,4
199112,60,220303,2,.69999999,,220303,47,01-12-1991,01-12-1991,1991-12-01,1991,12,4
199112,189,220303,2,.75,,220303,47,01-12-1991,01-12-1991,1991-12-01,1991,12,4
199112,80,220303,2,.88999999,,220303,47,01-12-1991,01-12-1991,1991-12-01,1991,12,4
199112,54,220303,2,1.2,,220303,47,01-12-1991,01-12-1991,1991-12-01,1991,12,4
199112,56,220303,2,.69999999,,220303,47,01-12-1991,01-12-1991,1991-12-01,1991,12,4
199112,46,220303,2,.88999999,,220303,47,01-12-1991,01-12-1991,1991-12-01,1991,12,4
199112,140,220303,2,1.05,,220303,47,01-12-1991,01-12-1991,1991-12-01,1991,12,4
199112,100,220303,2,1.05,,220303,47,01-12-1991,01-12-1991,1991-12-01,1991,12,4
199112,89,220303,2,.69999999,,220303,47,01-12-1991,01-12-1991,1991-12-01,1991,12,4
199112,88,220303,2,.60000002,,220303,47,01-12-1991,01-12-1991,1991-12-01,1991,12,4
199112,93,220303,2,.80000001,,220303,47,01-12-1991,01-12-1991,1991-12-01,1991,12,4
199112,111,220303,2,.70999998,,220303,47,01-12-1991,01-12-1991,1991-12-01,1991,12,4
199112,114,220303,2,.89999998,,220303,47,01-12-1991,01-12-1991,1991-12-01,1991,12,4
199112,18,220303,2,.69999999,,220303,47,01-12-1991,01-12-1991,1991-12-01,1991,12,4
199112,17,220303,2,.64999998,,220303,47,01-12-1991,01-12-1991,1991-12-01,1991,12,4
199112,106,220303,2,.88999999,,220303,47,01-12-1991,01-12-1991,1991-12-01,1991,12,4
199201,24,220303,2,.63999999,,220303,48,01-01-1992,01-01-1992,1992-01-01,1992,1,1
199201,114,220303,2,1.04,,220303,48,01-01-1992,01-01-1992,1992-01-01,1992,1,1
199201,61,220303,2,.80000001,,220303,48,01-01-1992,01-01-1992,1992-01-01,1992,1,1
199201,58,220303,2,.64999998,,220303,48,01-01-1992,01-01-1992,1992-01-01,1992,1,1
199201,75,220303,2,.94999999,,220303,48,01-01-1992,01-01-1992,1992-01-01,1992,1,1
199201,18,220303,2,.69999999,,220303,48,01-01-1992,01-01-1992,1992-01-01,1992,1,1
199201,140,220303,2,1.1,,220303,48,01-01-1992,01-01-1992,1992-01-01,1992,1,1
199201,56,220303,2,.69999999,,220303,48,01-01-1992,01-01-1992,1992-01-01,1992,1,1
199201,54,220303,2,1.2,,220303,48,01-01-1992,01-01-1992,1992-01-01,1992,1,1
199201,106,220303,2,.80000001,,220303,48,01-01-1992,01-01-1992,1992-01-01,1992,1,1
199201,100,220303,2,1.05,,220303,48,01-01-1992,01-01-1992,1992-01-01,1992,1,1
199201,111,220303,2,.70999998,,220303,48,01-01-1992,01-01-1992,1992-01-01,1992,1,1
199201,73,220303,2,.94999999,,220303,48,01-01-1992,01-01-1992,1992-01-01,1992,1,1
199201,88,220303,2,.60000002,,220303,48,01-01-1992,01-01-1992,1992-01-01,1992,1,1
199201,77,220303,2,.85000002,,220303,48,01-01-1992,01-01-1992,1992-01-01,1992,1,1
199201,56,220303,2,.69999999,,220303,48,01-01-1992,01-01-1992,1992-01-01,1992,1,1
199201,189,220303,2,.75,,220303,48,01-01-1992,01-01-1992,1992-01-01,1992,1,1
199201,133,220303,2,.80000001,,220303,48,01-01-1992,01-01-1992,1992-01-01,1992,1,1
199201,106,220303,2,.88999999,,220303,48,01-01-1992,01-01-1992,1992-01-01,1992,1,1
199201,70,220303,2,.89999998,,220303,48,01-01-1992,01-01-1992,1992-01-01,1992,1,1
199201,98,220303,2,.99000001,,220303,48,01-01-1992,01-01-1992,1992-01-01,1992,1,1
199201,12,220303,2,.85000002,,220303,48,01-01-1992,01-01-1992,1992-01-01,1992,1,1
199201,80,220303,2,.88999999,,220303,48,01-01-1992,01-01-1992,1992-01-01,1992,1,1
199201,89,220303,2,.69999999,,220303,48,01-01-1992,01-01-1992,1992-01-01,1992,1,1
199201,143,220303,2,1.1,,220303,48,01-01-1992,01-01-1992,1992-01-01,1992,1,1
199201,142,220303,2,.94999999,,220303,48,01-01-1992,01-01-1992,1992-01-01,1992,1,1
199201,106,220303,2,.75,,220303,48,01-01-1992,01-01-1992,1992-01-01,1992,1,1
199201,46,220303,2,.88999999,,220303,48,01-01-1992,01-01-1992,1992-01-01,1992,1,1
199201,17,220303,2,.64999998,,220303,48,01-01-1992,01-01-1992,1992-01-01,1992,1,1
199201,60,220303,2,.69999999,,220303,48,01-01-1992,01-01-1992,1992-01-01,1992,1,1
199201,25,220303,2,1.2,,220303,48,01-01-1992,01-01-1992,1992-01-01,1992,1,1
199201,138,220303,2,.69999999,,220303,48,01-01-1992,01-01-1992,1992-01-01,1992,1,1
199201,103,220303,2,.85000002,,220303,48,01-01-1992,01-01-1992,1992-01-01,1992,1,1
199201,93,220303,2,.80000001,,220303,48,01-01-1992,01-01-1992,1992-01-01,1992,1,1
199201,111,220303,2,.85000002,,220303,48,01-01-1992,01-01-1992,1992-01-01,1992,1,1
199202,60,220303,2,.69999999,,220303,49,01-02-1992,01-02-1992,1992-02-01,1992,2,1
199202,111,220303,2,.85000002,,220303,49,01-02-1992,01-02-1992,1992-02-01,1992,2,1
199202,140,220303,2,1.1,,220303,49,01-02-1992,01-02-1992,1992-02-01,1992,2,1
199202,114,220303,2,1.04,,220303,49,01-02-1992,01-02-1992,1992-02-01,1992,2,1
199202,138,220303,2,.69999999,,220303,49,01-02-1992,01-02-1992,1992-02-01,1992,2,1
199202,106,220303,2,.88999999,,220303,49,01-02-1992,01-02-1992,1992-02-01,1992,2,1
199202,103,220303,2,.85000002,,220303,49,01-02-1992,01-02-1992,1992-02-01,1992,2,1
199202,93,220303,2,.80000001,,220303,49,01-02-1992,01-02-1992,1992-02-01,1992,2,1
199202,140,220303,2,.89999998,,220303,49,01-02-1992,01-02-1992,1992-02-01,1992,2,1
199202,58,220303,2,.64999998,,220303,49,01-02-1992,01-02-1992,1992-02-01,1992,2,1
199202,111,220303,2,.70999998,,220303,49,01-02-1992,01-02-1992,1992-02-01,1992,2,1
199202,138,220303,2,.99000001,,220303,49,01-02-1992,01-02-1992,1992-02-01,1992,2,1
199202,163,220303,2,.69999999,,220303,49,01-02-1992,01-02-1992,1992-02-01,1992,2,1
199202,89,220303,2,.69999999,,220303,49,01-02-1992,01-02-1992,1992-02-01,1992,2,1
199202,80,220303,2,.88999999,,220303,49,01-02-1992,01-02-1992,1992-02-01,1992,2,1
199202,70,220303,2,.89999998,,220303,49,01-02-1992,01-02-1992,1992-02-01,1992,2,1
199202,143,220303,2,1.1,,220303,49,01-02-1992,01-02-1992,1992-02-01,1992,2,1
199202,25,220303,2,1.2,,220303,49,01-02-1992,01-02-1992,1992-02-01,1992,2,1
199202,56,220303,2,.69999999,,220303,49,01-02-1992,01-02-1992,1992-02-01,1992,2,1
199202,17,220303,2,.64999998,,220303,49,01-02-1992,01-02-1992,1992-02-01,1992,2,1
199202,189,220303,2,.75,,220303,49,01-02-1992,01-02-1992,1992-02-01,1992,2,1
199202,106,220303,2,.80000001,,220303,49,01-02-1992,01-02-1992,1992-02-01,1992,2,1
199202,18,220303,2,.69999999,,220303,49,01-02-1992,01-02-1992,1992-02-01,1992,2,1
199202,142,220303,2,.94999999,,220303,49,01-02-1992,01-02-1992,1992-02-01,1992,2,1
199202,46,220303,2,.88999999,,220303,49,01-02-1992,01-02-1992,1992-02-01,1992,2,1
199202,54,220303,2,1.2,,220303,49,01-02-1992,01-02-1992,1992-02-01,1992,2,1
199202,61,220303,2,.80000001,,220303,49,01-02-1992,01-02-1992,1992-02-01,1992,2,1
199202,100,220303,2,1.05,,220303,49,01-02-1992,01-02-1992,1992-02-01,1992,2,1
199202,88,220303,2,.60000002,,220303,49,01-02-1992,01-02-1992,1992-02-01,1992,2,1
199202,98,220303,2,.99000001,,220303,49,01-02-1992,01-02-1992,1992-02-01,1992,2,1
199202,106,220303,2,.75,,220303,49,01-02-1992,01-02-1992,1992-02-01,1992,2,1
199202,77,220303,2,.85000002,,220303,49,01-02-1992,01-02-1992,1992-02-01,1992,2,1
199202,24,220303,2,.63999999,,220303,49,01-02-1992,01-02-1992,1992-02-01,1992,2,1
199202,75,220303,2,.94999999,,220303,49,01-02-1992,01-02-1992,1992-02-01,1992,2,1
199202,73,220303,2,1,,220303,49,01-02-1992,01-02-1992,1992-02-01,1992,2,1
199202,56,220303,2,.75,,220303,49,01-02-1992,01-02-1992,1992-02-01,1992,2,1
199202,133,220303,2,.80000001,,220303,49,01-02-1992,01-02-1992,1992-02-01,1992,2,1
199203,58,220303,2,.69999999,,220303,50,01-03-1992,01-03-1992,1992-03-01,1992,3,1
199203,138,220303,2,.69999999,,220303,50,01-03-1992,01-03-1992,1992-03-01,1992,3,1
199203,88,220303,2,.60000002,,220303,50,01-03-1992,01-03-1992,1992-03-01,1992,3,1
199203,140,220303,2,1,,220303,50,01-03-1992,01-03-1992,1992-03-01,1992,3,1
199203,114,220303,2,1.04,,220303,50,01-03-1992,01-03-1992,1992-03-01,1992,3,1
199203,17,220303,2,.64999998,,220303,50,01-03-1992,01-03-1992,1992-03-01,1992,3,1
199203,98,220303,2,.99000001,,220303,50,01-03-1992,01-03-1992,1992-03-01,1992,3,1
199203,163,220303,2,.69999999,,220303,50,01-03-1992,01-03-1992,1992-03-01,1992,3,1
199203,106,220303,2,.75,,220303,50,01-03-1992,01-03-1992,1992-03-01,1992,3,1
199203,106,220303,2,.88999999,,220303,50,01-03-1992,01-03-1992,1992-03-01,1992,3,1
199203,18,220303,2,.69999999,,220303,50,01-03-1992,01-03-1992,1992-03-01,1992,3,1
199203,138,220303,2,.99000001,,220303,50,01-03-1992,01-03-1992,1992-03-01,1992,3,1
199203,111,220303,2,.85000002,,220303,50,01-03-1992,01-03-1992,1992-03-01,1992,3,1
199203,140,220303,2,1.1,,220303,50,01-03-1992,01-03-1992,1992-03-01,1992,3,1
199203,70,220303,2,.89999998,,220303,50,01-03-1992,01-03-1992,1992-03-01,1992,3,1
199203,142,220303,2,1.1,,220303,50,01-03-1992,01-03-1992,1992-03-01,1992,3,1
199203,93,220303,2,.80000001,,220303,50,01-03-1992,01-03-1992,1992-03-01,1992,3,1
199203,103,220303,2,.85000002,,220303,50,01-03-1992,01-03-1992,1992-03-01,1992,3,1
199203,77,220303,2,.85000002,,220303,50,01-03-1992,01-03-1992,1992-03-01,1992,3,1
199203,61,220303,2,.80000001,,220303,50,01-03-1992,01-03-1992,1992-03-01,1992,3,1
199203,41,220303,2,.69999999,,220303,50,01-03-1992,01-03-1992,1992-03-01,1992,3,1
199203,133,220303,2,.80000001,,220303,50,01-03-1992,01-03-1992,1992-03-01,1992,3,1
199203,100,220303,2,1.05,,220303,50,01-03-1992,01-03-1992,1992-03-01,1992,3,1
199203,24,220303,2,.63999999,,220303,50,01-03-1992,01-03-1992,1992-03-01,1992,3,1
199203,143,220303,2,1.1,,220303,50,01-03-1992,01-03-1992,1992-03-01,1992,3,1
199203,75,220303,2,.94999999,,220303,50,01-03-1992,01-03-1992,1992-03-01,1992,3,1
199203,189,220303,2,.75,,220303,50,01-03-1992,01-03-1992,1992-03-01,1992,3,1
199203,106,220303,2,.80000001,,220303,50,01-03-1992,01-03-1992,1992-03-01,1992,3,1
199203,56,220303,2,.75,,220303,50,01-03-1992,01-03-1992,1992-03-01,1992,3,1
199203,80,220303,2,.88999999,,220303,50,01-03-1992,01-03-1992,1992-03-01,1992,3,1
199203,60,220303,2,.69999999,,220303,50,01-03-1992,01-03-1992,1992-03-01,1992,3,1
199203,73,220303,2,1.2,,220303,50,01-03-1992,01-03-1992,1992-03-01,1992,3,1
199203,54,220303,2,1.2,,220303,50,01-03-1992,01-03-1992,1992-03-01,1992,3,1
199203,46,220303,2,.88999999,,220303,50,01-03-1992,01-03-1992,1992-03-01,1992,3,1
199203,56,220303,2,.69999999,,220303,50,01-03-1992,01-03-1992,1992-03-01,1992,3,1
199203,89,220303,2,.69999999,,220303,50,01-03-1992,01-03-1992,1992-03-01,1992,3,1
199204,17,220303,2,.64999998,,220303,51,01-04-1992,01-04-1992,1992-04-01,1992,4,2
199204,61,220303,2,.80000001,,220303,51,01-04-1992,01-04-1992,1992-04-01,1992,4,2
199204,46,220303,2,.88999999,,220303,51,01-04-1992,01-04-1992,1992-04-01,1992,4,2
199204,41,220303,2,.69999999,,220303,51,01-04-1992,01-04-1992,1992-04-01,1992,4,2
199204,54,220303,2,1.2,,220303,51,01-04-1992,01-04-1992,1992-04-01,1992,4,2
199204,73,220303,2,1.2,,220303,51,01-04-1992,01-04-1992,1992-04-01,1992,4,2
199204,77,220303,2,.85000002,,220303,51,01-04-1992,01-04-1992,1992-04-01,1992,4,2
199204,111,220303,2,.85000002,,220303,51,01-04-1992,01-04-1992,1992-04-01,1992,4,2
199204,56,220303,2,.75,,220303,51,01-04-1992,01-04-1992,1992-04-01,1992,4,2
199204,88,220303,2,.60000002,,220303,51,01-04-1992,01-04-1992,1992-04-01,1992,4,2
199204,60,220303,2,.69999999,,220303,51,01-04-1992,01-04-1992,1992-04-01,1992,4,2
199204,140,220303,2,1.1,,220303,51,01-04-1992,01-04-1992,1992-04-01,1992,4,2
199204,106,220303,2,1.05,,220303,51,01-04-1992,01-04-1992,1992-04-01,1992,4,2
199204,100,220303,2,1.15,,220303,51,01-04-1992,01-04-1992,1992-04-01,1992,4,2
199204,182,220303,2,1.1,,220303,51,01-04-1992,01-04-1992,1992-04-01,1992,4,2
199204,58,220303,2,.69999999,,220303,51,01-04-1992,01-04-1992,1992-04-01,1992,4,2
199204,70,220303,2,.94999999,,220303,51,01-04-1992,01-04-1992,1992-04-01,1992,4,2
199204,189,220303,2,.75,,220303,51,01-04-1992,01-04-1992,1992-04-01,1992,4,2
199204,143,220303,2,1.1,,220303,51,01-04-1992,01-04-1992,1992-04-01,1992,4,2
199204,103,220303,2,.85000002,,220303,51,01-04-1992,01-04-1992,1992-04-01,1992,4,2
199204,114,220303,2,1.04,,220303,51,01-04-1992,01-04-1992,1992-04-01,1992,4,2
199204,89,220303,2,.69999999,,220303,51,01-04-1992,01-04-1992,1992-04-01,1992,4,2
199204,138,220303,2,.94999999,,220303,51,01-04-1992,01-04-1992,1992-04-01,1992,4,2
199204,106,220303,2,.80000001,,220303,51,01-04-1992,01-04-1992,1992-04-01,1992,4,2
199204,24,220303,2,.63999999,,220303,51,01-04-1992,01-04-1992,1992-04-01,1992,4,2
199204,111,220303,2,.70999998,,220303,51,01-04-1992,01-04-1992,1992-04-01,1992,4,2
199204,75,220303,2,.94999999,,220303,51,01-04-1992,01-04-1992,1992-04-01,1992,4,2
199204,56,220303,2,.75,,220303,51,01-04-1992,01-04-1992,1992-04-01,1992,4,2
199204,140,220303,2,1,,220303,51,01-04-1992,01-04-1992,1992-04-01,1992,4,2
199204,93,220303,2,.80000001,,220303,51,01-04-1992,01-04-1992,1992-04-01,1992,4,2
199204,106,220303,2,.75,,220303,51,01-04-1992,01-04-1992,1992-04-01,1992,4,2
199204,163,220303,2,.69999999,,220303,51,01-04-1992,01-04-1992,1992-04-01,1992,4,2
199204,142,220303,2,1.1,,220303,51,01-04-1992,01-04-1992,1992-04-01,1992,4,2
199204,138,220303,2,.69999999,,220303,51,01-04-1992,01-04-1992,1992-04-01,1992,4,2
199204,80,220303,2,.88999999,,220303,51,01-04-1992,01-04-1992,1992-04-01,1992,4,2
199205,142,220303,2,1.1,,220303,52,01-05-1992,01-05-1992,1992-05-01,1992,5,2
199205,75,220303,2,.94999999,,220303,52,01-05-1992,01-05-1992,1992-05-01,1992,5,2
199205,106,220303,2,.80000001,,220303,52,01-05-1992,01-05-1992,1992-05-01,1992,5,2
199205,111,220303,2,.70999998,,220303,52,01-05-1992,01-05-1992,1992-05-01,1992,5,2
199205,100,220303,2,1.15,,220303,52,01-05-1992,01-05-1992,1992-05-01,1992,5,2
199205,88,220303,2,.64999998,,220303,52,01-05-1992,01-05-1992,1992-05-01,1992,5,2
199205,106,220303,2,1.05,,220303,52,01-05-1992,01-05-1992,1992-05-01,1992,5,2
199205,46,220303,2,.88999999,,220303,52,01-05-1992,01-05-1992,1992-05-01,1992,5,2
199205,98,220303,2,.99000001,,220303,52,01-05-1992,01-05-1992,1992-05-01,1992,5,2
199205,163,220303,2,.69999999,,220303,52,01-05-1992,01-05-1992,1992-05-01,1992,5,2
199205,89,220303,2,.69999999,,220303,52,01-05-1992,01-05-1992,1992-05-01,1992,5,2
199205,24,220303,2,.63999999,,220303,52,01-05-1992,01-05-1992,1992-05-01,1992,5,2
199205,138,220303,2,.94999999,,220303,52,01-05-1992,01-05-1992,1992-05-01,1992,5,2
199205,143,220303,2,1.1,,220303,52,01-05-1992,01-05-1992,1992-05-01,1992,5,2
199205,56,220303,2,.75,,220303,52,01-05-1992,01-05-1992,1992-05-01,1992,5,2
199205,73,220303,2,1,,220303,52,01-05-1992,01-05-1992,1992-05-01,1992,5,2
199205,182,220303,2,1.1,,220303,52,01-05-1992,01-05-1992,1992-05-01,1992,5,2
199205,61,220303,2,.80000001,,220303,52,01-05-1992,01-05-1992,1992-05-01,1992,5,2
199205,17,220303,2,.64999998,,220303,52,01-05-1992,01-05-1992,1992-05-01,1992,5,2
199205,140,220303,2,1.1,,220303,52,01-05-1992,01-05-1992,1992-05-01,1992,5,2
199205,140,220303,2,1,,220303,52,01-05-1992,01-05-1992,1992-05-01,1992,5,2
199205,60,220303,2,.69999999,,220303,52,01-05-1992,01-05-1992,1992-05-01,1992,5,2
199205,56,220303,2,.75,,220303,52,01-05-1992,01-05-1992,1992-05-01,1992,5,2
199205,103,220303,2,.85000002,,220303,52,01-05-1992,01-05-1992,1992-05-01,1992,5,2
199205,111,220303,2,.85000002,,220303,52,01-05-1992,01-05-1992,1992-05-01,1992,5,2
199205,18,220303,2,.75,,220303,52,01-05-1992,01-05-1992,1992-05-01,1992,5,2
199205,93,220303,2,.80000001,,220303,52,01-05-1992,01-05-1992,1992-05-01,1992,5,2
199205,114,220303,2,1.05,,220303,52,01-05-1992,01-05-1992,1992-05-01,1992,5,2
199205,80,220303,2,.88999999,,220303,52,01-05-1992,01-05-1992,1992-05-01,1992,5,2
199205,138,220303,2,.69999999,,220303,52,01-05-1992,01-05-1992,1992-05-01,1992,5,2
199205,54,220303,2,1.2,,220303,52,01-05-1992,01-05-1992,1992-05-01,1992,5,2
199205,41,220303,2,.69999999,,220303,52,01-05-1992,01-05-1992,1992-05-01,1992,5,2
199206,12,220303,2,1.16,,220303,53,01-06-1992,01-06-1992,1992-06-01,1992,6,2
199206,98,220303,2,.99000001,,220303,53,01-06-1992,01-06-1992,1992-06-01,1992,6,2
199206,58,220303,2,.69999999,,220303,53,01-06-1992,01-06-1992,1992-06-01,1992,6,2
199206,103,220303,2,.85000002,,220303,53,01-06-1992,01-06-1992,1992-06-01,1992,6,2
199206,24,220303,2,.63999999,,220303,53,01-06-1992,01-06-1992,1992-06-01,1992,6,2
199206,70,220303,2,.89999998,,220303,53,01-06-1992,01-06-1992,1992-06-01,1992,6,2
199206,189,220303,2,.89999998,,220303,53,01-06-1992,01-06-1992,1992-06-01,1992,6,2
199206,88,220303,2,.64999998,,220303,53,01-06-1992,01-06-1992,1992-06-01,1992,6,2
199206,75,220303,2,.94999999,,220303,53,01-06-1992,01-06-1992,1992-06-01,1992,6,2
199206,18,220303,2,.75,,220303,53,01-06-1992,01-06-1992,1992-06-01,1992,6,2
199206,140,220303,2,1.05,,220303,53,01-06-1992,01-06-1992,1992-06-01,1992,6,2
199206,106,220303,2,.80000001,,220303,53,01-06-1992,01-06-1992,1992-06-01,1992,6,2
199206,89,220303,2,.69999999,,220303,53,01-06-1992,01-06-1992,1992-06-01,1992,6,2
199206,41,220303,2,.69999999,,220303,53,01-06-1992,01-06-1992,1992-06-01,1992,6,2
199206,80,220303,2,.88999999,,220303,53,01-06-1992,01-06-1992,1992-06-01,1992,6,2
199206,73,220303,2,1,,220303,53,01-06-1992,01-06-1992,1992-06-01,1992,6,2
199206,46,220303,2,.88999999,,220303,53,01-06-1992,01-06-1992,1992-06-01,1992,6,2
199206,17,220303,2,.64999998,,220303,53,01-06-1992,01-06-1992,1992-06-01,1992,6,2
199206,56,220303,2,.75,,220303,53,01-06-1992,01-06-1992,1992-06-01,1992,6,2
199206,114,220303,2,1.05,,220303,53,01-06-1992,01-06-1992,1992-06-01,1992,6,2
199206,61,220303,2,.85000002,,220303,53,01-06-1992,01-06-1992,1992-06-01,1992,6,2
199206,111,220303,2,.70999998,,220303,53,01-06-1992,01-06-1992,1992-06-01,1992,6,2
199206,143,220303,2,1.15,,220303,53,01-06-1992,01-06-1992,1992-06-01,1992,6,2
199206,106,220303,2,.80000001,,220303,53,01-06-1992,01-06-1992,1992-06-01,1992,6,2
199206,100,220303,2,1.15,,220303,53,01-06-1992,01-06-1992,1992-06-01,1992,6,2
199206,111,220303,2,.85000002,,220303,53,01-06-1992,01-06-1992,1992-06-01,1992,6,2
199206,93,220303,2,.80000001,,220303,53,01-06-1992,01-06-1992,1992-06-01,1992,6,2
199206,106,220303,2,1.05,,220303,53,01-06-1992,01-06-1992,1992-06-01,1992,6,2
199206,182,220303,2,1.1,,220303,53,01-06-1992,01-06-1992,1992-06-01,1992,6,2
199206,140,220303,2,1,,220303,53,01-06-1992,01-06-1992,1992-06-01,1992,6,2
199206,25,220303,2,1.2,,220303,53,01-06-1992,01-06-1992,1992-06-01,1992,6,2
199206,163,220303,2,.69999999,,220303,53,01-06-1992,01-06-1992,1992-06-01,1992,6,2
199206,138,220303,2,.69999999,,220303,53,01-06-1992,01-06-1992,1992-06-01,1992,6,2
199206,54,220303,2,1.2,,220303,53,01-06-1992,01-06-1992,1992-06-01,1992,6,2
199206,138,220303,2,.94999999,,220303,53,01-06-1992,01-06-1992,1992-06-01,1992,6,2
199206,142,220303,2,1.1,,220303,53,01-06-1992,01-06-1992,1992-06-01,1992,6,2
199207,80,220303,2,.88999999,,220303,54,01-07-1992,01-07-1992,1992-07-01,1992,7,3
199207,70,220303,2,.89999998,,220303,54,01-07-1992,01-07-1992,1992-07-01,1992,7,3
199207,17,220303,2,.64999998,,220303,54,01-07-1992,01-07-1992,1992-07-01,1992,7,3
199207,106,220303,2,.94999999,,220303,54,01-07-1992,01-07-1992,1992-07-01,1992,7,3
199207,106,220303,2,.80000001,,220303,54,01-07-1992,01-07-1992,1992-07-01,1992,7,3
199207,98,220303,2,.99000001,,220303,54,01-07-1992,01-07-1992,1992-07-01,1992,7,3
199207,54,220303,2,1.2,,220303,54,01-07-1992,01-07-1992,1992-07-01,1992,7,3
199207,111,220303,2,.70999998,,220303,54,01-07-1992,01-07-1992,1992-07-01,1992,7,3
199207,103,220303,2,.94999999,,220303,54,01-07-1992,01-07-1992,1992-07-01,1992,7,3
199207,46,220303,2,.94999999,,220303,54,01-07-1992,01-07-1992,1992-07-01,1992,7,3
199207,100,220303,2,.88999999,,220303,54,01-07-1992,01-07-1992,1992-07-01,1992,7,3
199207,140,220303,2,1,,220303,54,01-07-1992,01-07-1992,1992-07-01,1992,7,3
199207,93,220303,2,.80000001,,220303,54,01-07-1992,01-07-1992,1992-07-01,1992,7,3
199207,140,220303,2,1.05,,220303,54,01-07-1992,01-07-1992,1992-07-01,1992,7,3
199207,138,220303,2,.69999999,,220303,54,01-07-1992,01-07-1992,1992-07-01,1992,7,3
199207,88,220303,2,.64999998,,220303,54,01-07-1992,01-07-1992,1992-07-01,1992,7,3
199207,106,220303,2,.80000001,,220303,54,01-07-1992,01-07-1992,1992-07-01,1992,7,3
199207,60,220303,2,.69999999,,220303,54,01-07-1992,01-07-1992,1992-07-01,1992,7,3
199207,163,220303,2,.69999999,,220303,54,01-07-1992,01-07-1992,1992-07-01,1992,7,3
199207,142,220303,2,1.1,,220303,54,01-07-1992,01-07-1992,1992-07-01,1992,7,3
199207,114,220303,2,.94999999,,220303,54,01-07-1992,01-07-1992,1992-07-01,1992,7,3
199207,182,220303,2,1.1,,220303,54,01-07-1992,01-07-1992,1992-07-01,1992,7,3
199207,56,220303,2,.75,,220303,54,01-07-1992,01-07-1992,1992-07-01,1992,7,3
199207,75,220303,2,.94999999,,220303,54,01-07-1992,01-07-1992,1992-07-01,1992,7,3
199207,143,220303,2,1.15,,220303,54,01-07-1992,01-07-1992,1992-07-01,1992,7,3
199207,89,220303,2,.69999999,,220303,54,01-07-1992,01-07-1992,1992-07-01,1992,7,3
199207,18,220303,2,.75,,220303,54,01-07-1992,01-07-1992,1992-07-01,1992,7,3
199207,73,220303,2,1,,220303,54,01-07-1992,01-07-1992,1992-07-01,1992,7,3
199207,12,220303,2,1.16,,220303,54,01-07-1992,01-07-1992,1992-07-01,1992,7,3
199207,61,220303,2,.85000002,,220303,54,01-07-1992,01-07-1992,1992-07-01,1992,7,3
199207,24,220303,2,.63999999,,220303,54,01-07-1992,01-07-1992,1992-07-01,1992,7,3
199207,189,220303,2,.89999998,,220303,54,01-07-1992,01-07-1992,1992-07-01,1992,7,3
199207,58,220303,2,.69999999,,220303,54,01-07-1992,01-07-1992,1992-07-01,1992,7,3
199207,111,220303,2,.85000002,,220303,54,01-07-1992,01-07-1992,1992-07-01,1992,7,3
199207,138,220303,2,.94999999,,220303,54,01-07-1992,01-07-1992,1992-07-01,1992,7,3
199207,56,220303,2,.69999999,,220303,54,01-07-1992,01-07-1992,1992-07-01,1992,7,3
199208,106,220303,2,.80000001,,220303,55,01-08-1992,01-08-1992,1992-08-01,1992,8,3
199208,143,220303,2,1.1,,220303,55,01-08-1992,01-08-1992,1992-08-01,1992,8,3
199208,70,220303,2,.89999998,,220303,55,01-08-1992,01-08-1992,1992-08-01,1992,8,3
199208,156,220303,2,1,,220303,55,01-08-1992,01-08-1992,1992-08-01,1992,8,3
199208,58,220303,2,.69999999,,220303,55,01-08-1992,01-08-1992,1992-08-01,1992,8,3
199208,163,220303,2,.69999999,,220303,55,01-08-1992,01-08-1992,1992-08-01,1992,8,3
199208,54,220303,2,1.2,,220303,55,01-08-1992,01-08-1992,1992-08-01,1992,8,3
199208,80,220303,2,.88999999,,220303,55,01-08-1992,01-08-1992,1992-08-01,1992,8,3
199208,106,220303,2,.94999999,,220303,55,01-08-1992,01-08-1992,1992-08-01,1992,8,3
199208,142,220303,2,1.1,,220303,55,01-08-1992,01-08-1992,1992-08-01,1992,8,3
199208,189,220303,2,.89999998,,220303,55,01-08-1992,01-08-1992,1992-08-01,1992,8,3
199208,111,220303,2,.85000002,,220303,55,01-08-1992,01-08-1992,1992-08-01,1992,8,3
199208,133,220303,2,.69999999,,220303,55,01-08-1992,01-08-1992,1992-08-01,1992,8,3
199208,89,220303,2,.69999999,,220303,55,01-08-1992,01-08-1992,1992-08-01,1992,8,3
199208,182,220303,2,1.1,,220303,55,01-08-1992,01-08-1992,1992-08-01,1992,8,3
199208,138,220303,2,.94999999,,220303,55,01-08-1992,01-08-1992,1992-08-01,1992,8,3
199208,114,220303,2,1.05,,220303,55,01-08-1992,01-08-1992,1992-08-01,1992,8,3
199208,73,220303,2,1,,220303,55,01-08-1992,01-08-1992,1992-08-01,1992,8,3
199208,93,220303,2,.80000001,,220303,55,01-08-1992,01-08-1992,1992-08-01,1992,8,3
199208,140,220303,2,1.05,,220303,55,01-08-1992,01-08-1992,1992-08-01,1992,8,3
199208,103,220303,2,.89999998,,220303,55,01-08-1992,01-08-1992,1992-08-01,1992,8,3
199208,24,220303,2,.63999999,,220303,55,01-08-1992,01-08-1992,1992-08-01,1992,8,3
199208,138,220303,2,.69999999,,220303,55,01-08-1992,01-08-1992,1992-08-01,1992,8,3
199208,140,220303,2,1,,220303,55,01-08-1992,01-08-1992,1992-08-01,1992,8,3
199208,75,220303,2,.94999999,,220303,55,01-08-1992,01-08-1992,1992-08-01,1992,8,3
199208,60,220303,2,.80000001,,220303,55,01-08-1992,01-08-1992,1992-08-01,1992,8,3
199208,56,220303,2,.69999999,,220303,55,01-08-1992,01-08-1992,1992-08-01,1992,8,3
199208,100,220303,2,.88999999,,220303,55,01-08-1992,01-08-1992,1992-08-01,1992,8,3
199208,56,220303,2,.69999999,,220303,55,01-08-1992,01-08-1992,1992-08-01,1992,8,3
199208,41,220303,2,.69999999,,220303,55,01-08-1992,01-08-1992,1992-08-01,1992,8,3
199208,12,220303,2,1.16,,220303,55,01-08-1992,01-08-1992,1992-08-01,1992,8,3
199208,61,220303,2,.85000002,,220303,55,01-08-1992,01-08-1992,1992-08-01,1992,8,3
199208,106,220303,2,.80000001,,220303,55,01-08-1992,01-08-1992,1992-08-01,1992,8,3
199208,17,220303,2,.64999998,,220303,55,01-08-1992,01-08-1992,1992-08-01,1992,8,3
199208,98,220303,2,.99000001,,220303,55,01-08-1992,01-08-1992,1992-08-01,1992,8,3
199208,111,220303,2,.70999998,,220303,55,01-08-1992,01-08-1992,1992-08-01,1992,8,3
199208,18,220303,2,.69999999,,220303,55,01-08-1992,01-08-1992,1992-08-01,1992,8,3
199208,25,220303,2,1.2,,220303,55,01-08-1992,01-08-1992,1992-08-01,1992,8,3
199208,88,220303,2,.64999998,,220303,55,01-08-1992,01-08-1992,1992-08-01,1992,8,3
199209,54,220303,2,1.2,,220303,56,01-09-1992,01-09-1992,1992-09-01,1992,9,3
199209,182,220303,2,1.1,,220303,56,01-09-1992,01-09-1992,1992-09-01,1992,9,3
199209,70,220303,2,.89999998,,220303,56,01-09-1992,01-09-1992,1992-09-01,1992,9,3
199209,75,220303,2,.94999999,,220303,56,01-09-1992,01-09-1992,1992-09-01,1992,9,3
199209,140,220303,2,1.05,,220303,56,01-09-1992,01-09-1992,1992-09-01,1992,9,3
199209,111,220303,2,.70999998,,220303,56,01-09-1992,01-09-1992,1992-09-01,1992,9,3
199209,163,220303,2,.69999999,,220303,56,01-09-1992,01-09-1992,1992-09-01,1992,9,3
199209,24,220303,2,.63999999,,220303,56,01-09-1992,01-09-1992,1992-09-01,1992,9,3
199209,73,220303,2,1,,220303,56,01-09-1992,01-09-1992,1992-09-01,1992,9,3
199209,12,220303,2,1.16,,220303,56,01-09-1992,01-09-1992,1992-09-01,1992,9,3
199209,138,220303,2,.94999999,,220303,56,01-09-1992,01-09-1992,1992-09-01,1992,9,3
199209,142,220303,2,1.1,,220303,56,01-09-1992,01-09-1992,1992-09-01,1992,9,3
199209,61,220303,2,.85000002,,220303,56,01-09-1992,01-09-1992,1992-09-01,1992,9,3
199209,89,220303,2,.85000002,,220303,56,01-09-1992,01-09-1992,1992-09-01,1992,9,3
199209,60,220303,2,.80000001,,220303,56,01-09-1992,01-09-1992,1992-09-01,1992,9,3
199209,111,220303,2,.85000002,,220303,56,01-09-1992,01-09-1992,1992-09-01,1992,9,3
199209,18,220303,2,.69999999,,220303,56,01-09-1992,01-09-1992,1992-09-01,1992,9,3
199209,138,220303,2,.69999999,,220303,56,01-09-1992,01-09-1992,1992-09-01,1992,9,3
199209,80,220303,2,.88999999,,220303,56,01-09-1992,01-09-1992,1992-09-01,1992,9,3
199209,106,220303,2,.80000001,,220303,56,01-09-1992,01-09-1992,1992-09-01,1992,9,3
199209,58,220303,2,.69999999,,220303,56,01-09-1992,01-09-1992,1992-09-01,1992,9,3
199209,140,220303,2,1,,220303,56,01-09-1992,01-09-1992,1992-09-01,1992,9,3
199209,77,220303,2,.94999999,,220303,56,01-09-1992,01-09-1992,1992-09-01,1992,9,3
199209,114,220303,2,.94999999,,220303,56,01-09-1992,01-09-1992,1992-09-01,1992,9,3
199209,156,220303,2,1,,220303,56,01-09-1992,01-09-1992,1992-09-01,1992,9,3
199209,100,220303,2,.94999999,,220303,56,01-09-1992,01-09-1992,1992-09-01,1992,9,3
199209,189,220303,2,.89999998,,220303,56,01-09-1992,01-09-1992,1992-09-01,1992,9,3
199209,103,220303,2,.94999999,,220303,56,01-09-1992,01-09-1992,1992-09-01,1992,9,3
199209,133,220303,2,.69999999,,220303,56,01-09-1992,01-09-1992,1992-09-01,1992,9,3
199209,56,220303,2,.69999999,,220303,56,01-09-1992,01-09-1992,1992-09-01,1992,9,3
199209,93,220303,2,.80000001,,220303,56,01-09-1992,01-09-1992,1992-09-01,1992,9,3
199209,98,220303,2,.99000001,,220303,56,01-09-1992,01-09-1992,1992-09-01,1992,9,3
199209,143,220303,2,1.1,,220303,56,01-09-1992,01-09-1992,1992-09-01,1992,9,3
199209,25,220303,2,1.2,,220303,56,01-09-1992,01-09-1992,1992-09-01,1992,9,3
199209,106,220303,2,.80000001,,220303,56,01-09-1992,01-09-1992,1992-09-01,1992,9,3
199209,41,220303,2,.69999999,,220303,56,01-09-1992,01-09-1992,1992-09-01,1992,9,3
199209,56,220303,2,.75,,220303,56,01-09-1992,01-09-1992,1992-09-01,1992,9,3
199210,61,220303,2,.80000001,,220303,57,01-10-1992,01-10-1992,1992-10-01,1992,10,4
199210,106,220303,2,.80000001,,220303,57,01-10-1992,01-10-1992,1992-10-01,1992,10,4
199210,41,220303,2,.69999999,,220303,57,01-10-1992,01-10-1992,1992-10-01,1992,10,4
199210,18,220303,2,.69999999,,220303,57,01-10-1992,01-10-1992,1992-10-01,1992,10,4
199210,111,220303,2,.70999998,,220303,57,01-10-1992,01-10-1992,1992-10-01,1992,10,4
199210,60,220303,2,.80000001,,220303,57,01-10-1992,01-10-1992,1992-10-01,1992,10,4
199210,88,220303,2,.64999998,,220303,57,01-10-1992,01-10-1992,1992-10-01,1992,10,4
199210,103,220303,2,.94999999,,220303,57,01-10-1992,01-10-1992,1992-10-01,1992,10,4
199210,143,220303,2,1.1,,220303,57,01-10-1992,01-10-1992,1992-10-01,1992,10,4
199210,54,220303,2,1.25,,220303,57,01-10-1992,01-10-1992,1992-10-01,1992,10,4
199210,163,220303,2,.69999999,,220303,57,01-10-1992,01-10-1992,1992-10-01,1992,10,4
199210,138,220303,2,.94999999,,220303,57,01-10-1992,01-10-1992,1992-10-01,1992,10,4
199210,77,220303,2,.94999999,,220303,57,01-10-1992,01-10-1992,1992-10-01,1992,10,4
199210,70,220303,2,.89999998,,220303,57,01-10-1992,01-10-1992,1992-10-01,1992,10,4
199210,182,220303,2,1.1,,220303,57,01-10-1992,01-10-1992,1992-10-01,1992,10,4
199210,93,220303,2,.89999998,,220303,57,01-10-1992,01-10-1992,1992-10-01,1992,10,4
199210,17,220303,2,.64999998,,220303,57,01-10-1992,01-10-1992,1992-10-01,1992,10,4
199210,140,220303,2,1,,220303,57,01-10-1992,01-10-1992,1992-10-01,1992,10,4
199210,58,220303,2,.69999999,,220303,57,01-10-1992,01-10-1992,1992-10-01,1992,10,4
199210,140,220303,2,1.05,,220303,57,01-10-1992,01-10-1992,1992-10-01,1992,10,4
199210,25,220303,2,1.2,,220303,57,01-10-1992,01-10-1992,1992-10-01,1992,10,4
199210,138,220303,2,.69999999,,220303,57,01-10-1992,01-10-1992,1992-10-01,1992,10,4
199210,56,220303,2,.69999999,,220303,57,01-10-1992,01-10-1992,1992-10-01,1992,10,4
199210,56,220303,2,.75,,220303,57,01-10-1992,01-10-1992,1992-10-01,1992,10,4
199210,114,220303,2,.94999999,,220303,57,01-10-1992,01-10-1992,1992-10-01,1992,10,4
199210,98,220303,2,.99000001,,220303,57,01-10-1992,01-10-1992,1992-10-01,1992,10,4
199210,12,220303,2,1.16,,220303,57,01-10-1992,01-10-1992,1992-10-01,1992,10,4
199210,133,220303,2,.69999999,,220303,57,01-10-1992,01-10-1992,1992-10-01,1992,10,4
199210,106,220303,2,.80000001,,220303,57,01-10-1992,01-10-1992,1992-10-01,1992,10,4
199210,75,220303,2,.94999999,,220303,57,01-10-1992,01-10-1992,1992-10-01,1992,10,4
199210,106,220303,2,.94999999,,220303,57,01-10-1992,01-10-1992,1992-10-01,1992,10,4
199210,80,220303,2,.88999999,,220303,57,01-10-1992,01-10-1992,1992-10-01,1992,10,4
199210,73,220303,2,1,,220303,57,01-10-1992,01-10-1992,1992-10-01,1992,10,4
199210,189,220303,2,.75,,220303,57,01-10-1992,01-10-1992,1992-10-01,1992,10,4
199210,150,220303,2,.99000001,,220303,57,01-10-1992,01-10-1992,1992-10-01,1992,10,4
199210,142,220303,2,1.15,,220303,57,01-10-1992,01-10-1992,1992-10-01,1992,10,4
199210,24,220303,2,.63999999,,220303,57,01-10-1992,01-10-1992,1992-10-01,1992,10,4
199210,100,220303,2,.94999999,,220303,57,01-10-1992,01-10-1992,1992-10-01,1992,10,4
199210,156,220303,2,1,,220303,57,01-10-1992,01-10-1992,1992-10-01,1992,10,4
199211,133,220303,2,.69999999,,220303,58,01-11-1992,01-11-1992,1992-11-01,1992,11,4
199211,182,220303,2,1.1,,220303,58,01-11-1992,01-11-1992,1992-11-01,1992,11,4
199211,89,220303,2,.69999999,,220303,58,01-11-1992,01-11-1992,1992-11-01,1992,11,4
199211,25,220303,2,1.2,,220303,58,01-11-1992,01-11-1992,1992-11-01,1992,11,4
199211,18,220303,2,.76999998,,220303,58,01-11-1992,01-11-1992,1992-11-01,1992,11,4
199211,114,220303,2,.94999999,,220303,58,01-11-1992,01-11-1992,1992-11-01,1992,11,4
199211,140,220303,2,1,,220303,58,01-11-1992,01-11-1992,1992-11-01,1992,11,4
199211,70,220303,2,1,,220303,58,01-11-1992,01-11-1992,1992-11-01,1992,11,4
199211,140,220303,2,1.05,,220303,58,01-11-1992,01-11-1992,1992-11-01,1992,11,4
199211,60,220303,2,.80000001,,220303,58,01-11-1992,01-11-1992,1992-11-01,1992,11,4
199211,24,220303,2,.63999999,,220303,58,01-11-1992,01-11-1992,1992-11-01,1992,11,4
199211,77,220303,2,.94999999,,220303,58,01-11-1992,01-11-1992,1992-11-01,1992,11,4
199211,56,220303,2,.69999999,,220303,58,01-11-1992,01-11-1992,1992-11-01,1992,11,4
199211,75,220303,2,.94999999,,220303,58,01-11-1992,01-11-1992,1992-11-01,1992,11,4
199211,54,220303,2,1.25,,220303,58,01-11-1992,01-11-1992,1992-11-01,1992,11,4
199211,73,220303,2,1,,220303,58,01-11-1992,01-11-1992,1992-11-01,1992,11,4
199211,163,220303,2,.69999999,,220303,58,01-11-1992,01-11-1992,1992-11-01,1992,11,4
199211,103,220303,2,.94999999,,220303,58,01-11-1992,01-11-1992,1992-11-01,1992,11,4
199211,41,220303,2,.69999999,,220303,58,01-11-1992,01-11-1992,1992-11-01,1992,11,4
199211,100,220303,2,.94999999,,220303,58,01-11-1992,01-11-1992,1992-11-01,1992,11,4
199211,106,220303,2,.94999999,,220303,58,01-11-1992,01-11-1992,1992-11-01,1992,11,4
199211,106,220303,2,.80000001,,220303,58,01-11-1992,01-11-1992,1992-11-01,1992,11,4
199211,58,220303,2,.69999999,,220303,58,01-11-1992,01-11-1992,1992-11-01,1992,11,4
199211,142,220303,2,1.15,,220303,58,01-11-1992,01-11-1992,1992-11-01,1992,11,4
199211,56,220303,2,.75,,220303,58,01-11-1992,01-11-1992,1992-11-01,1992,11,4
199211,189,220303,2,.75,,220303,58,01-11-1992,01-11-1992,1992-11-01,1992,11,4
199211,138,220303,2,.69999999,,220303,58,01-11-1992,01-11-1992,1992-11-01,1992,11,4
199211,150,220303,2,.99000001,,220303,58,01-11-1992,01-11-1992,1992-11-01,1992,11,4
199211,138,220303,2,.94999999,,220303,58,01-11-1992,01-11-1992,1992-11-01,1992,11,4
199211,106,220303,2,.80000001,,220303,58,01-11-1992,01-11-1992,1992-11-01,1992,11,4
199211,93,220303,2,.89999998,,220303,58,01-11-1992,01-11-1992,1992-11-01,1992,11,4
199211,98,220303,2,.99000001,,220303,58,01-11-1992,01-11-1992,1992-11-01,1992,11,4
199211,143,220303,2,1.1,,220303,58,01-11-1992,01-11-1992,1992-11-01,1992,11,4
199211,12,220303,2,1.16,,220303,58,01-11-1992,01-11-1992,1992-11-01,1992,11,4
199211,61,220303,2,.80000001,,220303,58,01-11-1992,01-11-1992,1992-11-01,1992,11,4
199211,17,220303,2,.64999998,,220303,58,01-11-1992,01-11-1992,1992-11-01,1992,11,4
199211,111,220303,2,.80000001,,220303,58,01-11-1992,01-11-1992,1992-11-01,1992,11,4
199211,80,220303,2,.88999999,,220303,58,01-11-1992,01-11-1992,1992-11-01,1992,11,4
199211,88,220303,2,.64999998,,220303,58,01-11-1992,01-11-1992,1992-11-01,1992,11,4
199211,156,220303,2,1,,220303,58,01-11-1992,01-11-1992,1992-11-01,1992,11,4
199212,111,220303,2,.80000001,,220303,59,01-12-1992,01-12-1992,1992-12-01,1992,12,4
199212,156,220303,2,1,,220303,59,01-12-1992,01-12-1992,1992-12-01,1992,12,4
199212,25,220303,2,1.2,,220303,59,01-12-1992,01-12-1992,1992-12-01,1992,12,4
199212,18,220303,2,.76999998,,220303,59,01-12-1992,01-12-1992,1992-12-01,1992,12,4
199212,56,220303,2,.69999999,,220303,59,01-12-1992,01-12-1992,1992-12-01,1992,12,4
199212,17,220303,2,.64999998,,220303,59,01-12-1992,01-12-1992,1992-12-01,1992,12,4
199212,73,220303,2,1,,220303,59,01-12-1992,01-12-1992,1992-12-01,1992,12,4
199212,60,220303,2,.80000001,,220303,59,01-12-1992,01-12-1992,1992-12-01,1992,12,4
199212,80,220303,2,.88999999,,220303,59,01-12-1992,01-12-1992,1992-12-01,1992,12,4
199212,163,220303,2,.69999999,,220303,59,01-12-1992,01-12-1992,1992-12-01,1992,12,4
199212,41,220303,2,.69999999,,220303,59,01-12-1992,01-12-1992,1992-12-01,1992,12,4
199212,89,220303,2,.69999999,,220303,59,01-12-1992,01-12-1992,1992-12-01,1992,12,4
199212,143,220303,2,1.1,,220303,59,01-12-1992,01-12-1992,1992-12-01,1992,12,4
199212,24,220303,2,.63999999,,220303,59,01-12-1992,01-12-1992,1992-12-01,1992,12,4
199212,133,220303,2,.69999999,,220303,59,01-12-1992,01-12-1992,1992-12-01,1992,12,4
199212,189,220303,2,.75,,220303,59,01-12-1992,01-12-1992,1992-12-01,1992,12,4
199212,138,220303,2,.94999999,,220303,59,01-12-1992,01-12-1992,1992-12-01,1992,12,4
199212,56,220303,2,.75,,220303,59,01-12-1992,01-12-1992,1992-12-01,1992,12,4
199212,103,220303,2,.94999999,,220303,59,01-12-1992,01-12-1992,1992-12-01,1992,12,4
199212,140,220303,2,1.05,,220303,59,01-12-1992,01-12-1992,1992-12-01,1992,12,4
199212,100,220303,2,.85000002,,220303,59,01-12-1992,01-12-1992,1992-12-01,1992,12,4
199212,58,220303,2,.69999999,,220303,59,01-12-1992,01-12-1992,1992-12-01,1992,12,4
199212,106,220303,2,.94999999,,220303,59,01-12-1992,01-12-1992,1992-12-01,1992,12,4
199212,106,220303,2,.80000001,,220303,59,01-12-1992,01-12-1992,1992-12-01,1992,12,4
199212,88,220303,2,.64999998,,220303,59,01-12-1992,01-12-1992,1992-12-01,1992,12,4
199212,68,220303,2,.75,,220303,59,01-12-1992,01-12-1992,1992-12-01,1992,12,4
199212,140,220303,2,1,,220303,59,01-12-1992,01-12-1992,1992-12-01,1992,12,4
199212,133,220303,2,1.5,,220303,59,01-12-1992,01-12-1992,1992-12-01,1992,12,4
199212,46,220303,2,1.25,,220303,59,01-12-1992,01-12-1992,1992-12-01,1992,12,4
199212,75,220303,2,.94999999,,220303,59,01-12-1992,01-12-1992,1992-12-01,1992,12,4
199212,106,220303,2,.80000001,,220303,59,01-12-1992,01-12-1992,1992-12-01,1992,12,4
199212,77,220303,2,.94999999,,220303,59,01-12-1992,01-12-1992,1992-12-01,1992,12,4
199212,54,220303,2,1.25,,220303,59,01-12-1992,01-12-1992,1992-12-01,1992,12,4
199212,70,220303,2,1,,220303,59,01-12-1992,01-12-1992,1992-12-01,1992,12,4
199212,12,220303,2,1.16,,220303,59,01-12-1992,01-12-1992,1992-12-01,1992,12,4
199212,61,220303,2,.80000001,,220303,59,01-12-1992,01-12-1992,1992-12-01,1992,12,4
199212,182,220303,2,1.1,,220303,59,01-12-1992,01-12-1992,1992-12-01,1992,12,4
199212,93,220303,2,.89999998,,220303,59,01-12-1992,01-12-1992,1992-12-01,1992,12,4
199212,138,220303,2,.69999999,,220303,59,01-12-1992,01-12-1992,1992-12-01,1992,12,4
199212,114,220303,2,.94999999,,220303,59,01-12-1992,01-12-1992,1992-12-01,1992,12,4
199212,98,220303,2,.99000001,,220303,59,01-12-1992,01-12-1992,1992-12-01,1992,12,4
199212,142,220303,2,1.15,,220303,59,01-12-1992,01-12-1992,1992-12-01,1992,12,4
199212,150,220303,2,.88999999,,220303,59,01-12-1992,01-12-1992,1992-12-01,1992,12,4
199301,100,220303,2,.88999999,,220303,60,01-01-1993,01-01-1993,1993-01-01,1993,1,1
199301,56,220303,2,.69999999,,220303,60,01-01-1993,01-01-1993,1993-01-01,1993,1,1
199301,106,220303,2,.80000001,,220303,60,01-01-1993,01-01-1993,1993-01-01,1993,1,1
199301,182,220303,2,1.1,,220303,60,01-01-1993,01-01-1993,1993-01-01,1993,1,1
199301,88,220303,2,.64999998,,220303,60,01-01-1993,01-01-1993,1993-01-01,1993,1,1
199301,24,220303,2,.63999999,,220303,60,01-01-1993,01-01-1993,1993-01-01,1993,1,1
199301,25,220303,2,1.2,,220303,60,01-01-1993,01-01-1993,1993-01-01,1993,1,1
199301,44,220303,2,.72000003,,220303,60,01-01-1993,01-01-1993,1993-01-01,1993,1,1
199301,77,220303,2,.94999999,,220303,60,01-01-1993,01-01-1993,1993-01-01,1993,1,1
199301,111,220303,2,.80000001,,220303,60,01-01-1993,01-01-1993,1993-01-01,1993,1,1
199301,70,220303,2,1,,220303,60,01-01-1993,01-01-1993,1993-01-01,1993,1,1
199301,80,220303,2,.88999999,,220303,60,01-01-1993,01-01-1993,1993-01-01,1993,1,1
199301,156,220303,2,1,,220303,60,01-01-1993,01-01-1993,1993-01-01,1993,1,1
199301,54,220303,2,1.25,,220303,60,01-01-1993,01-01-1993,1993-01-01,1993,1,1
199301,150,220303,2,.88999999,,220303,60,01-01-1993,01-01-1993,1993-01-01,1993,1,1
199301,46,220303,2,1.25,,220303,60,01-01-1993,01-01-1993,1993-01-01,1993,1,1
199301,133,220303,2,1.5,,220303,60,01-01-1993,01-01-1993,1993-01-01,1993,1,1
199301,60,220303,2,.80000001,,220303,60,01-01-1993,01-01-1993,1993-01-01,1993,1,1
199301,106,220303,2,.94999999,,220303,60,01-01-1993,01-01-1993,1993-01-01,1993,1,1
199301,133,220303,2,.80000001,,220303,60,01-01-1993,01-01-1993,1993-01-01,1993,1,1
199301,56,220303,2,.69999999,,220303,60,01-01-1993,01-01-1993,1993-01-01,1993,1,1
199301,68,220303,2,.75,,220303,60,01-01-1993,01-01-1993,1993-01-01,1993,1,1
199301,18,220303,2,.76999998,,220303,60,01-01-1993,01-01-1993,1993-01-01,1993,1,1
199301,89,220303,2,.69999999,,220303,60,01-01-1993,01-01-1993,1993-01-01,1993,1,1
199301,58,220303,2,.64999998,,220303,60,01-01-1993,01-01-1993,1993-01-01,1993,1,1
199301,98,220303,2,.99000001,,220303,60,01-01-1993,01-01-1993,1993-01-01,1993,1,1
199301,189,220303,2,.75,,220303,60,01-01-1993,01-01-1993,1993-01-01,1993,1,1
199301,138,220303,2,.69999999,,220303,60,01-01-1993,01-01-1993,1993-01-01,1993,1,1
199301,75,220303,2,.94999999,,220303,60,01-01-1993,01-01-1993,1993-01-01,1993,1,1
199301,143,220303,2,1.1,,220303,60,01-01-1993,01-01-1993,1993-01-01,1993,1,1
199301,106,220303,2,.80000001,,220303,60,01-01-1993,01-01-1993,1993-01-01,1993,1,1
199301,17,220303,2,.64999998,,220303,60,01-01-1993,01-01-1993,1993-01-01,1993,1,1
199301,163,220303,2,.69999999,,220303,60,01-01-1993,01-01-1993,1993-01-01,1993,1,1
199301,142,220303,2,1.15,,220303,60,01-01-1993,01-01-1993,1993-01-01,1993,1,1
199301,138,220303,2,.94999999,,220303,60,01-01-1993,01-01-1993,1993-01-01,1993,1,1
199301,114,220303,2,.94999999,,220303,60,01-01-1993,01-01-1993,1993-01-01,1993,1,1
199301,140,220303,2,1.05,,220303,60,01-01-1993,01-01-1993,1993-01-01,1993,1,1
199301,73,220303,2,1,,220303,60,01-01-1993,01-01-1993,1993-01-01,1993,1,1
199301,103,220303,2,.85000002,,220303,60,01-01-1993,01-01-1993,1993-01-01,1993,1,1
199302,100,220303,2,.94999999,,220303,61,01-02-1993,01-02-1993,1993-02-01,1993,2,1
199302,56,220303,2,.69999999,,220303,61,01-02-1993,01-02-1993,1993-02-01,1993,2,1
199302,54,220303,2,1.25,,220303,61,01-02-1993,01-02-1993,1993-02-01,1993,2,1
199302,163,220303,2,.69999999,,220303,61,01-02-1993,01-02-1993,1993-02-01,1993,2,1
199302,150,220303,2,.88999999,,220303,61,01-02-1993,01-02-1993,1993-02-01,1993,2,1
199302,138,220303,2,.69999999,,220303,61,01-02-1993,01-02-1993,1993-02-01,1993,2,1
199302,24,220303,2,.63999999,,220303,61,01-02-1993,01-02-1993,1993-02-01,1993,2,1
199302,133,220303,2,1.2,,220303,61,01-02-1993,01-02-1993,1993-02-01,1993,2,1
199302,77,220303,2,.94999999,,220303,61,01-02-1993,01-02-1993,1993-02-01,1993,2,1
199302,93,220303,2,.75,,220303,61,01-02-1993,01-02-1993,1993-02-01,1993,2,1
199302,89,220303,2,.69999999,,220303,61,01-02-1993,01-02-1993,1993-02-01,1993,2,1
199302,138,220303,2,.94999999,,220303,61,01-02-1993,01-02-1993,1993-02-01,1993,2,1
199302,140,220303,2,1.05,,220303,61,01-02-1993,01-02-1993,1993-02-01,1993,2,1
199302,133,220303,2,.80000001,,220303,61,01-02-1993,01-02-1993,1993-02-01,1993,2,1
199302,156,220303,2,1,,220303,61,01-02-1993,01-02-1993,1993-02-01,1993,2,1
199302,142,220303,2,1.15,,220303,61,01-02-1993,01-02-1993,1993-02-01,1993,2,1
199302,68,220303,2,.75,,220303,61,01-02-1993,01-02-1993,1993-02-01,1993,2,1
199302,189,220303,2,.80000001,,220303,61,01-02-1993,01-02-1993,1993-02-01,1993,2,1
199302,18,220303,2,.76999998,,220303,61,01-02-1993,01-02-1993,1993-02-01,1993,2,1
199302,48,220303,2,1.16,,220303,61,01-02-1993,01-02-1993,1993-02-01,1993,2,1
199302,60,220303,2,.80000001,,220303,61,01-02-1993,01-02-1993,1993-02-01,1993,2,1
199302,232,220303,2,1.3,,220303,61,01-02-1993,01-02-1993,1993-02-01,1993,2,1
199302,106,220303,2,.80000001,,220303,61,01-02-1993,01-02-1993,1993-02-01,1993,2,1
199302,73,220303,2,1,,220303,61,01-02-1993,01-02-1993,1993-02-01,1993,2,1
199302,75,220303,2,.94999999,,220303,61,01-02-1993,01-02-1993,1993-02-01,1993,2,1
199302,106,220303,2,.80000001,,220303,61,01-02-1993,01-02-1993,1993-02-01,1993,2,1
199302,182,220303,2,1.1,,220303,61,01-02-1993,01-02-1993,1993-02-01,1993,2,1
199302,103,220303,2,.85000002,,220303,61,01-02-1993,01-02-1993,1993-02-01,1993,2,1
199302,170,220303,2,.94999999,,220303,61,01-02-1993,01-02-1993,1993-02-01,1993,2,1
199302,46,220303,2,1.25,,220303,61,01-02-1993,01-02-1993,1993-02-01,1993,2,1
199302,80,220303,2,.88999999,,220303,61,01-02-1993,01-02-1993,1993-02-01,1993,2,1
199302,88,220303,2,.64999998,,220303,61,01-02-1993,01-02-1993,1993-02-01,1993,2,1
199302,70,220303,2,1,,220303,61,01-02-1993,01-02-1993,1993-02-01,1993,2,1
199302,25,220303,2,1.2,,220303,61,01-02-1993,01-02-1993,1993-02-01,1993,2,1
199302,58,220303,2,.64999998,,220303,61,01-02-1993,01-02-1993,1993-02-01,1993,2,1
199302,133,220303,2,1.5,,220303,61,01-02-1993,01-02-1993,1993-02-01,1993,2,1
199302,98,220303,2,.99000001,,220303,61,01-02-1993,01-02-1993,1993-02-01,1993,2,1
199302,114,220303,2,.94999999,,220303,61,01-02-1993,01-02-1993,1993-02-01,1993,2,1
199302,182,220303,2,.69999999,,220303,61,01-02-1993,01-02-1993,1993-02-01,1993,2,1
199302,143,220303,2,1.15,,220303,61,01-02-1993,01-02-1993,1993-02-01,1993,2,1
199302,56,220303,2,.69999999,,220303,61,01-02-1993,01-02-1993,1993-02-01,1993,2,1
199302,44,220303,2,.72000003,,220303,61,01-02-1993,01-02-1993,1993-02-01,1993,2,1
199302,17,220303,2,.64999998,,220303,61,01-02-1993,01-02-1993,1993-02-01,1993,2,1
199303,58,220303,2,.64999998,,220303,62,01-03-1993,01-03-1993,1993-03-01,1993,3,1
199303,182,220303,2,.69999999,,220303,62,01-03-1993,01-03-1993,1993-03-01,1993,3,1
199303,156,220303,2,1,,220303,62,01-03-1993,01-03-1993,1993-03-01,1993,3,1
199303,138,220303,2,.94999999,,220303,62,01-03-1993,01-03-1993,1993-03-01,1993,3,1
199303,133,220303,2,1.2,,220303,62,01-03-1993,01-03-1993,1993-03-01,1993,3,1
199303,56,220303,2,.80000001,,220303,62,01-03-1993,01-03-1993,1993-03-01,1993,3,1
199303,189,220303,2,.80000001,,220303,62,01-03-1993,01-03-1993,1993-03-01,1993,3,1
199303,93,220303,2,.75,,220303,62,01-03-1993,01-03-1993,1993-03-01,1993,3,1
199303,61,220303,2,.80000001,,220303,62,01-03-1993,01-03-1993,1993-03-01,1993,3,1
199303,170,220303,2,.94999999,,220303,62,01-03-1993,01-03-1993,1993-03-01,1993,3,1
199303,17,220303,2,.64999998,,220303,62,01-03-1993,01-03-1993,1993-03-01,1993,3,1
199303,25,220303,2,1.2,,220303,62,01-03-1993,01-03-1993,1993-03-01,1993,3,1
199303,60,220303,2,.80000001,,220303,62,01-03-1993,01-03-1993,1993-03-01,1993,3,1
199303,106,220303,2,.80000001,,220303,62,01-03-1993,01-03-1993,1993-03-01,1993,3,1
199303,70,220303,2,1,,220303,62,01-03-1993,01-03-1993,1993-03-01,1993,3,1
199303,133,220303,2,.80000001,,220303,62,01-03-1993,01-03-1993,1993-03-01,1993,3,1
199303,73,220303,2,1,,220303,62,01-03-1993,01-03-1993,1993-03-01,1993,3,1
199303,88,220303,2,.64999998,,220303,62,01-03-1993,01-03-1993,1993-03-01,1993,3,1
199303,182,220303,2,1.1,,220303,62,01-03-1993,01-03-1993,1993-03-01,1993,3,1
199303,114,220303,2,.99000001,,220303,62,01-03-1993,01-03-1993,1993-03-01,1993,3,1
199303,44,220303,2,.77999997,,220303,62,01-03-1993,01-03-1993,1993-03-01,1993,3,1
199303,98,220303,2,.99000001,,220303,62,01-03-1993,01-03-1993,1993-03-01,1993,3,1
199303,68,220303,2,.75,,220303,62,01-03-1993,01-03-1993,1993-03-01,1993,3,1
199303,80,220303,2,.88999999,,220303,62,01-03-1993,01-03-1993,1993-03-01,1993,3,1
199303,46,220303,2,1.25,,220303,62,01-03-1993,01-03-1993,1993-03-01,1993,3,1
199303,18,220303,2,.76999998,,220303,62,01-03-1993,01-03-1993,1993-03-01,1993,3,1
199303,133,220303,2,1.5,,220303,62,01-03-1993,01-03-1993,1993-03-01,1993,3,1
199303,56,220303,2,.75,,220303,62,01-03-1993,01-03-1993,1993-03-01,1993,3,1
199303,75,220303,2,.94999999,,220303,62,01-03-1993,01-03-1993,1993-03-01,1993,3,1
199303,48,220303,2,1.16,,220303,62,01-03-1993,01-03-1993,1993-03-01,1993,3,1
199303,232,220303,2,1.3,,220303,62,01-03-1993,01-03-1993,1993-03-01,1993,3,1
199303,140,220303,2,1.05,,220303,62,01-03-1993,01-03-1993,1993-03-01,1993,3,1
199303,24,220303,2,.63999999,,220303,62,01-03-1993,01-03-1993,1993-03-01,1993,3,1
199303,103,220303,2,.85000002,,220303,62,01-03-1993,01-03-1993,1993-03-01,1993,3,1
199303,150,220303,2,.88999999,,220303,62,01-03-1993,01-03-1993,1993-03-01,1993,3,1
199303,140,220303,2,1,,220303,62,01-03-1993,01-03-1993,1993-03-01,1993,3,1
199303,54,220303,2,1.25,,220303,62,01-03-1993,01-03-1993,1993-03-01,1993,3,1
199303,77,220303,2,.94999999,,220303,62,01-03-1993,01-03-1993,1993-03-01,1993,3,1
199303,100,220303,2,.94999999,,220303,62,01-03-1993,01-03-1993,1993-03-01,1993,3,1
199303,138,220303,2,.69999999,,220303,62,01-03-1993,01-03-1993,1993-03-01,1993,3,1
199303,89,220303,2,.69999999,,220303,62,01-03-1993,01-03-1993,1993-03-01,1993,3,1
199303,163,220303,2,.69999999,,220303,62,01-03-1993,01-03-1993,1993-03-01,1993,3,1
199303,41,220303,2,.94999999,,220303,62,01-03-1993,01-03-1993,1993-03-01,1993,3,1
199303,106,220303,2,.80000001,,220303,62,01-03-1993,01-03-1993,1993-03-01,1993,3,1
199304,232,220303,2,1.3,,220303,63,01-04-1993,01-04-1993,1993-04-01,1993,4,2
199304,189,220303,2,.80000001,,220303,63,01-04-1993,01-04-1993,1993-04-01,1993,4,2
199304,18,220303,2,.76999998,,220303,63,01-04-1993,01-04-1993,1993-04-01,1993,4,2
199304,75,220303,2,.94999999,,220303,63,01-04-1993,01-04-1993,1993-04-01,1993,4,2
199304,106,220303,2,.99000001,,220303,63,01-04-1993,01-04-1993,1993-04-01,1993,4,2
199304,98,220303,2,.99000001,,220303,63,01-04-1993,01-04-1993,1993-04-01,1993,4,2
199304,25,220303,2,1.2,,220303,63,01-04-1993,01-04-1993,1993-04-01,1993,4,2
199304,68,220303,2,.64999998,,220303,63,01-04-1993,01-04-1993,1993-04-01,1993,4,2
199304,156,220303,2,1,,220303,63,01-04-1993,01-04-1993,1993-04-01,1993,4,2
199304,155,220303,2,.69999999,,220303,63,01-04-1993,01-04-1993,1993-04-01,1993,4,2
199304,24,220303,2,.75,,220303,63,01-04-1993,01-04-1993,1993-04-01,1993,4,2
199304,93,220303,2,.75,,220303,63,01-04-1993,01-04-1993,1993-04-01,1993,4,2
199304,54,220303,2,1.25,,220303,63,01-04-1993,01-04-1993,1993-04-01,1993,4,2
199304,70,220303,2,1,,220303,63,01-04-1993,01-04-1993,1993-04-01,1993,4,2
199304,150,220303,2,.88999999,,220303,63,01-04-1993,01-04-1993,1993-04-01,1993,4,2
199304,89,220303,2,.69999999,,220303,63,01-04-1993,01-04-1993,1993-04-01,1993,4,2
199304,41,220303,2,.94999999,,220303,63,01-04-1993,01-04-1993,1993-04-01,1993,4,2
199304,60,220303,2,.80000001,,220303,63,01-04-1993,01-04-1993,1993-04-01,1993,4,2
199304,46,220303,2,1.25,,220303,63,01-04-1993,01-04-1993,1993-04-01,1993,4,2
199304,163,220303,2,.69999999,,220303,63,01-04-1993,01-04-1993,1993-04-01,1993,4,2
199304,140,220303,2,1.05,,220303,63,01-04-1993,01-04-1993,1993-04-01,1993,4,2
199304,114,220303,2,.99000001,,220303,63,01-04-1993,01-04-1993,1993-04-01,1993,4,2
199304,189,220303,2,.80000001,,220303,63,01-04-1993,01-04-1993,1993-04-01,1993,4,2
199304,138,220303,2,.69999999,,220303,63,01-04-1993,01-04-1993,1993-04-01,1993,4,2
199304,138,220303,2,.94999999,,220303,63,01-04-1993,01-04-1993,1993-04-01,1993,4,2
199304,106,220303,2,.80000001,,220303,63,01-04-1993,01-04-1993,1993-04-01,1993,4,2
199304,44,220303,2,.77999997,,220303,63,01-04-1993,01-04-1993,1993-04-01,1993,4,2
199304,61,220303,2,.80000001,,220303,63,01-04-1993,01-04-1993,1993-04-01,1993,4,2
199304,100,220303,2,.94999999,,220303,63,01-04-1993,01-04-1993,1993-04-01,1993,4,2
