quote_date,region,item_id,p10,p20,p30,p40,p50,p60,p70,p80,p90,date,date2,date3,date4,year,month,quarter
198802,2,220303,.5,.5,.54000002,.55000001,.59500003,.60000002,.60000002,.64999998,.64999998,1,01-02-1988,01-02-1988,1988-02-01,1988,2,1
198803,2,220303,.46000001,.54000002,.55000001,.60000002,.60000002,.60000002,.64999998,.75,1,2,01-03-1988,01-03-1988,1988-03-01,1988,3,1
198804,2,220303,.5,.57999998,.60000002,.60000002,.60000002,.64999998,.64999998,.69999999,.75,3,01-04-1988,01-04-1988,1988-04-01,1988,4,2
198805,2,220303,.55000001,.57999998,.60000002,.60000002,.625,.64999998,.69999999,.75,.80000001,4,01-05-1988,01-05-1988,1988-05-01,1988,5,2
198806,2,220303,.5,.51999998,.55000001,.60000002,.60000002,.60000002,.64999998,.64999998,.69999999,5,01-06-1988,01-06-1988,1988-06-01,1988,6,2
198807,2,220303,.47999999,.51999998,.55000001,.60000002,.60000002,.60000002,.68000001,.69999999,.80000001,6,01-07-1988,01-07-1988,1988-07-01,1988,7,3
198809,2,220303,.47999999,.5,.55000001,.62,.64999998,.64999998,.75,.75999999,.80000001,8,01-09-1988,01-09-1988,1988-09-01,1988,9,3
198810,2,220303,.5,.55000001,.55000001,.60000002,.62,.64999998,.75,.80000001,.80000001,9,01-10-1988,01-10-1988,1988-10-01,1988,10,4
198811,2,220303,.5,.55000001,.57999998,.64999998,.64999998,.64999998,.69999999,.75999999,.85000002,10,01-11-1988,01-11-1988,1988-11-01,1988,11,4
198812,2,220303,.55000001,.55000001,.57999998,.64999998,.64999998,.64999998,.69999999,.75,.80000001,11,01-12-1988,01-12-1988,1988-12-01,1988,12,4
198901,2,220303,.47999999,.5,.57999998,.60000002,.64999998,.69999999,.75,.75,.80000001,12,01-01-1989,01-01-1989,1989-01-01,1989,1,1
198903,2,220303,.47999999,.5,.57999998,.60000002,.64999998,.64999998,.69999999,.75,.75,14,01-03-1989,01-03-1989,1989-03-01,1989,3,1
198904,2,220303,.47999999,.5,.60000002,.64999998,.64999998,.69999999,.69999999,.75,.75,15,01-04-1989,01-04-1989,1989-04-01,1989,4,2
198905,2,220303,.47999999,.64999998,.64999998,.64999998,.69999999,.69999999,.75,.75,.75,16,01-05-1989,01-05-1989,1989-05-01,1989,5,2
198906,2,220303,.5,.64999998,.69999999,.69999999,.72500002,.75,.75,.75,.94999999,17,01-06-1989,01-06-1989,1989-06-01,1989,6,2
198907,2,220303,.47999999,.47999999,.60000002,.64999998,.69999999,.69999999,.69999999,.75,.94999999,18,01-07-1989,01-07-1989,1989-07-01,1989,7,3
198908,2,220303,.47999999,.60000002,.64999998,.64999998,.69999999,.69999999,.75,.75,.85000002,19,01-08-1989,01-08-1989,1989-08-01,1989,8,3
198909,2,220303,.47999999,.60000002,.64999998,.64999998,.69999999,.69999999,.69999999,.75,.75,20,01-09-1989,01-09-1989,1989-09-01,1989,9,3
198910,2,220303,.51999998,.60000002,.69999999,.69999999,.69999999,.69999999,.75,.75,.85000002,21,01-10-1989,01-10-1989,1989-10-01,1989,10,4
198911,2,220303,.47999999,.50999999,.60000002,.69999999,.69999999,.69999999,.75,.75,.85000002,22,01-11-1989,01-11-1989,1989-11-01,1989,11,4
198912,2,220303,.47999999,.50999999,.55000001,.64999998,.69999999,.69999999,.75,.75,.85000002,23,01-12-1989,01-12-1989,1989-12-01,1989,12,4
199001,2,220303,.5,.5,.52999997,.55000001,.67499995,.69999999,.69999999,.75,.75,24,01-01-1990,01-01-1990,1990-01-01,1990,1,1
199002,2,220303,.5,.55000001,.55000001,.64999998,.69499999,.69999999,.69999999,.75,.85000002,25,01-02-1990,01-02-1990,1990-02-01,1990,2,1
199003,2,220303,.52999997,.55000001,.55000001,.69999999,.69999999,.69999999,.75,.85000002,.98000002,26,01-03-1990,01-03-1990,1990-03-01,1990,3,1
199004,2,220303,.55000001,.55000001,.64999998,.67499995,.75,.75,.80000001,.82500005,.99000001,27,01-04-1990,01-04-1990,1990-04-01,1990,4,2
199005,2,220303,.55000001,.62,.64999998,.69999999,.75,.75,.80000001,.80000001,.85000002,28,01-05-1990,01-05-1990,1990-05-01,1990,5,2
199006,2,220303,.5,.55000001,.62,.69999999,.72500002,.75,.80000001,.80000001,.99000001,29,01-06-1990,01-06-1990,1990-06-01,1990,6,2
199007,2,220303,.62,.64999998,.69999999,.69999999,.76499999,.80000001,.80000001,.85000002,.99000001,30,01-07-1990,01-07-1990,1990-07-01,1990,7,3
199008,2,220303,.55000001,.62,.69999999,.75,.75,.77999997,.80000001,.85000002,.94999999,31,01-08-1990,01-08-1990,1990-08-01,1990,8,3
199009,2,220303,.55000001,.62,.64999998,.69999999,.76499999,.79000002,.80000001,.80000001,.85000002,32,01-09-1990,01-09-1990,1990-09-01,1990,9,3
199010,2,220303,.55000001,.62,.69999999,.69999999,.75,.75,.79000002,.80000001,.94999999,33,01-10-1990,01-10-1990,1990-10-01,1990,10,4
199011,2,220303,.55000001,.65999997,.69999999,.75,.79000002,.80000001,.85000002,.97000003,1,34,01-11-1990,01-11-1990,1990-11-01,1990,11,4
199012,2,220303,.55000001,.60000002,.62,.69999999,.76999998,.80000001,.94999999,.99000001,1,35,01-12-1990,01-12-1990,1990-12-01,1990,12,4
199101,2,220303,.58999997,.79000002,.80000001,.80000001,.94999999,.94999999,.94999999,.99000001,1.05,36,01-01-1991,01-01-1991,1991-01-01,1991,1,1
199102,2,220303,.58999997,.60000002,.69999999,.75,.79000002,.80000001,.94999999,1.05,1.05,37,01-02-1991,01-02-1991,1991-02-01,1991,2,1
199103,2,220303,.60000002,.69999999,.69999999,.75,.80000001,.82999998,.85000002,.94999999,1.05,38,01-03-1991,01-03-1991,1991-03-01,1991,3,1
199104,2,220303,.60000002,.67499995,.69999999,.72500002,.80000001,.86500001,.89999998,1.1,1.25,39,01-04-1991,01-04-1991,1991-04-01,1991,4,2
199105,2,220303,.60000002,.67499995,.69999999,.82500005,.85000002,.89999998,.94999999,1.1,1.25,40,01-05-1991,01-05-1991,1991-05-01,1991,5,2
199106,2,220303,.64999998,.67499995,.69999999,.77499998,.80000001,.82500005,.89999998,.97500002,1.15,41,01-06-1991,01-06-1991,1991-06-01,1991,6,2
199107,2,220303,.64999998,.69999999,.72000003,.75,.80000001,.85000002,.89999998,.99000001,1.1,42,01-07-1991,01-07-1991,1991-07-01,1991,7,3
199108,2,220303,.64999998,.69999999,.73000002,.80000001,.84000003,.85000002,.89999998,.99000001,1.2,43,01-08-1991,01-08-1991,1991-08-01,1991,8,3
199109,2,220303,.64999998,.69999999,.69999999,.78499997,.85000002,.89499998,.94999999,1.05,1.2,44,01-09-1991,01-09-1991,1991-09-01,1991,9,3
199110,2,220303,.63999999,.69999999,.69999999,.75,.80000001,.88999999,.94999999,.99000001,1.2,45,01-10-1991,01-10-1991,1991-10-01,1991,10,4
199111,2,220303,.64999998,.69999999,.69999999,.75,.80000001,.85000002,.89999998,.99000001,1.2,46,01-11-1991,01-11-1991,1991-11-01,1991,11,4
199112,2,220303,.69999999,.69999999,.69999999,.75,.85000002,.88999999,.89999998,.99000001,1.15,47,01-12-1991,01-12-1991,1991-12-01,1991,12,4
199201,2,220303,.64999998,.69999999,.70999998,.80000001,.85000002,.87,.89999998,.97000003,1.1,48,01-01-1992,01-01-1992,1992-01-01,1992,1,1
199202,2,220303,.64999998,.69999999,.75,.80000001,.85000002,.88999999,.89999998,.99000001,1.1,49,01-02-1992,01-02-1992,1992-02-01,1992,2,1
199203,2,220303,.69999999,.69999999,.69999999,.80000001,.82500005,.88999999,.94999999,1,1.1,50,01-03-1992,01-03-1992,1992-03-01,1992,3,1
199204,2,220303,.69999999,.69999999,.75,.77499998,.85000002,.88999999,.94999999,1.075,1.1,51,01-04-1992,01-04-1992,1992-04-01,1992,4,2
199205,2,220303,.69999999,.69999999,.75,.80000001,.85000002,.94999999,1,1.05,1.1,52,01-05-1992,01-05-1992,1992-05-01,1992,5,2
199206,2,220303,.69999999,.69999999,.75,.85000002,.88999999,.94999999,1,1.05,1.15,53,01-06-1992,01-06-1992,1992-06-01,1992,6,2
199207,2,220303,.69999999,.69999999,.75,.80000001,.88999999,.94999999,.94999999,1,1.1,54,01-07-1992,01-07-1992,1992-07-01,1992,7,3
199208,2,220303,.69999999,.69999999,.69999999,.80000001,.88999999,.89999998,.99000001,1.05,1.1,55,01-08-1992,01-08-1992,1992-08-01,1992,8,3
199209,2,220303,.69999999,.69999999,.80000001,.85000002,.89999998,.94999999,.94999999,1,1.1,56,01-09-1992,01-09-1992,1992-09-01,1992,9,3
199210,2,220303,.69999999,.69999999,.75,.80000001,.89999998,.94999999,.99000001,1,1.15,57,01-10-1992,01-10-1992,1992-10-01,1992,10,4
199211,2,220303,.69999999,.69999999,.75999999,.80000001,.92499995,.94999999,.99000001,1,1.125,58,01-11-1992,01-11-1992,1992-11-01,1992,11,4
199212,2,220303,.69999999,.69999999,.75,.80000001,.88999999,.94999999,1,1.05,1.16,59,01-12-1992,01-12-1992,1992-12-01,1992,12,4
199301,2,220303,.64999998,.69999999,.75,.80000001,.88999999,.94999999,.99000001,1.05,1.2,60,01-01-1993,01-01-1993,1993-01-01,1993,1,1
199302,2,220303,.69999999,.69999999,.75,.80000001,.88999999,.94999999,1,1.15,1.2,61,01-02-1993,01-02-1993,1993-02-01,1993,2,1
199303,2,220303,.69999999,.75,.80000001,.80000001,.88999999,.94999999,.99000001,1.05,1.2,62,01-03-1993,01-03-1993,1993-03-01,1993,3,1
199304,2,220303,.69999999,.75,.80000001,.80000001,.80000001,.94999999,.99000001,1,1.2,63,01-04-1993,01-04-1993,1993-04-01,1993,4,2
199305,2,220303,.69999999,.75,.80000001,.80000001,.88999999,.94999999,.99000001,1,1.25,64,01-05-1993,01-05-1993,1993-05-01,1993,5,2
199306,2,220303,.69999999,.75,.80000001,.80000001,.88999999,.94999999,.99000001,1,1.25,65,01-06-1993,01-06-1993,1993-06-01,1993,6,2
199307,2,220303,.69999999,.75,.80000001,.80000001,.91999996,.94999999,.99000001,1.05,1.29,66,01-07-1993,01-07-1993,1993-07-01,1993,7,3
199308,2,220303,.69999999,.80000001,.80000001,.80000001,.94999999,.94999999,.99000001,1,1.2,67,01-08-1993,01-08-1993,1993-08-01,1993,8,3
199309,2,220303,.69999999,.77499998,.80000001,.81,.94999999,.99000001,1,1.15,1.295,68,01-09-1993,01-09-1993,1993-09-01,1993,9,3
199310,2,220303,.69999999,.80000001,.80000001,.81999999,.94999999,.99000001,1,1.15,1.3,69,01-10-1993,01-10-1993,1993-10-01,1993,10,4
199311,2,220303,.69999999,.80000001,.80000001,.81999999,.94999999,.99000001,1,1.12,1.29,70,01-11-1993,01-11-1993,1993-11-01,1993,11,4
199312,2,220303,.69999999,.80000001,.80000001,.81,.94999999,.99000001,1.05,1.15,1.29,71,01-12-1993,01-12-1993,1993-12-01,1993,12,4
199401,2,220303,.69999999,.80000001,.80000001,.89999998,.94999999,.99000001,1.05,1.15,1.3,72,01-01-1994,01-01-1994,1994-01-01,1994,1,1
199402,2,220303,.75,.80000001,.81999999,.89999998,.94999999,.99000001,1.05,1.2,1.3,73,01-02-1994,01-02-1994,1994-02-01,1994,2,1
199403,2,220303,.75,.80000001,.80000001,.89999998,.99000001,1,1.05,1.15,1.29,74,01-03-1994,01-03-1994,1994-03-01,1994,3,1
199404,2,220303,.80000001,.80000001,.85000002,.94999999,.99000001,1,1.1,1.2,1.29,75,01-04-1994,01-04-1994,1994-04-01,1994,4,2
199405,2,220303,.72500002,.80000001,.80000001,.89999998,.97000003,.995,1.075,1.2,1.325,76,01-05-1994,01-05-1994,1994-05-01,1994,5,2
199406,2,220303,.75,.80000001,.80000001,.89999998,.97000003,.995,1.075,1.175,1.3,77,01-06-1994,01-06-1994,1994-06-01,1994,6,2
199407,2,220303,.80000001,.80000001,.80000001,.89999998,.99000001,1,1.05,1.15,1.3,78,01-07-1994,01-07-1994,1994-07-01,1994,7,3
199408,2,220303,.80000001,.80000001,.85000002,.94999999,.99000001,1,1.1,1.22,1.35,79,01-08-1994,01-08-1994,1994-08-01,1994,8,3
199409,2,220303,.80000001,.80000001,.85000002,.89999998,.97000003,1,1.05,1.15,1.3,80,01-09-1994,01-09-1994,1994-09-01,1994,9,3
199410,2,220303,.80000001,.80000001,.85000002,.94999999,.99000001,1.05,1.1,1.2,1.35,81,01-10-1994,01-10-1994,1994-10-01,1994,10,4
199411,2,220303,.80000001,.80000001,.85000002,.92000002,.99000001,1,1.1,1.2,1.35,82,01-11-1994,01-11-1994,1994-11-01,1994,11,4
199412,2,220303,.80000001,.80000001,.85000002,.90999997,.99000001,1,1.05,1.15,1.3,83,01-12-1994,01-12-1994,1994-12-01,1994,12,4
199501,2,220303,.80000001,.80000001,.85000002,.92000002,.99000001,1.05,1.15,1.2,1.35,84,01-01-1995,01-01-1995,1995-01-01,1995,1,1
199502,2,220303,.80000001,.80000001,.89999998,.99000001,1.02,1.0599999,1.1,1.2,1.35,85,01-02-1995,01-02-1995,1995-02-01,1995,2,1
199503,2,220303,.80000001,.80000001,.89999998,.99000001,1.01,1.05,1.1,1.2,1.35,86,01-03-1995,01-03-1995,1995-03-01,1995,3,1
199504,2,220303,.80000001,.80000001,.90999997,.99000001,1.01,1.0599999,1.125,1.2,1.35,87,01-04-1995,01-04-1995,1995-04-01,1995,4,2
199505,2,220303,.80000001,.80000001,.92000002,.99000001,1.035,1.09,1.15,1.2,1.35,88,01-05-1995,01-05-1995,1995-05-01,1995,5,2
199506,2,220303,.80000001,.85000002,.94999999,.99000001,1.02,1.09,1.15,1.2,1.35,89,01-06-1995,01-06-1995,1995-06-01,1995,6,2
199507,2,220303,.80000001,.85000002,.94999999,.99000001,1,1.0700001,1.1,1.2,1.35,90,01-07-1995,01-07-1995,1995-07-01,1995,7,3
199508,2,220303,.80000001,.85000002,.94999999,.99000001,1.025,1.0700001,1.1,1.2,1.35,91,01-08-1995,01-08-1995,1995-08-01,1995,8,3
199509,2,220303,.80000001,.88,.94999999,.99000001,1.05,1.1,1.15,1.2,1.35,92,01-09-1995,01-09-1995,1995-09-01,1995,9,3
199510,2,220303,.80000001,.86500001,.94999999,.99000001,1.05,1.1,1.1900001,1.235,1.325,93,01-10-1995,01-10-1995,1995-10-01,1995,10,4
199511,2,220303,.80000001,.88999999,.94999999,.99000001,1.05,1.1,1.1900001,1.235,1.325,94,01-11-1995,01-11-1995,1995-11-01,1995,11,4
199512,2,220303,.80000001,.89999998,.94999999,.99000001,1,1.1,1.15,1.2,1.35,95,01-12-1995,01-12-1995,1995-12-01,1995,12,4
199601,2,220303,.80000001,.89999998,.94999999,.99000001,1.025,1.1,1.15,1.25,1.35,96,01-01-1996,01-01-1996,1996-01-01,1996,1,1
199602,2,220303,.80000001,.89999998,.94999999,1,1.025,1.1,1.2,1.3,1.35,97,01-02-1996,01-02-1996,1996-02-01,1996,2,1
199603,2,220303,.80000001,.89999998,.99000001,1,1.05,1.1900001,1.2,1.3,1.5,98,01-03-1996,01-03-1996,1996-03-01,1996,3,1
199604,2,220303,.80000001,.89999998,.99000001,1,1.1,1.1900001,1.25,1.3,1.5,99,01-04-1996,01-04-1996,1996-04-01,1996,4,2
199605,2,220303,.80000001,.89999998,.99000001,1,1.1,1.1900001,1.25,1.3,1.5,100,01-05-1996,01-05-1996,1996-05-01,1996,5,2
199606,2,220303,.80000001,.89999998,.99000001,1,1.1,1.2,1.3,1.35,1.4,101,01-06-1996,01-06-1996,1996-06-01,1996,6,2
199607,2,220303,.89999998,.89999998,.99000001,1,1.1,1.2,1.3,1.3,1.4,102,01-07-1996,01-07-1996,1996-07-01,1996,7,3
199608,2,220303,.80000001,.94999999,1,1.09,1.145,1.2,1.3,1.35,1.5,103,01-08-1996,01-08-1996,1996-08-01,1996,8,3
199609,2,220303,.80000001,.99000001,1,1.09,1.145,1.2,1.3,1.35,1.5,104,01-09-1996,01-09-1996,1996-09-01,1996,9,3
199610,2,220303,.89999998,.99000001,1,1.05,1.1,1.2,1.3,1.3,1.5,105,01-10-1996,01-10-1996,1996-10-01,1996,10,4
199611,2,220303,.89999998,.97000003,1,1.05,1.1,1.245,1.3,1.35,1.5,106,01-11-1996,01-11-1996,1996-11-01,1996,11,4
199612,2,220303,.89999998,.94999999,1,1.05,1.1,1.2,1.3,1.35,1.49,107,01-12-1996,01-12-1996,1996-12-01,1996,12,4
199701,2,220303,.89999998,.97000003,1,1.05,1.1,1.295,1.3,1.35,1.5,108,01-01-1997,01-01-1997,1997-01-01,1997,1,1
199702,2,220303,.89999998,.94999999,1,1.1,1.125,1.2,1.29,1.3,1.35,109,01-02-1997,01-02-1997,1997-02-01,1997,2,1
199703,2,220303,.89999998,1,1.1,1.1,1.2,1.25,1.3,1.35,1.75,110,01-03-1997,01-03-1997,1997-03-01,1997,3,1
199704,2,220303,.89999998,.99000001,1.075,1.1,1.1950001,1.25,1.3,1.4000001,1.75,111,01-04-1997,01-04-1997,1997-04-01,1997,4,2
199705,2,220303,.89999998,.99000001,1.075,1.145,1.2,1.29,1.3,1.325,1.725,112,01-05-1997,01-05-1997,1997-05-01,1997,5,2
199706,2,220303,.85000002,.98000002,1.05,1.1,1.2,1.29,1.3,1.35,2.0999999,113,01-06-1997,01-06-1997,1997-06-01,1997,6,2
199707,2,220303,.85000002,.98000002,1.05,1.1,1.2,1.25,1.3,1.3,1.6,114,01-07-1997,01-07-1997,1997-07-01,1997,7,3
199708,2,220303,.85000002,.98000002,1,1.1,1.2,1.29,1.3,1.35,1.75,115,01-08-1997,01-08-1997,1997-08-01,1997,8,3
199709,2,220303,.89999998,1,1.1,1.1,1.2,1.29,1.3,1.35,1.75,116,01-09-1997,01-09-1997,1997-09-01,1997,9,3
199710,2,220303,.92499995,.995,1.075,1.1,1.2,1.29,1.3,1.325,1.675,117,01-10-1997,01-10-1997,1997-10-01,1997,10,4
199711,2,220303,.89999998,1,1.1,1.1,1.2,1.29,1.3,1.35,1.6,118,01-11-1997,01-11-1997,1997-11-01,1997,11,4
199712,2,220303,.89999998,1,1.1,1.1,1.225,1.3,1.3,1.35,1.75,119,01-12-1997,01-12-1997,1997-12-01,1997,12,4
199801,2,220303,.89999998,1,1.05,1.1,1.2,1.29,1.3,1.35,1.75,120,01-01-1998,01-01-1998,1998-01-01,1998,1,1
199802,2,220303,.80000001,.99000001,1.1,1.1900001,1.25,1.29,1.3,1.35,1.75,121,01-02-1998,01-02-1998,1998-02-01,1998,2,1
199803,2,220303,.85000002,1,1.1,1.1,1.225,1.3,1.35,1.39,1.75,122,01-03-1998,01-03-1998,1998-03-01,1998,3,1
199804,2,220303,.85000002,.99000001,1.1,1.1,1.225,1.29,1.3,1.39,1.75,123,01-04-1998,01-04-1998,1998-04-01,1998,4,2
199805,2,220303,.80000001,.99000001,1.1,1.1,1.225,1.3,1.35,1.39,1.75,124,01-05-1998,01-05-1998,1998-05-01,1998,5,2
199806,2,220303,.80000001,.99000001,1.09,1.15,1.25,1.29,1.35,1.39,1.75,125,01-06-1998,01-06-1998,1998-06-01,1998,6,2
199807,2,220303,.80000001,.99000001,1.1,1.15,1.27,1.3,1.35,1.39,1.75,126,01-07-1998,01-07-1998,1998-07-01,1998,7,3
199808,2,220303,.94999999,1,1.1,1.2,1.3,1.35,1.39,1.45,1.75,127,01-08-1998,01-08-1998,1998-08-01,1998,8,3
199809,2,220303,.875,1,1.095,1.175,1.295,1.3,1.35,1.4400001,1.975,128,01-09-1998,01-09-1998,1998-09-01,1998,9,3
199810,2,220303,.89999998,1,1.1,1.2,1.3,1.3,1.35,1.4,1.75,129,01-10-1998,01-10-1998,1998-10-01,1998,10,4
199811,2,220303,.89999998,1,1.1,1.245,1.3,1.325,1.37,1.49,1.975,130,01-11-1998,01-11-1998,1998-11-01,1998,11,4
199812,2,220303,.89999998,1,1.1,1.2,1.3,1.3,1.35,1.4,1.75,131,01-12-1998,01-12-1998,1998-12-01,1998,12,4
199901,2,220303,.89999998,.94999999,1,1.15,1.3,1.3,1.35,1.49,1.75,132,01-01-1999,01-01-1999,1999-01-01,1999,1,1
199902,2,220303,.89999998,1,1.15,1.3,1.3,1.35,1.4,1.49,1.75,133,01-02-1999,01-02-1999,1999-02-01,1999,2,1
199903,2,220303,.89999998,1,1.15,1.29,1.3,1.35,1.4,1.5,1.75,134,01-03-1999,01-03-1999,1999-03-01,1999,3,1
199904,2,220303,.89999998,1,1.1,1.29,1.3,1.35,1.4,1.49,1.75,135,01-04-1999,01-04-1999,1999-04-01,1999,4,2
199905,2,220303,.89999998,1,1.1,1.3,1.3,1.39,1.45,1.55,1.75,136,01-05-1999,01-05-1999,1999-05-01,1999,5,2
199906,2,220303,.89999998,1.05,1.15,1.3,1.3,1.4,1.49,1.59,1.75,137,01-06-1999,01-06-1999,1999-06-01,1999,6,2
199907,2,220303,.89999998,1.1,1.29,1.3,1.3,1.4,1.49,1.59,1.79,138,01-07-1999,01-07-1999,1999-07-01,1999,7,3
199908,2,220303,.99000001,1.1,1.29,1.3,1.3,1.35,1.45,1.55,1.75,139,01-08-1999,01-08-1999,1999-08-01,1999,8,3
199909,2,220303,.99000001,1.1,1.15,1.29,1.3,1.35,1.4,1.59,1.75,140,01-09-1999,01-09-1999,1999-09-01,1999,9,3
199910,2,220303,1,1.1,1.2,1.29,1.3,1.35,1.4,1.59,1.79,141,01-10-1999,01-10-1999,1999-10-01,1999,10,4
199911,2,220303,.99000001,1.05,1.15,1.29,1.3,1.3,1.4,1.5,1.59,142,01-11-1999,01-11-1999,1999-11-01,1999,11,4
199912,2,220303,.99000001,1.075,1.2,1.29,1.3,1.3,1.4,1.59,1.79,143,01-12-1999,01-12-1999,1999-12-01,1999,12,4
200001,2,220303,.99000001,1.1,1.2,1.29,1.3,1.3,1.4,1.59,1.79,144,01-01-2000,01-01-2000,2000-01-01,2000,1,1
200002,2,220303,1,1.1,1.2,1.25,1.3,1.3,1.35,1.5,1.79,145,01-02-2000,01-02-2000,2000-02-01,2000,2,1
200003,2,220303,1,1.1,1.2,1.29,1.3,1.3,1.4,1.52,1.75,146,01-03-2000,01-03-2000,2000-03-01,2000,3,1
200004,2,220303,1,1.15,1.25,1.3,1.3,1.3200001,1.45,1.5,1.59,147,01-04-2000,01-04-2000,2000-04-01,2000,4,2
200005,2,220303,.97500002,1.125,1.225,1.295,1.3,1.36,1.45,1.495,1.6700001,148,01-05-2000,01-05-2000,2000-05-01,2000,5,2
200006,2,220303,1,1.15,1.25,1.3,1.35,1.4,1.45,1.5,1.59,149,01-06-2000,01-06-2000,2000-06-01,2000,6,2
200007,2,220303,1,1.15,1.25,1.3,1.35,1.39,1.45,1.5,1.6,150,01-07-2000,01-07-2000,2000-07-01,2000,7,3
200008,2,220303,.94999999,1.1,1.25,1.3,1.35,1.4,1.45,1.5,2.1900001,151,01-08-2000,01-08-2000,2000-08-01,2000,8,3
200009,2,220303,1,1.2,1.25,1.3,1.39,1.45,1.5,1.5,1.79,152,01-09-2000,01-09-2000,2000-09-01,2000,9,3
200010,2,220303,1.1,1.2,1.29,1.3200001,1.35,1.4,1.5,1.5,1.6900001,153,01-10-2000,01-10-2000,2000-10-01,2000,10,4
200011,2,220303,1.1,1.2,1.25,1.3200001,1.35,1.4,1.5,1.6,1.85,154,01-11-2000,01-11-2000,2000-11-01,2000,11,4
200012,2,220303,1.1,1.2,1.25,1.3200001,1.35,1.4,1.5,1.5,1.6900001,155,01-12-2000,01-12-2000,2000-12-01,2000,12,4
200101,2,220303,1.1,1.175,1.25,1.325,1.35,1.395,1.475,1.55,1.87,156,01-01-2001,01-01-2001,2001-01-01,2001,1,1
200102,2,220303,1.1,1.2,1.27,1.35,1.35,1.395,1.55,1.74,1.87,157,01-02-2001,01-02-2001,2001-02-01,2001,2,1
200103,2,220303,1.1,1.2,1.3,1.35,1.37,1.5,1.6,1.79,1.89,158,01-03-2001,01-03-2001,2001-03-01,2001,3,1
200104,2,220303,1.1,1.175,1.3,1.35,1.395,1.525,1.625,1.8399999,2.0900002,159,01-04-2001,01-04-2001,2001-04-01,2001,4,2
200105,2,220303,1.1,1.2,1.3,1.35,1.4200001,1.5,1.6900001,1.89,1.99,160,01-05-2001,01-05-2001,2001-05-01,2001,5,2
200106,2,220303,1.1,1.2,1.3,1.4,1.49,1.59,1.6900001,1.79,1.99,161,01-06-2001,01-06-2001,2001-06-01,2001,6,2
200107,2,220303,1.2,1.2,1.3,1.4,1.5,1.6,1.7,1.89,2.1900001,162,01-07-2001,01-07-2001,2001-07-01,2001,7,3
200108,2,220303,1.2,1.2,1.35,1.4,1.495,1.6,1.7,1.79,1.99,163,01-08-2001,01-08-2001,2001-08-01,2001,8,3
200109,2,220303,1.2,1.2,1.35,1.45,1.5,1.62,1.7,1.79,1.99,164,01-09-2001,01-09-2001,2001-09-01,2001,9,3
200110,2,220303,1.15,1.2,1.3,1.4,1.45,1.5,1.7,1.77,1.99,165,01-10-2001,01-10-2001,2001-10-01,2001,10,4
200111,2,220303,1.2,1.2,1.3,1.4,1.47,1.5,1.7,1.79,1.99,166,01-11-2001,01-11-2001,2001-11-01,2001,11,4
200112,2,220303,1.15,1.2,1.3,1.4,1.47,1.5,1.7,1.85,1.99,167,01-12-2001,01-12-2001,2001-12-01,2001,12,4
200201,2,220303,1.15,1.2,1.3,1.4,1.475,1.59,1.7,1.89,2.1900001,168,01-01-2002,01-01-2002,2002-01-01,2002,1,1
200202,2,220303,1.2,1.2,1.2,1.3,1.4,1.45,1.7,1.79,1.99,169,01-02-2002,01-02-2002,2002-02-01,2002,2,1
200203,2,220303,1.1,1.2,1.2,1.3,1.4,1.45,1.5,1.75,1.9,170,01-03-2002,01-03-2002,2002-03-01,2002,3,1
200204,2,220303,1.1,1.2,1.2,1.3,1.4,1.47,1.5,1.75,1.9,171,01-04-2002,01-04-2002,2002-04-01,2002,4,2
200205,2,220303,1.1,1.2,1.2,1.3,1.4,1.45,1.59,1.79,1.99,172,01-05-2002,01-05-2002,2002-05-01,2002,5,2
200206,2,220303,1.15,1.2,1.25,1.3,1.45,1.45,1.59,1.75,1.99,173,01-06-2002,01-06-2002,2002-06-01,2002,6,2
200207,2,220303,1.1,1.2,1.29,1.3,1.45,1.49,1.59,1.89,1.99,174,01-07-2002,01-07-2002,2002-07-01,2002,7,3
200208,2,220303,1.15,1.2,1.29,1.4,1.45,1.49,1.59,1.75,1.9,175,01-08-2002,01-08-2002,2002-08-01,2002,8,3
200209,2,220303,1.2,1.2,1.29,1.3,1.45,1.49,1.59,1.75,1.9,176,01-09-2002,01-09-2002,2002-09-01,2002,9,3
200210,2,220303,1.15,1.2,1.2,1.3,1.45,1.45,1.59,1.75,1.9,177,01-10-2002,01-10-2002,2002-10-01,2002,10,4
200211,2,220303,1.15,1.2,1.3,1.3,1.45,1.49,1.59,1.89,1.99,178,01-11-2002,01-11-2002,2002-11-01,2002,11,4
200212,2,220303,1.2,1.2,1.3,1.3499999,1.45,1.49,1.59,1.8199999,1.99,179,01-12-2002,01-12-2002,2002-12-01,2002,12,4
200301,2,220303,1.2,1.2,1.3,1.3,1.45,1.5,1.7,1.89,1.99,180,01-01-2003,01-01-2003,2003-01-01,2003,1,1
200302,2,220303,1.2,1.3,1.3,1.45,1.45,1.5,1.75,1.9,1.99,181,01-02-2003,01-02-2003,2003-02-01,2003,2,1
200303,2,220303,.99000001,1.2,1.3,1.45,1.45,1.49,1.75,1.89,1.99,182,01-03-2003,01-03-2003,2003-03-01,2003,3,1
200304,2,220303,1,1.2,1.3,1.45,1.45,1.45,1.5,1.89,1.99,183,01-04-2003,01-04-2003,2003-04-01,2003,4,2
200305,2,220303,.99000001,1.2,1.3,1.3,1.45,1.45,1.79,1.89,1.99,184,01-05-2003,01-05-2003,2003-05-01,2003,5,2
200306,2,220303,1.1,1.2,1.45,1.45,1.5,1.59,1.79,1.89,1.99,185,01-06-2003,01-06-2003,2003-06-01,2003,6,2
200307,2,220303,1,1.2,1.3,1.45,1.45,1.59,1.79,1.9,2,186,01-07-2003,01-07-2003,2003-07-01,2003,7,3
200308,2,220303,1,1.2,1.3,1.45,1.49,1.55,1.7,1.9,2,187,01-08-2003,01-08-2003,2003-08-01,2003,8,3
200309,2,220303,1,1.2,1.3,1.45,1.49,1.5,1.7,1.89,1.99,188,01-09-2003,01-09-2003,2003-09-01,2003,9,3
200310,2,220303,1.2,1.3,1.3,1.45,1.5,1.5,1.6,1.9,1.99,189,01-10-2003,01-10-2003,2003-10-01,2003,10,4
200311,2,220303,1.2,1.29,1.3,1.45,1.5,1.5,1.6,1.9,1.99,190,01-11-2003,01-11-2003,2003-11-01,2003,11,4
200312,2,220303,1.1950001,1.245,1.3,1.47,1.5,1.5450001,1.75,1.99,1.995,191,01-12-2003,01-12-2003,2003-12-01,2003,12,4
200401,2,220303,1.2,1.2,1.4,1.49,1.5,1.6,1.79,1.99,1.99,192,01-01-2004,01-01-2004,2004-01-01,2004,1,1
200402,2,220303,1.1900001,1.2,1.4,1.49,1.5,1.6,1.8,1.95,1.99,193,01-02-2004,01-02-2004,2004-02-01,2004,2,1
200403,2,220303,1.2,1.3,1.45,1.49,1.5,1.65,1.85,1.95,1.99,194,01-03-2004,01-03-2004,2004-03-01,2004,3,1
200404,2,220303,1.15,1.2,1.3,1.49,1.5,1.6,1.85,1.95,2,195,01-04-2004,01-04-2004,2004-04-01,2004,4,2
200405,2,220303,1.2,1.3,1.4,1.5,1.525,1.65,1.85,1.99,2,196,01-05-2004,01-05-2004,2004-05-01,2004,5,2
200406,2,220303,1.1900001,1.25,1.4,1.49,1.5,1.625,1.85,1.99,2.25,197,01-06-2004,01-06-2004,2004-06-01,2004,6,2
200407,2,220303,1.2,1.3,1.4,1.49,1.5,1.79,1.85,1.99,2.25,198,01-07-2004,01-07-2004,2004-07-01,2004,7,3
200408,2,220303,1.2,1.3,1.35,1.49,1.5,1.65,1.85,1.95,2.25,199,01-08-2004,01-08-2004,2004-08-01,2004,8,3
200409,2,220303,1.2,1.3,1.4,1.49,1.5,1.65,1.85,1.95,2.25,200,01-09-2004,01-09-2004,2004-09-01,2004,9,3
200410,2,220303,1.2,1.3,1.4,1.49,1.5,1.79,1.85,1.95,2.25,201,01-10-2004,01-10-2004,2004-10-01,2004,10,4
200411,2,220303,1.2,1.3,1.4,1.49,1.5,1.65,1.8,1.89,2.25,202,01-11-2004,01-11-2004,2004-11-01,2004,11,4
200412,2,220303,1.2,1.3,1.4,1.49,1.5,1.65,1.85,1.95,2.25,203,01-12-2004,01-12-2004,2004-12-01,2004,12,4
200501,2,220303,1.2,1.3,1.4449999,1.49,1.525,1.65,1.825,1.925,2.2750001,204,01-01-2005,01-01-2005,2005-01-01,2005,1,1
200502,2,220303,1.2,1.3,1.4,1.49,1.55,1.65,1.8,1.95,2.25,205,01-02-2005,01-02-2005,2005-02-01,2005,2,1
200503,2,220303,1.2,1.3,1.4449999,1.495,1.6,1.7,1.825,1.975,2.325,206,01-03-2005,01-03-2005,2005-03-01,2005,3,1
200504,2,220303,1.2,1.3,1.4,1.49,1.5,1.65,1.8,1.95,2.25,207,01-04-2005,01-04-2005,2005-04-01,2005,4,2
200505,2,220303,1.1799999,1.3,1.4,1.49,1.5,1.65,1.7,1.85,2,208,01-05-2005,01-05-2005,2005-05-01,2005,5,2
200506,2,220303,1.2,1.4,1.49,1.5,1.595,1.6900001,1.8,1.95,2.25,209,01-06-2005,01-06-2005,2005-06-01,2005,6,2
200507,2,220303,1.2,1.3,1.49,1.49,1.5,1.65,1.79,1.99,2.25,210,01-07-2005,01-07-2005,2005-07-01,2005,7,3
200508,2,220303,1.2,1.4,1.49,1.5,1.595,1.6900001,1.8,1.9,2.0999999,211,01-08-2005,01-08-2005,2005-08-01,2005,8,3
200509,2,220303,1.3,1.45,1.49,1.5,1.6,1.6900001,1.8,1.99,2.25,212,01-09-2005,01-09-2005,2005-09-01,2005,9,3
200510,2,220303,1.25,1.425,1.49,1.5,1.6,1.6900001,1.8,1.975,2.375,213,01-10-2005,01-10-2005,2005-10-01,2005,10,4
200511,2,220303,1.3,1.45,1.49,1.5,1.6,1.75,1.8,2,2.4000001,214,01-11-2005,01-11-2005,2005-11-01,2005,11,4
200512,2,220303,1.2,1.4,1.49,1.5,1.6,1.7,1.8,2,2.4000001,215,01-12-2005,01-12-2005,2005-12-01,2005,12,4
200601,2,220303,1.3,1.45,1.49,1.5,1.59,1.6900001,1.8,2,2.25,216,01-01-2006,01-01-2006,2006-01-01,2006,1,1
200602,2,220303,1.3,1.4,1.49,1.5,1.6,1.75,1.8,2,2.4000001,217,01-02-2006,01-02-2006,2006-02-01,2006,2,1
200603,2,220303,1.3,1.45,1.49,1.5,1.655,1.8,1.9,2,2.4000001,218,01-03-2006,01-03-2006,2006-03-01,2006,3,1
200604,2,220303,1.29,1.4,1.49,1.5,1.6,1.75,1.8,2,2.4000001,219,01-04-2006,01-04-2006,2006-04-01,2006,4,2
200605,2,220303,1.29,1.4,1.49,1.5,1.6,1.75,1.9,2,2.4000001,220,01-05-2006,01-05-2006,2006-05-01,2006,5,2
200606,2,220303,1.29,1.4,1.49,1.5,1.62,1.79,1.8,2,2.5,221,01-06-2006,01-06-2006,2006-06-01,2006,6,2
200607,2,220303,1.3,1.49,1.5,1.6,1.75,1.8,2,2.0999999,2.4000001,222,01-07-2006,01-07-2006,2006-07-01,2006,7,3
200608,2,220303,1.3,1.4,1.49,1.5,1.655,1.8,2,2.0999999,2.4000001,223,01-08-2006,01-08-2006,2006-08-01,2006,8,3
200609,2,220303,1.25,1.395,1.49,1.5,1.61,1.795,1.95,2.0999999,2.4000001,224,01-09-2006,01-09-2006,2006-09-01,2006,9,3
200610,2,220303,1.3,1.49,1.5,1.6,1.72,1.8,2,2.2,2.4000001,225,01-10-2006,01-10-2006,2006-10-01,2006,10,4
200611,2,220303,1.3,1.4,1.49,1.59,1.6900001,1.8,2,2.2,2.4000001,226,01-11-2006,01-11-2006,2006-11-01,2006,11,4
200612,2,220303,1.3,1.4,1.49,1.59,1.655,1.8,2,2.0999999,2.5,227,01-12-2006,01-12-2006,2006-12-01,2006,12,4
200701,2,220303,1.3,1.49,1.49,1.59,1.6849999,1.8,2,2.2,2.6500001,228,01-01-2007,01-01-2007,2007-01-01,2007,1,1
200702,2,220303,1.3,1.49,1.5,1.595,1.6900001,1.8,2,2.1500001,2.5,229,01-02-2007,01-02-2007,2007-02-01,2007,2,1
200703,2,220303,1.3,1.49,1.5,1.6,1.6950001,1.8,2,2.2,2.6500001,230,01-03-2007,01-03-2007,2007-03-01,2007,3,1
200704,2,220303,1.2,1.4,1.49,1.59,1.635,1.8,2,2.2,2.6500001,231,01-04-2007,01-04-2007,2007-04-01,2007,4,2
200705,2,220303,1.3,1.49,1.5,1.59,1.75,1.8,2,2.2,2.5,232,01-05-2007,01-05-2007,2007-05-01,2007,5,2
200706,2,220303,1.2,1.49,1.5,1.59,1.6900001,1.8,2.0999999,2.2,2.6500001,233,01-06-2007,01-06-2007,2007-06-01,2007,6,2
200707,2,220303,1.2,1.49,1.5,1.62,1.8,1.85,2.2,2.3499999,2.6500001,234,01-07-2007,01-07-2007,2007-07-01,2007,7,3
200708,2,220303,1.25,1.49,1.6,1.635,1.72,1.825,2.0999999,2.2249999,2.4949999,235,01-08-2007,01-08-2007,2007-08-01,2007,8,3
200709,2,220303,1.2,1.49,1.5,1.6900001,1.775,1.8,2.0999999,2.25,2.5,236,01-09-2007,01-09-2007,2007-09-01,2007,9,3
200710,2,220303,1.3,1.49,1.59,1.6900001,1.72,1.8,1.9,2.2,2.49,237,01-10-2007,01-10-2007,2007-10-01,2007,10,4
200711,2,220303,1.3,1.5,1.6,1.6900001,1.8,1.85,2.1900001,2.3,2.5,238,01-11-2007,01-11-2007,2007-11-01,2007,11,4
200712,2,220303,1.3,1.49,1.59,1.6900001,1.775,1.8,2,2.2,2.45,239,01-12-2007,01-12-2007,2007-12-01,2007,12,4
200801,2,220303,1.3,1.49,1.6,1.6900001,1.75,1.8,2,2.3,2.5,240,01-01-2008,01-01-2008,2008-01-01,2008,1,1
200802,2,220303,1.2,1.49,1.66,1.6900001,1.8,1.85,2.2,2.3499999,2.6500001,241,01-02-2008,01-02-2008,2008-02-01,2008,2,1
200803,2,220303,1.2,1.5,1.6900001,1.75,1.8,1.9,2.2,2.45,2.6500001,242,01-03-2008,01-03-2008,2008-03-01,2008,3,1
200804,2,220303,1.2,1.4,1.6900001,1.79,1.8,1.9,2.3,2.5,2.7,243,01-04-2008,01-04-2008,2008-04-01,2008,4,2
200805,2,220303,1.2,1.4,1.6900001,1.8,1.8199999,2.0999999,2.3499999,2.5,2.7,244,01-05-2008,01-05-2008,2008-05-01,2008,5,2
200806,2,220303,1.2,1.4,1.6799999,1.6900001,1.8,1.85,2.0999999,2.3499999,2.5,245,01-06-2008,01-06-2008,2008-06-01,2008,6,2
200807,2,220303,1.25,1.4,1.6900001,1.8,1.8,1.875,2.3499999,2.4749999,2.6500001,246,01-07-2008,01-07-2008,2008-07-01,2008,7,3
200808,2,220303,1.325,1.4,1.6900001,1.8,1.825,2.0999999,2.395,2.4749999,2.6500001,247,01-08-2008,01-08-2008,2008-08-01,2008,8,3
200809,2,220303,1.3,1.4,1.6900001,1.8,1.85,2.05,2.0999999,2.4000001,2.5,248,01-09-2008,01-09-2008,2008-09-01,2008,9,3
200810,2,220303,1.3,1.4,1.75,1.8,1.85,2.0999999,2.2,2.4000001,2.5,249,01-10-2008,01-10-2008,2008-10-01,2008,10,4
200811,2,220303,1.3,1.4,1.6900001,1.8,1.85,2.0999999,2.3499999,2.45,2.75,250,01-11-2008,01-11-2008,2008-11-01,2008,11,4
200812,2,220303,1.3,1.4,1.6900001,1.79,1.8,1.9,2.0999999,2.3,2.5,251,01-12-2008,01-12-2008,2008-12-01,2008,12,4
200901,2,220303,1.3,1.4,1.6900001,1.79,1.8,2,2.0999999,2.49,2.75,252,01-01-2009,01-01-2009,2009-01-01,2009,1,1
200902,2,220303,1.4,1.49,1.65,1.79,1.8,1.95,2.0999999,2.4000001,2.75,253,01-02-2009,01-02-2009,2009-02-01,2009,2,1
200903,2,220303,1.3,1.5,1.6900001,1.8,1.8,1.95,2.0999999,2.4000001,2.79,254,01-03-2009,01-03-2009,2009-03-01,2009,3,1
200904,2,220303,1.3,1.5,1.6900001,1.8,1.8,1.95,2.0999999,2.4000001,2.79,255,01-04-2009,01-04-2009,2009-04-01,2009,4,2
200905,2,220303,1.2,1.5,1.6900001,1.8,1.8,1.95,2.0999999,2.45,2.79,256,01-05-2009,01-05-2009,2009-05-01,2009,5,2
200906,2,220303,1.4,1.5,1.6900001,1.79,1.8,1.95,2,2.0999999,2.79,257,01-06-2009,01-06-2009,2009-06-01,2009,6,2
200907,2,220303,1.15,1.4,1.5,1.79,1.8,1.95,2.0999999,2.45,2.8,258,01-07-2009,01-07-2009,2009-07-01,2009,7,3
200908,2,220303,1.175,1.4,1.55,1.77,1.8,1.95,2.05,2.2750001,2.6500001,259,01-08-2009,01-08-2009,2009-08-01,2009,8,3
200909,2,220303,1.25,1.45,1.625,1.79,1.8,1.97,2.0999999,2.375,2.6500001,260,01-09-2009,01-09-2009,2009-09-01,2009,9,3
200910,2,220303,1.3,1.4,1.5,1.75,1.8,1.95,2.0999999,2.45,2.75,261,01-10-2009,01-10-2009,2009-10-01,2009,10,4
200911,2,220303,1.3,1.5,1.65,1.79,1.8,1.95,2.0999999,2.45,2.75,262,01-11-2009,01-11-2009,2009-11-01,2009,11,4
200912,2,220303,1.3,1.4,1.5,1.7,1.8,1.95,2.0999999,2.45,2.8,263,01-12-2009,01-12-2009,2009-12-01,2009,12,4
201001,2,220303,1.3,1.4,1.5,1.75,1.8,1.95,2.0999999,2.3,2.8,264,01-01-2010,01-01-2010,2010-01-01,2010,1,1
201002,2,220303,1.39,1.4,1.5,1.7,1.8,1.8,2.0999999,2.7,2.99,265,01-02-2010,01-02-2010,2010-02-01,2010,2,1
201003,2,220303,1.39,1.4,1.5,1.7,1.8,1.8,2.0999999,2.7,2.99,266,01-03-2010,01-03-2010,2010-03-01,2010,3,1
201004,2,220303,1.39,1.4,1.5,1.7,1.8,1.89,2.0999999,2.7,2.99,267,01-04-2010,01-04-2010,2010-04-01,2010,4,2
201005,2,220303,1.4,1.5,1.6900001,1.79,1.8,1.95,2.29,2.45,3,268,01-05-2010,01-05-2010,2010-05-01,2010,5,2
201006,2,220303,1.4,1.425,1.645,1.725,1.8,1.95,2.2449999,2.45,2.9949999,269,01-06-2010,01-06-2010,2010-06-01,2010,6,2
201007,2,220303,1.4,1.5,1.6900001,1.7,1.8,1.95,2.29,2.45,3,270,01-07-2010,01-07-2010,2010-07-01,2010,7,3
201008,2,220303,1.4,1.45,1.6,1.7,1.8,1.95,2.3,2.5,3,271,01-08-2010,01-08-2010,2010-08-01,2010,8,3
201009,2,220303,1.4,1.45,1.6,1.7,1.8,1.95,2.4000001,2.5,3,272,01-09-2010,01-09-2010,2010-09-01,2010,9,3
201010,2,220303,1.4,1.4,1.6,1.7,1.8,1.95,2.3,2.45,2.99,273,01-10-2010,01-10-2010,2010-10-01,2010,10,4
201011,2,220303,1.4,1.47,1.6,1.775,1.8,2.05,2.3,2.4749999,2.97,274,01-11-2010,01-11-2010,2010-11-01,2010,11,4
201012,2,220303,1.4,1.45,1.6,1.75,1.8,2.0999999,2.3,2.5,2.99,275,01-12-2010,01-12-2010,2010-12-01,2010,12,4
201101,2,220303,1.4,1.49,1.6,1.75,1.8,2,2.3,2.5,2.99,276,01-01-2011,01-01-2011,2011-01-01,2011,1,1
201102,2,220303,1.4,1.45,1.7,1.8,1.9,2.3,2.45,2.8,3.0899999,277,01-02-2011,01-02-2011,2011-02-01,2011,2,1
201103,2,220303,1.4,1.6,1.7,1.8,1.975,2.3,2.45,2.75,2.99,278,01-03-2011,01-03-2011,2011-03-01,2011,3,1
201104,2,220303,1.3,1.6,1.8,1.8,2.0999999,2.4000001,2.5,2.8,3.0899999,279,01-04-2011,01-04-2011,2011-04-01,2011,4,2
201105,2,220303,1.4,1.6,1.8,1.89,2.0999999,2.4000001,2.5,2.8,3.0899999,280,01-05-2011,01-05-2011,2011-05-01,2011,5,2
201106,2,220303,1,1.5,1.7,1.8,2,2.3,2.5,2.8,2.99,281,01-06-2011,01-06-2011,2011-06-01,2011,6,2
201107,2,220303,1,1.5,1.7,1.8,2,2.3,2.49,2.75,2.95,282,01-07-2011,01-07-2011,2011-07-01,2011,7,3
201108,2,220303,1.35,1.6,1.8,1.89,2.0999999,2.3,2.5,2.8,2.99,283,01-08-2011,01-08-2011,2011-08-01,2011,8,3
201109,2,220303,1.4,1.6,1.8,1.9,2.0999999,2.45,2.5,2.8,3.0999999,284,01-09-2011,01-09-2011,2011-09-01,2011,9,3
201110,2,220303,1.4,1.7,1.8,1.9,2.1500001,2.45,2.5,2.8,3.2,285,01-10-2011,01-10-2011,2011-10-01,2011,10,4
201111,2,220303,1.4,1.7,1.8,1.89,2.0999999,2.45,2.5,2.8,3.0999999,286,01-11-2011,01-11-2011,2011-11-01,2011,11,4
201112,2,220303,1.35,1.6,1.8,1.85,2.0999999,2.45,2.5,2.8,3.2,287,01-12-2011,01-12-2011,2011-12-01,2011,12,4
201201,2,220303,1.4,1.7,1.8,1.89,2.125,2.49,2.75,2.8,3.2,288,01-01-2012,01-01-2012,2012-01-01,2012,1,1
201202,2,220303,1.6,1.8,1.85,2,2.25,2.5,2.75,3.0599999,3.75,289,01-02-2012,01-02-2012,2012-02-01,2012,2,1
201203,2,220303,1.6,1.7,1.8,1.9,2.3,2.49,2.75,2.99,3.75,290,01-03-2012,01-03-2012,2012-03-01,2012,3,1
201204,2,220303,1.4,1.7,1.8,1.9,2.2249999,2.45,2.5999999,2.99,3.25,291,01-04-2012,01-04-2012,2012-04-01,2012,4,2
201205,2,220303,1.4,1.8,1.89,2,2.3,2.49,2.5999999,3.0599999,3.49,292,01-05-2012,01-05-2012,2012-05-01,2012,5,2
201206,2,220303,1.6500001,1.8,1.895,2.05,2.3,2.5250001,2.75,3.0799999,3.47,293,01-06-2012,01-06-2012,2012-06-01,2012,6,2
201207,2,220303,1.5,1.75,1.895,2.125,2.3,2.5749998,2.75,3.0250001,3.47,294,01-07-2012,01-07-2012,2012-07-01,2012,7,3
201208,2,220303,1.4,1.7,1.8,2,2.3,2.55,2.75,3.0599999,3.49,295,01-08-2012,01-08-2012,2012-08-01,2012,8,3
201209,2,220303,1.4,1.7,1.9,2.0999999,2.3,2.5,2.75,3.0599999,3.49,296,01-09-2012,01-09-2012,2012-09-01,2012,9,3
201210,2,220303,1.6,1.7,1.85,2,2.3,2.55,2.75,3.0599999,3.49,297,01-10-2012,01-10-2012,2012-10-01,2012,10,4
201211,2,220303,1.6,1.8,1.875,2.1500001,2.3,2.5749998,2.75,3.0799999,3.5999999,298,01-11-2012,01-11-2012,2012-11-01,2012,11,4
201212,2,220303,1.6,1.8,1.85,2.0999999,2.3,2.55,2.75,3.0999999,3.7,299,01-12-2012,01-12-2012,2012-12-01,2012,12,4
201301,2,220303,1.6,1.8,1.9,2.2,2.5,2.5999999,2.8,3.0999999,3.6400001,300,01-01-2013,01-01-2013,2013-01-01,2013,1,1
201302,2,220303,1.395,1.795,1.875,2.1999998,2.5,2.7,2.99,3.2249999,3.9000001,301,01-02-2013,01-02-2013,2013-02-01,2013,2,1
201303,2,220303,1.39,1.79,1.99,2.4000001,2.5999999,2.75,2.99,3.3,3.9000001,302,01-03-2013,01-03-2013,2013-03-01,2013,3,1
201304,2,220303,1.4,1.79,1.9,2.4000001,2.5999999,2.6500001,2.99,3.1500001,3.6400001,303,01-04-2013,01-04-2013,2013-04-01,2013,4,2
201305,2,220303,1.05,1.6,1.9,2.4000001,2.55,2.6500001,2.99,3.3,3.9000001,304,01-05-2013,01-05-2013,2013-05-01,2013,5,2
201306,2,220303,1.05,1.75,1.85,2.0999999,2.5999999,2.75,2.99,3.3,3.8299999,305,01-06-2013,01-06-2013,2013-06-01,2013,6,2
201307,2,220303,1.22,1.775,1.875,2.25,2.55,2.75,3.02,3.3,3.865,306,01-07-2013,01-07-2013,2013-07-01,2013,7,3
201308,2,220303,1.3399999,1.725,1.875,2.4000001,2.5999999,2.7249999,2.99,3.2249999,3.865,307,01-08-2013,01-08-2013,2013-08-01,2013,8,3
201309,2,220303,1.39,1.7,1.9,2.0999999,2.5999999,2.75,2.99,3.3,3.8299999,308,01-09-2013,01-09-2013,2013-09-01,2013,9,3
201310,2,220303,1.29,1.7,1.9,2.0999999,2.625,2.75,2.99,3.3,3.75,309,01-10-2013,01-10-2013,2013-10-01,2013,10,4
201311,2,220303,1.1,1.7,1.9,2.0999999,2.5999999,2.75,2.95,3.3,3.75,310,01-11-2013,01-11-2013,2013-11-01,2013,11,4
201312,2,220303,1.05,1.6500001,1.8499999,2.3,2.5999999,2.75,2.99,3.3499999,3.825,311,01-12-2013,01-12-2013,2013-12-01,2013,12,4
201401,2,220303,1.29,1.7,1.9,2.0999999,2.5999999,2.75,2.8499999,3.4000001,3.75,312,01-01-2014,01-01-2014,2014-01-01,2014,1,1
201402,2,220303,1,1.5,1.9,2,2.5999999,2.7,2.75,2.99,3.5,313,01-02-2014,01-02-2014,2014-02-01,2014,2,1
201403,2,220303,1.2,1.6,1.9,2.4000001,2.5999999,2.75,2.8499999,3.1500001,3.75,314,01-03-2014,01-03-2014,2014-03-01,2014,3,1
201404,2,220303,1.2,1.7,1.9,2,2.5999999,2.6500001,2.8,3.1500001,3.5,315,01-04-2014,01-04-2014,2014-04-01,2014,4,2
201405,2,220303,1.29,1.75,1.9,2.4000001,2.5999999,2.7,2.8499999,3.1500001,3.5,316,01-05-2014,01-05-2014,2014-05-01,2014,5,2
201406,2,220303,1.2,1.5,1.9,2.4000001,2.5999999,2.75,2.95,3.4000001,3.95,317,01-06-2014,01-06-2014,2014-06-01,2014,6,2
201407,2,220303,1.2,1.7,1.9,2,2.5999999,2.75,2.95,3.1500001,3.5,318,01-07-2014,01-07-2014,2014-07-01,2014,7,3
201408,2,220303,1.245,1.725,2,2.2449999,2.625,2.7750001,2.97,3.2750001,3.5,319,01-08-2014,01-08-2014,2014-08-01,2014,8,3
201409,2,220303,1.14,1.825,2,2.5999999,2.625,2.7750001,2.97,3.2750001,3.5,320,01-09-2014,01-09-2014,2014-09-01,2014,9,3
201410,2,220303,1.2,1.8,2,2.5999999,2.6750002,2.8,2.95,3.25,3.5,321,01-10-2014,01-10-2014,2014-10-01,2014,10,4
201411,2,220303,.99000001,1.59,1.9,2.4000001,2.5999999,2.8,2.95,3.1500001,3.5,322,01-11-2014,01-11-2014,2014-11-01,2014,11,4
201412,2,220303,1.245,1.6700001,1.995,2.0450001,2.6750002,2.8,2.95,3.075,3.5,323,01-12-2014,01-12-2014,2014-12-01,2014,12,4
201501,2,220303,1.2,1.59,2,2.5999999,2.5999999,2.8,2.95,3,3.5,324,01-01-2015,01-01-2015,2015-01-01,2015,1,1
201502,2,220303,.99000001,1.75,2,2.0899999,2.7,2.8499999,2.99,3.1500001,3.5,325,01-02-2015,01-02-2015,2015-02-01,2015,2,1
201503,2,220303,1.15,1.89,2,2.5999999,2.7,2.8499999,2.95,3,3.5,326,01-03-2015,01-03-2015,2015-03-01,2015,3,1
201504,2,220303,.99000001,1.75,2,2.0899999,2.6750002,2.8,2.95,3,3.5,327,01-04-2015,01-04-2015,2015-04-01,2015,4,2
201505,2,220303,.99000001,1.59,1.9,2,2.625,2.8,2.99,3.1500001,3.5,328,01-05-2015,01-05-2015,2015-05-01,2015,5,2
201506,2,220303,1.15,1.6,1.99,2,2.625,2.8,2.99,3.1500001,3.5,329,01-06-2015,01-06-2015,2015-06-01,2015,6,2
201507,2,220303,1.15,1.59,1.9,2,2.625,2.8,2.95,3,3.5,330,01-07-2015,01-07-2015,2015-07-01,2015,7,3
201508,2,220303,1.15,1.6,1.9,2.5999999,2.8,2.8499999,2.99,3,3.5,331,01-08-2015,01-08-2015,2015-08-01,2015,8,3
201509,2,220303,1.15,1.75,1.99,2.0899999,2.6750002,2.8,2.95,3,3.5,332,01-09-2015,01-09-2015,2015-09-01,2015,9,3
201510,2,220303,.99000001,1.6,1.89,2,2.6500001,2.95,2.95,3,3.5,333,01-10-2015,01-10-2015,2015-10-01,2015,10,4
201511,2,220303,.99000001,1.59,1.8,2,2.6500001,2.8499999,2.95,3,3.5,334,01-11-2015,01-11-2015,2015-11-01,2015,11,4
201512,2,220303,1.15,1.59,1.8,2,2.5999999,2.8,2.95,2.99,3.1500001,335,01-12-2015,01-12-2015,2015-12-01,2015,12,4
201601,2,220303,.99000001,1.59,1.9,2,2.5999999,2.8499999,2.95,3,3.5,336,01-01-2016,01-01-2016,2016-01-01,2016,1,1
201602,2,220303,1,1.6,1.99,2,2.5999999,2.9000001,2.99,3,3.49,337,01-02-2016,01-02-2016,2016-02-01,2016,2,1
201603,2,220303,1.15,1.6,1.89,2,2.625,2.9000001,2.99,2.99,3.2,338,01-03-2016,01-03-2016,2016-03-01,2016,3,1
201604,2,220303,1,1.6,1.9,2,2.5999999,2.8499999,2.99,2.99,3.2,339,01-04-2016,01-04-2016,2016-04-01,2016,4,2
201605,2,220303,.995,1.595,1.845,2,2.5450001,2.8249998,2.97,2.9949999,3.1750002,340,01-05-2016,01-05-2016,2016-05-01,2016,5,2
201606,2,220303,.99000001,1.7,2,2,2.5450001,2.8499999,2.99,2.99,3.2,341,01-06-2016,01-06-2016,2016-06-01,2016,6,2
201607,2,220303,.99000001,1.6,1.89,2.0899999,2.5450001,2.8499999,2.99,2.99,3.2,342,01-07-2016,01-07-2016,2016-07-01,2016,7,3
201608,2,220303,1,1.8,2,2.0899999,2.5999999,2.8499999,2.99,2.99,3.2,343,01-08-2016,01-08-2016,2016-08-01,2016,8,3
201609,2,220303,1,1.6,1.99,2,2.5,2.8499999,2.95,2.99,3.2,344,01-09-2016,01-09-2016,2016-09-01,2016,9,3
201610,2,220303,1,1.75,1.99,2.0899999,2.5,2.8499999,2.95,2.99,3.1500001,345,01-10-2016,01-10-2016,2016-10-01,2016,10,4
201611,2,220303,1,1.675,1.9400001,2.0450001,2.5,2.75,2.97,2.9949999,3.6950002,346,01-11-2016,01-11-2016,2016-11-01,2016,11,4
201612,2,220303,1,1.6,1.89,2,2.49,2.5999999,2.95,3,3.6900001,347,01-12-2016,01-12-2016,2016-12-01,2016,12,4
201701,2,220303,1,1.75,1.89,2.0899999,2.4949999,2.9000001,3,3,3.5899999,348,01-01-2017,01-01-2017,2017-01-01,2017,1,1
201702,2,220303,1.1,1.775,2,2.0450001,2.2,2.55,2.99,3.05,3.6900001,349,01-02-2017,01-02-2017,2017-02-01,2017,2,1
201703,2,220303,1,1.7,1.89,2,2.2,2.5,2.99,3,3.6900001,350,01-03-2017,01-03-2017,2017-03-01,2017,3,1
201704,2,220303,1.1,1.7,1.89,2,2.49,2.8,2.99,3.0999999,3.3499999,351,01-04-2017,01-04-2017,2017-04-01,2017,4,2
201705,2,220303,1.05,1.6500001,1.845,2.05,2.49,2.895,2.9949999,3.1500001,3.52,352,01-05-2017,01-05-2017,2017-05-01,2017,5,2
201706,2,220303,1.1,1.75,1.99,2,2.49,2.8,2.99,3.0999999,3.6900001,353,01-06-2017,01-06-2017,2017-06-01,2017,6,2
201707,2,220303,1.1,1.6,1.8,2,2.0999999,2.49,2.99,3,3.6900001,354,01-07-2017,01-07-2017,2017-07-01,2017,7,3
201708,2,220303,1,1.65,1.99,2,2.49,2.8,3,3.2,3.6900001,355,01-08-2017,01-08-2017,2017-08-01,2017,8,3
201709,2,220303,1,1.75,1.99,2,2.2950001,2.5,2.99,3.0999999,3.6900001,356,01-09-2017,01-09-2017,2017-09-01,2017,9,3
201710,2,220303,1.145,1.75,1.995,2.0949998,2.2950001,2.5,2.99,3.0999999,3.645,357,01-10-2017,01-10-2017,2017-10-01,2017,10,4
201711,2,220303,1.29,1.75,1.99,2.0899999,2.1900001,2.5,2.99,3,3.4000001,358,01-11-2017,01-11-2017,2017-11-01,2017,11,4
201712,2,220303,1,1.6900001,1.89,2,2.0999999,2.49,2.8,3,3.3499999,359,01-12-2017,01-12-2017,2017-12-01,2017,12,4
201801,2,220303,1.1,1.75,2,2.0999999,2.49,2.8,3,3.2,3.6900001,360,01-01-2018,01-01-2018,2018-01-01,2018,1,1
201802,2,220303,1.2,1.7,2,2.0999999,2.1950002,2.5,2.99,3,3.6900001,361,01-02-2018,01-02-2018,2018-02-01,2018,2,1
201803,2,220303,1.65,1.8,2,2.0999999,2.2,2.5,3,3.1900001,3.6900001,362,01-03-2018,01-03-2018,2018-03-01,2018,3,1
201804,2,220303,1.395,1.75,2,2.0999999,2.2,2.4949999,2.99,3,3.595,363,01-04-2018,01-04-2018,2018-04-01,2018,4,2
201805,2,220303,1.6,1.8,2,2.1900001,2.3499999,2.5,2.99,3.1900001,3.6900001,364,01-05-2018,01-05-2018,2018-05-01,2018,5,2
201806,2,220303,1.1,1.7,2,2,2.2,2.5,2.99,3.1900001,3.95,365,01-06-2018,01-06-2018,2018-06-01,2018,6,2
201807,2,220303,1.345,1.775,1.875,2,2.2,2.4949999,2.9949999,3.1950002,3.95,366,01-07-2018,01-07-2018,2018-07-01,2018,7,3
201808,2,220303,1,1.7,1.89,2,2.2,2.49,2.99,3.1500001,3.95,367,01-08-2018,01-08-2018,2018-08-01,2018,8,3
201809,2,220303,1,1.7,2,2.1900001,2.3499999,2.5,3,3.1900001,3.95,368,01-09-2018,01-09-2018,2018-09-01,2018,9,3
201810,2,220303,1.5,1.8,2,2.2,2.49,2.5,2.99,3.1900001,3.95,369,01-10-2018,01-10-2018,2018-10-01,2018,10,4
201811,2,220303,1.5,1.8,2,2.1900001,2.49,2.5,2.99,3.0999999,3.95,370,01-11-2018,01-11-2018,2018-11-01,2018,11,4
201812,2,220303,1.1,1.7,1.89,2,2.345,2.5,2.99,3.2,3.95,371,01-12-2018,01-12-2018,2018-12-01,2018,12,4
201901,2,220303,1.1,1.7,1.89,2,2.49,2.5,2.99,3.2,3.95,372,01-01-2019,01-01-2019,2019-01-01,2019,1,1
201902,2,220303,1.1,1.8,2,2.3,2.5,2.7,2.9000001,3.0999999,3.99,373,01-02-2019,01-02-2019,2019-02-01,2019,2,1
201903,2,220303,1.1,1.7,2,2.25,2.49,2.5,2.9000001,3.0999999,3.99,374,01-03-2019,01-03-2019,2019-03-01,2019,3,1
201904,2,220303,1.3,1.8,2,2.2750001,2.4949999,2.5,2.9000001,3.4000001,4.2950001,375,01-04-2019,01-04-2019,2019-04-01,2019,4,2
201905,2,220303,1.1,1.8,2,2.25,2.49,2.5,2.8,3.3,3.99,376,01-05-2019,01-05-2019,2019-05-01,2019,5,2
201906,2,220303,1.5,1.8,2,2.25,2.5,2.75,2.9000001,3.3,3.95,377,01-06-2019,01-06-2019,2019-06-01,2019,6,2
201907,2,220303,1.7,1.9,2,2.25,2.49,2.5,2.8,3.29,3.95,378,01-07-2019,01-07-2019,2019-07-01,2019,7,3
201908,2,220303,1.75,1.9449999,2,2.2249999,2.4949999,2.75,2.9000001,3.4949999,3.97,379,01-08-2019,01-08-2019,2019-08-01,2019,8,3
201909,2,220303,1.8,2,2,2.25,2.5,2.75,2.9000001,3.49,3.95,380,01-09-2019,01-09-2019,2019-09-01,2019,9,3
201910,2,220303,1.8,2,2.0999999,2.3,2.5,2.75,3.2,3.5,3.99,381,01-10-2019,01-10-2019,2019-10-01,2019,10,4
201911,2,220303,1.8,2,2.2,2.49,2.5,2.75,3,3.49,3.95,382,01-11-2019,01-11-2019,2019-11-01,2019,11,4
201912,2,220303,1.8,2,2.2,2.49,2.55,2.75,3.2,3.5,4,383,01-12-2019,01-12-2019,2019-12-01,2019,12,4
202001,2,220303,1.9,2,2.2,2.5,2.5999999,2.8,3.29,3.55,3.95,384,01-01-2020,01-01-2020,2020-01-01,2020,1,1
202002,2,220303,1.9,2.2,2.49,2.55,2.75,3,3.3499999,3.8900001,4.9899998,385,01-02-2020,01-02-2020,2020-02-01,2020,2,1
202003,2,220303,1.9,2.0999999,2.5,2.625,2.825,3.25,3.5250001,3.895,4.7950001,386,01-03-2020,01-03-2020,2020-03-01,2020,3,1
202004,2,220303,1,2.3,2.5999999,2.6900001,2.845,3,3,3.4000001,3.5,387,01-04-2020,01-04-2020,2020-04-01,2020,4,2
202005,2,220303,1.9,2.2750001,2.3,2.55,2.6900001,2.9949999,3,4.6999998,5.75,388,01-05-2020,01-05-2020,2020-05-01,2020,5,2
202006,2,220303,1.9,2.25,2.3,2.5,2.9000001,3,3,3.9000001,4.1999998,389,01-06-2020,01-06-2020,2020-06-01,2020,6,2
202007,2,220303,2.2,2.2,2.3,2.5,2.75,2.99,3,3.45,4.25,390,01-07-2020,01-07-2020,2020-07-01,2020,7,3
202008,2,220303,1.1,2,2.2,2.5,2.75,3,3.45,3.79,4.1999998,391,01-08-2020,01-08-2020,2020-08-01,2020,8,3
202009,2,220303,1.35,2,2.3,2.6500001,2.9749999,3.3,3.45,3.8900001,4.1999998,392,01-09-2020,01-09-2020,2020-09-01,2020,9,3
202010,2,220303,1.35,2,2.3,2.6500001,2.8499999,3,3.4000001,3.5,4.1999998,393,01-10-2020,01-10-2020,2020-10-01,2020,10,4
202011,2,220303,1.35,2,2.3,2.5,2.75,3,3.5,3.79,4.1999998,394,01-11-2020,01-11-2020,2020-11-01,2020,11,4
202012,2,220303,1.9,2.2,2.5,2.6500001,2.8499999,3,3.4000001,3.79,4.1999998,395,01-12-2020,01-12-2020,2020-12-01,2020,12,4
202101,2,220303,2,2.25,2.5,2.5,2.75,2.95,3,3.5,3.8900001,396,01-01-2021,01-01-2021,2021-01-01,2021,1,1
202102,2,220303,2.05,2.2750001,2.5,2.55,2.7,2.95,3,3.45,3.845,397,01-02-2021,01-02-2021,2021-02-01,2021,2,1
202103,2,220303,1.35,2.2,2.5,2.5999999,2.7,2.95,3,3.2,3.5,398,01-03-2021,01-03-2021,2021-03-01,2021,3,1
202104,2,220303,1.35,2.3,2.5,2.5999999,2.75,2.95,3,3.4000001,3.79,399,01-04-2021,01-04-2021,2021-04-01,2021,4,2
202105,2,220303,1.45,2.2750001,2.45,2.55,2.6500001,2.8499999,2.9749999,3.8400002,4.0500002,400,01-05-2021,01-05-2021,2021-05-01,2021,5,2
202106,2,220303,1.25,2.2249999,2.4000001,2.5749998,2.95,3,3.45,3.8400002,4.25,401,01-06-2021,01-06-2021,2021-06-01,2021,6,2
202107,2,220303,1.75,2.3,2.5,2.55,2.75,3,3.4000001,3.79,4.9499998,402,01-07-2021,01-07-2021,2021-07-01,2021,7,3
202108,2,220303,1.35,2.3,2.5,2.5999999,2.8499999,3,3.5,3.9000001,4.9499998,403,01-08-2021,01-08-2021,2021-08-01,2021,8,3
202109,2,220303,1.35,2.2,2.5,2.75,2.95,3.0899999,3.45,3.8900001,4.9499998,404,01-09-2021,01-09-2021,2021-09-01,2021,9,3
202110,2,220303,1.25,2.3,2.5,2.7,2.8699999,3,3.45,3.75,4.1999998,405,01-10-2021,01-10-2021,2021-10-01,2021,10,4
202111,2,220303,1.3,2.2,2.5,2.7,2.95,3.4000001,3.5,3.9000001,4.9000001,406,01-11-2021,01-11-2021,2021-11-01,2021,11,4
202112,2,220303,1.3,2.2,2.5999999,2.75,2.95,3.4000001,3.5,3.8900001,4.9000001,407,01-12-2021,01-12-2021,2021-12-01,2021,12,4
202201,2,220303,1.3,2.125,2.5,2.7249999,3,3.0949998,3.45,3.5,3.9000001,408,01-01-2022,01-01-2022,2022-01-01,2022,1,1
202202,2,220303,1.3,2.05,2.3,2.7,2.875,3.05,3.4000001,3.5,3.99,409,01-02-2022,01-02-2022,2022-02-01,2022,2,1
202203,2,220303,1.3,2.05,2.49,2.75,3,3.4000001,3.5,3.9000001,4.3499999,410,01-03-2022,01-03-2022,2022-03-01,2022,3,1
202204,2,220303,1.3,2.05,2.49,2.75,2.9000001,3.05,3.5,3.9000001,4.4899998,411,01-04-2022,01-04-2022,2022-04-01,2022,4,2
202205,2,220303,1.4,2.3,2.5,2.75,2.875,3,3.45,3.7,4.4899998,412,01-05-2022,01-05-2022,2022-05-01,2022,5,2
202206,2,220303,1.4,2.3,2.7,2.8499999,2.9000001,3.0999999,3.5,4,4.4899998,413,01-06-2022,01-06-2022,2022-06-01,2022,6,2
202207,2,220303,1.345,2.375,2.7750001,2.9250002,3.0749998,3.4749999,3.5250001,4.0500002,4.77,414,01-07-2022,01-07-2022,2022-07-01,2022,7,3
202208,2,220303,1.4,2.3,2.7,2.9000001,3.05,3.5,3.6500001,4,4.3499999,415,01-08-2022,01-08-2022,2022-08-01,2022,8,3
202209,2,220303,1.395,2.25,2.6750002,2.8499999,3.0250001,3.3,3.5999999,4,4.4250002,416,01-09-2022,01-09-2022,2022-09-01,2022,9,3
202210,2,220303,1.39,2.5,2.75,2.95,3.175,3.5,3.55,4,4.5,417,01-10-2022,01-10-2022,2022-10-01,2022,10,4
202211,2,220303,1.4,2.5,2.75,2.95,3.2,3.5,3.5899999,4,4.75,418,01-11-2022,01-11-2022,2022-11-01,2022,11,4
202212,2,220303,1.39,2.25,2.6500001,2.9000001,3.2,3.5,3.75,4,4.9499998,419,01-12-2022,01-12-2022,2022-12-01,2022,12,4
202301,2,220303,2,2.5,2.75,3.05,3.425,3.5,3.9000001,4,4.9499998,420,01-01-2023,01-01-2023,2023-01-01,2023,1,1
202302,2,220303,2.25,2.5,2.75,3.05,3.425,3.55,4,4,5,421,01-02-2023,01-02-2023,2023-02-01,2023,2,1
202303,2,220303,2,2.5,2.75,3.05,3.425,3.5899999,4,4.1500001,5.5,422,01-03-2023,01-03-2023,2023-03-01,2023,3,1
202304,2,220303,1.5,2.25,2.6500001,3.05,3.5,3.75,4,4.9899998,5.5,423,01-04-2023,01-04-2023,2023-04-01,2023,4,2
202305,2,220303,1.5,2.5,3,3.3499999,3.5,3.8499999,4,4.25,5.8000002,424,01-05-2023,01-05-2023,2023-05-01,2023,5,2
202306,2,220303,1.5,2.5,2.7,3.2,3.5,3.8,4,4.9499998,5.8000002,425,01-06-2023,01-06-2023,2023-06-01,2023,6,2
202307,2,220303,1.49,2.0999999,2.5999999,3,3.5,3.8,4,4.4499998,5.8000002,426,01-07-2023,01-07-2023,2023-07-01,2023,7,3
202308,2,220303,1.495,2.175,2.625,3.125,3.4949999,3.7750001,4,4.3249998,5.395,427,01-08-2023,01-08-2023,2023-08-01,2023,8,3
202309,2,220303,1.5,2.25,2.6500001,3.0999999,3.5,3.8499999,4,4.4499998,5.8000002,428,01-09-2023,01-09-2023,2023-09-01,2023,9,3
202310,2,220303,1.5,2.5,3.05,3.3499999,3.75,3.8499999,4,4.9499998,5.8000002,429,01-10-2023,01-10-2023,2023-10-01,2023,10,4
202311,2,220303,1.5,2.25,3,3.0999999,3.5,3.8499999,4,4.4499998,5.0999999,430,01-11-2023,01-11-2023,2023-11-01,2023,11,4
202312,2,220303,1.75,2.5,3.05,3.3499999,3.5,3.8499999,4,4.9499998,5.8000002,431,01-12-2023,01-12-2023,2023-12-01,2023,12,4
202401,2,220303,1.75,2.5,3,3.45,3.55,3.9000001,4,4.5,5.0999999,432,01-01-2024,01-01-2024,2024-01-01,2024,1,1
202402,2,220303,1.8,2.375,3.0999999,3.5,3.875,4,4.7449999,5.8500004,6.5,433,01-02-2024,01-02-2024,2024-02-01,2024,2,1
202403,2,220303,1.75,2.0450001,2.6500001,3.25,3.8,3.95,4.4499998,5.8500004,6.5,434,01-03-2024,01-03-2024,2024-03-01,2024,3,1
202404,2,220303,1.75,2.25,3,3.45,3.8499999,4,4.9899998,5.9000001,7,435,01-04-2024,01-04-2024,2024-04-01,2024,4,2
202405,2,220303,1.75,2.25,3,3.45,3.675,4,4.9899998,5.9000001,7,436,01-05-2024,01-05-2024,2024-05-01,2024,5,2
202406,2,220303,1.75,2.0450001,2.5999999,3.125,3.5,3.9250002,4.1500001,5.6500001,6.5,437,01-06-2024,01-06-2024,2024-06-01,2024,6,2
202407,2,220303,1.75,2.2,2.75,3.45,3.8249998,4,4.4499998,5.9000001,6.5,438,01-07-2024,01-07-2024,2024-07-01,2024,7,3
202408,2,220303,1.5,2.2,2.6500001,3.45,3.8499999,4,4.4499998,5.9000001,7,439,01-08-2024,01-08-2024,2024-08-01,2024,8,3
202409,2,220303,1.75,1.99,2.6500001,3.45,3.8,4,4.4499998,5.9000001,6.5,440,01-09-2024,01-09-2024,2024-09-01,2024,9,3
202410,2,220303,1.75,2.095,2.75,3.25,3.8,4,4.1500001,5.6500001,7,441,01-10-2024,01-10-2024,2024-10-01,2024,10,4
202411,2,220303,1.99,2.6500001,3.1500001,3.45,3.9749999,4.0500002,4.9899998,5.9499998,7,442,01-11-2024,01-11-2024,2024-11-01,2024,11,4
202412,2,220303,1.75,2.2,3.0999999,3.45,3.8,4,4.5,5.9499998,7.9000001,443,01-12-2024,01-12-2024,2024-12-01,2024,12,4
202501,2,220303,1.75,2.0999999,3.0999999,3.5,3.8,4,4.5,5.9250002,7.9000001,444,01-01-2025,01-01-2025,2025-01-01,2025,1,1
202502,2,220303,1.85,2.2,3.2249999,3.55,3.625,4,4.375,5.9000001,7.3500004,445,01-02-2025,01-02-2025,2025-02-01,2025,2,1
202503,2,220303,1.85,2.1950002,3.2249999,3.55,3.9000001,4,4.9899998,6.0999999,7.3500004,446,01-03-2025,01-03-2025,2025-03-01,2025,3,1
202504,2,220303,1.75,2.2,2.75,3.55,3.8499999,4,4.5,5.9499998,6.6999998,447,01-04-2025,01-04-2025,2025-04-01,2025,4,2
202505,2,220303,1.95,2.24,2.75,3.5,3.5999999,4,4.5,5.1500001,6.5,448,01-05-2025,01-05-2025,2025-05-01,2025,5,2
202506,2,220303,1.75,2.75,3.5,3.5999999,3.95,4.1999998,4.9899998,5.9000001,6.6999998,449,01-06-2025,01-06-2025,2025-06-01,2025,6,2
202507,2,220303,1.8,2.2,2.75,3.5999999,3.9000001,4.1999998,4.5,5.9000001,6.6999998,450,01-07-2025,01-07-2025,2025-07-01,2025,7,3
202508,2,220303,1.75,2.0799999,2.75,3.5999999,3.8499999,4.1999998,4.9499998,5.9499998,6.6999998,451,01-08-2025,01-08-2025,2025-08-01,2025,8,3
202509,2,220303,1.775,2.135,2.75,3.55,3.7249999,4.0999999,4.625,5.9250002,6.6999998,452,01-09-2025,01-09-2025,2025-09-01,2025,9,3
