quote_date,price,item_id,date,date2,date3,date4,store
200709,3.1800001,211408,236,01-09-2007,01-09-2007,2007-09-01,1
200710,3.1800001,211408,237,01-10-2007,01-10-2007,2007-10-01,1
200711,3.1800001,211408,238,01-11-2007,01-11-2007,2007-11-01,1
200712,2.74,211408,239,01-12-2007,01-12-2007,2007-12-01,1
200801,2.74,211408,240,01-01-2008,01-01-2008,2008-01-01,1
200802,2.74,211408,241,01-02-2008,01-02-2008,2008-02-01,1
200803,2.24,211408,242,01-03-2008,01-03-2008,2008-03-01,1
200804,2.24,211408,243,01-04-2008,01-04-2008,2008-04-01,1
200805,2.1600001,211408,244,01-05-2008,01-05-2008,2008-05-01,1
200806,2.8800001,211408,245,01-06-2008,01-06-2008,2008-06-01,1
200807,2.8800001,211408,246,01-07-2008,01-07-2008,2008-07-01,1
200808,2.8599999,211408,247,01-08-2008,01-08-2008,2008-08-01,1
200809,2.8399999,211408,248,01-09-2008,01-09-2008,2008-09-01,1
200810,2.8299999,211408,249,01-10-2008,01-10-2008,2008-10-01,1
200811,3.48,211408,250,01-11-2008,01-11-2008,2008-11-01,1
200812,3.47,211408,251,01-12-2008,01-12-2008,2008-12-01,1
200901,3.46,211408,252,01-01-2009,01-01-2009,2009-01-01,1
200902,3.4400001,211408,253,01-02-2009,01-02-2009,2009-02-01,1
200903,3.4200001,211408,254,01-03-2009,01-03-2009,2009-03-01,1
200904,2.99,211408,255,01-04-2009,01-04-2009,2009-04-01,1
200905,2.99,211408,256,01-05-2009,01-05-2009,2009-05-01,1
200906,3.4200001,211408,257,01-06-2009,01-06-2009,2009-06-01,1
200907,3.4000001,211408,258,01-07-2009,01-07-2009,2009-07-01,1
200908,3.3800001,211408,259,01-08-2009,01-08-2009,2009-08-01,1
200909,2,211408,260,01-09-2009,01-09-2009,2009-09-01,1
200910,3.3699999,211408,261,01-10-2009,01-10-2009,2009-10-01,1
200911,3.3499999,211408,262,01-11-2009,01-11-2009,2009-11-01,1
200912,3.3299999,211408,263,01-12-2009,01-12-2009,2009-12-01,1
201001,3.3299999,211408,264,01-01-2010,01-01-2010,2010-01-01,1
201002,3.3,211408,265,01-02-2010,01-02-2010,2010-02-01,1
201003,3.28,211408,266,01-03-2010,01-03-2010,2010-03-01,1
201004,3.26,211408,267,01-04-2010,01-04-2010,2010-04-01,1
201005,3.26,211408,268,01-05-2010,01-05-2010,2010-05-01,1
201006,3.26,211408,269,01-06-2010,01-06-2010,2010-06-01,1
201007,3.26,211408,270,01-07-2010,01-07-2010,2010-07-01,1
201008,3.25,211408,271,01-08-2010,01-08-2010,2010-08-01,1
201009,2.98,211408,272,01-09-2010,01-09-2010,2010-09-01,1
201010,2.98,211408,273,01-10-2010,01-10-2010,2010-10-01,1
201011,2.98,211408,274,01-11-2010,01-11-2010,2010-11-01,1
201012,2.98,211408,275,01-12-2010,01-12-2010,2010-12-01,1
201101,2.98,211408,276,01-01-2011,01-01-2011,2011-01-01,1
201102,2.98,211408,277,01-02-2011,01-02-2011,2011-02-01,1
201103,2.98,211408,278,01-03-2011,01-03-2011,2011-03-01,1
201104,2.98,211408,279,01-04-2011,01-04-2011,2011-04-01,1
201105,2.98,211408,280,01-05-2011,01-05-2011,2011-05-01,1
201106,2.98,211408,281,01-06-2011,01-06-2011,2011-06-01,1
201107,2.6800001,211408,282,01-07-2011,01-07-2011,2011-07-01,1
201108,2.6800001,211408,283,01-08-2011,01-08-2011,2011-08-01,1
201109,3.28,211408,284,01-09-2011,01-09-2011,2011-09-01,1
201110,3.3800001,211408,285,01-10-2011,01-10-2011,2011-10-01,1
201111,3.3800001,211408,286,01-11-2011,01-11-2011,2011-11-01,1
201112,3.28,211408,287,01-12-2011,01-12-2011,2011-12-01,1
201201,3,211408,288,01-01-2012,01-01-2012,2012-01-01,1
201202,3,211408,289,01-02-2012,01-02-2012,2012-02-01,1
201203,3,211408,290,01-03-2012,01-03-2012,2012-03-01,1
201204,2.95,211408,291,01-04-2012,01-04-2012,2012-04-01,1
201205,3.3800001,211408,292,01-05-2012,01-05-2012,2012-05-01,1
201206,3.3800001,211408,293,01-06-2012,01-06-2012,2012-06-01,1
201207,2.98,211408,294,01-07-2012,01-07-2012,2012-07-01,1
201208,2.98,211408,295,01-08-2012,01-08-2012,2012-08-01,1
201209,2.98,211408,296,01-09-2012,01-09-2012,2012-09-01,1
201210,2.98,211408,297,01-10-2012,01-10-2012,2012-10-01,1
201212,2.98,211408,299,01-12-2012,01-12-2012,2012-12-01,1
201301,2.98,211408,300,01-01-2013,01-01-2013,2013-01-01,1
201302,2.98,211408,301,01-02-2013,01-02-2013,2013-02-01,1
201303,2.98,211408,302,01-03-2013,01-03-2013,2013-03-01,1
201304,2.98,211408,303,01-04-2013,01-04-2013,2013-04-01,1
201305,2.98,211408,304,01-05-2013,01-05-2013,2013-05-01,1
201306,3.98,211408,305,01-06-2013,01-06-2013,2013-06-01,1
201307,3.98,211408,306,01-07-2013,01-07-2013,2013-07-01,1
201308,3.98,211408,307,01-08-2013,01-08-2013,2013-08-01,1
201309,3.98,211408,308,01-09-2013,01-09-2013,2013-09-01,1
201310,3,211408,309,01-10-2013,01-10-2013,2013-10-01,1
201311,3.98,211408,310,01-11-2013,01-11-2013,2013-11-01,1
201312,3.98,211408,311,01-12-2013,01-12-2013,2013-12-01,1
201401,2,211408,312,01-01-2014,01-01-2014,2014-01-01,1
201402,2,211408,313,01-02-2014,01-02-2014,2014-02-01,1
201404,3.98,211408,315,01-04-2014,01-04-2014,2014-04-01,1
201405,3.98,211408,316,01-05-2014,01-05-2014,2014-05-01,1
201406,3.98,211408,317,01-06-2014,01-06-2014,2014-06-01,1
201407,3.98,211408,318,01-07-2014,01-07-2014,2014-07-01,1
201408,3.98,211408,319,01-08-2014,01-08-2014,2014-08-01,1
201410,3.24,211408,321,01-10-2014,01-10-2014,2014-10-01,1
201411,3.24,211408,322,01-11-2014,01-11-2014,2014-11-01,1
201412,3.24,211408,323,01-12-2014,01-12-2014,2014-12-01,1
201501,1.87,211408,324,01-01-2015,01-01-2015,2015-01-01,1
201502,1.87,211408,325,01-02-2015,01-02-2015,2015-02-01,1
201503,1.87,211408,326,01-03-2015,01-03-2015,2015-03-01,1
201504,3.25,211408,327,01-04-2015,01-04-2015,2015-04-01,1
201505,3.7,211408,328,01-05-2015,01-05-2015,2015-05-01,1
201506,3.7,211408,329,01-06-2015,01-06-2015,2015-06-01,1
201507,2.6700001,211408,330,01-07-2015,01-07-2015,2015-07-01,1
201508,2.6700001,211408,331,01-08-2015,01-08-2015,2015-08-01,1
201509,2.6700001,211408,332,01-09-2015,01-09-2015,2015-09-01,1
201510,3.7,211408,333,01-10-2015,01-10-2015,2015-10-01,1
201511,3.7,211408,334,01-11-2015,01-11-2015,2015-11-01,1
201512,3.7,211408,335,01-12-2015,01-12-2015,2015-12-01,1
201601,2,211408,336,01-01-2016,01-01-2016,2016-01-01,1
201602,2,211408,337,01-02-2016,01-02-2016,2016-02-01,1
201603,2,211408,338,01-03-2016,01-03-2016,2016-03-01,1
201604,3.7,211408,339,01-04-2016,01-04-2016,2016-04-01,1
201605,4.25,211408,340,01-05-2016,01-05-2016,2016-05-01,1
201610,2,211408,345,01-10-2016,01-10-2016,2016-10-01,1
201611,2,211408,346,01-11-2016,01-11-2016,2016-11-01,1
201612,2,211408,347,01-12-2016,01-12-2016,2016-12-01,1
201701,3,211408,348,01-01-2017,01-01-2017,2017-01-01,1
201702,3,211408,349,01-02-2017,01-02-2017,2017-02-01,1
201703,3,211408,350,01-03-2017,01-03-2017,2017-03-01,1
201704,4.25,211408,351,01-04-2017,01-04-2017,2017-04-01,1
201705,4.25,211408,352,01-05-2017,01-05-2017,2017-05-01,1
201706,4.25,211408,353,01-06-2017,01-06-2017,2017-06-01,1
201707,3,211408,354,01-07-2017,01-07-2017,2017-07-01,1
201708,3,211408,355,01-08-2017,01-08-2017,2017-08-01,1
201710,3,211408,357,01-10-2017,01-10-2017,2017-10-01,1
201711,2.5,211408,358,01-11-2017,01-11-2017,2017-11-01,1
201712,4.25,211408,359,01-12-2017,01-12-2017,2017-12-01,1
201803,4.25,211408,362,01-03-2018,01-03-2018,2018-03-01,1
201804,3,211408,363,01-04-2018,01-04-2018,2018-04-01,1
201805,3,211408,364,01-05-2018,01-05-2018,2018-05-01,1
201806,4.25,211408,365,01-06-2018,01-06-2018,2018-06-01,1
201809,4.25,211408,368,01-09-2018,01-09-2018,2018-09-01,1
201810,2.5,211408,369,01-10-2018,01-10-2018,2018-10-01,1
201812,4.25,211408,371,01-12-2018,01-12-2018,2018-12-01,1
201901,2.5,211408,372,01-01-2019,01-01-2019,2019-01-01,1
201902,2.5,211408,373,01-02-2019,01-02-2019,2019-02-01,1
201903,4.25,211408,374,01-03-2019,01-03-2019,2019-03-01,1
201904,4.25,211408,375,01-04-2019,01-04-2019,2019-04-01,1
201905,2.5,211408,376,01-05-2019,01-05-2019,2019-05-01,1
201906,2.5,211408,377,01-06-2019,01-06-2019,2019-06-01,1
201907,2.5,211408,378,01-07-2019,01-07-2019,2019-07-01,1
201908,4.25,211408,379,01-08-2019,01-08-2019,2019-08-01,1
201909,4.25,211408,380,01-09-2019,01-09-2019,2019-09-01,1
201910,4.25,211408,381,01-10-2019,01-10-2019,2019-10-01,1
201911,4.25,211408,382,01-11-2019,01-11-2019,2019-11-01,1
201912,4.25,211408,383,01-12-2019,01-12-2019,2019-12-01,1
202003,2.5,211408,386,01-03-2020,01-03-2020,2020-03-01,1
202004,4.25,211408,387,01-04-2020,01-04-2020,2020-04-01,1
202005,4.25,211408,388,01-05-2020,01-05-2020,2020-05-01,1
202006,4.25,211408,389,01-06-2020,01-06-2020,2020-06-01,1
202007,4.25,211408,390,01-07-2020,01-07-2020,2020-07-01,1
202008,2.5,211408,391,01-08-2020,01-08-2020,2020-08-01,1
202009,4.25,211408,392,01-09-2020,01-09-2020,2020-09-01,1
202010,2.5,211408,393,01-10-2020,01-10-2020,2020-10-01,1
202011,4.25,211408,394,01-11-2020,01-11-2020,2020-11-01,1
202012,4.25,211408,395,01-12-2020,01-12-2020,2020-12-01,1
202101,2.5,211408,396,01-01-2021,01-01-2021,2021-01-01,1
202102,4.25,211408,397,01-02-2021,01-02-2021,2021-02-01,1
202103,2.5,211408,398,01-03-2021,01-03-2021,2021-03-01,1
202104,4.25,211408,399,01-04-2021,01-04-2021,2021-04-01,1
202105,2.5,211408,400,01-05-2021,01-05-2021,2021-05-01,1
202106,3.75,211408,401,01-06-2021,01-06-2021,2021-06-01,1
202107,3.75,211408,402,01-07-2021,01-07-2021,2021-07-01,1
202108,3.75,211408,403,01-08-2021,01-08-2021,2021-08-01,1
202109,3,211408,404,01-09-2021,01-09-2021,2021-09-01,1
202110,3.75,211408,405,01-10-2021,01-10-2021,2021-10-01,1
202111,3.75,211408,406,01-11-2021,01-11-2021,2021-11-01,1
202112,3.75,211408,407,01-12-2021,01-12-2021,2021-12-01,1
202201,3,211408,408,01-01-2022,01-01-2022,2022-01-01,1
202202,3.75,211408,409,01-02-2022,01-02-2022,2022-02-01,1
202203,3.75,211408,410,01-03-2022,01-03-2022,2022-03-01,1
202204,3.75,211408,411,01-04-2022,01-04-2022,2022-04-01,1
202205,3.75,211408,412,01-05-2022,01-05-2022,2022-05-01,1
202206,4,211408,413,01-06-2022,01-06-2022,2022-06-01,1
202207,4.5,211408,414,01-07-2022,01-07-2022,2022-07-01,1
202208,4.5,211408,415,01-08-2022,01-08-2022,2022-08-01,1
202209,3.5,211408,416,01-09-2022,01-09-2022,2022-09-01,1
202210,4.5,211408,417,01-10-2022,01-10-2022,2022-10-01,1
202212,4.5,211408,419,01-12-2022,01-12-2022,2022-12-01,1
202303,6,211408,422,01-03-2023,01-03-2023,2023-03-01,1
202304,6.5,211408,423,01-04-2023,01-04-2023,2023-04-01,1
202305,6.5,211408,424,01-05-2023,01-05-2023,2023-05-01,1
202307,6.5,211408,426,01-07-2023,01-07-2023,2023-07-01,1
202309,7.5,211408,428,01-09-2023,01-09-2023,2023-09-01,1
202310,7.5,211408,429,01-10-2023,01-10-2023,2023-10-01,1
202311,7.5,211408,430,01-11-2023,01-11-2023,2023-11-01,1
202312,7.5,211408,431,01-12-2023,01-12-2023,2023-12-01,1
202401,8.5,211408,432,01-01-2024,01-01-2024,2024-01-01,1
202402,8.5,211408,433,01-02-2024,01-02-2024,2024-02-01,1
202403,8.5,211408,434,01-03-2024,01-03-2024,2024-03-01,1
202404,8.5,211408,435,01-04-2024,01-04-2024,2024-04-01,1
202405,6.5,211408,436,01-05-2024,01-05-2024,2024-05-01,1
202406,10,211408,437,01-06-2024,01-06-2024,2024-06-01,1
202408,10,211408,439,01-08-2024,01-08-2024,2024-08-01,1
202409,10,211408,440,01-09-2024,01-09-2024,2024-09-01,1
202411,10,211408,442,01-11-2024,01-11-2024,2024-11-01,1
202412,9,211408,443,01-12-2024,01-12-2024,2024-12-01,1
202501,9,211408,444,01-01-2025,01-01-2025,2025-01-01,1
202503,7.48,211408,446,01-03-2025,01-03-2025,2025-03-01,1
202505,7.48,211408,448,01-05-2025,01-05-2025,2025-05-01,1
202506,7.48,211408,449,01-06-2025,01-06-2025,2025-06-01,1
202508,7.48,211408,451,01-08-2025,01-08-2025,2025-08-01,1
202509,7.48,211408,452,01-09-2025,01-09-2025,2025-09-01,1
200702,4.1700001,211408,229,01-02-2007,01-02-2007,2007-02-01,2
200703,4.5700002,211408,230,01-03-2007,01-03-2007,2007-03-01,2
200704,4.5700002,211408,231,01-04-2007,01-04-2007,2007-04-01,2
200705,4.5700002,211408,232,01-05-2007,01-05-2007,2007-05-01,2
200706,4.5700002,211408,233,01-06-2007,01-06-2007,2007-06-01,2
200707,4.5700002,211408,234,01-07-2007,01-07-2007,2007-07-01,2
200708,4.5500002,211408,235,01-08-2007,01-08-2007,2007-08-01,2
200709,4.1700001,211408,236,01-09-2007,01-09-2007,2007-09-01,2
200710,4.1700001,211408,237,01-10-2007,01-10-2007,2007-10-01,2
200711,4.1700001,211408,238,01-11-2007,01-11-2007,2007-11-01,2
200712,1.89,211408,239,01-12-2007,01-12-2007,2007-12-01,2
200801,4.1700001,211408,240,01-01-2008,01-01-2008,2008-01-01,2
200802,4.1700001,211408,241,01-02-2008,01-02-2008,2008-02-01,2
200803,4.1700001,211408,242,01-03-2008,01-03-2008,2008-03-01,2
200805,4.1700001,211408,244,01-05-2008,01-05-2008,2008-05-01,2
200806,4.1700001,211408,245,01-06-2008,01-06-2008,2008-06-01,2
200807,4.1700001,211408,246,01-07-2008,01-07-2008,2008-07-01,2
200808,4.0599999,211408,247,01-08-2008,01-08-2008,2008-08-01,2
200809,4.1700001,211408,248,01-09-2008,01-09-2008,2008-09-01,2
200810,4.5799999,211408,249,01-10-2008,01-10-2008,2008-10-01,2
200811,4.5799999,211408,250,01-11-2008,01-11-2008,2008-11-01,2
200901,4.5799999,211408,252,01-01-2009,01-01-2009,2009-01-01,2
200902,2.29,211408,253,01-02-2009,01-02-2009,2009-02-01,2
200903,1.89,211408,254,01-03-2009,01-03-2009,2009-03-01,2
200904,4.1700001,211408,255,01-04-2009,01-04-2009,2009-04-01,2
200905,4.1700001,211408,256,01-05-2009,01-05-2009,2009-05-01,2
200906,4.1700001,211408,257,01-06-2009,01-06-2009,2009-06-01,2
200907,4.1700001,211408,258,01-07-2009,01-07-2009,2009-07-01,2
200908,4.1700001,211408,259,01-08-2009,01-08-2009,2009-08-01,2
200909,4.1700001,211408,260,01-09-2009,01-09-2009,2009-09-01,2
200910,4.1700001,211408,261,01-10-2009,01-10-2009,2009-10-01,2
200911,4.02,211408,262,01-11-2009,01-11-2009,2009-11-01,2
200912,4.1700001,211408,263,01-12-2009,01-12-2009,2009-12-01,2
201001,4.1700001,211408,264,01-01-2010,01-01-2010,2010-01-01,2
201002,3.6800001,211408,265,01-02-2010,01-02-2010,2010-02-01,2
201007,2.79,211408,270,01-07-2010,01-07-2010,2010-07-01,2
201008,2.79,211408,271,01-08-2010,01-08-2010,2010-08-01,2
201009,2.79,211408,272,01-09-2010,01-09-2010,2010-09-01,2
201010,2.23,211408,273,01-10-2010,01-10-2010,2010-10-01,2
201011,2.79,211408,274,01-11-2010,01-11-2010,2010-11-01,2
201012,2.79,211408,275,01-12-2010,01-12-2010,2010-12-01,2
201101,2.79,211408,276,01-01-2011,01-01-2011,2011-01-01,2
201102,2.79,211408,277,01-02-2011,01-02-2011,2011-02-01,2
201103,2.6900001,211408,278,01-03-2011,01-03-2011,2011-03-01,2
201104,2.6900001,211408,279,01-04-2011,01-04-2011,2011-04-01,2
201105,2.6900001,211408,280,01-05-2011,01-05-2011,2011-05-01,2
201107,2.6900001,211408,282,01-07-2011,01-07-2011,2011-07-01,2
201108,2.6900001,211408,283,01-08-2011,01-08-2011,2011-08-01,2
201109,2.6900001,211408,284,01-09-2011,01-09-2011,2011-09-01,2
201110,2.6900001,211408,285,01-10-2011,01-10-2011,2011-10-01,2
201111,2.1500001,211408,286,01-11-2011,01-11-2011,2011-11-01,2
201112,2.29,211408,287,01-12-2011,01-12-2011,2011-12-01,2
201201,2.29,211408,288,01-01-2012,01-01-2012,2012-01-01,2
201202,2.29,211408,289,01-02-2012,01-02-2012,2012-02-01,2
201203,2.29,211408,290,01-03-2012,01-03-2012,2012-03-01,2
201204,2.29,211408,291,01-04-2012,01-04-2012,2012-04-01,2
201205,3.29,211408,292,01-05-2012,01-05-2012,2012-05-01,2
201206,3.29,211408,293,01-06-2012,01-06-2012,2012-06-01,2
201207,3.29,211408,294,01-07-2012,01-07-2012,2012-07-01,2
201208,3.29,211408,295,01-08-2012,01-08-2012,2012-08-01,2
201209,3.29,211408,296,01-09-2012,01-09-2012,2012-09-01,2
201210,3.29,211408,297,01-10-2012,01-10-2012,2012-10-01,2
201211,3.29,211408,298,01-11-2012,01-11-2012,2012-11-01,2
201212,3.29,211408,299,01-12-2012,01-12-2012,2012-12-01,2
201301,3.29,211408,300,01-01-2013,01-01-2013,2013-01-01,2
201302,3.29,211408,301,01-02-2013,01-02-2013,2013-02-01,2
201303,3.29,211408,302,01-03-2013,01-03-2013,2013-03-01,2
201304,3.29,211408,303,01-04-2013,01-04-2013,2013-04-01,2
201305,3.29,211408,304,01-05-2013,01-05-2013,2013-05-01,2
201306,2.6300001,211408,305,01-06-2013,01-06-2013,2013-06-01,2
201307,3.29,211408,306,01-07-2013,01-07-2013,2013-07-01,2
201308,3.29,211408,307,01-08-2013,01-08-2013,2013-08-01,2
201309,3.29,211408,308,01-09-2013,01-09-2013,2013-09-01,2
201310,3.29,211408,309,01-10-2013,01-10-2013,2013-10-01,2
201311,3.29,211408,310,01-11-2013,01-11-2013,2013-11-01,2
201312,3.29,211408,311,01-12-2013,01-12-2013,2013-12-01,2
201401,3.29,211408,312,01-01-2014,01-01-2014,2014-01-01,2
201402,3.29,211408,313,01-02-2014,01-02-2014,2014-02-01,2
201403,3.29,211408,314,01-03-2014,01-03-2014,2014-03-01,2
201406,4.46,211408,317,01-06-2014,01-06-2014,2014-06-01,2
201407,4.46,211408,318,01-07-2014,01-07-2014,2014-07-01,2
201408,4.46,211408,319,01-08-2014,01-08-2014,2014-08-01,2
201409,4.46,211408,320,01-09-2014,01-09-2014,2014-09-01,2
201411,4.29,211408,322,01-11-2014,01-11-2014,2014-11-01,2
201412,4.29,211408,323,01-12-2014,01-12-2014,2014-12-01,2
201503,4.29,211408,326,01-03-2015,01-03-2015,2015-03-01,2
201504,4.29,211408,327,01-04-2015,01-04-2015,2015-04-01,2
201505,2.1400001,211408,328,01-05-2015,01-05-2015,2015-05-01,2
201506,4.29,211408,329,01-06-2015,01-06-2015,2015-06-01,2
201507,4.29,211408,330,01-07-2015,01-07-2015,2015-07-01,2
201508,3,211408,331,01-08-2015,01-08-2015,2015-08-01,2
201509,3,211408,332,01-09-2015,01-09-2015,2015-09-01,2
201510,4.29,211408,333,01-10-2015,01-10-2015,2015-10-01,2
201511,4.29,211408,334,01-11-2015,01-11-2015,2015-11-01,2
201512,3,211408,335,01-12-2015,01-12-2015,2015-12-01,2
201601,4.29,211408,336,01-01-2016,01-01-2016,2016-01-01,2
201603,3.99,211408,338,01-03-2016,01-03-2016,2016-03-01,2
201604,2,211408,339,01-04-2016,01-04-2016,2016-04-01,2
201606,1.99,211408,341,01-06-2016,01-06-2016,2016-06-01,2
201610,3.99,211408,345,01-10-2016,01-10-2016,2016-10-01,2
201703,2.49,211408,350,01-03-2017,01-03-2017,2017-03-01,2
201704,2.49,211408,351,01-04-2017,01-04-2017,2017-04-01,2
201705,2.49,211408,352,01-05-2017,01-05-2017,2017-05-01,2
201706,2.99,211408,353,01-06-2017,01-06-2017,2017-06-01,2
201707,2.99,211408,354,01-07-2017,01-07-2017,2017-07-01,2
201708,2.99,211408,355,01-08-2017,01-08-2017,2017-08-01,2
201709,2.99,211408,356,01-09-2017,01-09-2017,2017-09-01,2
201710,2.99,211408,357,01-10-2017,01-10-2017,2017-10-01,2
201711,2.99,211408,358,01-11-2017,01-11-2017,2017-11-01,2
201712,2.99,211408,359,01-12-2017,01-12-2017,2017-12-01,2
201801,2.99,211408,360,01-01-2018,01-01-2018,2018-01-01,2
201802,2.99,211408,361,01-02-2018,01-02-2018,2018-02-01,2
201803,2.99,211408,362,01-03-2018,01-03-2018,2018-03-01,2
201804,2.99,211408,363,01-04-2018,01-04-2018,2018-04-01,2
201805,2.99,211408,364,01-05-2018,01-05-2018,2018-05-01,2
201806,2.99,211408,365,01-06-2018,01-06-2018,2018-06-01,2
201807,2.99,211408,366,01-07-2018,01-07-2018,2018-07-01,2
201808,2.99,211408,367,01-08-2018,01-08-2018,2018-08-01,2
201809,2.99,211408,368,01-09-2018,01-09-2018,2018-09-01,2
201810,2.99,211408,369,01-10-2018,01-10-2018,2018-10-01,2
201811,2.99,211408,370,01-11-2018,01-11-2018,2018-11-01,2
201812,2.99,211408,371,01-12-2018,01-12-2018,2018-12-01,2
201902,2.99,211408,373,01-02-2019,01-02-2019,2019-02-01,2
201903,3,211408,374,01-03-2019,01-03-2019,2019-03-01,2
201904,3,211408,375,01-04-2019,01-04-2019,2019-04-01,2
201905,3,211408,376,01-05-2019,01-05-2019,2019-05-01,2
201906,3,211408,377,01-06-2019,01-06-2019,2019-06-01,2
201907,3,211408,378,01-07-2019,01-07-2019,2019-07-01,2
201908,2.5,211408,379,01-08-2019,01-08-2019,2019-08-01,2
201909,2.5,211408,380,01-09-2019,01-09-2019,2019-09-01,2
201910,2.5,211408,381,01-10-2019,01-10-2019,2019-10-01,2
201911,2.5,211408,382,01-11-2019,01-11-2019,2019-11-01,2
201912,2.5,211408,383,01-12-2019,01-12-2019,2019-12-01,2
202001,2.5,211408,384,01-01-2020,01-01-2020,2020-01-01,2
202002,2.5,211408,385,01-02-2020,01-02-2020,2020-02-01,2
202003,2.5,211408,386,01-03-2020,01-03-2020,2020-03-01,2
202004,2.5,211408,387,01-04-2020,01-04-2020,2020-04-01,2
202008,2.5,211408,391,01-08-2020,01-08-2020,2020-08-01,2
202009,2.5,211408,392,01-09-2020,01-09-2020,2020-09-01,2
202010,2.5,211408,393,01-10-2020,01-10-2020,2020-10-01,2
202011,2.5,211408,394,01-11-2020,01-11-2020,2020-11-01,2
202012,2.5,211408,395,01-12-2020,01-12-2020,2020-12-01,2
202101,2.5,211408,396,01-01-2021,01-01-2021,2021-01-01,2
202104,2.5,211408,399,01-04-2021,01-04-2021,2021-04-01,2
202105,2.5,211408,400,01-05-2021,01-05-2021,2021-05-01,2
202106,2.5,211408,401,01-06-2021,01-06-2021,2021-06-01,2
202107,2.5,211408,402,01-07-2021,01-07-2021,2021-07-01,2
202108,2.5,211408,403,01-08-2021,01-08-2021,2021-08-01,2
202109,2.5,211408,404,01-09-2021,01-09-2021,2021-09-01,2
202110,2.5,211408,405,01-10-2021,01-10-2021,2021-10-01,2
202111,2.5,211408,406,01-11-2021,01-11-2021,2021-11-01,2
202112,2.9000001,211408,407,01-12-2021,01-12-2021,2021-12-01,2
202201,2.9000001,211408,408,01-01-2022,01-01-2022,2022-01-01,2
202202,2.9000001,211408,409,01-02-2022,01-02-2022,2022-02-01,2
202203,2.9000001,211408,410,01-03-2022,01-03-2022,2022-03-01,2
202204,2.9000001,211408,411,01-04-2022,01-04-2022,2022-04-01,2
202205,2.9000001,211408,412,01-05-2022,01-05-2022,2022-05-01,2
202206,2.9000001,211408,413,01-06-2022,01-06-2022,2022-06-01,2
202207,2.9000001,211408,414,01-07-2022,01-07-2022,2022-07-01,2
202208,2.9000001,211408,415,01-08-2022,01-08-2022,2022-08-01,2
202209,2.9000001,211408,416,01-09-2022,01-09-2022,2022-09-01,2
202210,3.5,211408,417,01-10-2022,01-10-2022,2022-10-01,2
202211,3.5,211408,418,01-11-2022,01-11-2022,2022-11-01,2
202212,3.95,211408,419,01-12-2022,01-12-2022,2022-12-01,2
202301,3.95,211408,420,01-01-2023,01-01-2023,2023-01-01,2
202302,3.95,211408,421,01-02-2023,01-02-2023,2023-02-01,2
202303,4.6500001,211408,422,01-03-2023,01-03-2023,2023-03-01,2
202304,4.6500001,211408,423,01-04-2023,01-04-2023,2023-04-01,2
202305,4.6500001,211408,424,01-05-2023,01-05-2023,2023-05-01,2
202306,4.6500001,211408,425,01-06-2023,01-06-2023,2023-06-01,2
202307,4.6500001,211408,426,01-07-2023,01-07-2023,2023-07-01,2
202308,4.6500001,211408,427,01-08-2023,01-08-2023,2023-08-01,2
202309,4.6500001,211408,428,01-09-2023,01-09-2023,2023-09-01,2
202310,4.6500001,211408,429,01-10-2023,01-10-2023,2023-10-01,2
202311,4.8000002,211408,430,01-11-2023,01-11-2023,2023-11-01,2
202312,4.8000002,211408,431,01-12-2023,01-12-2023,2023-12-01,2
202401,4.8000002,211408,432,01-01-2024,01-01-2024,2024-01-01,2
202402,4.8000002,211408,433,01-02-2024,01-02-2024,2024-02-01,2
202403,5.75,211408,434,01-03-2024,01-03-2024,2024-03-01,2
202404,7,211408,435,01-04-2024,01-04-2024,2024-04-01,2
202406,8.9499998,211408,437,01-06-2024,01-06-2024,2024-06-01,2
202407,7,211408,438,01-07-2024,01-07-2024,2024-07-01,2
202408,7,211408,439,01-08-2024,01-08-2024,2024-08-01,2
202409,7,211408,440,01-09-2024,01-09-2024,2024-09-01,2
202410,7,211408,441,01-10-2024,01-10-2024,2024-10-01,2
202411,7,211408,442,01-11-2024,01-11-2024,2024-11-01,2
202412,7,211408,443,01-12-2024,01-12-2024,2024-12-01,2
202501,7,211408,444,01-01-2025,01-01-2025,2025-01-01,2
202502,7,211408,445,01-02-2025,01-02-2025,2025-02-01,2
202503,7,211408,446,01-03-2025,01-03-2025,2025-03-01,2
202504,6.6500001,211408,447,01-04-2025,01-04-2025,2025-04-01,2
202505,6,211408,448,01-05-2025,01-05-2025,2025-05-01,2
202506,6,211408,449,01-06-2025,01-06-2025,2025-06-01,2
202507,6.1500001,211408,450,01-07-2025,01-07-2025,2025-07-01,2
202508,6.1500001,211408,451,01-08-2025,01-08-2025,2025-08-01,2
202509,6.1500001,211408,452,01-09-2025,01-09-2025,2025-09-01,2
200702,2.3299999,211408,229,01-02-2007,01-02-2007,2007-02-01,3
200703,2.3299999,211408,230,01-03-2007,01-03-2007,2007-03-01,3
200704,2.3299999,211408,231,01-04-2007,01-04-2007,2007-04-01,3
200705,2.3299999,211408,232,01-05-2007,01-05-2007,2007-05-01,3
200706,2,211408,233,01-06-2007,01-06-2007,2007-06-01,3
200707,2,211408,234,01-07-2007,01-07-2007,2007-07-01,3
200708,2,211408,235,01-08-2007,01-08-2007,2007-08-01,3
200709,2,211408,236,01-09-2007,01-09-2007,2007-09-01,3
200710,1.92,211408,237,01-10-2007,01-10-2007,2007-10-01,3
200711,1.89,211408,238,01-11-2007,01-11-2007,2007-11-01,3
200712,1.89,211408,239,01-12-2007,01-12-2007,2007-12-01,3
200804,1.98,211408,243,01-04-2008,01-04-2008,2008-04-01,3
200805,1.88,211408,244,01-05-2008,01-05-2008,2008-05-01,3
200807,1.88,211408,246,01-07-2008,01-07-2008,2008-07-01,3
200808,2.48,211408,247,01-08-2008,01-08-2008,2008-08-01,3
200809,2.48,211408,248,01-09-2008,01-09-2008,2008-09-01,3
200810,2.48,211408,249,01-10-2008,01-10-2008,2008-10-01,3
200811,2.48,211408,250,01-11-2008,01-11-2008,2008-11-01,3
200812,2.48,211408,251,01-12-2008,01-12-2008,2008-12-01,3
200901,2.48,211408,252,01-01-2009,01-01-2009,2009-01-01,3
200902,2.48,211408,253,01-02-2009,01-02-2009,2009-02-01,3
200903,2.48,211408,254,01-03-2009,01-03-2009,2009-03-01,3
200904,2.48,211408,255,01-04-2009,01-04-2009,2009-04-01,3
200905,2.28,211408,256,01-05-2009,01-05-2009,2009-05-01,3
200906,2.28,211408,257,01-06-2009,01-06-2009,2009-06-01,3
200907,1.91,211408,258,01-07-2009,01-07-2009,2009-07-01,3
200908,1.91,211408,259,01-08-2009,01-08-2009,2009-08-01,3
200909,1.99,211408,260,01-09-2009,01-09-2009,2009-09-01,3
200910,1.99,211408,261,01-10-2009,01-10-2009,2009-10-01,3
200911,1.99,211408,262,01-11-2009,01-11-2009,2009-11-01,3
200912,2.0899999,211408,263,01-12-2009,01-12-2009,2009-12-01,3
201003,2.0899999,211408,266,01-03-2010,01-03-2010,2010-03-01,3
201004,2.0899999,211408,267,01-04-2010,01-04-2010,2010-04-01,3
201005,1.97,211408,268,01-05-2010,01-05-2010,2010-05-01,3
201006,1.97,211408,269,01-06-2010,01-06-2010,2010-06-01,3
201007,1.97,211408,270,01-07-2010,01-07-2010,2010-07-01,3
201008,2.0899999,211408,271,01-08-2010,01-08-2010,2010-08-01,3
201009,2.1500001,211408,272,01-09-2010,01-09-2010,2010-09-01,3
201010,2.0799999,211408,273,01-10-2010,01-10-2010,2010-10-01,3
201011,2.0799999,211408,274,01-11-2010,01-11-2010,2010-11-01,3
201012,2.0799999,211408,275,01-12-2010,01-12-2010,2010-12-01,3
201101,2.0799999,211408,276,01-01-2011,01-01-2011,2011-01-01,3
201102,1.84,211408,277,01-02-2011,01-02-2011,2011-02-01,3
201103,1.84,211408,278,01-03-2011,01-03-2011,2011-03-01,3
201104,1.84,211408,279,01-04-2011,01-04-2011,2011-04-01,3
201105,1.84,211408,280,01-05-2011,01-05-2011,2011-05-01,3
201106,1.99,211408,281,01-06-2011,01-06-2011,2011-06-01,3
201107,1.99,211408,282,01-07-2011,01-07-2011,2011-07-01,3
201108,1.78,211408,283,01-08-2011,01-08-2011,2011-08-01,3
201109,1.89,211408,284,01-09-2011,01-09-2011,2011-09-01,3
201110,1.83,211408,285,01-10-2011,01-10-2011,2011-10-01,3
201111,1.83,211408,286,01-11-2011,01-11-2011,2011-11-01,3
201112,1.98,211408,287,01-12-2011,01-12-2011,2011-12-01,3
201201,2.3900001,211408,288,01-01-2012,01-01-2012,2012-01-01,3
201202,2.3900001,211408,289,01-02-2012,01-02-2012,2012-02-01,3
201203,1.99,211408,290,01-03-2012,01-03-2012,2012-03-01,3
201204,2.0899999,211408,291,01-04-2012,01-04-2012,2012-04-01,3
201205,2.0899999,211408,292,01-05-2012,01-05-2012,2012-05-01,3
201206,1.5,211408,293,01-06-2012,01-06-2012,2012-06-01,3
201211,3.49,211408,298,01-11-2012,01-11-2012,2012-11-01,3
201212,3.49,211408,299,01-12-2012,01-12-2012,2012-12-01,3
201301,3.49,211408,300,01-01-2013,01-01-2013,2013-01-01,3
201302,3.49,211408,301,01-02-2013,01-02-2013,2013-02-01,3
201303,3.49,211408,302,01-03-2013,01-03-2013,2013-03-01,3
201304,3.49,211408,303,01-04-2013,01-04-2013,2013-04-01,3
201305,3.49,211408,304,01-05-2013,01-05-2013,2013-05-01,3
201307,3.79,211408,306,01-07-2013,01-07-2013,2013-07-01,3
201308,3.79,211408,307,01-08-2013,01-08-2013,2013-08-01,3
201309,3.79,211408,308,01-09-2013,01-09-2013,2013-09-01,3
201310,3.79,211408,309,01-10-2013,01-10-2013,2013-10-01,3
201311,3.79,211408,310,01-11-2013,01-11-2013,2013-11-01,3
201401,3.75,211408,312,01-01-2014,01-01-2014,2014-01-01,3
201407,2.1900001,211408,318,01-07-2014,01-07-2014,2014-07-01,3
201408,2.1900001,211408,319,01-08-2014,01-08-2014,2014-08-01,3
201409,2.1900001,211408,320,01-09-2014,01-09-2014,2014-09-01,3
201410,2.1900001,211408,321,01-10-2014,01-10-2014,2014-10-01,3
201411,2.1900001,211408,322,01-11-2014,01-11-2014,2014-11-01,3
201501,2.1900001,211408,324,01-01-2015,01-01-2015,2015-01-01,3
201502,2.1900001,211408,325,01-02-2015,01-02-2015,2015-02-01,3
201503,2.1900001,211408,326,01-03-2015,01-03-2015,2015-03-01,3
201504,2.3900001,211408,327,01-04-2015,01-04-2015,2015-04-01,3
201505,2.3900001,211408,328,01-05-2015,01-05-2015,2015-05-01,3
201506,2.3900001,211408,329,01-06-2015,01-06-2015,2015-06-01,3
201507,2.5899999,211408,330,01-07-2015,01-07-2015,2015-07-01,3
201508,2.5899999,211408,331,01-08-2015,01-08-2015,2015-08-01,3
201509,2.5899999,211408,332,01-09-2015,01-09-2015,2015-09-01,3
201510,2.6099999,211408,333,01-10-2015,01-10-2015,2015-10-01,3
201511,2.6099999,211408,334,01-11-2015,01-11-2015,2015-11-01,3
201512,2.6099999,211408,335,01-12-2015,01-12-2015,2015-12-01,3
201601,2.6099999,211408,336,01-01-2016,01-01-2016,2016-01-01,3
201602,2.6099999,211408,337,01-02-2016,01-02-2016,2016-02-01,3
201603,2.6099999,211408,338,01-03-2016,01-03-2016,2016-03-01,3
201604,2.6099999,211408,339,01-04-2016,01-04-2016,2016-04-01,3
201605,2.6099999,211408,340,01-05-2016,01-05-2016,2016-05-01,3
201606,2.97,211408,341,01-06-2016,01-06-2016,2016-06-01,3
201607,2.97,211408,342,01-07-2016,01-07-2016,2016-07-01,3
201609,2.97,211408,344,01-09-2016,01-09-2016,2016-09-01,3
201610,2.97,211408,345,01-10-2016,01-10-2016,2016-10-01,3
201611,2.97,211408,346,01-11-2016,01-11-2016,2016-11-01,3
201612,2.97,211408,347,01-12-2016,01-12-2016,2016-12-01,3
201701,2.97,211408,348,01-01-2017,01-01-2017,2017-01-01,3
201702,2.97,211408,349,01-02-2017,01-02-2017,2017-02-01,3
201703,2.97,211408,350,01-03-2017,01-03-2017,2017-03-01,3
201704,3,211408,351,01-04-2017,01-04-2017,2017-04-01,3
201705,3,211408,352,01-05-2017,01-05-2017,2017-05-01,3
201706,3,211408,353,01-06-2017,01-06-2017,2017-06-01,3
201707,3,211408,354,01-07-2017,01-07-2017,2017-07-01,3
201708,3,211408,355,01-08-2017,01-08-2017,2017-08-01,3
201709,3,211408,356,01-09-2017,01-09-2017,2017-09-01,3
201712,3.48,211408,359,01-12-2017,01-12-2017,2017-12-01,3
201801,3.5799999,211408,360,01-01-2018,01-01-2018,2018-01-01,3
201803,3.5799999,211408,362,01-03-2018,01-03-2018,2018-03-01,3
201804,3.2,211408,363,01-04-2018,01-04-2018,2018-04-01,3
201805,3.2,211408,364,01-05-2018,01-05-2018,2018-05-01,3
201806,3.2,211408,365,01-06-2018,01-06-2018,2018-06-01,3
201807,3.5799999,211408,366,01-07-2018,01-07-2018,2018-07-01,3
201811,2.4000001,211408,370,01-11-2018,01-11-2018,2018-11-01,3
201812,2.4000001,211408,371,01-12-2018,01-12-2018,2018-12-01,3
201901,2.4000001,211408,372,01-01-2019,01-01-2019,2019-01-01,3
201902,2.4000001,211408,373,01-02-2019,01-02-2019,2019-02-01,3
201903,2.4000001,211408,374,01-03-2019,01-03-2019,2019-03-01,3
201904,2.4000001,211408,375,01-04-2019,01-04-2019,2019-04-01,3
201905,2.4000001,211408,376,01-05-2019,01-05-2019,2019-05-01,3
201906,2,211408,377,01-06-2019,01-06-2019,2019-06-01,3
201907,2,211408,378,01-07-2019,01-07-2019,2019-07-01,3
201908,2,211408,379,01-08-2019,01-08-2019,2019-08-01,3
201909,2.4000001,211408,380,01-09-2019,01-09-2019,2019-09-01,3
201910,2.55,211408,381,01-10-2019,01-10-2019,2019-10-01,3
201911,2.55,211408,382,01-11-2019,01-11-2019,2019-11-01,3
201912,2.55,211408,383,01-12-2019,01-12-2019,2019-12-01,3
202001,2.55,211408,384,01-01-2020,01-01-2020,2020-01-01,3
202002,2.55,211408,385,01-02-2020,01-02-2020,2020-02-01,3
202004,2.3499999,211408,387,01-04-2020,01-04-2020,2020-04-01,3
202006,3.5,211408,389,01-06-2020,01-06-2020,2020-06-01,3
202007,3.5,211408,390,01-07-2020,01-07-2020,2020-07-01,3
202008,2.5999999,211408,391,01-08-2020,01-08-2020,2020-08-01,3
202101,3.1900001,211408,396,01-01-2021,01-01-2021,2021-01-01,3
202102,3.1900001,211408,397,01-02-2021,01-02-2021,2021-02-01,3
202103,3.1900001,211408,398,01-03-2021,01-03-2021,2021-03-01,3
202104,3.1900001,211408,399,01-04-2021,01-04-2021,2021-04-01,3
202105,3.1900001,211408,400,01-05-2021,01-05-2021,2021-05-01,3
202106,3.1900001,211408,401,01-06-2021,01-06-2021,2021-06-01,3
202107,3.3900001,211408,402,01-07-2021,01-07-2021,2021-07-01,3
202108,3.3900001,211408,403,01-08-2021,01-08-2021,2021-08-01,3
202109,3.3900001,211408,404,01-09-2021,01-09-2021,2021-09-01,3
202110,3.3900001,211408,405,01-10-2021,01-10-2021,2021-10-01,3
202111,3.3900001,211408,406,01-11-2021,01-11-2021,2021-11-01,3
202112,3.79,211408,407,01-12-2021,01-12-2021,2021-12-01,3
202201,3.79,211408,408,01-01-2022,01-01-2022,2022-01-01,3
202202,3.79,211408,409,01-02-2022,01-02-2022,2022-02-01,3
202203,3.79,211408,410,01-03-2022,01-03-2022,2022-03-01,3
202204,3.79,211408,411,01-04-2022,01-04-2022,2022-04-01,3
202205,3.79,211408,412,01-05-2022,01-05-2022,2022-05-01,3
202206,3.99,211408,413,01-06-2022,01-06-2022,2022-06-01,3
202207,3.99,211408,414,01-07-2022,01-07-2022,2022-07-01,3
202208,4.6500001,211408,415,01-08-2022,01-08-2022,2022-08-01,3
202209,5.1500001,211408,416,01-09-2022,01-09-2022,2022-09-01,3
202210,5.1500001,211408,417,01-10-2022,01-10-2022,2022-10-01,3
202211,5.1500001,211408,418,01-11-2022,01-11-2022,2022-11-01,3
202212,5.1500001,211408,419,01-12-2022,01-12-2022,2022-12-01,3
202301,5.1500001,211408,420,01-01-2023,01-01-2023,2023-01-01,3
202302,5.1500001,211408,421,01-02-2023,01-02-2023,2023-02-01,3
202303,5.1500001,211408,422,01-03-2023,01-03-2023,2023-03-01,3
202312,7.5999999,211408,431,01-12-2023,01-12-2023,2023-12-01,3
202401,7.5999999,211408,432,01-01-2024,01-01-2024,2024-01-01,3
202402,7.5999999,211408,433,01-02-2024,01-02-2024,2024-02-01,3
202403,7.5999999,211408,434,01-03-2024,01-03-2024,2024-03-01,3
202404,8.3999996,211408,435,01-04-2024,01-04-2024,2024-04-01,3
202405,8.3999996,211408,436,01-05-2024,01-05-2024,2024-05-01,3
202406,8.3999996,211408,437,01-06-2024,01-06-2024,2024-06-01,3
202407,8.3999996,211408,438,01-07-2024,01-07-2024,2024-07-01,3
202408,8.3999996,211408,439,01-08-2024,01-08-2024,2024-08-01,3
202409,8.3999996,211408,440,01-09-2024,01-09-2024,2024-09-01,3
202411,8.3999996,211408,442,01-11-2024,01-11-2024,2024-11-01,3
202412,8.3999996,211408,443,01-12-2024,01-12-2024,2024-12-01,3
202501,8.3999996,211408,444,01-01-2025,01-01-2025,2025-01-01,3
202502,8.3999996,211408,445,01-02-2025,01-02-2025,2025-02-01,3
202503,8.3999996,211408,446,01-03-2025,01-03-2025,2025-03-01,3
202504,8.3999996,211408,447,01-04-2025,01-04-2025,2025-04-01,3
202505,8.3999996,211408,448,01-05-2025,01-05-2025,2025-05-01,3
202506,8.3999996,211408,449,01-06-2025,01-06-2025,2025-06-01,3
202507,8.3999996,211408,450,01-07-2025,01-07-2025,2025-07-01,3
202508,8.3999996,211408,451,01-08-2025,01-08-2025,2025-08-01,3
202509,7,211408,452,01-09-2025,01-09-2025,2025-09-01,3
200702,5.9899998,211408,229,01-02-2007,01-02-2007,2007-02-01,4
200703,5.9899998,211408,230,01-03-2007,01-03-2007,2007-03-01,4
200704,5.9899998,211408,231,01-04-2007,01-04-2007,2007-04-01,4
200705,5.9899998,211408,232,01-05-2007,01-05-2007,2007-05-01,4
200706,5.9899998,211408,233,01-06-2007,01-06-2007,2007-06-01,4
200708,5.9899998,211408,235,01-08-2007,01-08-2007,2007-08-01,4
200709,3.99,211408,236,01-09-2007,01-09-2007,2007-09-01,4
200710,5.9899998,211408,237,01-10-2007,01-10-2007,2007-10-01,4
200711,5.9899998,211408,238,01-11-2007,01-11-2007,2007-11-01,4
200712,5.9899998,211408,239,01-12-2007,01-12-2007,2007-12-01,4
200801,5.9899998,211408,240,01-01-2008,01-01-2008,2008-01-01,4
200802,6.4899998,211408,241,01-02-2008,01-02-2008,2008-02-01,4
200803,6.4899998,211408,242,01-03-2008,01-03-2008,2008-03-01,4
200804,6.4899998,211408,243,01-04-2008,01-04-2008,2008-04-01,4
200805,6.4899998,211408,244,01-05-2008,01-05-2008,2008-05-01,4
200806,6.4899998,211408,245,01-06-2008,01-06-2008,2008-06-01,4
200807,6.4899998,211408,246,01-07-2008,01-07-2008,2008-07-01,4
200808,6.4899998,211408,247,01-08-2008,01-08-2008,2008-08-01,4
200809,6.4899998,211408,248,01-09-2008,01-09-2008,2008-09-01,4
200810,6.4899998,211408,249,01-10-2008,01-10-2008,2008-10-01,4
200811,6.4899998,211408,250,01-11-2008,01-11-2008,2008-11-01,4
200812,6.4899998,211408,251,01-12-2008,01-12-2008,2008-12-01,4
200901,6.4899998,211408,252,01-01-2009,01-01-2009,2009-01-01,4
200902,6.4899998,211408,253,01-02-2009,01-02-2009,2009-02-01,4
200903,6.4899998,211408,254,01-03-2009,01-03-2009,2009-03-01,4
200904,6.4899998,211408,255,01-04-2009,01-04-2009,2009-04-01,4
200905,6.4899998,211408,256,01-05-2009,01-05-2009,2009-05-01,4
200906,6.4899998,211408,257,01-06-2009,01-06-2009,2009-06-01,4
200907,4.3200002,211408,258,01-07-2009,01-07-2009,2009-07-01,4
200908,6.4899998,211408,259,01-08-2009,01-08-2009,2009-08-01,4
200909,6.4899998,211408,260,01-09-2009,01-09-2009,2009-09-01,4
200910,4.3200002,211408,261,01-10-2009,01-10-2009,2009-10-01,4
200911,6.4899998,211408,262,01-11-2009,01-11-2009,2009-11-01,4
200912,6.4899998,211408,263,01-12-2009,01-12-2009,2009-12-01,4
201001,6.4899998,211408,264,01-01-2010,01-01-2010,2010-01-01,4
201002,6.4899998,211408,265,01-02-2010,01-02-2010,2010-02-01,4
201003,6.4899998,211408,266,01-03-2010,01-03-2010,2010-03-01,4
201004,6.4899998,211408,267,01-04-2010,01-04-2010,2010-04-01,4
201005,6.4899998,211408,268,01-05-2010,01-05-2010,2010-05-01,4
201006,6.4899998,211408,269,01-06-2010,01-06-2010,2010-06-01,4
201007,6.4899998,211408,270,01-07-2010,01-07-2010,2010-07-01,4
201008,6.4899998,211408,271,01-08-2010,01-08-2010,2010-08-01,4
201009,6.9899998,211408,272,01-09-2010,01-09-2010,2010-09-01,4
201010,6.9899998,211408,273,01-10-2010,01-10-2010,2010-10-01,4
201011,6.9899998,211408,274,01-11-2010,01-11-2010,2010-11-01,4
201012,6.9899998,211408,275,01-12-2010,01-12-2010,2010-12-01,4
201101,6.9899998,211408,276,01-01-2011,01-01-2011,2011-01-01,4
201102,6.9899998,211408,277,01-02-2011,01-02-2011,2011-02-01,4
201103,6.9899998,211408,278,01-03-2011,01-03-2011,2011-03-01,4
201104,6.9899998,211408,279,01-04-2011,01-04-2011,2011-04-01,4
201105,6.9899998,211408,280,01-05-2011,01-05-2011,2011-05-01,4
201107,6.9899998,211408,282,01-07-2011,01-07-2011,2011-07-01,4
201108,4.6500001,211408,283,01-08-2011,01-08-2011,2011-08-01,4
201109,6.9899998,211408,284,01-09-2011,01-09-2011,2011-09-01,4
201110,6.9899998,211408,285,01-10-2011,01-10-2011,2011-10-01,4
201111,6.9899998,211408,286,01-11-2011,01-11-2011,2011-11-01,4
201112,6.9899998,211408,287,01-12-2011,01-12-2011,2011-12-01,4
201201,6.9899998,211408,288,01-01-2012,01-01-2012,2012-01-01,4
201202,6.9899998,211408,289,01-02-2012,01-02-2012,2012-02-01,4
201203,6.9899998,211408,290,01-03-2012,01-03-2012,2012-03-01,4
201204,6.9899998,211408,291,01-04-2012,01-04-2012,2012-04-01,4
201205,6.9899998,211408,292,01-05-2012,01-05-2012,2012-05-01,4
201206,6.9899998,211408,293,01-06-2012,01-06-2012,2012-06-01,4
201207,6.9899998,211408,294,01-07-2012,01-07-2012,2012-07-01,4
201208,6.9899998,211408,295,01-08-2012,01-08-2012,2012-08-01,4
201209,6.9899998,211408,296,01-09-2012,01-09-2012,2012-09-01,4
201210,6.9899998,211408,297,01-10-2012,01-10-2012,2012-10-01,4
201211,6.9899998,211408,298,01-11-2012,01-11-2012,2012-11-01,4
201212,6.9899998,211408,299,01-12-2012,01-12-2012,2012-12-01,4
201301,6.9899998,211408,300,01-01-2013,01-01-2013,2013-01-01,4
201302,7.29,211408,301,01-02-2013,01-02-2013,2013-02-01,4
201303,7.29,211408,302,01-03-2013,01-03-2013,2013-03-01,4
201304,7.29,211408,303,01-04-2013,01-04-2013,2013-04-01,4
201305,7.29,211408,304,01-05-2013,01-05-2013,2013-05-01,4
201306,5,211408,305,01-06-2013,01-06-2013,2013-06-01,4
201307,7.5,211408,306,01-07-2013,01-07-2013,2013-07-01,4
201308,7.5,211408,307,01-08-2013,01-08-2013,2013-08-01,4
201309,7.5,211408,308,01-09-2013,01-09-2013,2013-09-01,4
201310,7.5,211408,309,01-10-2013,01-10-2013,2013-10-01,4
201311,7.5,211408,310,01-11-2013,01-11-2013,2013-11-01,4
201312,7.5,211408,311,01-12-2013,01-12-2013,2013-12-01,4
201401,7.5,211408,312,01-01-2014,01-01-2014,2014-01-01,4
201402,7.5,211408,313,01-02-2014,01-02-2014,2014-02-01,4
201403,7.5,211408,314,01-03-2014,01-03-2014,2014-03-01,4
201404,7.5,211408,315,01-04-2014,01-04-2014,2014-04-01,4
201405,7.5,211408,316,01-05-2014,01-05-2014,2014-05-01,4
201406,7.5,211408,317,01-06-2014,01-06-2014,2014-06-01,4
201407,5,211408,318,01-07-2014,01-07-2014,2014-07-01,4
201408,7.5,211408,319,01-08-2014,01-08-2014,2014-08-01,4
201409,7.5,211408,320,01-09-2014,01-09-2014,2014-09-01,4
201410,7.5,211408,321,01-10-2014,01-10-2014,2014-10-01,4
201411,7.5,211408,322,01-11-2014,01-11-2014,2014-11-01,4
201412,7.5,211408,323,01-12-2014,01-12-2014,2014-12-01,4
201501,7.5,211408,324,01-01-2015,01-01-2015,2015-01-01,4
201502,7.5,211408,325,01-02-2015,01-02-2015,2015-02-01,4
201503,7.5,211408,326,01-03-2015,01-03-2015,2015-03-01,4
201504,7.5,211408,327,01-04-2015,01-04-2015,2015-04-01,4
201505,7.5,211408,328,01-05-2015,01-05-2015,2015-05-01,4
201506,7.5,211408,329,01-06-2015,01-06-2015,2015-06-01,4
201507,7.5,211408,330,01-07-2015,01-07-2015,2015-07-01,4
201508,5,211408,331,01-08-2015,01-08-2015,2015-08-01,4
201509,7.5,211408,332,01-09-2015,01-09-2015,2015-09-01,4
201510,7.5,211408,333,01-10-2015,01-10-2015,2015-10-01,4
201511,7.5,211408,334,01-11-2015,01-11-2015,2015-11-01,4
201512,7.5,211408,335,01-12-2015,01-12-2015,2015-12-01,4
201601,7.5,211408,336,01-01-2016,01-01-2016,2016-01-01,4
201602,7.5,211408,337,01-02-2016,01-02-2016,2016-02-01,4
201603,7.5,211408,338,01-03-2016,01-03-2016,2016-03-01,4
201604,7.5,211408,339,01-04-2016,01-04-2016,2016-04-01,4
201605,7.5,211408,340,01-05-2016,01-05-2016,2016-05-01,4
201607,7.5,211408,342,01-07-2016,01-07-2016,2016-07-01,4
201608,7.5,211408,343,01-08-2016,01-08-2016,2016-08-01,4
201609,7.5,211408,344,01-09-2016,01-09-2016,2016-09-01,4
201610,7.5,211408,345,01-10-2016,01-10-2016,2016-10-01,4
201611,7.5,211408,346,01-11-2016,01-11-2016,2016-11-01,4
201612,7.5,211408,347,01-12-2016,01-12-2016,2016-12-01,4
201701,7.5,211408,348,01-01-2017,01-01-2017,2017-01-01,4
201702,7.5,211408,349,01-02-2017,01-02-2017,2017-02-01,4
201703,7.5,211408,350,01-03-2017,01-03-2017,2017-03-01,4
201704,7.9499998,211408,351,01-04-2017,01-04-2017,2017-04-01,4
201705,7.9499998,211408,352,01-05-2017,01-05-2017,2017-05-01,4
201706,7.9499998,211408,353,01-06-2017,01-06-2017,2017-06-01,4
201707,7.9499998,211408,354,01-07-2017,01-07-2017,2017-07-01,4
201708,7.9499998,211408,355,01-08-2017,01-08-2017,2017-08-01,4
201709,7.9499998,211408,356,01-09-2017,01-09-2017,2017-09-01,4
201710,7.9499998,211408,357,01-10-2017,01-10-2017,2017-10-01,4
201711,7.9499998,211408,358,01-11-2017,01-11-2017,2017-11-01,4
201712,7.9499998,211408,359,01-12-2017,01-12-2017,2017-12-01,4
201801,6.75,211408,360,01-01-2018,01-01-2018,2018-01-01,4
201802,7.9499998,211408,361,01-02-2018,01-02-2018,2018-02-01,4
201803,7.9499998,211408,362,01-03-2018,01-03-2018,2018-03-01,4
201804,7.9499998,211408,363,01-04-2018,01-04-2018,2018-04-01,4
201805,7.9499998,211408,364,01-05-2018,01-05-2018,2018-05-01,4
201806,7.9499998,211408,365,01-06-2018,01-06-2018,2018-06-01,4
201807,7.9499998,211408,366,01-07-2018,01-07-2018,2018-07-01,4
201808,7.9499998,211408,367,01-08-2018,01-08-2018,2018-08-01,4
201809,6.3499999,211408,368,01-09-2018,01-09-2018,2018-09-01,4
201810,7.9499998,211408,369,01-10-2018,01-10-2018,2018-10-01,4
201811,6.3499999,211408,370,01-11-2018,01-11-2018,2018-11-01,4
201901,7.9499998,211408,372,01-01-2019,01-01-2019,2019-01-01,4
201903,7.9499998,211408,374,01-03-2019,01-03-2019,2019-03-01,4
201904,7.9499998,211408,375,01-04-2019,01-04-2019,2019-04-01,4
201905,7.9499998,211408,376,01-05-2019,01-05-2019,2019-05-01,4
201906,7.9499998,211408,377,01-06-2019,01-06-2019,2019-06-01,4
201907,7.9499998,211408,378,01-07-2019,01-07-2019,2019-07-01,4
201908,7.9499998,211408,379,01-08-2019,01-08-2019,2019-08-01,4
201909,7.9499998,211408,380,01-09-2019,01-09-2019,2019-09-01,4
201910,7.9499998,211408,381,01-10-2019,01-10-2019,2019-10-01,4
201911,7.9499998,211408,382,01-11-2019,01-11-2019,2019-11-01,4
201912,7.9499998,211408,383,01-12-2019,01-12-2019,2019-12-01,4
202001,7.9499998,211408,384,01-01-2020,01-01-2020,2020-01-01,4
202002,7.9499998,211408,385,01-02-2020,01-02-2020,2020-02-01,4
202004,7.9499998,211408,387,01-04-2020,01-04-2020,2020-04-01,4
202005,5.9499998,211408,388,01-05-2020,01-05-2020,2020-05-01,4
202008,7.9499998,211408,391,01-08-2020,01-08-2020,2020-08-01,4
202009,7.9499998,211408,392,01-09-2020,01-09-2020,2020-09-01,4
202010,7.9499998,211408,393,01-10-2020,01-10-2020,2020-10-01,4
202011,7.9499998,211408,394,01-11-2020,01-11-2020,2020-11-01,4
202012,7.9499998,211408,395,01-12-2020,01-12-2020,2020-12-01,4
202101,7.9499998,211408,396,01-01-2021,01-01-2021,2021-01-01,4
202102,7.9499998,211408,397,01-02-2021,01-02-2021,2021-02-01,4
202103,7.9499998,211408,398,01-03-2021,01-03-2021,2021-03-01,4
202105,7.9499998,211408,400,01-05-2021,01-05-2021,2021-05-01,4
202106,7.9499998,211408,401,01-06-2021,01-06-2021,2021-06-01,4
202107,7.9499998,211408,402,01-07-2021,01-07-2021,2021-07-01,4
202108,7.9499998,211408,403,01-08-2021,01-08-2021,2021-08-01,4
202110,7.9499998,211408,405,01-10-2021,01-10-2021,2021-10-01,4
202111,7.9499998,211408,406,01-11-2021,01-11-2021,2021-11-01,4
202112,6.9499998,211408,407,01-12-2021,01-12-2021,2021-12-01,4
202201,7.9499998,211408,408,01-01-2022,01-01-2022,2022-01-01,4
202202,7.9499998,211408,409,01-02-2022,01-02-2022,2022-02-01,4
202203,7.9499998,211408,410,01-03-2022,01-03-2022,2022-03-01,4
202204,6.75,211408,411,01-04-2022,01-04-2022,2022-04-01,4
202205,7.9499998,211408,412,01-05-2022,01-05-2022,2022-05-01,4
202206,8.6000004,211408,413,01-06-2022,01-06-2022,2022-06-01,4
202207,8.6000004,211408,414,01-07-2022,01-07-2022,2022-07-01,4
202208,8.6000004,211408,415,01-08-2022,01-08-2022,2022-08-01,4
202209,8.6000004,211408,416,01-09-2022,01-09-2022,2022-09-01,4
202210,8.6000004,211408,417,01-10-2022,01-10-2022,2022-10-01,4
202211,8.6000004,211408,418,01-11-2022,01-11-2022,2022-11-01,4
202212,8.6000004,211408,419,01-12-2022,01-12-2022,2022-12-01,4
202301,8.6000004,211408,420,01-01-2023,01-01-2023,2023-01-01,4
202302,8.6000004,211408,421,01-02-2023,01-02-2023,2023-02-01,4
202303,10.75,211408,422,01-03-2023,01-03-2023,2023-03-01,4
202304,10.75,211408,423,01-04-2023,01-04-2023,2023-04-01,4
202306,10.75,211408,425,01-06-2023,01-06-2023,2023-06-01,4
202307,10.75,211408,426,01-07-2023,01-07-2023,2023-07-01,4
202308,10.75,211408,427,01-08-2023,01-08-2023,2023-08-01,4
202310,10.75,211408,429,01-10-2023,01-10-2023,2023-10-01,4
202311,10.75,211408,430,01-11-2023,01-11-2023,2023-11-01,4
202312,10.75,211408,431,01-12-2023,01-12-2023,2023-12-01,4
202401,13.4,211408,432,01-01-2024,01-01-2024,2024-01-01,4
202402,13.4,211408,433,01-02-2024,01-02-2024,2024-02-01,4
202403,13.4,211408,434,01-03-2024,01-03-2024,2024-03-01,4
202404,13.4,211408,435,01-04-2024,01-04-2024,2024-04-01,4
202405,16.1,211408,436,01-05-2024,01-05-2024,2024-05-01,4
202406,16.1,211408,437,01-06-2024,01-06-2024,2024-06-01,4
202407,16.1,211408,438,01-07-2024,01-07-2024,2024-07-01,4
202408,16.1,211408,439,01-08-2024,01-08-2024,2024-08-01,4
202409,16.1,211408,440,01-09-2024,01-09-2024,2024-09-01,4
202410,16.1,211408,441,01-10-2024,01-10-2024,2024-10-01,4
202411,16.1,211408,442,01-11-2024,01-11-2024,2024-11-01,4
202412,16.1,211408,443,01-12-2024,01-12-2024,2024-12-01,4
202501,16.1,211408,444,01-01-2025,01-01-2025,2025-01-01,4
202502,16.1,211408,445,01-02-2025,01-02-2025,2025-02-01,4
202503,16.1,211408,446,01-03-2025,01-03-2025,2025-03-01,4
202504,16.1,211408,447,01-04-2025,01-04-2025,2025-04-01,4
202505,16.1,211408,448,01-05-2025,01-05-2025,2025-05-01,4
202506,16.1,211408,449,01-06-2025,01-06-2025,2025-06-01,4
202507,14.5,211408,450,01-07-2025,01-07-2025,2025-07-01,4
202508,14.5,211408,451,01-08-2025,01-08-2025,2025-08-01,4
202509,14.5,211408,452,01-09-2025,01-09-2025,2025-09-01,4
200702,3.99,211408,229,01-02-2007,01-02-2007,2007-02-01,5
200703,3.74,211408,230,01-03-2007,01-03-2007,2007-03-01,5
200704,3.74,211408,231,01-04-2007,01-04-2007,2007-04-01,5
200705,3.74,211408,232,01-05-2007,01-05-2007,2007-05-01,5
200706,3.74,211408,233,01-06-2007,01-06-2007,2007-06-01,5
200707,3.74,211408,234,01-07-2007,01-07-2007,2007-07-01,5
200708,3.6800001,211408,235,01-08-2007,01-08-2007,2007-08-01,5
200709,3.6800001,211408,236,01-09-2007,01-09-2007,2007-09-01,5
200710,3.6800001,211408,237,01-10-2007,01-10-2007,2007-10-01,5
200711,3.6800001,211408,238,01-11-2007,01-11-2007,2007-11-01,5
200803,3.6800001,211408,242,01-03-2008,01-03-2008,2008-03-01,5
200805,3.8800001,211408,244,01-05-2008,01-05-2008,2008-05-01,5
200806,3.8800001,211408,245,01-06-2008,01-06-2008,2008-06-01,5
200807,3.74,211408,246,01-07-2008,01-07-2008,2008-07-01,5
200808,3.8800001,211408,247,01-08-2008,01-08-2008,2008-08-01,5
200809,3.74,211408,248,01-09-2008,01-09-2008,2008-09-01,5
200810,3.74,211408,249,01-10-2008,01-10-2008,2008-10-01,5
200811,3.8800001,211408,250,01-11-2008,01-11-2008,2008-11-01,5
200812,3.8800001,211408,251,01-12-2008,01-12-2008,2008-12-01,5
200901,3.74,211408,252,01-01-2009,01-01-2009,2009-01-01,5
200902,3.74,211408,253,01-02-2009,01-02-2009,2009-02-01,5
200903,3.74,211408,254,01-03-2009,01-03-2009,2009-03-01,5
200904,3.74,211408,255,01-04-2009,01-04-2009,2009-04-01,5
200905,3.45,211408,256,01-05-2009,01-05-2009,2009-05-01,5
200906,3.45,211408,257,01-06-2009,01-06-2009,2009-06-01,5
200907,3.24,211408,258,01-07-2009,01-07-2009,2009-07-01,5
200908,3.24,211408,259,01-08-2009,01-08-2009,2009-08-01,5
200909,3.24,211408,260,01-09-2009,01-09-2009,2009-09-01,5
200910,3.24,211408,261,01-10-2009,01-10-2009,2009-10-01,5
200911,3.3800001,211408,262,01-11-2009,01-11-2009,2009-11-01,5
200912,3.3800001,211408,263,01-12-2009,01-12-2009,2009-12-01,5
201001,3.3800001,211408,264,01-01-2010,01-01-2010,2010-01-01,5
201002,3.24,211408,265,01-02-2010,01-02-2010,2010-02-01,5
201003,3.24,211408,266,01-03-2010,01-03-2010,2010-03-01,5
201004,3.3399999,211408,267,01-04-2010,01-04-2010,2010-04-01,5
201005,3.3399999,211408,268,01-05-2010,01-05-2010,2010-05-01,5
201006,4.0999999,211408,269,01-06-2010,01-06-2010,2010-06-01,5
201007,3.98,211408,270,01-07-2010,01-07-2010,2010-07-01,5
201008,3.98,211408,271,01-08-2010,01-08-2010,2010-08-01,5
201009,3.48,211408,272,01-09-2010,01-09-2010,2010-09-01,5
201010,3.48,211408,273,01-10-2010,01-10-2010,2010-10-01,5
201011,3.48,211408,274,01-11-2010,01-11-2010,2010-11-01,5
201012,4.0900002,211408,275,01-12-2010,01-12-2010,2010-12-01,5
201104,3.28,211408,279,01-04-2011,01-04-2011,2011-04-01,5
201105,3.1500001,211408,280,01-05-2011,01-05-2011,2011-05-01,5
201107,3.48,211408,282,01-07-2011,01-07-2011,2011-07-01,5
201108,3.48,211408,283,01-08-2011,01-08-2011,2011-08-01,5
201109,3.48,211408,284,01-09-2011,01-09-2011,2011-09-01,5
201110,3.48,211408,285,01-10-2011,01-10-2011,2011-10-01,5
201111,3.48,211408,286,01-11-2011,01-11-2011,2011-11-01,5
201112,3.6900001,211408,287,01-12-2011,01-12-2011,2011-12-01,5
201201,3.6900001,211408,288,01-01-2012,01-01-2012,2012-01-01,5
201202,3.8900001,211408,289,01-02-2012,01-02-2012,2012-02-01,5
201203,3.49,211408,290,01-03-2012,01-03-2012,2012-03-01,5
201204,3.8900001,211408,291,01-04-2012,01-04-2012,2012-04-01,5
201205,3.8900001,211408,292,01-05-2012,01-05-2012,2012-05-01,5
201206,3,211408,293,01-06-2012,01-06-2012,2012-06-01,5
201207,3.5,211408,294,01-07-2012,01-07-2012,2012-07-01,5
201208,3.5,211408,295,01-08-2012,01-08-2012,2012-08-01,5
201209,3.2,211408,296,01-09-2012,01-09-2012,2012-09-01,5
201210,3,211408,297,01-10-2012,01-10-2012,2012-10-01,5
201211,3.48,211408,298,01-11-2012,01-11-2012,2012-11-01,5
201212,3.48,211408,299,01-12-2012,01-12-2012,2012-12-01,5
201301,3.48,211408,300,01-01-2013,01-01-2013,2013-01-01,5
201302,3.48,211408,301,01-02-2013,01-02-2013,2013-02-01,5
201303,3.48,211408,302,01-03-2013,01-03-2013,2013-03-01,5
201304,3.48,211408,303,01-04-2013,01-04-2013,2013-04-01,5
201305,3.25,211408,304,01-05-2013,01-05-2013,2013-05-01,5
201306,3.5,211408,305,01-06-2013,01-06-2013,2013-06-01,5
201307,3.5,211408,306,01-07-2013,01-07-2013,2013-07-01,5
201308,3.5,211408,307,01-08-2013,01-08-2013,2013-08-01,5
201309,3.5,211408,308,01-09-2013,01-09-2013,2013-09-01,5
201310,3.5,211408,309,01-10-2013,01-10-2013,2013-10-01,5
201311,3.75,211408,310,01-11-2013,01-11-2013,2013-11-01,5
201312,3.75,211408,311,01-12-2013,01-12-2013,2013-12-01,5
201401,3.75,211408,312,01-01-2014,01-01-2014,2014-01-01,5
201402,2.75,211408,313,01-02-2014,01-02-2014,2014-02-01,5
201403,3.75,211408,314,01-03-2014,01-03-2014,2014-03-01,5
201404,3.75,211408,315,01-04-2014,01-04-2014,2014-04-01,5
201405,3,211408,316,01-05-2014,01-05-2014,2014-05-01,5
201406,2.75,211408,317,01-06-2014,01-06-2014,2014-06-01,5
201407,2.75,211408,318,01-07-2014,01-07-2014,2014-07-01,5
201408,3,211408,319,01-08-2014,01-08-2014,2014-08-01,5
201409,3,211408,320,01-09-2014,01-09-2014,2014-09-01,5
201410,3,211408,321,01-10-2014,01-10-2014,2014-10-01,5
201411,3,211408,322,01-11-2014,01-11-2014,2014-11-01,5
201412,3,211408,323,01-12-2014,01-12-2014,2014-12-01,5
201501,3,211408,324,01-01-2015,01-01-2015,2015-01-01,5
201502,2.9000001,211408,325,01-02-2015,01-02-2015,2015-02-01,5
201503,2.9000001,211408,326,01-03-2015,01-03-2015,2015-03-01,5
201504,2.9000001,211408,327,01-04-2015,01-04-2015,2015-04-01,5
201505,3.45,211408,328,01-05-2015,01-05-2015,2015-05-01,5
201506,3.45,211408,329,01-06-2015,01-06-2015,2015-06-01,5
201507,3.45,211408,330,01-07-2015,01-07-2015,2015-07-01,5
201508,3.45,211408,331,01-08-2015,01-08-2015,2015-08-01,5
201509,3.45,211408,332,01-09-2015,01-09-2015,2015-09-01,5
201510,3.45,211408,333,01-10-2015,01-10-2015,2015-10-01,5
201511,3.45,211408,334,01-11-2015,01-11-2015,2015-11-01,5
201512,3.45,211408,335,01-12-2015,01-12-2015,2015-12-01,5
201601,3.45,211408,336,01-01-2016,01-01-2016,2016-01-01,5
201602,3.45,211408,337,01-02-2016,01-02-2016,2016-02-01,5
201603,3.45,211408,338,01-03-2016,01-03-2016,2016-03-01,5
201604,3.45,211408,339,01-04-2016,01-04-2016,2016-04-01,5
201605,3.45,211408,340,01-05-2016,01-05-2016,2016-05-01,5
201606,3.45,211408,341,01-06-2016,01-06-2016,2016-06-01,5
201607,3.5,211408,342,01-07-2016,01-07-2016,2016-07-01,5
201608,3.5,211408,343,01-08-2016,01-08-2016,2016-08-01,5
201609,3.5,211408,344,01-09-2016,01-09-2016,2016-09-01,5
201610,3.5,211408,345,01-10-2016,01-10-2016,2016-10-01,5
201611,3.5,211408,346,01-11-2016,01-11-2016,2016-11-01,5
201612,3.5,211408,347,01-12-2016,01-12-2016,2016-12-01,5
201701,3.5,211408,348,01-01-2017,01-01-2017,2017-01-01,5
201702,3.5999999,211408,349,01-02-2017,01-02-2017,2017-02-01,5
201703,3.5999999,211408,350,01-03-2017,01-03-2017,2017-03-01,5
201704,3.5999999,211408,351,01-04-2017,01-04-2017,2017-04-01,5
201705,3.5999999,211408,352,01-05-2017,01-05-2017,2017-05-01,5
201706,3.5999999,211408,353,01-06-2017,01-06-2017,2017-06-01,5
201707,3.5999999,211408,354,01-07-2017,01-07-2017,2017-07-01,5
201708,3.5999999,211408,355,01-08-2017,01-08-2017,2017-08-01,5
201709,3.5999999,211408,356,01-09-2017,01-09-2017,2017-09-01,5
201710,3.5999999,211408,357,01-10-2017,01-10-2017,2017-10-01,5
201711,3.5999999,211408,358,01-11-2017,01-11-2017,2017-11-01,5
201712,3.5999999,211408,359,01-12-2017,01-12-2017,2017-12-01,5
201801,3.5999999,211408,360,01-01-2018,01-01-2018,2018-01-01,5
201802,3.95,211408,361,01-02-2018,01-02-2018,2018-02-01,5
201803,3.95,211408,362,01-03-2018,01-03-2018,2018-03-01,5
201804,3.95,211408,363,01-04-2018,01-04-2018,2018-04-01,5
201805,3.95,211408,364,01-05-2018,01-05-2018,2018-05-01,5
201806,3.95,211408,365,01-06-2018,01-06-2018,2018-06-01,5
201807,3.95,211408,366,01-07-2018,01-07-2018,2018-07-01,5
201808,3.95,211408,367,01-08-2018,01-08-2018,2018-08-01,5
201809,3.95,211408,368,01-09-2018,01-09-2018,2018-09-01,5
201810,3.95,211408,369,01-10-2018,01-10-2018,2018-10-01,5
201811,3.5999999,211408,370,01-11-2018,01-11-2018,2018-11-01,5
201812,3.5999999,211408,371,01-12-2018,01-12-2018,2018-12-01,5
201901,3.5999999,211408,372,01-01-2019,01-01-2019,2019-01-01,5
201902,3.5999999,211408,373,01-02-2019,01-02-2019,2019-02-01,5
201903,3.5999999,211408,374,01-03-2019,01-03-2019,2019-03-01,5
201904,3.5999999,211408,375,01-04-2019,01-04-2019,2019-04-01,5
201905,3.5999999,211408,376,01-05-2019,01-05-2019,2019-05-01,5
201906,3.5999999,211408,377,01-06-2019,01-06-2019,2019-06-01,5
201907,3.5999999,211408,378,01-07-2019,01-07-2019,2019-07-01,5
201908,3,211408,379,01-08-2019,01-08-2019,2019-08-01,5
201909,3,211408,380,01-09-2019,01-09-2019,2019-09-01,5
201910,3,211408,381,01-10-2019,01-10-2019,2019-10-01,5
201911,3,211408,382,01-11-2019,01-11-2019,2019-11-01,5
201912,3,211408,383,01-12-2019,01-12-2019,2019-12-01,5
202001,3,211408,384,01-01-2020,01-01-2020,2020-01-01,5
202002,3,211408,385,01-02-2020,01-02-2020,2020-02-01,5
202004,3,211408,387,01-04-2020,01-04-2020,2020-04-01,5
202006,3.5,211408,389,01-06-2020,01-06-2020,2020-06-01,5
202007,3.5,211408,390,01-07-2020,01-07-2020,2020-07-01,5
202008,3,211408,391,01-08-2020,01-08-2020,2020-08-01,5
202009,3,211408,392,01-09-2020,01-09-2020,2020-09-01,5
202010,3,211408,393,01-10-2020,01-10-2020,2020-10-01,5
202011,3,211408,394,01-11-2020,01-11-2020,2020-11-01,5
202012,3,211408,395,01-12-2020,01-12-2020,2020-12-01,5
202101,3,211408,396,01-01-2021,01-01-2021,2021-01-01,5
202102,3,211408,397,01-02-2021,01-02-2021,2021-02-01,5
202103,3,211408,398,01-03-2021,01-03-2021,2021-03-01,5
202104,3,211408,399,01-04-2021,01-04-2021,2021-04-01,5
202105,3,211408,400,01-05-2021,01-05-2021,2021-05-01,5
202106,3,211408,401,01-06-2021,01-06-2021,2021-06-01,5
202107,3,211408,402,01-07-2021,01-07-2021,2021-07-01,5
202108,3,211408,403,01-08-2021,01-08-2021,2021-08-01,5
202109,3,211408,404,01-09-2021,01-09-2021,2021-09-01,5
202110,3,211408,405,01-10-2021,01-10-2021,2021-10-01,5
202111,3,211408,406,01-11-2021,01-11-2021,2021-11-01,5
202112,3,211408,407,01-12-2021,01-12-2021,2021-12-01,5
202201,3,211408,408,01-01-2022,01-01-2022,2022-01-01,5
202202,3,211408,409,01-02-2022,01-02-2022,2022-02-01,5
202203,3,211408,410,01-03-2022,01-03-2022,2022-03-01,5
202204,3.25,211408,411,01-04-2022,01-04-2022,2022-04-01,5
202205,3.25,211408,412,01-05-2022,01-05-2022,2022-05-01,5
202206,3.25,211408,413,01-06-2022,01-06-2022,2022-06-01,5
202207,4.3000002,211408,414,01-07-2022,01-07-2022,2022-07-01,5
202208,4.3000002,211408,415,01-08-2022,01-08-2022,2022-08-01,5
202209,4.3000002,211408,416,01-09-2022,01-09-2022,2022-09-01,5
202210,4.3000002,211408,417,01-10-2022,01-10-2022,2022-10-01,5
202211,4.25,211408,418,01-11-2022,01-11-2022,2022-11-01,5
202212,4.3000002,211408,419,01-12-2022,01-12-2022,2022-12-01,5
202301,4.3000002,211408,420,01-01-2023,01-01-2023,2023-01-01,5
202302,5.0999999,211408,421,01-02-2023,01-02-2023,2023-02-01,5
202303,5.1500001,211408,422,01-03-2023,01-03-2023,2023-03-01,5
202304,5.1500001,211408,423,01-04-2023,01-04-2023,2023-04-01,5
202305,5.8000002,211408,424,01-05-2023,01-05-2023,2023-05-01,5
202306,5.8000002,211408,425,01-06-2023,01-06-2023,2023-06-01,5
202307,5.8000002,211408,426,01-07-2023,01-07-2023,2023-07-01,5
202308,5.8000002,211408,427,01-08-2023,01-08-2023,2023-08-01,5
202309,6.8499999,211408,428,01-09-2023,01-09-2023,2023-09-01,5
202310,6.8499999,211408,429,01-10-2023,01-10-2023,2023-10-01,5
202311,6.8499999,211408,430,01-11-2023,01-11-2023,2023-11-01,5
202312,7.1500001,211408,431,01-12-2023,01-12-2023,2023-12-01,5
202401,7.1500001,211408,432,01-01-2024,01-01-2024,2024-01-01,5
202402,7.1500001,211408,433,01-02-2024,01-02-2024,2024-02-01,5
202403,7.8000002,211408,434,01-03-2024,01-03-2024,2024-03-01,5
202404,7.8000002,211408,435,01-04-2024,01-04-2024,2024-04-01,5
202405,7.8000002,211408,436,01-05-2024,01-05-2024,2024-05-01,5
202406,7.8000002,211408,437,01-06-2024,01-06-2024,2024-06-01,5
202407,7.8000002,211408,438,01-07-2024,01-07-2024,2024-07-01,5
202408,7.8000002,211408,439,01-08-2024,01-08-2024,2024-08-01,5
202409,7.8000002,211408,440,01-09-2024,01-09-2024,2024-09-01,5
202410,7.8000002,211408,441,01-10-2024,01-10-2024,2024-10-01,5
202411,7.8000002,211408,442,01-11-2024,01-11-2024,2024-11-01,5
202412,7.8000002,211408,443,01-12-2024,01-12-2024,2024-12-01,5
202501,7.8000002,211408,444,01-01-2025,01-01-2025,2025-01-01,5
202502,7,211408,445,01-02-2025,01-02-2025,2025-02-01,5
202503,7,211408,446,01-03-2025,01-03-2025,2025-03-01,5
202504,7,211408,447,01-04-2025,01-04-2025,2025-04-01,5
202505,6.5,211408,448,01-05-2025,01-05-2025,2025-05-01,5
202506,6.5,211408,449,01-06-2025,01-06-2025,2025-06-01,5
202507,6.5,211408,450,01-07-2025,01-07-2025,2025-07-01,5
202508,6.5,211408,451,01-08-2025,01-08-2025,2025-08-01,5
202509,6.5,211408,452,01-09-2025,01-09-2025,2025-09-01,5
200702,3.49,211408,229,01-02-2007,01-02-2007,2007-02-01,6
200703,3.49,211408,230,01-03-2007,01-03-2007,2007-03-01,6
200704,3.49,211408,231,01-04-2007,01-04-2007,2007-04-01,6
200705,3.49,211408,232,01-05-2007,01-05-2007,2007-05-01,6
200706,3.49,211408,233,01-06-2007,01-06-2007,2007-06-01,6
200707,3.49,211408,234,01-07-2007,01-07-2007,2007-07-01,6
200708,3.49,211408,235,01-08-2007,01-08-2007,2007-08-01,6
200709,3.49,211408,236,01-09-2007,01-09-2007,2007-09-01,6
200710,3.49,211408,237,01-10-2007,01-10-2007,2007-10-01,6
200711,3.49,211408,238,01-11-2007,01-11-2007,2007-11-01,6
200712,3.49,211408,239,01-12-2007,01-12-2007,2007-12-01,6
200801,3.49,211408,240,01-01-2008,01-01-2008,2008-01-01,6
200802,3.49,211408,241,01-02-2008,01-02-2008,2008-02-01,6
200803,3.49,211408,242,01-03-2008,01-03-2008,2008-03-01,6
200805,3.49,211408,244,01-05-2008,01-05-2008,2008-05-01,6
200806,3.49,211408,245,01-06-2008,01-06-2008,2008-06-01,6
200807,3.49,211408,246,01-07-2008,01-07-2008,2008-07-01,6
200808,3.49,211408,247,01-08-2008,01-08-2008,2008-08-01,6
200810,3.49,211408,249,01-10-2008,01-10-2008,2008-10-01,6
200811,3.49,211408,250,01-11-2008,01-11-2008,2008-11-01,6
200812,3.49,211408,251,01-12-2008,01-12-2008,2008-12-01,6
200903,3.49,211408,254,01-03-2009,01-03-2009,2009-03-01,6
200904,3.49,211408,255,01-04-2009,01-04-2009,2009-04-01,6
200906,3.49,211408,257,01-06-2009,01-06-2009,2009-06-01,6
200908,3.49,211408,259,01-08-2009,01-08-2009,2009-08-01,6
200909,3.49,211408,260,01-09-2009,01-09-2009,2009-09-01,6
200910,3.49,211408,261,01-10-2009,01-10-2009,2009-10-01,6
200911,3.49,211408,262,01-11-2009,01-11-2009,2009-11-01,6
201001,3.49,211408,264,01-01-2010,01-01-2010,2010-01-01,6
201003,3.49,211408,266,01-03-2010,01-03-2010,2010-03-01,6
201004,3.49,211408,267,01-04-2010,01-04-2010,2010-04-01,6
201006,3.49,211408,269,01-06-2010,01-06-2010,2010-06-01,6
201007,3.49,211408,270,01-07-2010,01-07-2010,2010-07-01,6
201008,3.49,211408,271,01-08-2010,01-08-2010,2010-08-01,6
201010,3.49,211408,273,01-10-2010,01-10-2010,2010-10-01,6
201011,3.49,211408,274,01-11-2010,01-11-2010,2010-11-01,6
201012,3.49,211408,275,01-12-2010,01-12-2010,2010-12-01,6
201101,3.49,211408,276,01-01-2011,01-01-2011,2011-01-01,6
201102,3.49,211408,277,01-02-2011,01-02-2011,2011-02-01,6
201103,3.49,211408,278,01-03-2011,01-03-2011,2011-03-01,6
201104,3.49,211408,279,01-04-2011,01-04-2011,2011-04-01,6
201106,3.49,211408,281,01-06-2011,01-06-2011,2011-06-01,6
201107,3.49,211408,282,01-07-2011,01-07-2011,2011-07-01,6
201108,3.49,211408,283,01-08-2011,01-08-2011,2011-08-01,6
201109,3.49,211408,284,01-09-2011,01-09-2011,2011-09-01,6
201110,3.49,211408,285,01-10-2011,01-10-2011,2011-10-01,6
201111,3.49,211408,286,01-11-2011,01-11-2011,2011-11-01,6
201112,3.49,211408,287,01-12-2011,01-12-2011,2011-12-01,6
201201,3.49,211408,288,01-01-2012,01-01-2012,2012-01-01,6
201208,4.9899998,211408,295,01-08-2012,01-08-2012,2012-08-01,6
201209,4.9899998,211408,296,01-09-2012,01-09-2012,2012-09-01,6
201210,4.9899998,211408,297,01-10-2012,01-10-2012,2012-10-01,6
201212,4.9899998,211408,299,01-12-2012,01-12-2012,2012-12-01,6
201301,4.9899998,211408,300,01-01-2013,01-01-2013,2013-01-01,6
201303,4.9899998,211408,302,01-03-2013,01-03-2013,2013-03-01,6
201304,4.9899998,211408,303,01-04-2013,01-04-2013,2013-04-01,6
201305,4.9899998,211408,304,01-05-2013,01-05-2013,2013-05-01,6
201306,4.9899998,211408,305,01-06-2013,01-06-2013,2013-06-01,6
201307,4.9899998,211408,306,01-07-2013,01-07-2013,2013-07-01,6
201308,4.9899998,211408,307,01-08-2013,01-08-2013,2013-08-01,6
201309,4.9899998,211408,308,01-09-2013,01-09-2013,2013-09-01,6
201310,4.9899998,211408,309,01-10-2013,01-10-2013,2013-10-01,6
201311,4.9899998,211408,310,01-11-2013,01-11-2013,2013-11-01,6
201312,4.9899998,211408,311,01-12-2013,01-12-2013,2013-12-01,6
201401,4.9899998,211408,312,01-01-2014,01-01-2014,2014-01-01,6
201402,4.9899998,211408,313,01-02-2014,01-02-2014,2014-02-01,6
201403,4.9899998,211408,314,01-03-2014,01-03-2014,2014-03-01,6
201404,4.9899998,211408,315,01-04-2014,01-04-2014,2014-04-01,6
201405,5,211408,316,01-05-2014,01-05-2014,2014-05-01,6
201406,5,211408,317,01-06-2014,01-06-2014,2014-06-01,6
201407,5,211408,318,01-07-2014,01-07-2014,2014-07-01,6
201408,5,211408,319,01-08-2014,01-08-2014,2014-08-01,6
201410,5,211408,321,01-10-2014,01-10-2014,2014-10-01,6
201411,5,211408,322,01-11-2014,01-11-2014,2014-11-01,6
201412,5,211408,323,01-12-2014,01-12-2014,2014-12-01,6
201501,5,211408,324,01-01-2015,01-01-2015,2015-01-01,6
201502,5,211408,325,01-02-2015,01-02-2015,2015-02-01,6
201503,5,211408,326,01-03-2015,01-03-2015,2015-03-01,6
201504,5,211408,327,01-04-2015,01-04-2015,2015-04-01,6
201505,5,211408,328,01-05-2015,01-05-2015,2015-05-01,6
201506,5,211408,329,01-06-2015,01-06-2015,2015-06-01,6
201507,5,211408,330,01-07-2015,01-07-2015,2015-07-01,6
201508,5,211408,331,01-08-2015,01-08-2015,2015-08-01,6
201509,5,211408,332,01-09-2015,01-09-2015,2015-09-01,6
201510,5,211408,333,01-10-2015,01-10-2015,2015-10-01,6
201511,5,211408,334,01-11-2015,01-11-2015,2015-11-01,6
201512,5,211408,335,01-12-2015,01-12-2015,2015-12-01,6
201601,5,211408,336,01-01-2016,01-01-2016,2016-01-01,6
201603,5,211408,338,01-03-2016,01-03-2016,2016-03-01,6
201604,5,211408,339,01-04-2016,01-04-2016,2016-04-01,6
201605,5,211408,340,01-05-2016,01-05-2016,2016-05-01,6
201606,5,211408,341,01-06-2016,01-06-2016,2016-06-01,6
201607,5,211408,342,01-07-2016,01-07-2016,2016-07-01,6
201608,5,211408,343,01-08-2016,01-08-2016,2016-08-01,6
201609,5,211408,344,01-09-2016,01-09-2016,2016-09-01,6
201610,5,211408,345,01-10-2016,01-10-2016,2016-10-01,6
201611,5,211408,346,01-11-2016,01-11-2016,2016-11-01,6
201612,5,211408,347,01-12-2016,01-12-2016,2016-12-01,6
201701,5,211408,348,01-01-2017,01-01-2017,2017-01-01,6
201702,5,211408,349,01-02-2017,01-02-2017,2017-02-01,6
201703,5,211408,350,01-03-2017,01-03-2017,2017-03-01,6
201704,5,211408,351,01-04-2017,01-04-2017,2017-04-01,6
201705,5,211408,352,01-05-2017,01-05-2017,2017-05-01,6
201706,5,211408,353,01-06-2017,01-06-2017,2017-06-01,6
201707,5,211408,354,01-07-2017,01-07-2017,2017-07-01,6
201708,5,211408,355,01-08-2017,01-08-2017,2017-08-01,6
201709,5,211408,356,01-09-2017,01-09-2017,2017-09-01,6
201710,5,211408,357,01-10-2017,01-10-2017,2017-10-01,6
201711,5,211408,358,01-11-2017,01-11-2017,2017-11-01,6
201712,5,211408,359,01-12-2017,01-12-2017,2017-12-01,6
201801,5,211408,360,01-01-2018,01-01-2018,2018-01-01,6
201802,5,211408,361,01-02-2018,01-02-2018,2018-02-01,6
201803,5,211408,362,01-03-2018,01-03-2018,2018-03-01,6
201804,5,211408,363,01-04-2018,01-04-2018,2018-04-01,6
201805,5,211408,364,01-05-2018,01-05-2018,2018-05-01,6
201806,5,211408,365,01-06-2018,01-06-2018,2018-06-01,6
201807,5,211408,366,01-07-2018,01-07-2018,2018-07-01,6
201808,5,211408,367,01-08-2018,01-08-2018,2018-08-01,6
201809,5,211408,368,01-09-2018,01-09-2018,2018-09-01,6
201810,5,211408,369,01-10-2018,01-10-2018,2018-10-01,6
201811,5,211408,370,01-11-2018,01-11-2018,2018-11-01,6
201901,4,211408,372,01-01-2019,01-01-2019,2019-01-01,6
201902,4,211408,373,01-02-2019,01-02-2019,2019-02-01,6
201903,4,211408,374,01-03-2019,01-03-2019,2019-03-01,6
201904,4,211408,375,01-04-2019,01-04-2019,2019-04-01,6
201905,4,211408,376,01-05-2019,01-05-2019,2019-05-01,6
201906,4,211408,377,01-06-2019,01-06-2019,2019-06-01,6
201907,4,211408,378,01-07-2019,01-07-2019,2019-07-01,6
201908,4,211408,379,01-08-2019,01-08-2019,2019-08-01,6
201909,4,211408,380,01-09-2019,01-09-2019,2019-09-01,6
201910,4,211408,381,01-10-2019,01-10-2019,2019-10-01,6
201911,4,211408,382,01-11-2019,01-11-2019,2019-11-01,6
201912,4,211408,383,01-12-2019,01-12-2019,2019-12-01,6
202001,4,211408,384,01-01-2020,01-01-2020,2020-01-01,6
202002,4,211408,385,01-02-2020,01-02-2020,2020-02-01,6
202003,4,211408,386,01-03-2020,01-03-2020,2020-03-01,6
202008,4,211408,391,01-08-2020,01-08-2020,2020-08-01,6
202009,4,211408,392,01-09-2020,01-09-2020,2020-09-01,6
202010,4,211408,393,01-10-2020,01-10-2020,2020-10-01,6
202103,4,211408,398,01-03-2021,01-03-2021,2021-03-01,6
202104,4,211408,399,01-04-2021,01-04-2021,2021-04-01,6
202105,4.25,211408,400,01-05-2021,01-05-2021,2021-05-01,6
202106,4.25,211408,401,01-06-2021,01-06-2021,2021-06-01,6
202107,4.25,211408,402,01-07-2021,01-07-2021,2021-07-01,6
202108,4.25,211408,403,01-08-2021,01-08-2021,2021-08-01,6
202109,4.25,211408,404,01-09-2021,01-09-2021,2021-09-01,6
202110,3.8,211408,405,01-10-2021,01-10-2021,2021-10-01,6
202111,3.8,211408,406,01-11-2021,01-11-2021,2021-11-01,6
202112,3.8,211408,407,01-12-2021,01-12-2021,2021-12-01,6
202201,3.8,211408,408,01-01-2022,01-01-2022,2022-01-01,6
202202,3.8,211408,409,01-02-2022,01-02-2022,2022-02-01,6
202203,3.8,211408,410,01-03-2022,01-03-2022,2022-03-01,6
202204,3.8,211408,411,01-04-2022,01-04-2022,2022-04-01,6
202205,3.8,211408,412,01-05-2022,01-05-2022,2022-05-01,6
202206,3.8,211408,413,01-06-2022,01-06-2022,2022-06-01,6
202207,3.8,211408,414,01-07-2022,01-07-2022,2022-07-01,6
202208,3.8,211408,415,01-08-2022,01-08-2022,2022-08-01,6
202209,3.8,211408,416,01-09-2022,01-09-2022,2022-09-01,6
202210,3.8,211408,417,01-10-2022,01-10-2022,2022-10-01,6
202211,3.8,211408,418,01-11-2022,01-11-2022,2022-11-01,6
202212,4.25,211408,419,01-12-2022,01-12-2022,2022-12-01,6
202303,5.25,211408,422,01-03-2023,01-03-2023,2023-03-01,6
202304,6.25,211408,423,01-04-2023,01-04-2023,2023-04-01,6
202305,6.25,211408,424,01-05-2023,01-05-2023,2023-05-01,6
202306,6.25,211408,425,01-06-2023,01-06-2023,2023-06-01,6
202307,6.25,211408,426,01-07-2023,01-07-2023,2023-07-01,6
202308,6.25,211408,427,01-08-2023,01-08-2023,2023-08-01,6
202309,6.25,211408,428,01-09-2023,01-09-2023,2023-09-01,6
202310,7.25,211408,429,01-10-2023,01-10-2023,2023-10-01,6
202311,7.25,211408,430,01-11-2023,01-11-2023,2023-11-01,6
202312,7.25,211408,431,01-12-2023,01-12-2023,2023-12-01,6
202401,7.25,211408,432,01-01-2024,01-01-2024,2024-01-01,6
202402,7.5,211408,433,01-02-2024,01-02-2024,2024-02-01,6
202403,8,211408,434,01-03-2024,01-03-2024,2024-03-01,6
202404,8,211408,435,01-04-2024,01-04-2024,2024-04-01,6
202405,8,211408,436,01-05-2024,01-05-2024,2024-05-01,6
202406,8,211408,437,01-06-2024,01-06-2024,2024-06-01,6
202407,8,211408,438,01-07-2024,01-07-2024,2024-07-01,6
202408,8.5,211408,439,01-08-2024,01-08-2024,2024-08-01,6
202409,8.5,211408,440,01-09-2024,01-09-2024,2024-09-01,6
202410,8.5,211408,441,01-10-2024,01-10-2024,2024-10-01,6
202411,8.5,211408,442,01-11-2024,01-11-2024,2024-11-01,6
202412,8.5,211408,443,01-12-2024,01-12-2024,2024-12-01,6
202501,8.5,211408,444,01-01-2025,01-01-2025,2025-01-01,6
202502,8.5,211408,445,01-02-2025,01-02-2025,2025-02-01,6
202503,8.5,211408,446,01-03-2025,01-03-2025,2025-03-01,6
202504,7.5,211408,447,01-04-2025,01-04-2025,2025-04-01,6
202506,7.5,211408,449,01-06-2025,01-06-2025,2025-06-01,6
202507,7.5,211408,450,01-07-2025,01-07-2025,2025-07-01,6
202508,7.5,211408,451,01-08-2025,01-08-2025,2025-08-01,6
202509,7.5,211408,452,01-09-2025,01-09-2025,2025-09-01,6
200703,4.5900002,211408,230,01-03-2007,01-03-2007,2007-03-01,7
200704,4.5900002,211408,231,01-04-2007,01-04-2007,2007-04-01,7
200705,4.5900002,211408,232,01-05-2007,01-05-2007,2007-05-01,7
200706,4.5900002,211408,233,01-06-2007,01-06-2007,2007-06-01,7
200707,4.5900002,211408,234,01-07-2007,01-07-2007,2007-07-01,7
200710,4.5900002,211408,237,01-10-2007,01-10-2007,2007-10-01,7
200711,4.5900002,211408,238,01-11-2007,01-11-2007,2007-11-01,7
200712,4.5900002,211408,239,01-12-2007,01-12-2007,2007-12-01,7
200803,4.5900002,211408,242,01-03-2008,01-03-2008,2008-03-01,7
200804,4.5900002,211408,243,01-04-2008,01-04-2008,2008-04-01,7
200805,4.5900002,211408,244,01-05-2008,01-05-2008,2008-05-01,7
200806,4.5900002,211408,245,01-06-2008,01-06-2008,2008-06-01,7
200807,4.5900002,211408,246,01-07-2008,01-07-2008,2008-07-01,7
200808,4.5900002,211408,247,01-08-2008,01-08-2008,2008-08-01,7
200809,4.5900002,211408,248,01-09-2008,01-09-2008,2008-09-01,7
200810,4.5900002,211408,249,01-10-2008,01-10-2008,2008-10-01,7
200811,4.5900002,211408,250,01-11-2008,01-11-2008,2008-11-01,7
200812,4.5900002,211408,251,01-12-2008,01-12-2008,2008-12-01,7
200901,4.5900002,211408,252,01-01-2009,01-01-2009,2009-01-01,7
200903,4.6999998,211408,254,01-03-2009,01-03-2009,2009-03-01,7
200905,4.6999998,211408,256,01-05-2009,01-05-2009,2009-05-01,7
200906,4.6999998,211408,257,01-06-2009,01-06-2009,2009-06-01,7
200907,4.6999998,211408,258,01-07-2009,01-07-2009,2009-07-01,7
200908,4.6999998,211408,259,01-08-2009,01-08-2009,2009-08-01,7
200910,4.6999998,211408,261,01-10-2009,01-10-2009,2009-10-01,7
200911,4.6999998,211408,262,01-11-2009,01-11-2009,2009-11-01,7
200912,4.6999998,211408,263,01-12-2009,01-12-2009,2009-12-01,7
201001,4.6999998,211408,264,01-01-2010,01-01-2010,2010-01-01,7
201002,4.6999998,211408,265,01-02-2010,01-02-2010,2010-02-01,7
201003,4.6999998,211408,266,01-03-2010,01-03-2010,2010-03-01,7
201004,4.6999998,211408,267,01-04-2010,01-04-2010,2010-04-01,7
201005,4.6999998,211408,268,01-05-2010,01-05-2010,2010-05-01,7
201006,4.6999998,211408,269,01-06-2010,01-06-2010,2010-06-01,7
201007,4.6999998,211408,270,01-07-2010,01-07-2010,2010-07-01,7
201008,4.6999998,211408,271,01-08-2010,01-08-2010,2010-08-01,7
201009,4.6999998,211408,272,01-09-2010,01-09-2010,2010-09-01,7
201010,4.6999998,211408,273,01-10-2010,01-10-2010,2010-10-01,7
201011,4.6999998,211408,274,01-11-2010,01-11-2010,2010-11-01,7
201012,4.6999998,211408,275,01-12-2010,01-12-2010,2010-12-01,7
201101,4.6999998,211408,276,01-01-2011,01-01-2011,2011-01-01,7
201102,4.6999998,211408,277,01-02-2011,01-02-2011,2011-02-01,7
201103,4.6999998,211408,278,01-03-2011,01-03-2011,2011-03-01,7
201104,4.6999998,211408,279,01-04-2011,01-04-2011,2011-04-01,7
201105,4.6999998,211408,280,01-05-2011,01-05-2011,2011-05-01,7
201106,4.6999998,211408,281,01-06-2011,01-06-2011,2011-06-01,7
201107,4.5,211408,282,01-07-2011,01-07-2011,2011-07-01,7
201108,4.5,211408,283,01-08-2011,01-08-2011,2011-08-01,7
201109,4.5,211408,284,01-09-2011,01-09-2011,2011-09-01,7
201110,4.5,211408,285,01-10-2011,01-10-2011,2011-10-01,7
201111,4.5,211408,286,01-11-2011,01-11-2011,2011-11-01,7
201112,4.5,211408,287,01-12-2011,01-12-2011,2011-12-01,7
201201,4.5,211408,288,01-01-2012,01-01-2012,2012-01-01,7
201203,4.5,211408,290,01-03-2012,01-03-2012,2012-03-01,7
201204,4.5,211408,291,01-04-2012,01-04-2012,2012-04-01,7
201205,4.5,211408,292,01-05-2012,01-05-2012,2012-05-01,7
201206,4.5,211408,293,01-06-2012,01-06-2012,2012-06-01,7
201207,4.5,211408,294,01-07-2012,01-07-2012,2012-07-01,7
201208,4.5,211408,295,01-08-2012,01-08-2012,2012-08-01,7
201209,4.5,211408,296,01-09-2012,01-09-2012,2012-09-01,7
201210,4.5,211408,297,01-10-2012,01-10-2012,2012-10-01,7
201211,4.5,211408,298,01-11-2012,01-11-2012,2012-11-01,7
201212,4.5,211408,299,01-12-2012,01-12-2012,2012-12-01,7
201301,4.5,211408,300,01-01-2013,01-01-2013,2013-01-01,7
201302,4.5,211408,301,01-02-2013,01-02-2013,2013-02-01,7
201304,4.5,211408,303,01-04-2013,01-04-2013,2013-04-01,7
201305,4.5,211408,304,01-05-2013,01-05-2013,2013-05-01,7
201306,4.5,211408,305,01-06-2013,01-06-2013,2013-06-01,7
201307,4.5,211408,306,01-07-2013,01-07-2013,2013-07-01,7
201308,4.5,211408,307,01-08-2013,01-08-2013,2013-08-01,7
201309,4.5,211408,308,01-09-2013,01-09-2013,2013-09-01,7
201310,4.5,211408,309,01-10-2013,01-10-2013,2013-10-01,7
201311,4.5,211408,310,01-11-2013,01-11-2013,2013-11-01,7
201312,4.5,211408,311,01-12-2013,01-12-2013,2013-12-01,7
201404,4.5,211408,315,01-04-2014,01-04-2014,2014-04-01,7
201406,4.5,211408,317,01-06-2014,01-06-2014,2014-06-01,7
201407,4.5,211408,318,01-07-2014,01-07-2014,2014-07-01,7
201408,4.5,211408,319,01-08-2014,01-08-2014,2014-08-01,7
201409,4.5,211408,320,01-09-2014,01-09-2014,2014-09-01,7
201410,4.5,211408,321,01-10-2014,01-10-2014,2014-10-01,7
201411,4.5,211408,322,01-11-2014,01-11-2014,2014-11-01,7
201412,4.5,211408,323,01-12-2014,01-12-2014,2014-12-01,7
201501,4.5,211408,324,01-01-2015,01-01-2015,2015-01-01,7
201503,4.3200002,211408,326,01-03-2015,01-03-2015,2015-03-01,7
201504,4.3200002,211408,327,01-04-2015,01-04-2015,2015-04-01,7
201505,4.3200002,211408,328,01-05-2015,01-05-2015,2015-05-01,7
201506,4.7199998,211408,329,01-06-2015,01-06-2015,2015-06-01,7
201507,4.7199998,211408,330,01-07-2015,01-07-2015,2015-07-01,7
201508,4.7199998,211408,331,01-08-2015,01-08-2015,2015-08-01,7
201509,4.7199998,211408,332,01-09-2015,01-09-2015,2015-09-01,7
201510,4.7199998,211408,333,01-10-2015,01-10-2015,2015-10-01,7
201511,4.7199998,211408,334,01-11-2015,01-11-2015,2015-11-01,7
201512,4.7199998,211408,335,01-12-2015,01-12-2015,2015-12-01,7
201601,4.7199998,211408,336,01-01-2016,01-01-2016,2016-01-01,7
201603,4.7199998,211408,338,01-03-2016,01-03-2016,2016-03-01,7
201604,4.7199998,211408,339,01-04-2016,01-04-2016,2016-04-01,7
201605,4.7199998,211408,340,01-05-2016,01-05-2016,2016-05-01,7
201606,4.7199998,211408,341,01-06-2016,01-06-2016,2016-06-01,7
201607,4.7199998,211408,342,01-07-2016,01-07-2016,2016-07-01,7
201608,4.7199998,211408,343,01-08-2016,01-08-2016,2016-08-01,7
201610,4.7199998,211408,345,01-10-2016,01-10-2016,2016-10-01,7
201611,4.7199998,211408,346,01-11-2016,01-11-2016,2016-11-01,7
201612,4.7199998,211408,347,01-12-2016,01-12-2016,2016-12-01,7
201703,4.7199998,211408,350,01-03-2017,01-03-2017,2017-03-01,7
201705,5.3299999,211408,352,01-05-2017,01-05-2017,2017-05-01,7
201706,5.3299999,211408,353,01-06-2017,01-06-2017,2017-06-01,7
201707,5.3299999,211408,354,01-07-2017,01-07-2017,2017-07-01,7
201708,5.3299999,211408,355,01-08-2017,01-08-2017,2017-08-01,7
201709,5.3299999,211408,356,01-09-2017,01-09-2017,2017-09-01,7
201710,5.3299999,211408,357,01-10-2017,01-10-2017,2017-10-01,7
201711,5.3299999,211408,358,01-11-2017,01-11-2017,2017-11-01,7
201712,5.3299999,211408,359,01-12-2017,01-12-2017,2017-12-01,7
201801,5.3299999,211408,360,01-01-2018,01-01-2018,2018-01-01,7
201802,5.3299999,211408,361,01-02-2018,01-02-2018,2018-02-01,7
201803,5.3299999,211408,362,01-03-2018,01-03-2018,2018-03-01,7
201804,5.3299999,211408,363,01-04-2018,01-04-2018,2018-04-01,7
201805,5.3299999,211408,364,01-05-2018,01-05-2018,2018-05-01,7
201806,5.3299999,211408,365,01-06-2018,01-06-2018,2018-06-01,7
201807,5.3299999,211408,366,01-07-2018,01-07-2018,2018-07-01,7
201808,5.3299999,211408,367,01-08-2018,01-08-2018,2018-08-01,7
201809,5.3299999,211408,368,01-09-2018,01-09-2018,2018-09-01,7
201810,5.3299999,211408,369,01-10-2018,01-10-2018,2018-10-01,7
201811,5.3299999,211408,370,01-11-2018,01-11-2018,2018-11-01,7
201812,5.3299999,211408,371,01-12-2018,01-12-2018,2018-12-01,7
201903,5.3000002,211408,374,01-03-2019,01-03-2019,2019-03-01,7
201904,5.3000002,211408,375,01-04-2019,01-04-2019,2019-04-01,7
201905,5.3000002,211408,376,01-05-2019,01-05-2019,2019-05-01,7
201906,5.3000002,211408,377,01-06-2019,01-06-2019,2019-06-01,7
201908,5.3000002,211408,379,01-08-2019,01-08-2019,2019-08-01,7
201909,5.3000002,211408,380,01-09-2019,01-09-2019,2019-09-01,7
201910,5.3000002,211408,381,01-10-2019,01-10-2019,2019-10-01,7
201911,5.3000002,211408,382,01-11-2019,01-11-2019,2019-11-01,7
201912,5.3000002,211408,383,01-12-2019,01-12-2019,2019-12-01,7
202001,5.3000002,211408,384,01-01-2020,01-01-2020,2020-01-01,7
202002,5.3000002,211408,385,01-02-2020,01-02-2020,2020-02-01,7
202003,5.3000002,211408,386,01-03-2020,01-03-2020,2020-03-01,7
202004,5.3000002,211408,387,01-04-2020,01-04-2020,2020-04-01,7
202005,5.3000002,211408,388,01-05-2020,01-05-2020,2020-05-01,7
202006,5.3000002,211408,389,01-06-2020,01-06-2020,2020-06-01,7
202007,7.5,211408,390,01-07-2020,01-07-2020,2020-07-01,7
202008,5.25,211408,391,01-08-2020,01-08-2020,2020-08-01,7
202009,5.25,211408,392,01-09-2020,01-09-2020,2020-09-01,7
202010,5.25,211408,393,01-10-2020,01-10-2020,2020-10-01,7
202011,5,211408,394,01-11-2020,01-11-2020,2020-11-01,7
202012,5,211408,395,01-12-2020,01-12-2020,2020-12-01,7
202101,5,211408,396,01-01-2021,01-01-2021,2021-01-01,7
202102,5,211408,397,01-02-2021,01-02-2021,2021-02-01,7
202103,5,211408,398,01-03-2021,01-03-2021,2021-03-01,7
202104,5,211408,399,01-04-2021,01-04-2021,2021-04-01,7
202105,5,211408,400,01-05-2021,01-05-2021,2021-05-01,7
202106,5,211408,401,01-06-2021,01-06-2021,2021-06-01,7
202107,5,211408,402,01-07-2021,01-07-2021,2021-07-01,7
202108,5,211408,403,01-08-2021,01-08-2021,2021-08-01,7
202109,5,211408,404,01-09-2021,01-09-2021,2021-09-01,7
202110,5,211408,405,01-10-2021,01-10-2021,2021-10-01,7
202111,5,211408,406,01-11-2021,01-11-2021,2021-11-01,7
202112,5,211408,407,01-12-2021,01-12-2021,2021-12-01,7
202201,5,211408,408,01-01-2022,01-01-2022,2022-01-01,7
202202,5,211408,409,01-02-2022,01-02-2022,2022-02-01,7
202203,5,211408,410,01-03-2022,01-03-2022,2022-03-01,7
202204,5,211408,411,01-04-2022,01-04-2022,2022-04-01,7
202205,5,211408,412,01-05-2022,01-05-2022,2022-05-01,7
202206,5,211408,413,01-06-2022,01-06-2022,2022-06-01,7
202207,5,211408,414,01-07-2022,01-07-2022,2022-07-01,7
202208,5.25,211408,415,01-08-2022,01-08-2022,2022-08-01,7
202209,5.25,211408,416,01-09-2022,01-09-2022,2022-09-01,7
202210,5.25,211408,417,01-10-2022,01-10-2022,2022-10-01,7
202301,8,211408,420,01-01-2023,01-01-2023,2023-01-01,7
202302,8,211408,421,01-02-2023,01-02-2023,2023-02-01,7
202303,8,211408,422,01-03-2023,01-03-2023,2023-03-01,7
202304,8,211408,423,01-04-2023,01-04-2023,2023-04-01,7
202305,8,211408,424,01-05-2023,01-05-2023,2023-05-01,7
202306,8,211408,425,01-06-2023,01-06-2023,2023-06-01,7
202307,8,211408,426,01-07-2023,01-07-2023,2023-07-01,7
202308,8,211408,427,01-08-2023,01-08-2023,2023-08-01,7
202309,8,211408,428,01-09-2023,01-09-2023,2023-09-01,7
202311,8,211408,430,01-11-2023,01-11-2023,2023-11-01,7
202312,8,211408,431,01-12-2023,01-12-2023,2023-12-01,7
202401,8,211408,432,01-01-2024,01-01-2024,2024-01-01,7
202402,8.9499998,211408,433,01-02-2024,01-02-2024,2024-02-01,7
202403,8.9499998,211408,434,01-03-2024,01-03-2024,2024-03-01,7
202404,8.9499998,211408,435,01-04-2024,01-04-2024,2024-04-01,7
202405,8.9499998,211408,436,01-05-2024,01-05-2024,2024-05-01,7
202406,9.5,211408,437,01-06-2024,01-06-2024,2024-06-01,7
202407,9.5,211408,438,01-07-2024,01-07-2024,2024-07-01,7
202408,9.5,211408,439,01-08-2024,01-08-2024,2024-08-01,7
202409,9.5,211408,440,01-09-2024,01-09-2024,2024-09-01,7
202410,9.5,211408,441,01-10-2024,01-10-2024,2024-10-01,7
202411,9.5,211408,442,01-11-2024,01-11-2024,2024-11-01,7
202412,9.5,211408,443,01-12-2024,01-12-2024,2024-12-01,7
202501,9.5,211408,444,01-01-2025,01-01-2025,2025-01-01,7
202502,9.5,211408,445,01-02-2025,01-02-2025,2025-02-01,7
202503,8.5,211408,446,01-03-2025,01-03-2025,2025-03-01,7
202504,8.5,211408,447,01-04-2025,01-04-2025,2025-04-01,7
202505,8.5,211408,448,01-05-2025,01-05-2025,2025-05-01,7
202506,8.5,211408,449,01-06-2025,01-06-2025,2025-06-01,7
202507,8.5,211408,450,01-07-2025,01-07-2025,2025-07-01,7
202508,6.8000002,211408,451,01-08-2025,01-08-2025,2025-08-01,7
202509,8.5,211408,452,01-09-2025,01-09-2025,2025-09-01,7
200702,2.5599999,211408,229,01-02-2007,01-02-2007,2007-02-01,8
200703,2.5599999,211408,230,01-03-2007,01-03-2007,2007-03-01,8
200704,2.5599999,211408,231,01-04-2007,01-04-2007,2007-04-01,8
200705,2.5599999,211408,232,01-05-2007,01-05-2007,2007-05-01,8
200706,2.5599999,211408,233,01-06-2007,01-06-2007,2007-06-01,8
200707,2.3800001,211408,234,01-07-2007,01-07-2007,2007-07-01,8
200708,2.3800001,211408,235,01-08-2007,01-08-2007,2007-08-01,8
200709,2.48,211408,236,01-09-2007,01-09-2007,2007-09-01,8
200710,2.48,211408,237,01-10-2007,01-10-2007,2007-10-01,8
200711,2.48,211408,238,01-11-2007,01-11-2007,2007-11-01,8
200712,2.48,211408,239,01-12-2007,01-12-2007,2007-12-01,8
200801,2.48,211408,240,01-01-2008,01-01-2008,2008-01-01,8
200802,2.48,211408,241,01-02-2008,01-02-2008,2008-02-01,8
200803,2.98,211408,242,01-03-2008,01-03-2008,2008-03-01,8
200804,2.98,211408,243,01-04-2008,01-04-2008,2008-04-01,8
200805,2.98,211408,244,01-05-2008,01-05-2008,2008-05-01,8
200806,2.98,211408,245,01-06-2008,01-06-2008,2008-06-01,8
200807,2.98,211408,246,01-07-2008,01-07-2008,2008-07-01,8
200808,2.98,211408,247,01-08-2008,01-08-2008,2008-08-01,8
200809,2.48,211408,248,01-09-2008,01-09-2008,2008-09-01,8
200810,2.48,211408,249,01-10-2008,01-10-2008,2008-10-01,8
200811,2.48,211408,250,01-11-2008,01-11-2008,2008-11-01,8
200812,2.48,211408,251,01-12-2008,01-12-2008,2008-12-01,8
200901,2.48,211408,252,01-01-2009,01-01-2009,2009-01-01,8
200902,2.28,211408,253,01-02-2009,01-02-2009,2009-02-01,8
200903,2.28,211408,254,01-03-2009,01-03-2009,2009-03-01,8
200904,2.28,211408,255,01-04-2009,01-04-2009,2009-04-01,8
200905,2.48,211408,256,01-05-2009,01-05-2009,2009-05-01,8
200906,2.48,211408,257,01-06-2009,01-06-2009,2009-06-01,8
200907,2.48,211408,258,01-07-2009,01-07-2009,2009-07-01,8
200908,2.48,211408,259,01-08-2009,01-08-2009,2009-08-01,8
200909,2.48,211408,260,01-09-2009,01-09-2009,2009-09-01,8
200910,2.48,211408,261,01-10-2009,01-10-2009,2009-10-01,8
200911,2.48,211408,262,01-11-2009,01-11-2009,2009-11-01,8
200912,2.48,211408,263,01-12-2009,01-12-2009,2009-12-01,8
201001,2.98,211408,264,01-01-2010,01-01-2010,2010-01-01,8
201002,2.98,211408,265,01-02-2010,01-02-2010,2010-02-01,8
201003,2.48,211408,266,01-03-2010,01-03-2010,2010-03-01,8
201004,2.48,211408,267,01-04-2010,01-04-2010,2010-04-01,8
201005,2.47,211408,268,01-05-2010,01-05-2010,2010-05-01,8
201006,2.8399999,211408,269,01-06-2010,01-06-2010,2010-06-01,8
201007,2.8399999,211408,270,01-07-2010,01-07-2010,2010-07-01,8
201008,2.8399999,211408,271,01-08-2010,01-08-2010,2010-08-01,8
201009,2.8399999,211408,272,01-09-2010,01-09-2010,2010-09-01,8
201010,2.8399999,211408,273,01-10-2010,01-10-2010,2010-10-01,8
201011,2.8399999,211408,274,01-11-2010,01-11-2010,2010-11-01,8
201012,2.8399999,211408,275,01-12-2010,01-12-2010,2010-12-01,8
201101,2.8399999,211408,276,01-01-2011,01-01-2011,2011-01-01,8
201102,2.8399999,211408,277,01-02-2011,01-02-2011,2011-02-01,8
201103,2.48,211408,278,01-03-2011,01-03-2011,2011-03-01,8
201104,2.48,211408,279,01-04-2011,01-04-2011,2011-04-01,8
201105,2.48,211408,280,01-05-2011,01-05-2011,2011-05-01,8
201106,2.48,211408,281,01-06-2011,01-06-2011,2011-06-01,8
201107,2.98,211408,282,01-07-2011,01-07-2011,2011-07-01,8
201108,2.98,211408,283,01-08-2011,01-08-2011,2011-08-01,8
201109,2.98,211408,284,01-09-2011,01-09-2011,2011-09-01,8
201110,2.98,211408,285,01-10-2011,01-10-2011,2011-10-01,8
201111,2.98,211408,286,01-11-2011,01-11-2011,2011-11-01,8
201112,2.98,211408,287,01-12-2011,01-12-2011,2011-12-01,8
201201,2.98,211408,288,01-01-2012,01-01-2012,2012-01-01,8
201202,2.98,211408,289,01-02-2012,01-02-2012,2012-02-01,8
201203,2.98,211408,290,01-03-2012,01-03-2012,2012-03-01,8
201204,2.98,211408,291,01-04-2012,01-04-2012,2012-04-01,8
201205,2.98,211408,292,01-05-2012,01-05-2012,2012-05-01,8
201206,2.98,211408,293,01-06-2012,01-06-2012,2012-06-01,8
201207,2.5,211408,294,01-07-2012,01-07-2012,2012-07-01,8
201208,2.5,211408,295,01-08-2012,01-08-2012,2012-08-01,8
201209,2.5,211408,296,01-09-2012,01-09-2012,2012-09-01,8
201210,2.98,211408,297,01-10-2012,01-10-2012,2012-10-01,8
201211,2.98,211408,298,01-11-2012,01-11-2012,2012-11-01,8
201212,2.98,211408,299,01-12-2012,01-12-2012,2012-12-01,8
201301,2.98,211408,300,01-01-2013,01-01-2013,2013-01-01,8
201302,2.98,211408,301,01-02-2013,01-02-2013,2013-02-01,8
201303,2.98,211408,302,01-03-2013,01-03-2013,2013-03-01,8
201304,2.98,211408,303,01-04-2013,01-04-2013,2013-04-01,8
201305,3.1800001,211408,304,01-05-2013,01-05-2013,2013-05-01,8
201306,3.1800001,211408,305,01-06-2013,01-06-2013,2013-06-01,8
201307,3.1800001,211408,306,01-07-2013,01-07-2013,2013-07-01,8
201308,3,211408,307,01-08-2013,01-08-2013,2013-08-01,8
201309,3,211408,308,01-09-2013,01-09-2013,2013-09-01,8
201310,3,211408,309,01-10-2013,01-10-2013,2013-10-01,8
201311,3,211408,310,01-11-2013,01-11-2013,2013-11-01,8
201312,3,211408,311,01-12-2013,01-12-2013,2013-12-01,8
201401,3,211408,312,01-01-2014,01-01-2014,2014-01-01,8
201402,3,211408,313,01-02-2014,01-02-2014,2014-02-01,8
201403,3,211408,314,01-03-2014,01-03-2014,2014-03-01,8
201404,3,211408,315,01-04-2014,01-04-2014,2014-04-01,8
201405,3,211408,316,01-05-2014,01-05-2014,2014-05-01,8
201406,3,211408,317,01-06-2014,01-06-2014,2014-06-01,8
201407,3,211408,318,01-07-2014,01-07-2014,2014-07-01,8
201408,2.49,211408,319,01-08-2014,01-08-2014,2014-08-01,8
201409,3,211408,320,01-09-2014,01-09-2014,2014-09-01,8
201410,3,211408,321,01-10-2014,01-10-2014,2014-10-01,8
201411,3,211408,322,01-11-2014,01-11-2014,2014-11-01,8
201412,3,211408,323,01-12-2014,01-12-2014,2014-12-01,8
201501,3,211408,324,01-01-2015,01-01-2015,2015-01-01,8
201502,2.9000001,211408,325,01-02-2015,01-02-2015,2015-02-01,8
201504,1.75,211408,327,01-04-2015,01-04-2015,2015-04-01,8
201505,1.85,211408,328,01-05-2015,01-05-2015,2015-05-01,8
201506,1.89,211408,329,01-06-2015,01-06-2015,2015-06-01,8
201507,2.25,211408,330,01-07-2015,01-07-2015,2015-07-01,8
201508,2.25,211408,331,01-08-2015,01-08-2015,2015-08-01,8
201509,1.8099999,211408,332,01-09-2015,01-09-2015,2015-09-01,8
201510,1.89,211408,333,01-10-2015,01-10-2015,2015-10-01,8
201511,2.02,211408,334,01-11-2015,01-11-2015,2015-11-01,8
201512,2.25,211408,335,01-12-2015,01-12-2015,2015-12-01,8
201602,2,211408,337,01-02-2016,01-02-2016,2016-02-01,8
201603,2,211408,338,01-03-2016,01-03-2016,2016-03-01,8
201604,2,211408,339,01-04-2016,01-04-2016,2016-04-01,8
201605,2,211408,340,01-05-2016,01-05-2016,2016-05-01,8
201606,2,211408,341,01-06-2016,01-06-2016,2016-06-01,8
201607,2,211408,342,01-07-2016,01-07-2016,2016-07-01,8
201608,2,211408,343,01-08-2016,01-08-2016,2016-08-01,8
201609,2,211408,344,01-09-2016,01-09-2016,2016-09-01,8
201610,2,211408,345,01-10-2016,01-10-2016,2016-10-01,8
201611,2,211408,346,01-11-2016,01-11-2016,2016-11-01,8
201612,2,211408,347,01-12-2016,01-12-2016,2016-12-01,8
201701,2,211408,348,01-01-2017,01-01-2017,2017-01-01,8
201702,2,211408,349,01-02-2017,01-02-2017,2017-02-01,8
201703,2,211408,350,01-03-2017,01-03-2017,2017-03-01,8
201704,2,211408,351,01-04-2017,01-04-2017,2017-04-01,8
201705,2.5,211408,352,01-05-2017,01-05-2017,2017-05-01,8
201706,2.25,211408,353,01-06-2017,01-06-2017,2017-06-01,8
201707,2.25,211408,354,01-07-2017,01-07-2017,2017-07-01,8
201708,2.25,211408,355,01-08-2017,01-08-2017,2017-08-01,8
201709,2.25,211408,356,01-09-2017,01-09-2017,2017-09-01,8
201710,2.25,211408,357,01-10-2017,01-10-2017,2017-10-01,8
201711,2.25,211408,358,01-11-2017,01-11-2017,2017-11-01,8
201712,2.25,211408,359,01-12-2017,01-12-2017,2017-12-01,8
201801,2.25,211408,360,01-01-2018,01-01-2018,2018-01-01,8
201802,2.25,211408,361,01-02-2018,01-02-2018,2018-02-01,8
201803,2.25,211408,362,01-03-2018,01-03-2018,2018-03-01,8
201804,2.25,211408,363,01-04-2018,01-04-2018,2018-04-01,8
201805,2.25,211408,364,01-05-2018,01-05-2018,2018-05-01,8
201806,2.25,211408,365,01-06-2018,01-06-2018,2018-06-01,8
201807,2.3399999,211408,366,01-07-2018,01-07-2018,2018-07-01,8
201808,2.3399999,211408,367,01-08-2018,01-08-2018,2018-08-01,8
201809,2.3399999,211408,368,01-09-2018,01-09-2018,2018-09-01,8
201810,2.3399999,211408,369,01-10-2018,01-10-2018,2018-10-01,8
201811,2.3399999,211408,370,01-11-2018,01-11-2018,2018-11-01,8
201812,2.3399999,211408,371,01-12-2018,01-12-2018,2018-12-01,8
201901,2.3399999,211408,372,01-01-2019,01-01-2019,2019-01-01,8
201902,2.3399999,211408,373,01-02-2019,01-02-2019,2019-02-01,8
201903,2.3399999,211408,374,01-03-2019,01-03-2019,2019-03-01,8
201904,2.3399999,211408,375,01-04-2019,01-04-2019,2019-04-01,8
201905,2.3399999,211408,376,01-05-2019,01-05-2019,2019-05-01,8
201906,2.3399999,211408,377,01-06-2019,01-06-2019,2019-06-01,8
201907,2.3399999,211408,378,01-07-2019,01-07-2019,2019-07-01,8
201908,2.3399999,211408,379,01-08-2019,01-08-2019,2019-08-01,8
201909,2.3399999,211408,380,01-09-2019,01-09-2019,2019-09-01,8
201910,2.3399999,211408,381,01-10-2019,01-10-2019,2019-10-01,8
201911,2.3399999,211408,382,01-11-2019,01-11-2019,2019-11-01,8
201912,2.3399999,211408,383,01-12-2019,01-12-2019,2019-12-01,8
202001,2.3399999,211408,384,01-01-2020,01-01-2020,2020-01-01,8
202002,2.3399999,211408,385,01-02-2020,01-02-2020,2020-02-01,8
202003,2.3399999,211408,386,01-03-2020,01-03-2020,2020-03-01,8
202004,2.3399999,211408,387,01-04-2020,01-04-2020,2020-04-01,8
202008,3.25,211408,391,01-08-2020,01-08-2020,2020-08-01,8
202009,3.25,211408,392,01-09-2020,01-09-2020,2020-09-01,8
202010,3.25,211408,393,01-10-2020,01-10-2020,2020-10-01,8
202011,3.25,211408,394,01-11-2020,01-11-2020,2020-11-01,8
202012,3.25,211408,395,01-12-2020,01-12-2020,2020-12-01,8
202101,3.25,211408,396,01-01-2021,01-01-2021,2021-01-01,8
202102,3.25,211408,397,01-02-2021,01-02-2021,2021-02-01,8
202103,3.25,211408,398,01-03-2021,01-03-2021,2021-03-01,8
202104,3.25,211408,399,01-04-2021,01-04-2021,2021-04-01,8
202106,3.25,211408,401,01-06-2021,01-06-2021,2021-06-01,8
202107,3.25,211408,402,01-07-2021,01-07-2021,2021-07-01,8
202108,3.25,211408,403,01-08-2021,01-08-2021,2021-08-01,8
202109,3.25,211408,404,01-09-2021,01-09-2021,2021-09-01,8
202110,3.25,211408,405,01-10-2021,01-10-2021,2021-10-01,8
202111,3.25,211408,406,01-11-2021,01-11-2021,2021-11-01,8
202112,3.25,211408,407,01-12-2021,01-12-2021,2021-12-01,8
202201,3.25,211408,408,01-01-2022,01-01-2022,2022-01-01,8
202202,3.25,211408,409,01-02-2022,01-02-2022,2022-02-01,8
202203,3.25,211408,410,01-03-2022,01-03-2022,2022-03-01,8
202204,3.5,211408,411,01-04-2022,01-04-2022,2022-04-01,8
202205,3.5,211408,412,01-05-2022,01-05-2022,2022-05-01,8
202206,3.5,211408,413,01-06-2022,01-06-2022,2022-06-01,8
202207,3.5,211408,414,01-07-2022,01-07-2022,2022-07-01,8
202208,3.6500001,211408,415,01-08-2022,01-08-2022,2022-08-01,8
202209,3.6500001,211408,416,01-09-2022,01-09-2022,2022-09-01,8
202210,3.6500001,211408,417,01-10-2022,01-10-2022,2022-10-01,8
202211,3.6500001,211408,418,01-11-2022,01-11-2022,2022-11-01,8
202212,3.7,211408,419,01-12-2022,01-12-2022,2022-12-01,8
202301,3.7,211408,420,01-01-2023,01-01-2023,2023-01-01,8
202302,3.7,211408,421,01-02-2023,01-02-2023,2023-02-01,8
202303,3.7,211408,422,01-03-2023,01-03-2023,2023-03-01,8
202305,4.25,211408,424,01-05-2023,01-05-2023,2023-05-01,8
202306,4.8000002,211408,425,01-06-2023,01-06-2023,2023-06-01,8
202307,4.8000002,211408,426,01-07-2023,01-07-2023,2023-07-01,8
202308,4.8000002,211408,427,01-08-2023,01-08-2023,2023-08-01,8
202309,4.9499998,211408,428,01-09-2023,01-09-2023,2023-09-01,8
202310,5.5,211408,429,01-10-2023,01-10-2023,2023-10-01,8
202311,5.5,211408,430,01-11-2023,01-11-2023,2023-11-01,8
202312,5.5,211408,431,01-12-2023,01-12-2023,2023-12-01,8
202401,5.5,211408,432,01-01-2024,01-01-2024,2024-01-01,8
202402,5.5,211408,433,01-02-2024,01-02-2024,2024-02-01,8
202403,6.25,211408,434,01-03-2024,01-03-2024,2024-03-01,8
202404,7,211408,435,01-04-2024,01-04-2024,2024-04-01,8
202405,7,211408,436,01-05-2024,01-05-2024,2024-05-01,8
202406,7,211408,437,01-06-2024,01-06-2024,2024-06-01,8
202407,7,211408,438,01-07-2024,01-07-2024,2024-07-01,8
202408,7,211408,439,01-08-2024,01-08-2024,2024-08-01,8
202409,7,211408,440,01-09-2024,01-09-2024,2024-09-01,8
202410,7,211408,441,01-10-2024,01-10-2024,2024-10-01,8
202411,7,211408,442,01-11-2024,01-11-2024,2024-11-01,8
202412,7,211408,443,01-12-2024,01-12-2024,2024-12-01,8
202501,4,211408,444,01-01-2025,01-01-2025,2025-01-01,8
202502,4,211408,445,01-02-2025,01-02-2025,2025-02-01,8
202503,4.02,211408,446,01-03-2025,01-03-2025,2025-03-01,8
202504,6.0799999,211408,447,01-04-2025,01-04-2025,2025-04-01,8
202505,6.5799999,211408,448,01-05-2025,01-05-2025,2025-05-01,8
202506,6.5799999,211408,449,01-06-2025,01-06-2025,2025-06-01,8
202507,6.0599999,211408,450,01-07-2025,01-07-2025,2025-07-01,8
202508,6.0599999,211408,451,01-08-2025,01-08-2025,2025-08-01,8
202509,6.0599999,211408,452,01-09-2025,01-09-2025,2025-09-01,8
200702,3.99,211408,229,01-02-2007,01-02-2007,2007-02-01,9
200703,3.99,211408,230,01-03-2007,01-03-2007,2007-03-01,9
200704,3.99,211408,231,01-04-2007,01-04-2007,2007-04-01,9
200705,3.99,211408,232,01-05-2007,01-05-2007,2007-05-01,9
200706,3.48,211408,233,01-06-2007,01-06-2007,2007-06-01,9
200707,3.48,211408,234,01-07-2007,01-07-2007,2007-07-01,9
200708,3.48,211408,235,01-08-2007,01-08-2007,2007-08-01,9
200709,3.48,211408,236,01-09-2007,01-09-2007,2007-09-01,9
200710,3.48,211408,237,01-10-2007,01-10-2007,2007-10-01,9
200711,1.92,211408,238,01-11-2007,01-11-2007,2007-11-01,9
200712,1.89,211408,239,01-12-2007,01-12-2007,2007-12-01,9
200801,1.89,211408,240,01-01-2008,01-01-2008,2008-01-01,9
200802,1.88,211408,241,01-02-2008,01-02-2008,2008-02-01,9
200803,1.88,211408,242,01-03-2008,01-03-2008,2008-03-01,9
200804,1.88,211408,243,01-04-2008,01-04-2008,2008-04-01,9
200805,1.88,211408,244,01-05-2008,01-05-2008,2008-05-01,9
200806,2.28,211408,245,01-06-2008,01-06-2008,2008-06-01,9
200807,1.88,211408,246,01-07-2008,01-07-2008,2008-07-01,9
200808,2.28,211408,247,01-08-2008,01-08-2008,2008-08-01,9
200809,2.28,211408,248,01-09-2008,01-09-2008,2008-09-01,9
200810,2.28,211408,249,01-10-2008,01-10-2008,2008-10-01,9
200811,1.96,211408,250,01-11-2008,01-11-2008,2008-11-01,9
200812,1.96,211408,251,01-12-2008,01-12-2008,2008-12-01,9
200901,1.96,211408,252,01-01-2009,01-01-2009,2009-01-01,9
200902,1.96,211408,253,01-02-2009,01-02-2009,2009-02-01,9
200903,1.96,211408,254,01-03-2009,01-03-2009,2009-03-01,9
200904,1.96,211408,255,01-04-2009,01-04-2009,2009-04-01,9
200905,1.96,211408,256,01-05-2009,01-05-2009,2009-05-01,9
200906,1.96,211408,257,01-06-2009,01-06-2009,2009-06-01,9
200907,1.74,211408,258,01-07-2009,01-07-2009,2009-07-01,9
200908,1.74,211408,259,01-08-2009,01-08-2009,2009-08-01,9
200909,1.74,211408,260,01-09-2009,01-09-2009,2009-09-01,9
200910,1.74,211408,261,01-10-2009,01-10-2009,2009-10-01,9
200911,1.88,211408,262,01-11-2009,01-11-2009,2009-11-01,9
200912,1.88,211408,263,01-12-2009,01-12-2009,2009-12-01,9
201001,1.85,211408,264,01-01-2010,01-01-2010,2010-01-01,9
201002,1.85,211408,265,01-02-2010,01-02-2010,2010-02-01,9
201003,1.85,211408,266,01-03-2010,01-03-2010,2010-03-01,9
201004,1.85,211408,267,01-04-2010,01-04-2010,2010-04-01,9
201005,1.85,211408,268,01-05-2010,01-05-2010,2010-05-01,9
201006,2.3499999,211408,269,01-06-2010,01-06-2010,2010-06-01,9
201007,2.1800001,211408,270,01-07-2010,01-07-2010,2010-07-01,9
201008,2.1800001,211408,271,01-08-2010,01-08-2010,2010-08-01,9
201009,2.1800001,211408,272,01-09-2010,01-09-2010,2010-09-01,9
201010,1.84,211408,273,01-10-2010,01-10-2010,2010-10-01,9
201011,1.84,211408,274,01-11-2010,01-11-2010,2010-11-01,9
201012,1.64,211408,275,01-12-2010,01-12-2010,2010-12-01,9
201101,2.1900001,211408,276,01-01-2011,01-01-2011,2011-01-01,9
201102,1.63,211408,277,01-02-2011,01-02-2011,2011-02-01,9
201103,1.63,211408,278,01-03-2011,01-03-2011,2011-03-01,9
201104,1.63,211408,279,01-04-2011,01-04-2011,2011-04-01,9
201105,1.63,211408,280,01-05-2011,01-05-2011,2011-05-01,9
201106,1.84,211408,281,01-06-2011,01-06-2011,2011-06-01,9
201107,1.84,211408,282,01-07-2011,01-07-2011,2011-07-01,9
201108,1.47,211408,283,01-08-2011,01-08-2011,2011-08-01,9
201109,1.47,211408,284,01-09-2011,01-09-2011,2011-09-01,9
201110,1.84,211408,285,01-10-2011,01-10-2011,2011-10-01,9
201111,1.84,211408,286,01-11-2011,01-11-2011,2011-11-01,9
201112,2.1900001,211408,287,01-12-2011,01-12-2011,2011-12-01,9
201201,2.1900001,211408,288,01-01-2012,01-01-2012,2012-01-01,9
201202,2.29,211408,289,01-02-2012,01-02-2012,2012-02-01,9
201203,1.6900001,211408,290,01-03-2012,01-03-2012,2012-03-01,9
201204,2.29,211408,291,01-04-2012,01-04-2012,2012-04-01,9
201205,2.29,211408,292,01-05-2012,01-05-2012,2012-05-01,9
201206,1.6900001,211408,293,01-06-2012,01-06-2012,2012-06-01,9
201207,1.6900001,211408,294,01-07-2012,01-07-2012,2012-07-01,9
201208,1.8200001,211408,295,01-08-2012,01-08-2012,2012-08-01,9
201209,1.8,211408,296,01-09-2012,01-09-2012,2012-09-01,9
201210,1.84,211408,297,01-10-2012,01-10-2012,2012-10-01,9
201211,1.98,211408,298,01-11-2012,01-11-2012,2012-11-01,9
201212,1.98,211408,299,01-12-2012,01-12-2012,2012-12-01,9
201301,2.1500001,211408,300,01-01-2013,01-01-2013,2013-01-01,9
201302,2.1500001,211408,301,01-02-2013,01-02-2013,2013-02-01,9
201303,2.1500001,211408,302,01-03-2013,01-03-2013,2013-03-01,9
201304,1.98,211408,303,01-04-2013,01-04-2013,2013-04-01,9
201305,1.75,211408,304,01-05-2013,01-05-2013,2013-05-01,9
201306,2,211408,305,01-06-2013,01-06-2013,2013-06-01,9
201307,2,211408,306,01-07-2013,01-07-2013,2013-07-01,9
201308,2,211408,307,01-08-2013,01-08-2013,2013-08-01,9
201309,1.75,211408,308,01-09-2013,01-09-2013,2013-09-01,9
201310,2,211408,309,01-10-2013,01-10-2013,2013-10-01,9
201311,2,211408,310,01-11-2013,01-11-2013,2013-11-01,9
201312,2,211408,311,01-12-2013,01-12-2013,2013-12-01,9
201401,2,211408,312,01-01-2014,01-01-2014,2014-01-01,9
201402,1.5,211408,313,01-02-2014,01-02-2014,2014-02-01,9
201403,1.5,211408,314,01-03-2014,01-03-2014,2014-03-01,9
201404,1.75,211408,315,01-04-2014,01-04-2014,2014-04-01,9
201405,1.75,211408,316,01-05-2014,01-05-2014,2014-05-01,9
201406,1.75,211408,317,01-06-2014,01-06-2014,2014-06-01,9
201407,1.75,211408,318,01-07-2014,01-07-2014,2014-07-01,9
201408,1.85,211408,319,01-08-2014,01-08-2014,2014-08-01,9
201409,1.9,211408,320,01-09-2014,01-09-2014,2014-09-01,9
201410,1.9,211408,321,01-10-2014,01-10-2014,2014-10-01,9
201411,1.75,211408,322,01-11-2014,01-11-2014,2014-11-01,9
201412,1.75,211408,323,01-12-2014,01-12-2014,2014-12-01,9
201501,1.75,211408,324,01-01-2015,01-01-2015,2015-01-01,9
201502,1.75,211408,325,01-02-2015,01-02-2015,2015-02-01,9
201503,1.75,211408,326,01-03-2015,01-03-2015,2015-03-01,9
201504,1.75,211408,327,01-04-2015,01-04-2015,2015-04-01,9
201505,2,211408,328,01-05-2015,01-05-2015,2015-05-01,9
201506,2,211408,329,01-06-2015,01-06-2015,2015-06-01,9
201507,2,211408,330,01-07-2015,01-07-2015,2015-07-01,9
201508,2,211408,331,01-08-2015,01-08-2015,2015-08-01,9
201509,2,211408,332,01-09-2015,01-09-2015,2015-09-01,9
201510,2,211408,333,01-10-2015,01-10-2015,2015-10-01,9
201511,2,211408,334,01-11-2015,01-11-2015,2015-11-01,9
201512,2,211408,335,01-12-2015,01-12-2015,2015-12-01,9
201601,2,211408,336,01-01-2016,01-01-2016,2016-01-01,9
201602,2,211408,337,01-02-2016,01-02-2016,2016-02-01,9
201603,2,211408,338,01-03-2016,01-03-2016,2016-03-01,9
201604,2,211408,339,01-04-2016,01-04-2016,2016-04-01,9
201605,2,211408,340,01-05-2016,01-05-2016,2016-05-01,9
201606,2,211408,341,01-06-2016,01-06-2016,2016-06-01,9
201607,2,211408,342,01-07-2016,01-07-2016,2016-07-01,9
201608,2,211408,343,01-08-2016,01-08-2016,2016-08-01,9
201609,2,211408,344,01-09-2016,01-09-2016,2016-09-01,9
201610,2,211408,345,01-10-2016,01-10-2016,2016-10-01,9
201611,2,211408,346,01-11-2016,01-11-2016,2016-11-01,9
201612,2,211408,347,01-12-2016,01-12-2016,2016-12-01,9
201701,2,211408,348,01-01-2017,01-01-2017,2017-01-01,9
201702,2.2,211408,349,01-02-2017,01-02-2017,2017-02-01,9
201703,2.2,211408,350,01-03-2017,01-03-2017,2017-03-01,9
201704,2.2,211408,351,01-04-2017,01-04-2017,2017-04-01,9
201705,2.2,211408,352,01-05-2017,01-05-2017,2017-05-01,9
201706,2.2,211408,353,01-06-2017,01-06-2017,2017-06-01,9
201707,2.25,211408,354,01-07-2017,01-07-2017,2017-07-01,9
201708,2.25,211408,355,01-08-2017,01-08-2017,2017-08-01,9
201709,2.25,211408,356,01-09-2017,01-09-2017,2017-09-01,9
201710,2.25,211408,357,01-10-2017,01-10-2017,2017-10-01,9
201711,2.25,211408,358,01-11-2017,01-11-2017,2017-11-01,9
201712,2.25,211408,359,01-12-2017,01-12-2017,2017-12-01,9
201801,2.25,211408,360,01-01-2018,01-01-2018,2018-01-01,9
201802,2.25,211408,361,01-02-2018,01-02-2018,2018-02-01,9
201803,2.3499999,211408,362,01-03-2018,01-03-2018,2018-03-01,9
201804,2.3499999,211408,363,01-04-2018,01-04-2018,2018-04-01,9
201805,2.3499999,211408,364,01-05-2018,01-05-2018,2018-05-01,9
201806,2.3499999,211408,365,01-06-2018,01-06-2018,2018-06-01,9
201807,2.3499999,211408,366,01-07-2018,01-07-2018,2018-07-01,9
201808,2.3499999,211408,367,01-08-2018,01-08-2018,2018-08-01,9
201809,2.3499999,211408,368,01-09-2018,01-09-2018,2018-09-01,9
201810,2.3499999,211408,369,01-10-2018,01-10-2018,2018-10-01,9
201811,2.3499999,211408,370,01-11-2018,01-11-2018,2018-11-01,9
201812,2.3499999,211408,371,01-12-2018,01-12-2018,2018-12-01,9
201901,2.3499999,211408,372,01-01-2019,01-01-2019,2019-01-01,9
201902,2.3499999,211408,373,01-02-2019,01-02-2019,2019-02-01,9
201903,2.3499999,211408,374,01-03-2019,01-03-2019,2019-03-01,9
201904,2.3499999,211408,375,01-04-2019,01-04-2019,2019-04-01,9
201905,2.3499999,211408,376,01-05-2019,01-05-2019,2019-05-01,9
201906,2.3499999,211408,377,01-06-2019,01-06-2019,2019-06-01,9
201907,2.3499999,211408,378,01-07-2019,01-07-2019,2019-07-01,9
201908,2.3499999,211408,379,01-08-2019,01-08-2019,2019-08-01,9
201909,2.3499999,211408,380,01-09-2019,01-09-2019,2019-09-01,9
201910,2.3499999,211408,381,01-10-2019,01-10-2019,2019-10-01,9
201911,2.3499999,211408,382,01-11-2019,01-11-2019,2019-11-01,9
201912,2.3499999,211408,383,01-12-2019,01-12-2019,2019-12-01,9
202001,2.3499999,211408,384,01-01-2020,01-01-2020,2020-01-01,9
202002,2.3499999,211408,385,01-02-2020,01-02-2020,2020-02-01,9
202003,2.3499999,211408,386,01-03-2020,01-03-2020,2020-03-01,9
202004,2.55,211408,387,01-04-2020,01-04-2020,2020-04-01,9
202008,2.55,211408,391,01-08-2020,01-08-2020,2020-08-01,9
202009,2.55,211408,392,01-09-2020,01-09-2020,2020-09-01,9
202010,2.55,211408,393,01-10-2020,01-10-2020,2020-10-01,9
202011,2.55,211408,394,01-11-2020,01-11-2020,2020-11-01,9
202012,2.55,211408,395,01-12-2020,01-12-2020,2020-12-01,9
202101,2.55,211408,396,01-01-2021,01-01-2021,2021-01-01,9
202102,2.55,211408,397,01-02-2021,01-02-2021,2021-02-01,9
202103,2.55,211408,398,01-03-2021,01-03-2021,2021-03-01,9
202104,2.55,211408,399,01-04-2021,01-04-2021,2021-04-01,9
202105,2.55,211408,400,01-05-2021,01-05-2021,2021-05-01,9
202106,2.55,211408,401,01-06-2021,01-06-2021,2021-06-01,9
202107,2.55,211408,402,01-07-2021,01-07-2021,2021-07-01,9
202108,2.55,211408,403,01-08-2021,01-08-2021,2021-08-01,9
202109,2.55,211408,404,01-09-2021,01-09-2021,2021-09-01,9
202110,2.55,211408,405,01-10-2021,01-10-2021,2021-10-01,9
202111,2.55,211408,406,01-11-2021,01-11-2021,2021-11-01,9
202112,2.5,211408,407,01-12-2021,01-12-2021,2021-12-01,9
202201,2.55,211408,408,01-01-2022,01-01-2022,2022-01-01,9
202202,2.75,211408,409,01-02-2022,01-02-2022,2022-02-01,9
202203,2.75,211408,410,01-03-2022,01-03-2022,2022-03-01,9
202204,2.75,211408,411,01-04-2022,01-04-2022,2022-04-01,9
202205,2.75,211408,412,01-05-2022,01-05-2022,2022-05-01,9
202206,2.75,211408,413,01-06-2022,01-06-2022,2022-06-01,9
202207,3.2,211408,414,01-07-2022,01-07-2022,2022-07-01,9
202208,3.2,211408,415,01-08-2022,01-08-2022,2022-08-01,9
202209,3.2,211408,416,01-09-2022,01-09-2022,2022-09-01,9
202210,3.2,211408,417,01-10-2022,01-10-2022,2022-10-01,9
202211,3.2,211408,418,01-11-2022,01-11-2022,2022-11-01,9
202212,3.8,211408,419,01-12-2022,01-12-2022,2022-12-01,9
202301,3.8,211408,420,01-01-2023,01-01-2023,2023-01-01,9
202302,3.8,211408,421,01-02-2023,01-02-2023,2023-02-01,9
202303,3.8,211408,422,01-03-2023,01-03-2023,2023-03-01,9
202304,3.8,211408,423,01-04-2023,01-04-2023,2023-04-01,9
202305,4.3499999,211408,424,01-05-2023,01-05-2023,2023-05-01,9
202306,4.3499999,211408,425,01-06-2023,01-06-2023,2023-06-01,9
202307,4.5,211408,426,01-07-2023,01-07-2023,2023-07-01,9
202308,4.5,211408,427,01-08-2023,01-08-2023,2023-08-01,9
202309,5.0999999,211408,428,01-09-2023,01-09-2023,2023-09-01,9
202310,5.5,211408,429,01-10-2023,01-10-2023,2023-10-01,9
202311,5.5,211408,430,01-11-2023,01-11-2023,2023-11-01,9
202312,5.8000002,211408,431,01-12-2023,01-12-2023,2023-12-01,9
202401,5.8000002,211408,432,01-01-2024,01-01-2024,2024-01-01,9
202402,5.8000002,211408,433,01-02-2024,01-02-2024,2024-02-01,9
202403,6.5,211408,434,01-03-2024,01-03-2024,2024-03-01,9
202404,6.5,211408,435,01-04-2024,01-04-2024,2024-04-01,9
202405,6.5,211408,436,01-05-2024,01-05-2024,2024-05-01,9
202406,6.5,211408,437,01-06-2024,01-06-2024,2024-06-01,9
202407,6.5,211408,438,01-07-2024,01-07-2024,2024-07-01,9
202408,6.5,211408,439,01-08-2024,01-08-2024,2024-08-01,9
202409,6.5,211408,440,01-09-2024,01-09-2024,2024-09-01,9
202410,6.5,211408,441,01-10-2024,01-10-2024,2024-10-01,9
202411,6.5,211408,442,01-11-2024,01-11-2024,2024-11-01,9
202412,6.5,211408,443,01-12-2024,01-12-2024,2024-12-01,9
202501,6.5,211408,444,01-01-2025,01-01-2025,2025-01-01,9
202502,5.8499999,211408,445,01-02-2025,01-02-2025,2025-02-01,9
202503,5.8499999,211408,446,01-03-2025,01-03-2025,2025-03-01,9
202504,5.8499999,211408,447,01-04-2025,01-04-2025,2025-04-01,9
202505,5.5500002,211408,448,01-05-2025,01-05-2025,2025-05-01,9
202506,5.5500002,211408,449,01-06-2025,01-06-2025,2025-06-01,9
202507,5.5500002,211408,450,01-07-2025,01-07-2025,2025-07-01,9
202508,5.5500002,211408,451,01-08-2025,01-08-2025,2025-08-01,9
202509,5.5500002,211408,452,01-09-2025,01-09-2025,2025-09-01,9
200702,4.1500001,211408,229,01-02-2007,01-02-2007,2007-02-01,10
200703,4.1500001,211408,230,01-03-2007,01-03-2007,2007-03-01,10
200704,4.1500001,211408,231,01-04-2007,01-04-2007,2007-04-01,10
200705,4.1500001,211408,232,01-05-2007,01-05-2007,2007-05-01,10
200706,4.1500001,211408,233,01-06-2007,01-06-2007,2007-06-01,10
200707,4.1500001,211408,234,01-07-2007,01-07-2007,2007-07-01,10
200708,3.79,211408,235,01-08-2007,01-08-2007,2007-08-01,10
200709,3.79,211408,236,01-09-2007,01-09-2007,2007-09-01,10
200710,3.79,211408,237,01-10-2007,01-10-2007,2007-10-01,10
200711,3.79,211408,238,01-11-2007,01-11-2007,2007-11-01,10
200712,3.5899999,211408,239,01-12-2007,01-12-2007,2007-12-01,10
200801,3.6900001,211408,240,01-01-2008,01-01-2008,2008-01-01,10
200802,3.45,211408,241,01-02-2008,01-02-2008,2008-02-01,10
200803,3.45,211408,242,01-03-2008,01-03-2008,2008-03-01,10
200804,3.45,211408,243,01-04-2008,01-04-2008,2008-04-01,10
200805,3.45,211408,244,01-05-2008,01-05-2008,2008-05-01,10
200806,3.45,211408,245,01-06-2008,01-06-2008,2008-06-01,10
200807,3.45,211408,246,01-07-2008,01-07-2008,2008-07-01,10
200808,3.45,211408,247,01-08-2008,01-08-2008,2008-08-01,10
200809,3.45,211408,248,01-09-2008,01-09-2008,2008-09-01,10
200810,3.45,211408,249,01-10-2008,01-10-2008,2008-10-01,10
200811,3.45,211408,250,01-11-2008,01-11-2008,2008-11-01,10
200812,3.45,211408,251,01-12-2008,01-12-2008,2008-12-01,10
200901,3.45,211408,252,01-01-2009,01-01-2009,2009-01-01,10
200902,3.45,211408,253,01-02-2009,01-02-2009,2009-02-01,10
200903,3.45,211408,254,01-03-2009,01-03-2009,2009-03-01,10
200904,3.45,211408,255,01-04-2009,01-04-2009,2009-04-01,10
200905,3.45,211408,256,01-05-2009,01-05-2009,2009-05-01,10
200906,3.45,211408,257,01-06-2009,01-06-2009,2009-06-01,10
200907,3.45,211408,258,01-07-2009,01-07-2009,2009-07-01,10
200908,3.3399999,211408,259,01-08-2009,01-08-2009,2009-08-01,10
200909,3.3399999,211408,260,01-09-2009,01-09-2009,2009-09-01,10
200910,3.3399999,211408,261,01-10-2009,01-10-2009,2009-10-01,10
200911,3.3800001,211408,262,01-11-2009,01-11-2009,2009-11-01,10
200912,3.3800001,211408,263,01-12-2009,01-12-2009,2009-12-01,10
201001,3.3800001,211408,264,01-01-2010,01-01-2010,2010-01-01,10
201002,3.3800001,211408,265,01-02-2010,01-02-2010,2010-02-01,10
201003,3.3800001,211408,266,01-03-2010,01-03-2010,2010-03-01,10
201004,3.3800001,211408,267,01-04-2010,01-04-2010,2010-04-01,10
201005,3.3800001,211408,268,01-05-2010,01-05-2010,2010-05-01,10
201006,3.3800001,211408,269,01-06-2010,01-06-2010,2010-06-01,10
201007,3.45,211408,270,01-07-2010,01-07-2010,2010-07-01,10
201008,3.79,211408,271,01-08-2010,01-08-2010,2010-08-01,10
201009,3.98,211408,272,01-09-2010,01-09-2010,2010-09-01,10
201010,3.78,211408,273,01-10-2010,01-10-2010,2010-10-01,10
201011,3.78,211408,274,01-11-2010,01-11-2010,2010-11-01,10
201012,4.0900002,211408,275,01-12-2010,01-12-2010,2010-12-01,10
201101,4.1900001,211408,276,01-01-2011,01-01-2011,2011-01-01,10
201102,3.5899999,211408,277,01-02-2011,01-02-2011,2011-02-01,10
201103,3.5899999,211408,278,01-03-2011,01-03-2011,2011-03-01,10
201104,3.48,211408,279,01-04-2011,01-04-2011,2011-04-01,10
201105,3.1500001,211408,280,01-05-2011,01-05-2011,2011-05-01,10
201106,3.1500001,211408,281,01-06-2011,01-06-2011,2011-06-01,10
201107,3.1500001,211408,282,01-07-2011,01-07-2011,2011-07-01,10
201108,3.24,211408,283,01-08-2011,01-08-2011,2011-08-01,10
201109,3.24,211408,284,01-09-2011,01-09-2011,2011-09-01,10
201110,3.24,211408,285,01-10-2011,01-10-2011,2011-10-01,10
201111,3.24,211408,286,01-11-2011,01-11-2011,2011-11-01,10
201112,3.24,211408,287,01-12-2011,01-12-2011,2011-12-01,10
201201,3.79,211408,288,01-01-2012,01-01-2012,2012-01-01,10
201202,3.8900001,211408,289,01-02-2012,01-02-2012,2012-02-01,10
201203,3.8900001,211408,290,01-03-2012,01-03-2012,2012-03-01,10
201204,3.8900001,211408,291,01-04-2012,01-04-2012,2012-04-01,10
201205,3.8900001,211408,292,01-05-2012,01-05-2012,2012-05-01,10
201206,3.8900001,211408,293,01-06-2012,01-06-2012,2012-06-01,10
201207,3.8900001,211408,294,01-07-2012,01-07-2012,2012-07-01,10
201208,3.8900001,211408,295,01-08-2012,01-08-2012,2012-08-01,10
201209,3.9000001,211408,296,01-09-2012,01-09-2012,2012-09-01,10
201210,3,211408,297,01-10-2012,01-10-2012,2012-10-01,10
201211,3.49,211408,298,01-11-2012,01-11-2012,2012-11-01,10
201212,3.49,211408,299,01-12-2012,01-12-2012,2012-12-01,10
201301,3.49,211408,300,01-01-2013,01-01-2013,2013-01-01,10
201302,3.6900001,211408,301,01-02-2013,01-02-2013,2013-02-01,10
201303,3.6900001,211408,302,01-03-2013,01-03-2013,2013-03-01,10
201304,3.6900001,211408,303,01-04-2013,01-04-2013,2013-04-01,10
201305,3.6900001,211408,304,01-05-2013,01-05-2013,2013-05-01,10
201306,3.5999999,211408,305,01-06-2013,01-06-2013,2013-06-01,10
201307,3.5999999,211408,306,01-07-2013,01-07-2013,2013-07-01,10
201308,3.5999999,211408,307,01-08-2013,01-08-2013,2013-08-01,10
201309,3.5999999,211408,308,01-09-2013,01-09-2013,2013-09-01,10
201310,3.5,211408,309,01-10-2013,01-10-2013,2013-10-01,10
201311,3.5999999,211408,310,01-11-2013,01-11-2013,2013-11-01,10
201312,3.5999999,211408,311,01-12-2013,01-12-2013,2013-12-01,10
201401,3.75,211408,312,01-01-2014,01-01-2014,2014-01-01,10
201402,3.75,211408,313,01-02-2014,01-02-2014,2014-02-01,10
201403,3.75,211408,314,01-03-2014,01-03-2014,2014-03-01,10
201404,3.75,211408,315,01-04-2014,01-04-2014,2014-04-01,10
201405,3.75,211408,316,01-05-2014,01-05-2014,2014-05-01,10
201406,3.3,211408,317,01-06-2014,01-06-2014,2014-06-01,10
201407,3.3,211408,318,01-07-2014,01-07-2014,2014-07-01,10
201408,3.3,211408,319,01-08-2014,01-08-2014,2014-08-01,10
201409,3.3,211408,320,01-09-2014,01-09-2014,2014-09-01,10
201410,3.3,211408,321,01-10-2014,01-10-2014,2014-10-01,10
201411,3.3,211408,322,01-11-2014,01-11-2014,2014-11-01,10
201412,3.3,211408,323,01-12-2014,01-12-2014,2014-12-01,10
201501,3.2,211408,324,01-01-2015,01-01-2015,2015-01-01,10
201502,3.2,211408,325,01-02-2015,01-02-2015,2015-02-01,10
201503,3.2,211408,326,01-03-2015,01-03-2015,2015-03-01,10
201504,3.2,211408,327,01-04-2015,01-04-2015,2015-04-01,10
201505,3.5,211408,328,01-05-2015,01-05-2015,2015-05-01,10
201506,3.5,211408,329,01-06-2015,01-06-2015,2015-06-01,10
201507,3.5,211408,330,01-07-2015,01-07-2015,2015-07-01,10
201508,3.45,211408,331,01-08-2015,01-08-2015,2015-08-01,10
201509,3.45,211408,332,01-09-2015,01-09-2015,2015-09-01,10
201510,3.45,211408,333,01-10-2015,01-10-2015,2015-10-01,10
201511,3.45,211408,334,01-11-2015,01-11-2015,2015-11-01,10
201512,3.45,211408,335,01-12-2015,01-12-2015,2015-12-01,10
201601,3.45,211408,336,01-01-2016,01-01-2016,2016-01-01,10
201602,3.45,211408,337,01-02-2016,01-02-2016,2016-02-01,10
201603,3.45,211408,338,01-03-2016,01-03-2016,2016-03-01,10
201604,3.45,211408,339,01-04-2016,01-04-2016,2016-04-01,10
201605,3.45,211408,340,01-05-2016,01-05-2016,2016-05-01,10
201606,3.45,211408,341,01-06-2016,01-06-2016,2016-06-01,10
201607,3.45,211408,342,01-07-2016,01-07-2016,2016-07-01,10
201608,3.45,211408,343,01-08-2016,01-08-2016,2016-08-01,10
201609,3.45,211408,344,01-09-2016,01-09-2016,2016-09-01,10
201610,3.45,211408,345,01-10-2016,01-10-2016,2016-10-01,10
201611,3.45,211408,346,01-11-2016,01-11-2016,2016-11-01,10
201612,3.45,211408,347,01-12-2016,01-12-2016,2016-12-01,10
201701,3.45,211408,348,01-01-2017,01-01-2017,2017-01-01,10
201702,3.7,211408,349,01-02-2017,01-02-2017,2017-02-01,10
201703,3.7,211408,350,01-03-2017,01-03-2017,2017-03-01,10
201704,3.7,211408,351,01-04-2017,01-04-2017,2017-04-01,10
201705,3.7,211408,352,01-05-2017,01-05-2017,2017-05-01,10
201706,3.7,211408,353,01-06-2017,01-06-2017,2017-06-01,10
201707,3.7,211408,354,01-07-2017,01-07-2017,2017-07-01,10
201708,3.7,211408,355,01-08-2017,01-08-2017,2017-08-01,10
201709,3.7,211408,356,01-09-2017,01-09-2017,2017-09-01,10
201710,3.75,211408,357,01-10-2017,01-10-2017,2017-10-01,10
201711,3.75,211408,358,01-11-2017,01-11-2017,2017-11-01,10
201712,3.75,211408,359,01-12-2017,01-12-2017,2017-12-01,10
201801,3.95,211408,360,01-01-2018,01-01-2018,2018-01-01,10
201802,3.95,211408,361,01-02-2018,01-02-2018,2018-02-01,10
201803,3.95,211408,362,01-03-2018,01-03-2018,2018-03-01,10
201804,3.5,211408,363,01-04-2018,01-04-2018,2018-04-01,10
201805,3.5,211408,364,01-05-2018,01-05-2018,2018-05-01,10
201806,3.5,211408,365,01-06-2018,01-06-2018,2018-06-01,10
201807,3.5,211408,366,01-07-2018,01-07-2018,2018-07-01,10
201808,3.5,211408,367,01-08-2018,01-08-2018,2018-08-01,10
201809,3.5,211408,368,01-09-2018,01-09-2018,2018-09-01,10
201810,3.5,211408,369,01-10-2018,01-10-2018,2018-10-01,10
201811,3.5,211408,370,01-11-2018,01-11-2018,2018-11-01,10
201812,3.5,211408,371,01-12-2018,01-12-2018,2018-12-01,10
201901,3.5999999,211408,372,01-01-2019,01-01-2019,2019-01-01,10
201902,3.5999999,211408,373,01-02-2019,01-02-2019,2019-02-01,10
201903,3.5999999,211408,374,01-03-2019,01-03-2019,2019-03-01,10
201904,3.5999999,211408,375,01-04-2019,01-04-2019,2019-04-01,10
201905,3.5999999,211408,376,01-05-2019,01-05-2019,2019-05-01,10
201906,3.5999999,211408,377,01-06-2019,01-06-2019,2019-06-01,10
201907,3.5999999,211408,378,01-07-2019,01-07-2019,2019-07-01,10
201908,3.4000001,211408,379,01-08-2019,01-08-2019,2019-08-01,10
201909,3.4000001,211408,380,01-09-2019,01-09-2019,2019-09-01,10
201910,3.4000001,211408,381,01-10-2019,01-10-2019,2019-10-01,10
201911,3.4000001,211408,382,01-11-2019,01-11-2019,2019-11-01,10
201912,3.4000001,211408,383,01-12-2019,01-12-2019,2019-12-01,10
202001,3.75,211408,384,01-01-2020,01-01-2020,2020-01-01,10
202002,3.75,211408,385,01-02-2020,01-02-2020,2020-02-01,10
202003,3.75,211408,386,01-03-2020,01-03-2020,2020-03-01,10
202004,3.75,211408,387,01-04-2020,01-04-2020,2020-04-01,10
202005,3.75,211408,388,01-05-2020,01-05-2020,2020-05-01,10
202006,3.75,211408,389,01-06-2020,01-06-2020,2020-06-01,10
202007,3.75,211408,390,01-07-2020,01-07-2020,2020-07-01,10
202008,3.75,211408,391,01-08-2020,01-08-2020,2020-08-01,10
202009,3.75,211408,392,01-09-2020,01-09-2020,2020-09-01,10
202010,3.4000001,211408,393,01-10-2020,01-10-2020,2020-10-01,10
202012,3.4000001,211408,395,01-12-2020,01-12-2020,2020-12-01,10
202101,3.4000001,211408,396,01-01-2021,01-01-2021,2021-01-01,10
202102,3.4000001,211408,397,01-02-2021,01-02-2021,2021-02-01,10
202103,3.4000001,211408,398,01-03-2021,01-03-2021,2021-03-01,10
202104,3.4000001,211408,399,01-04-2021,01-04-2021,2021-04-01,10
202105,3.4000001,211408,400,01-05-2021,01-05-2021,2021-05-01,10
202106,3.4000001,211408,401,01-06-2021,01-06-2021,2021-06-01,10
202107,3.4000001,211408,402,01-07-2021,01-07-2021,2021-07-01,10
202108,3.4000001,211408,403,01-08-2021,01-08-2021,2021-08-01,10
202109,3.4000001,211408,404,01-09-2021,01-09-2021,2021-09-01,10
202110,3.4000001,211408,405,01-10-2021,01-10-2021,2021-10-01,10
202111,3.4000001,211408,406,01-11-2021,01-11-2021,2021-11-01,10
202112,3.4000001,211408,407,01-12-2021,01-12-2021,2021-12-01,10
202201,3.4000001,211408,408,01-01-2022,01-01-2022,2022-01-01,10
202202,3.4000001,211408,409,01-02-2022,01-02-2022,2022-02-01,10
202203,3.4000001,211408,410,01-03-2022,01-03-2022,2022-03-01,10
202204,3.8,211408,411,01-04-2022,01-04-2022,2022-04-01,10
202205,3.8,211408,412,01-05-2022,01-05-2022,2022-05-01,10
202206,3.95,211408,413,01-06-2022,01-06-2022,2022-06-01,10
202207,4.6500001,211408,414,01-07-2022,01-07-2022,2022-07-01,10
202208,4.6500001,211408,415,01-08-2022,01-08-2022,2022-08-01,10
202209,4.6500001,211408,416,01-09-2022,01-09-2022,2022-09-01,10
202210,5.1500001,211408,417,01-10-2022,01-10-2022,2022-10-01,10
202211,5.1500001,211408,418,01-11-2022,01-11-2022,2022-11-01,10
202212,6.1500001,211408,419,01-12-2022,01-12-2022,2022-12-01,10
202301,6.1500001,211408,420,01-01-2023,01-01-2023,2023-01-01,10
202302,6.1500001,211408,421,01-02-2023,01-02-2023,2023-02-01,10
202303,5.1500001,211408,422,01-03-2023,01-03-2023,2023-03-01,10
202304,5.9499998,211408,423,01-04-2023,01-04-2023,2023-04-01,10
202305,5.9499998,211408,424,01-05-2023,01-05-2023,2023-05-01,10
202306,5.9499998,211408,425,01-06-2023,01-06-2023,2023-06-01,10
202307,5.9499998,211408,426,01-07-2023,01-07-2023,2023-07-01,10
202308,6,211408,427,01-08-2023,01-08-2023,2023-08-01,10
202309,7,211408,428,01-09-2023,01-09-2023,2023-09-01,10
202312,5.5,211408,431,01-12-2023,01-12-2023,2023-12-01,10
202401,5.8000002,211408,432,01-01-2024,01-01-2024,2024-01-01,10
202402,6.5,211408,433,01-02-2024,01-02-2024,2024-02-01,10
202403,6.5,211408,434,01-03-2024,01-03-2024,2024-03-01,10
202404,6.5,211408,435,01-04-2024,01-04-2024,2024-04-01,10
202405,6.5,211408,436,01-05-2024,01-05-2024,2024-05-01,10
202406,6.5,211408,437,01-06-2024,01-06-2024,2024-06-01,10
202407,6.5,211408,438,01-07-2024,01-07-2024,2024-07-01,10
202408,6.5,211408,439,01-08-2024,01-08-2024,2024-08-01,10
202409,6.5,211408,440,01-09-2024,01-09-2024,2024-09-01,10
202410,6.5,211408,441,01-10-2024,01-10-2024,2024-10-01,10
202411,6.5,211408,442,01-11-2024,01-11-2024,2024-11-01,10
202412,6.5,211408,443,01-12-2024,01-12-2024,2024-12-01,10
202501,6.5,211408,444,01-01-2025,01-01-2025,2025-01-01,10
202502,6.5,211408,445,01-02-2025,01-02-2025,2025-02-01,10
202503,5.8499999,211408,446,01-03-2025,01-03-2025,2025-03-01,10
202504,5.8499999,211408,447,01-04-2025,01-04-2025,2025-04-01,10
202505,5.5500002,211408,448,01-05-2025,01-05-2025,2025-05-01,10
202506,5.5500002,211408,449,01-06-2025,01-06-2025,2025-06-01,10
202507,5.5500002,211408,450,01-07-2025,01-07-2025,2025-07-01,10
202508,5.5500002,211408,451,01-08-2025,01-08-2025,2025-08-01,10
202509,5.5500002,211408,452,01-09-2025,01-09-2025,2025-09-01,10
200702,4.5900002,211408,229,01-02-2007,01-02-2007,2007-02-01,11
200703,4.5900002,211408,230,01-03-2007,01-03-2007,2007-03-01,11
200704,4.5900002,211408,231,01-04-2007,01-04-2007,2007-04-01,11
200705,4.5900002,211408,232,01-05-2007,01-05-2007,2007-05-01,11
200706,4.5900002,211408,233,01-06-2007,01-06-2007,2007-06-01,11
200707,4.5900002,211408,234,01-07-2007,01-07-2007,2007-07-01,11
200708,4.5900002,211408,235,01-08-2007,01-08-2007,2007-08-01,11
200709,4.5900002,211408,236,01-09-2007,01-09-2007,2007-09-01,11
200710,4.5900002,211408,237,01-10-2007,01-10-2007,2007-10-01,11
200711,4.5900002,211408,238,01-11-2007,01-11-2007,2007-11-01,11
200712,4.5900002,211408,239,01-12-2007,01-12-2007,2007-12-01,11
200801,4.5900002,211408,240,01-01-2008,01-01-2008,2008-01-01,11
200802,4.5900002,211408,241,01-02-2008,01-02-2008,2008-02-01,11
200803,4.5900002,211408,242,01-03-2008,01-03-2008,2008-03-01,11
200804,4.5900002,211408,243,01-04-2008,01-04-2008,2008-04-01,11
200805,4.5900002,211408,244,01-05-2008,01-05-2008,2008-05-01,11
200806,4.5900002,211408,245,01-06-2008,01-06-2008,2008-06-01,11
200807,4.5900002,211408,246,01-07-2008,01-07-2008,2008-07-01,11
200808,4.5900002,211408,247,01-08-2008,01-08-2008,2008-08-01,11
200809,4.5900002,211408,248,01-09-2008,01-09-2008,2008-09-01,11
200810,4.5900002,211408,249,01-10-2008,01-10-2008,2008-10-01,11
200811,4.5900002,211408,250,01-11-2008,01-11-2008,2008-11-01,11
200812,4.5900002,211408,251,01-12-2008,01-12-2008,2008-12-01,11
200901,4.5900002,211408,252,01-01-2009,01-01-2009,2009-01-01,11
200902,4.5900002,211408,253,01-02-2009,01-02-2009,2009-02-01,11
200903,4.5900002,211408,254,01-03-2009,01-03-2009,2009-03-01,11
200904,4.5900002,211408,255,01-04-2009,01-04-2009,2009-04-01,11
200905,4.5999999,211408,256,01-05-2009,01-05-2009,2009-05-01,11
200906,4.5900002,211408,257,01-06-2009,01-06-2009,2009-06-01,11
200907,4.6900001,211408,258,01-07-2009,01-07-2009,2009-07-01,11
200908,4.6900001,211408,259,01-08-2009,01-08-2009,2009-08-01,11
200909,4.5900002,211408,260,01-09-2009,01-09-2009,2009-09-01,11
200910,4.5900002,211408,261,01-10-2009,01-10-2009,2009-10-01,11
200911,4.5900002,211408,262,01-11-2009,01-11-2009,2009-11-01,11
200912,4.5900002,211408,263,01-12-2009,01-12-2009,2009-12-01,11
201001,4.6900001,211408,264,01-01-2010,01-01-2010,2010-01-01,11
201002,4.5900002,211408,265,01-02-2010,01-02-2010,2010-02-01,11
201003,4.5900002,211408,266,01-03-2010,01-03-2010,2010-03-01,11
201004,4.5900002,211408,267,01-04-2010,01-04-2010,2010-04-01,11
201005,4.5900002,211408,268,01-05-2010,01-05-2010,2010-05-01,11
201006,4.5900002,211408,269,01-06-2010,01-06-2010,2010-06-01,11
201007,4.5900002,211408,270,01-07-2010,01-07-2010,2010-07-01,11
201008,4.5900002,211408,271,01-08-2010,01-08-2010,2010-08-01,11
201009,4.6999998,211408,272,01-09-2010,01-09-2010,2010-09-01,11
201010,4.6999998,211408,273,01-10-2010,01-10-2010,2010-10-01,11
201011,4.6999998,211408,274,01-11-2010,01-11-2010,2010-11-01,11
201012,4.6999998,211408,275,01-12-2010,01-12-2010,2010-12-01,11
201101,4.6999998,211408,276,01-01-2011,01-01-2011,2011-01-01,11
201102,4.6999998,211408,277,01-02-2011,01-02-2011,2011-02-01,11
201103,4.6999998,211408,278,01-03-2011,01-03-2011,2011-03-01,11
201104,4.6999998,211408,279,01-04-2011,01-04-2011,2011-04-01,11
201105,4.6999998,211408,280,01-05-2011,01-05-2011,2011-05-01,11
201106,4.6999998,211408,281,01-06-2011,01-06-2011,2011-06-01,11
201107,4.5,211408,282,01-07-2011,01-07-2011,2011-07-01,11
201108,4.5,211408,283,01-08-2011,01-08-2011,2011-08-01,11
201109,4.5,211408,284,01-09-2011,01-09-2011,2011-09-01,11
201110,4.5,211408,285,01-10-2011,01-10-2011,2011-10-01,11
201111,4.5,211408,286,01-11-2011,01-11-2011,2011-11-01,11
201112,4.5,211408,287,01-12-2011,01-12-2011,2011-12-01,11
201201,4.5,211408,288,01-01-2012,01-01-2012,2012-01-01,11
201202,4.5,211408,289,01-02-2012,01-02-2012,2012-02-01,11
201203,4.5,211408,290,01-03-2012,01-03-2012,2012-03-01,11
201204,4.5,211408,291,01-04-2012,01-04-2012,2012-04-01,11
201205,4.5,211408,292,01-05-2012,01-05-2012,2012-05-01,11
201206,4.5,211408,293,01-06-2012,01-06-2012,2012-06-01,11
201207,4.5,211408,294,01-07-2012,01-07-2012,2012-07-01,11
201208,4.5,211408,295,01-08-2012,01-08-2012,2012-08-01,11
201209,4.5,211408,296,01-09-2012,01-09-2012,2012-09-01,11
201210,4.5,211408,297,01-10-2012,01-10-2012,2012-10-01,11
201211,4.5,211408,298,01-11-2012,01-11-2012,2012-11-01,11
201301,4.5,211408,300,01-01-2013,01-01-2013,2013-01-01,11
201306,3.6900001,211408,305,01-06-2013,01-06-2013,2013-06-01,11
201307,3.6900001,211408,306,01-07-2013,01-07-2013,2013-07-01,11
201308,3.6900001,211408,307,01-08-2013,01-08-2013,2013-08-01,11
201309,3.6900001,211408,308,01-09-2013,01-09-2013,2013-09-01,11
201310,3.6900001,211408,309,01-10-2013,01-10-2013,2013-10-01,11
201311,3.6900001,211408,310,01-11-2013,01-11-2013,2013-11-01,11
201312,3.6900001,211408,311,01-12-2013,01-12-2013,2013-12-01,11
201401,3.6900001,211408,312,01-01-2014,01-01-2014,2014-01-01,11
201402,3.6900001,211408,313,01-02-2014,01-02-2014,2014-02-01,11
201403,3.6900001,211408,314,01-03-2014,01-03-2014,2014-03-01,11
201404,3.6900001,211408,315,01-04-2014,01-04-2014,2014-04-01,11
201405,3.6900001,211408,316,01-05-2014,01-05-2014,2014-05-01,11
201406,3.6900001,211408,317,01-06-2014,01-06-2014,2014-06-01,11
201407,3.6900001,211408,318,01-07-2014,01-07-2014,2014-07-01,11
201408,3.6900001,211408,319,01-08-2014,01-08-2014,2014-08-01,11
201409,3.6900001,211408,320,01-09-2014,01-09-2014,2014-09-01,11
201410,3.6900001,211408,321,01-10-2014,01-10-2014,2014-10-01,11
201411,3.6900001,211408,322,01-11-2014,01-11-2014,2014-11-01,11
201412,3.6900001,211408,323,01-12-2014,01-12-2014,2014-12-01,11
201501,3.6900001,211408,324,01-01-2015,01-01-2015,2015-01-01,11
201502,3.6900001,211408,325,01-02-2015,01-02-2015,2015-02-01,11
201503,3.6900001,211408,326,01-03-2015,01-03-2015,2015-03-01,11
201504,3.6900001,211408,327,01-04-2015,01-04-2015,2015-04-01,11
201505,3.6900001,211408,328,01-05-2015,01-05-2015,2015-05-01,11
201506,3.6900001,211408,329,01-06-2015,01-06-2015,2015-06-01,11
201507,3.6900001,211408,330,01-07-2015,01-07-2015,2015-07-01,11
201508,3.6900001,211408,331,01-08-2015,01-08-2015,2015-08-01,11
201509,4.0500002,211408,332,01-09-2015,01-09-2015,2015-09-01,11
201510,4.0500002,211408,333,01-10-2015,01-10-2015,2015-10-01,11
201511,4.0500002,211408,334,01-11-2015,01-11-2015,2015-11-01,11
201512,4.0500002,211408,335,01-12-2015,01-12-2015,2015-12-01,11
201601,4.0500002,211408,336,01-01-2016,01-01-2016,2016-01-01,11
201602,4.0500002,211408,337,01-02-2016,01-02-2016,2016-02-01,11
201603,4.0500002,211408,338,01-03-2016,01-03-2016,2016-03-01,11
201604,4.0500002,211408,339,01-04-2016,01-04-2016,2016-04-01,11
201605,4.0500002,211408,340,01-05-2016,01-05-2016,2016-05-01,11
201606,4.0500002,211408,341,01-06-2016,01-06-2016,2016-06-01,11
201607,4.0500002,211408,342,01-07-2016,01-07-2016,2016-07-01,11
201608,4.0500002,211408,343,01-08-2016,01-08-2016,2016-08-01,11
201609,4.0500002,211408,344,01-09-2016,01-09-2016,2016-09-01,11
201610,4.0500002,211408,345,01-10-2016,01-10-2016,2016-10-01,11
201611,4.0500002,211408,346,01-11-2016,01-11-2016,2016-11-01,11
201612,4.0500002,211408,347,01-12-2016,01-12-2016,2016-12-01,11
201701,4.0500002,211408,348,01-01-2017,01-01-2017,2017-01-01,11
201702,4.0500002,211408,349,01-02-2017,01-02-2017,2017-02-01,11
201703,4.0500002,211408,350,01-03-2017,01-03-2017,2017-03-01,11
201705,4.7199998,211408,352,01-05-2017,01-05-2017,2017-05-01,11
201706,4.7199998,211408,353,01-06-2017,01-06-2017,2017-06-01,11
201707,4.7199998,211408,354,01-07-2017,01-07-2017,2017-07-01,11
201708,4.7199998,211408,355,01-08-2017,01-08-2017,2017-08-01,11
201709,4.7199998,211408,356,01-09-2017,01-09-2017,2017-09-01,11
201710,4.7199998,211408,357,01-10-2017,01-10-2017,2017-10-01,11
201711,4.7199998,211408,358,01-11-2017,01-11-2017,2017-11-01,11
201712,4.7199998,211408,359,01-12-2017,01-12-2017,2017-12-01,11
201801,4.9499998,211408,360,01-01-2018,01-01-2018,2018-01-01,11
201802,4.9499998,211408,361,01-02-2018,01-02-2018,2018-02-01,11
201803,4.9499998,211408,362,01-03-2018,01-03-2018,2018-03-01,11
201804,4.9499998,211408,363,01-04-2018,01-04-2018,2018-04-01,11
201805,4.9499998,211408,364,01-05-2018,01-05-2018,2018-05-01,11
201806,4.9499998,211408,365,01-06-2018,01-06-2018,2018-06-01,11
201807,4.9499998,211408,366,01-07-2018,01-07-2018,2018-07-01,11
201808,4.8499999,211408,367,01-08-2018,01-08-2018,2018-08-01,11
201809,4.8499999,211408,368,01-09-2018,01-09-2018,2018-09-01,11
201810,4.8499999,211408,369,01-10-2018,01-10-2018,2018-10-01,11
201811,4.8499999,211408,370,01-11-2018,01-11-2018,2018-11-01,11
201812,4.8499999,211408,371,01-12-2018,01-12-2018,2018-12-01,11
201901,4.8499999,211408,372,01-01-2019,01-01-2019,2019-01-01,11
201902,4.8499999,211408,373,01-02-2019,01-02-2019,2019-02-01,11
201903,4.8499999,211408,374,01-03-2019,01-03-2019,2019-03-01,11
201904,4.8499999,211408,375,01-04-2019,01-04-2019,2019-04-01,11
201905,4.8499999,211408,376,01-05-2019,01-05-2019,2019-05-01,11
201906,4.8499999,211408,377,01-06-2019,01-06-2019,2019-06-01,11
201907,4.8499999,211408,378,01-07-2019,01-07-2019,2019-07-01,11
201908,4.8499999,211408,379,01-08-2019,01-08-2019,2019-08-01,11
201909,4.8499999,211408,380,01-09-2019,01-09-2019,2019-09-01,11
201910,4.8499999,211408,381,01-10-2019,01-10-2019,2019-10-01,11
201911,4.8499999,211408,382,01-11-2019,01-11-2019,2019-11-01,11
201912,4.8499999,211408,383,01-12-2019,01-12-2019,2019-12-01,11
202001,4.8499999,211408,384,01-01-2020,01-01-2020,2020-01-01,11
202002,4.8499999,211408,385,01-02-2020,01-02-2020,2020-02-01,11
202003,4.8499999,211408,386,01-03-2020,01-03-2020,2020-03-01,11
202004,4.8499999,211408,387,01-04-2020,01-04-2020,2020-04-01,11
202005,4.8499999,211408,388,01-05-2020,01-05-2020,2020-05-01,11
202006,4.8499999,211408,389,01-06-2020,01-06-2020,2020-06-01,11
202007,4.8499999,211408,390,01-07-2020,01-07-2020,2020-07-01,11
202008,5,211408,391,01-08-2020,01-08-2020,2020-08-01,11
202009,5,211408,392,01-09-2020,01-09-2020,2020-09-01,11
202010,5,211408,393,01-10-2020,01-10-2020,2020-10-01,11
202011,5,211408,394,01-11-2020,01-11-2020,2020-11-01,11
202012,5,211408,395,01-12-2020,01-12-2020,2020-12-01,11
202102,5,211408,397,01-02-2021,01-02-2021,2021-02-01,11
202103,5,211408,398,01-03-2021,01-03-2021,2021-03-01,11
202104,5,211408,399,01-04-2021,01-04-2021,2021-04-01,11
202105,5,211408,400,01-05-2021,01-05-2021,2021-05-01,11
202106,5,211408,401,01-06-2021,01-06-2021,2021-06-01,11
202107,5,211408,402,01-07-2021,01-07-2021,2021-07-01,11
202108,5,211408,403,01-08-2021,01-08-2021,2021-08-01,11
202109,5,211408,404,01-09-2021,01-09-2021,2021-09-01,11
202110,5,211408,405,01-10-2021,01-10-2021,2021-10-01,11
202111,5,211408,406,01-11-2021,01-11-2021,2021-11-01,11
202112,5,211408,407,01-12-2021,01-12-2021,2021-12-01,11
202201,5,211408,408,01-01-2022,01-01-2022,2022-01-01,11
202202,5,211408,409,01-02-2022,01-02-2022,2022-02-01,11
202203,5,211408,410,01-03-2022,01-03-2022,2022-03-01,11
202204,5,211408,411,01-04-2022,01-04-2022,2022-04-01,11
202205,5,211408,412,01-05-2022,01-05-2022,2022-05-01,11
202206,5,211408,413,01-06-2022,01-06-2022,2022-06-01,11
202207,5,211408,414,01-07-2022,01-07-2022,2022-07-01,11
202208,5.25,211408,415,01-08-2022,01-08-2022,2022-08-01,11
202209,5.25,211408,416,01-09-2022,01-09-2022,2022-09-01,11
202210,5.25,211408,417,01-10-2022,01-10-2022,2022-10-01,11
202211,5.3000002,211408,418,01-11-2022,01-11-2022,2022-11-01,11
202301,8,211408,420,01-01-2023,01-01-2023,2023-01-01,11
202302,8,211408,421,01-02-2023,01-02-2023,2023-02-01,11
202303,8,211408,422,01-03-2023,01-03-2023,2023-03-01,11
202304,8,211408,423,01-04-2023,01-04-2023,2023-04-01,11
202305,8,211408,424,01-05-2023,01-05-2023,2023-05-01,11
202306,8,211408,425,01-06-2023,01-06-2023,2023-06-01,11
202307,8,211408,426,01-07-2023,01-07-2023,2023-07-01,11
202308,8,211408,427,01-08-2023,01-08-2023,2023-08-01,11
202309,8,211408,428,01-09-2023,01-09-2023,2023-09-01,11
202311,8,211408,430,01-11-2023,01-11-2023,2023-11-01,11
202401,8,211408,432,01-01-2024,01-01-2024,2024-01-01,11
202402,8.9499998,211408,433,01-02-2024,01-02-2024,2024-02-01,11
202403,8.9499998,211408,434,01-03-2024,01-03-2024,2024-03-01,11
202404,8.9499998,211408,435,01-04-2024,01-04-2024,2024-04-01,11
202405,8.9499998,211408,436,01-05-2024,01-05-2024,2024-05-01,11
202406,9.5,211408,437,01-06-2024,01-06-2024,2024-06-01,11
202407,9.5,211408,438,01-07-2024,01-07-2024,2024-07-01,11
202408,9.5,211408,439,01-08-2024,01-08-2024,2024-08-01,11
202409,9.5,211408,440,01-09-2024,01-09-2024,2024-09-01,11
202410,9.5,211408,441,01-10-2024,01-10-2024,2024-10-01,11
202411,9.5,211408,442,01-11-2024,01-11-2024,2024-11-01,11
202412,9.5,211408,443,01-12-2024,01-12-2024,2024-12-01,11
202503,7,211408,446,01-03-2025,01-03-2025,2025-03-01,11
202504,7,211408,447,01-04-2025,01-04-2025,2025-04-01,11
202505,7,211408,448,01-05-2025,01-05-2025,2025-05-01,11
202506,7,211408,449,01-06-2025,01-06-2025,2025-06-01,11
202507,7,211408,450,01-07-2025,01-07-2025,2025-07-01,11
202508,7,211408,451,01-08-2025,01-08-2025,2025-08-01,11
202509,5.5999999,211408,452,01-09-2025,01-09-2025,2025-09-01,11
200702,2.98,211408,229,01-02-2007,01-02-2007,2007-02-01,12
200703,2.98,211408,230,01-03-2007,01-03-2007,2007-03-01,12
200704,2.98,211408,231,01-04-2007,01-04-2007,2007-04-01,12
200705,2.5599999,211408,232,01-05-2007,01-05-2007,2007-05-01,12
200706,2.5599999,211408,233,01-06-2007,01-06-2007,2007-06-01,12
200707,2.5599999,211408,234,01-07-2007,01-07-2007,2007-07-01,12
200708,2.78,211408,235,01-08-2007,01-08-2007,2007-08-01,12
200709,2.78,211408,236,01-09-2007,01-09-2007,2007-09-01,12
200710,2.78,211408,237,01-10-2007,01-10-2007,2007-10-01,12
200711,2.78,211408,238,01-11-2007,01-11-2007,2007-11-01,12
200712,2.74,211408,239,01-12-2007,01-12-2007,2007-12-01,12
200801,2.98,211408,240,01-01-2008,01-01-2008,2008-01-01,12
200802,2.25,211408,241,01-02-2008,01-02-2008,2008-02-01,12
200803,2.24,211408,242,01-03-2008,01-03-2008,2008-03-01,12
200804,2.24,211408,243,01-04-2008,01-04-2008,2008-04-01,12
200805,2.1600001,211408,244,01-05-2008,01-05-2008,2008-05-01,12
200806,2.8800001,211408,245,01-06-2008,01-06-2008,2008-06-01,12
200807,2.8800001,211408,246,01-07-2008,01-07-2008,2008-07-01,12
200808,2.8599999,211408,247,01-08-2008,01-08-2008,2008-08-01,12
200809,2.8399999,211408,248,01-09-2008,01-09-2008,2008-09-01,12
200810,2.8299999,211408,249,01-10-2008,01-10-2008,2008-10-01,12
200811,3.48,211408,250,01-11-2008,01-11-2008,2008-11-01,12
200812,3.47,211408,251,01-12-2008,01-12-2008,2008-12-01,12
200901,3.46,211408,252,01-01-2009,01-01-2009,2009-01-01,12
200902,3.4400001,211408,253,01-02-2009,01-02-2009,2009-02-01,12
200903,3.4200001,211408,254,01-03-2009,01-03-2009,2009-03-01,12
200904,2.99,211408,255,01-04-2009,01-04-2009,2009-04-01,12
200905,2.99,211408,256,01-05-2009,01-05-2009,2009-05-01,12
200906,3.4100001,211408,257,01-06-2009,01-06-2009,2009-06-01,12
200907,3.4000001,211408,258,01-07-2009,01-07-2009,2009-07-01,12
200908,3.3800001,211408,259,01-08-2009,01-08-2009,2009-08-01,12
200909,3.3800001,211408,260,01-09-2009,01-09-2009,2009-09-01,12
200910,3.3699999,211408,261,01-10-2009,01-10-2009,2009-10-01,12
200911,3.3499999,211408,262,01-11-2009,01-11-2009,2009-11-01,12
200912,3.3299999,211408,263,01-12-2009,01-12-2009,2009-12-01,12
201001,3.3199999,211408,264,01-01-2010,01-01-2010,2010-01-01,12
201002,3.3,211408,265,01-02-2010,01-02-2010,2010-02-01,12
201003,3.27,211408,266,01-03-2010,01-03-2010,2010-03-01,12
201004,3.26,211408,267,01-04-2010,01-04-2010,2010-04-01,12
201005,3.26,211408,268,01-05-2010,01-05-2010,2010-05-01,12
201006,3.26,211408,269,01-06-2010,01-06-2010,2010-06-01,12
201007,3.25,211408,270,01-07-2010,01-07-2010,2010-07-01,12
201008,3.25,211408,271,01-08-2010,01-08-2010,2010-08-01,12
201009,2.98,211408,272,01-09-2010,01-09-2010,2010-09-01,12
201010,2.98,211408,273,01-10-2010,01-10-2010,2010-10-01,12
201011,2.98,211408,274,01-11-2010,01-11-2010,2010-11-01,12
201012,2.98,211408,275,01-12-2010,01-12-2010,2010-12-01,12
201101,2.98,211408,276,01-01-2011,01-01-2011,2011-01-01,12
201102,2.98,211408,277,01-02-2011,01-02-2011,2011-02-01,12
201103,2.98,211408,278,01-03-2011,01-03-2011,2011-03-01,12
201104,2.98,211408,279,01-04-2011,01-04-2011,2011-04-01,12
201105,2.98,211408,280,01-05-2011,01-05-2011,2011-05-01,12
201106,2.98,211408,281,01-06-2011,01-06-2011,2011-06-01,12
201107,2.6800001,211408,282,01-07-2011,01-07-2011,2011-07-01,12
201108,2.6800001,211408,283,01-08-2011,01-08-2011,2011-08-01,12
201109,3.28,211408,284,01-09-2011,01-09-2011,2011-09-01,12
201110,3.3800001,211408,285,01-10-2011,01-10-2011,2011-10-01,12
201111,3.3800001,211408,286,01-11-2011,01-11-2011,2011-11-01,12
201112,3.28,211408,287,01-12-2011,01-12-2011,2011-12-01,12
201201,3,211408,288,01-01-2012,01-01-2012,2012-01-01,12
201202,3,211408,289,01-02-2012,01-02-2012,2012-02-01,12
201203,3,211408,290,01-03-2012,01-03-2012,2012-03-01,12
201204,3.3800001,211408,291,01-04-2012,01-04-2012,2012-04-01,12
201205,3.3800001,211408,292,01-05-2012,01-05-2012,2012-05-01,12
201206,3.3800001,211408,293,01-06-2012,01-06-2012,2012-06-01,12
201207,2.98,211408,294,01-07-2012,01-07-2012,2012-07-01,12
201208,2.98,211408,295,01-08-2012,01-08-2012,2012-08-01,12
201209,2.98,211408,296,01-09-2012,01-09-2012,2012-09-01,12
201210,2.98,211408,297,01-10-2012,01-10-2012,2012-10-01,12
201211,2,211408,298,01-11-2012,01-11-2012,2012-11-01,12
201212,2.98,211408,299,01-12-2012,01-12-2012,2012-12-01,12
201301,2.98,211408,300,01-01-2013,01-01-2013,2013-01-01,12
201302,2.98,211408,301,01-02-2013,01-02-2013,2013-02-01,12
201303,2.98,211408,302,01-03-2013,01-03-2013,2013-03-01,12
201304,2.98,211408,303,01-04-2013,01-04-2013,2013-04-01,12
201305,2.98,211408,304,01-05-2013,01-05-2013,2013-05-01,12
201306,3.98,211408,305,01-06-2013,01-06-2013,2013-06-01,12
201307,3.98,211408,306,01-07-2013,01-07-2013,2013-07-01,12
201308,3.98,211408,307,01-08-2013,01-08-2013,2013-08-01,12
201309,3.98,211408,308,01-09-2013,01-09-2013,2013-09-01,12
201310,3,211408,309,01-10-2013,01-10-2013,2013-10-01,12
201311,3.98,211408,310,01-11-2013,01-11-2013,2013-11-01,12
201312,3.98,211408,311,01-12-2013,01-12-2013,2013-12-01,12
201401,2,211408,312,01-01-2014,01-01-2014,2014-01-01,12
201402,2,211408,313,01-02-2014,01-02-2014,2014-02-01,12
201403,2,211408,314,01-03-2014,01-03-2014,2014-03-01,12
201404,2,211408,315,01-04-2014,01-04-2014,2014-04-01,12
201405,3.98,211408,316,01-05-2014,01-05-2014,2014-05-01,12
201406,3.98,211408,317,01-06-2014,01-06-2014,2014-06-01,12
201407,2,211408,318,01-07-2014,01-07-2014,2014-07-01,12
201408,3.98,211408,319,01-08-2014,01-08-2014,2014-08-01,12
201409,3.98,211408,320,01-09-2014,01-09-2014,2014-09-01,12
201410,3.24,211408,321,01-10-2014,01-10-2014,2014-10-01,12
201411,3.24,211408,322,01-11-2014,01-11-2014,2014-11-01,12
201412,3.25,211408,323,01-12-2014,01-12-2014,2014-12-01,12
201501,1.87,211408,324,01-01-2015,01-01-2015,2015-01-01,12
201502,1.87,211408,325,01-02-2015,01-02-2015,2015-02-01,12
201503,1.87,211408,326,01-03-2015,01-03-2015,2015-03-01,12
201504,3.25,211408,327,01-04-2015,01-04-2015,2015-04-01,12
201505,3.7,211408,328,01-05-2015,01-05-2015,2015-05-01,12
201506,3.7,211408,329,01-06-2015,01-06-2015,2015-06-01,12
201507,2.6700001,211408,330,01-07-2015,01-07-2015,2015-07-01,12
201508,2.6700001,211408,331,01-08-2015,01-08-2015,2015-08-01,12
201509,2.6700001,211408,332,01-09-2015,01-09-2015,2015-09-01,12
201510,3.7,211408,333,01-10-2015,01-10-2015,2015-10-01,12
201511,3.7,211408,334,01-11-2015,01-11-2015,2015-11-01,12
201512,3.7,211408,335,01-12-2015,01-12-2015,2015-12-01,12
201601,2,211408,336,01-01-2016,01-01-2016,2016-01-01,12
201602,2,211408,337,01-02-2016,01-02-2016,2016-02-01,12
201603,2,211408,338,01-03-2016,01-03-2016,2016-03-01,12
201604,3.7,211408,339,01-04-2016,01-04-2016,2016-04-01,12
201605,4.25,211408,340,01-05-2016,01-05-2016,2016-05-01,12
201606,2.5,211408,341,01-06-2016,01-06-2016,2016-06-01,12
201607,3,211408,342,01-07-2016,01-07-2016,2016-07-01,12
201608,2.5,211408,343,01-08-2016,01-08-2016,2016-08-01,12
201609,2.5,211408,344,01-09-2016,01-09-2016,2016-09-01,12
201610,4.25,211408,345,01-10-2016,01-10-2016,2016-10-01,12
201611,4.25,211408,346,01-11-2016,01-11-2016,2016-11-01,12
201612,4.25,211408,347,01-12-2016,01-12-2016,2016-12-01,12
201701,3,211408,348,01-01-2017,01-01-2017,2017-01-01,12
201702,3,211408,349,01-02-2017,01-02-2017,2017-02-01,12
201703,3,211408,350,01-03-2017,01-03-2017,2017-03-01,12
201704,4.25,211408,351,01-04-2017,01-04-2017,2017-04-01,12
201705,4.25,211408,352,01-05-2017,01-05-2017,2017-05-01,12
201706,4.25,211408,353,01-06-2017,01-06-2017,2017-06-01,12
201707,3,211408,354,01-07-2017,01-07-2017,2017-07-01,12
201708,3,211408,355,01-08-2017,01-08-2017,2017-08-01,12
201709,3,211408,356,01-09-2017,01-09-2017,2017-09-01,12
201710,4.25,211408,357,01-10-2017,01-10-2017,2017-10-01,12
201711,2.5,211408,358,01-11-2017,01-11-2017,2017-11-01,12
201712,4.25,211408,359,01-12-2017,01-12-2017,2017-12-01,12
201801,3,211408,360,01-01-2018,01-01-2018,2018-01-01,12
201802,3,211408,361,01-02-2018,01-02-2018,2018-02-01,12
201803,4.25,211408,362,01-03-2018,01-03-2018,2018-03-01,12
201804,3,211408,363,01-04-2018,01-04-2018,2018-04-01,12
201805,3,211408,364,01-05-2018,01-05-2018,2018-05-01,12
201806,4.25,211408,365,01-06-2018,01-06-2018,2018-06-01,12
201807,2.5,211408,366,01-07-2018,01-07-2018,2018-07-01,12
201808,2.5,211408,367,01-08-2018,01-08-2018,2018-08-01,12
201809,4.25,211408,368,01-09-2018,01-09-2018,2018-09-01,12
201810,2.5,211408,369,01-10-2018,01-10-2018,2018-10-01,12
201811,4.25,211408,370,01-11-2018,01-11-2018,2018-11-01,12
201812,4.25,211408,371,01-12-2018,01-12-2018,2018-12-01,12
201901,2.5,211408,372,01-01-2019,01-01-2019,2019-01-01,12
201902,2.5,211408,373,01-02-2019,01-02-2019,2019-02-01,12
201903,4.25,211408,374,01-03-2019,01-03-2019,2019-03-01,12
201904,4.25,211408,375,01-04-2019,01-04-2019,2019-04-01,12
201905,2.5,211408,376,01-05-2019,01-05-2019,2019-05-01,12
201906,2.5,211408,377,01-06-2019,01-06-2019,2019-06-01,12
201907,4.25,211408,378,01-07-2019,01-07-2019,2019-07-01,12
201908,4.25,211408,379,01-08-2019,01-08-2019,2019-08-01,12
201909,4.25,211408,380,01-09-2019,01-09-2019,2019-09-01,12
201910,4.25,211408,381,01-10-2019,01-10-2019,2019-10-01,12
201911,4.25,211408,382,01-11-2019,01-11-2019,2019-11-01,12
201912,4.25,211408,383,01-12-2019,01-12-2019,2019-12-01,12
202001,2,211408,384,01-01-2020,01-01-2020,2020-01-01,12
202002,4.25,211408,385,01-02-2020,01-02-2020,2020-02-01,12
202003,2.5,211408,386,01-03-2020,01-03-2020,2020-03-01,12
202004,4.25,211408,387,01-04-2020,01-04-2020,2020-04-01,12
202005,4.25,211408,388,01-05-2020,01-05-2020,2020-05-01,12
202006,4.25,211408,389,01-06-2020,01-06-2020,2020-06-01,12
202007,4.25,211408,390,01-07-2020,01-07-2020,2020-07-01,12
202008,2.5,211408,391,01-08-2020,01-08-2020,2020-08-01,12
202009,4.25,211408,392,01-09-2020,01-09-2020,2020-09-01,12
202010,2.5,211408,393,01-10-2020,01-10-2020,2020-10-01,12
202011,4.25,211408,394,01-11-2020,01-11-2020,2020-11-01,12
202012,4.25,211408,395,01-12-2020,01-12-2020,2020-12-01,12
202101,2.5,211408,396,01-01-2021,01-01-2021,2021-01-01,12
202102,4.25,211408,397,01-02-2021,01-02-2021,2021-02-01,12
202103,2.5,211408,398,01-03-2021,01-03-2021,2021-03-01,12
202104,4.25,211408,399,01-04-2021,01-04-2021,2021-04-01,12
202105,2.5,211408,400,01-05-2021,01-05-2021,2021-05-01,12
202106,3.75,211408,401,01-06-2021,01-06-2021,2021-06-01,12
202107,3.75,211408,402,01-07-2021,01-07-2021,2021-07-01,12
202108,3.75,211408,403,01-08-2021,01-08-2021,2021-08-01,12
202109,3,211408,404,01-09-2021,01-09-2021,2021-09-01,12
202110,3.75,211408,405,01-10-2021,01-10-2021,2021-10-01,12
202111,3.75,211408,406,01-11-2021,01-11-2021,2021-11-01,12
202112,3.75,211408,407,01-12-2021,01-12-2021,2021-12-01,12
202201,3,211408,408,01-01-2022,01-01-2022,2022-01-01,12
202202,3.75,211408,409,01-02-2022,01-02-2022,2022-02-01,12
202203,3.75,211408,410,01-03-2022,01-03-2022,2022-03-01,12
202204,3.75,211408,411,01-04-2022,01-04-2022,2022-04-01,12
202205,4,211408,412,01-05-2022,01-05-2022,2022-05-01,12
202206,4.5,211408,413,01-06-2022,01-06-2022,2022-06-01,12
202207,4.5,211408,414,01-07-2022,01-07-2022,2022-07-01,12
202208,4.5,211408,415,01-08-2022,01-08-2022,2022-08-01,12
202210,4.5,211408,417,01-10-2022,01-10-2022,2022-10-01,12
202211,3,211408,418,01-11-2022,01-11-2022,2022-11-01,12
202212,4.5,211408,419,01-12-2022,01-12-2022,2022-12-01,12
202301,6,211408,420,01-01-2023,01-01-2023,2023-01-01,12
202302,6,211408,421,01-02-2023,01-02-2023,2023-02-01,12
202303,6,211408,422,01-03-2023,01-03-2023,2023-03-01,12
202304,6.5,211408,423,01-04-2023,01-04-2023,2023-04-01,12
202305,6.5,211408,424,01-05-2023,01-05-2023,2023-05-01,12
202306,6.5,211408,425,01-06-2023,01-06-2023,2023-06-01,12
202307,7.5,211408,426,01-07-2023,01-07-2023,2023-07-01,12
202308,5,211408,427,01-08-2023,01-08-2023,2023-08-01,12
202309,7.5,211408,428,01-09-2023,01-09-2023,2023-09-01,12
202310,7.5,211408,429,01-10-2023,01-10-2023,2023-10-01,12
202311,7.5,211408,430,01-11-2023,01-11-2023,2023-11-01,12
202312,7.5,211408,431,01-12-2023,01-12-2023,2023-12-01,12
202401,8.5,211408,432,01-01-2024,01-01-2024,2024-01-01,12
202402,6.5,211408,433,01-02-2024,01-02-2024,2024-02-01,12
202403,8.5,211408,434,01-03-2024,01-03-2024,2024-03-01,12
202404,8.5,211408,435,01-04-2024,01-04-2024,2024-04-01,12
202405,6.5,211408,436,01-05-2024,01-05-2024,2024-05-01,12
202406,10,211408,437,01-06-2024,01-06-2024,2024-06-01,12
202407,6.5,211408,438,01-07-2024,01-07-2024,2024-07-01,12
202408,10,211408,439,01-08-2024,01-08-2024,2024-08-01,12
202409,10,211408,440,01-09-2024,01-09-2024,2024-09-01,12
202410,7.5,211408,441,01-10-2024,01-10-2024,2024-10-01,12
202411,10,211408,442,01-11-2024,01-11-2024,2024-11-01,12
202412,9,211408,443,01-12-2024,01-12-2024,2024-12-01,12
202501,9,211408,444,01-01-2025,01-01-2025,2025-01-01,12
202502,6.48,211408,445,01-02-2025,01-02-2025,2025-02-01,12
202503,7.48,211408,446,01-03-2025,01-03-2025,2025-03-01,12
202504,5.48,211408,447,01-04-2025,01-04-2025,2025-04-01,12
202505,7.48,211408,448,01-05-2025,01-05-2025,2025-05-01,12
202506,7.48,211408,449,01-06-2025,01-06-2025,2025-06-01,12
202507,4.98,211408,450,01-07-2025,01-07-2025,2025-07-01,12
202508,7.48,211408,451,01-08-2025,01-08-2025,2025-08-01,12
202509,7.48,211408,452,01-09-2025,01-09-2025,2025-09-01,12
200702,6.79,211408,229,01-02-2007,01-02-2007,2007-02-01,13
200703,6.79,211408,230,01-03-2007,01-03-2007,2007-03-01,13
200704,5.9899998,211408,231,01-04-2007,01-04-2007,2007-04-01,13
200705,5.9899998,211408,232,01-05-2007,01-05-2007,2007-05-01,13
200706,5.9899998,211408,233,01-06-2007,01-06-2007,2007-06-01,13
200707,5.9899998,211408,234,01-07-2007,01-07-2007,2007-07-01,13
200708,5.9899998,211408,235,01-08-2007,01-08-2007,2007-08-01,13
200709,5.9899998,211408,236,01-09-2007,01-09-2007,2007-09-01,13
200710,5.9899998,211408,237,01-10-2007,01-10-2007,2007-10-01,13
200711,5.9899998,211408,238,01-11-2007,01-11-2007,2007-11-01,13
200712,6.29,211408,239,01-12-2007,01-12-2007,2007-12-01,13
200801,6.29,211408,240,01-01-2008,01-01-2008,2008-01-01,13
200802,6.29,211408,241,01-02-2008,01-02-2008,2008-02-01,13
200803,6.29,211408,242,01-03-2008,01-03-2008,2008-03-01,13
200812,3.78,211408,251,01-12-2008,01-12-2008,2008-12-01,13
200901,3.78,211408,252,01-01-2009,01-01-2009,2009-01-01,13
200902,1.89,211408,253,01-02-2009,01-02-2009,2009-02-01,13
200903,3.78,211408,254,01-03-2009,01-03-2009,2009-03-01,13
200904,3.78,211408,255,01-04-2009,01-04-2009,2009-04-01,13
200905,3.78,211408,256,01-05-2009,01-05-2009,2009-05-01,13
200906,3.78,211408,257,01-06-2009,01-06-2009,2009-06-01,13
200907,3.78,211408,258,01-07-2009,01-07-2009,2009-07-01,13
200908,3.78,211408,259,01-08-2009,01-08-2009,2009-08-01,13
200909,3.78,211408,260,01-09-2009,01-09-2009,2009-09-01,13
200910,3.78,211408,261,01-10-2009,01-10-2009,2009-10-01,13
200911,3.78,211408,262,01-11-2009,01-11-2009,2009-11-01,13
200912,3.78,211408,263,01-12-2009,01-12-2009,2009-12-01,13
201001,3.78,211408,264,01-01-2010,01-01-2010,2010-01-01,13
201002,3.78,211408,265,01-02-2010,01-02-2010,2010-02-01,13
201003,3.78,211408,266,01-03-2010,01-03-2010,2010-03-01,13
201004,3.78,211408,267,01-04-2010,01-04-2010,2010-04-01,13
201005,3.78,211408,268,01-05-2010,01-05-2010,2010-05-01,13
201006,3,211408,269,01-06-2010,01-06-2010,2010-06-01,13
201007,3.78,211408,270,01-07-2010,01-07-2010,2010-07-01,13
201008,3.78,211408,271,01-08-2010,01-08-2010,2010-08-01,13
201010,3,211408,273,01-10-2010,01-10-2010,2010-10-01,13
201011,3.79,211408,274,01-11-2010,01-11-2010,2010-11-01,13
201012,3.79,211408,275,01-12-2010,01-12-2010,2010-12-01,13
201101,1.85,211408,276,01-01-2011,01-01-2011,2011-01-01,13
201102,2,211408,277,01-02-2011,01-02-2011,2011-02-01,13
201103,3.79,211408,278,01-03-2011,01-03-2011,2011-03-01,13
201105,2.98,211408,280,01-05-2011,01-05-2011,2011-05-01,13
201106,2.98,211408,281,01-06-2011,01-06-2011,2011-06-01,13
201107,3.29,211408,282,01-07-2011,01-07-2011,2011-07-01,13
201108,2.6800001,211408,283,01-08-2011,01-08-2011,2011-08-01,13
201109,2.6800001,211408,284,01-09-2011,01-09-2011,2011-09-01,13
201110,2.5999999,211408,285,01-10-2011,01-10-2011,2011-10-01,13
201111,2.5999999,211408,286,01-11-2011,01-11-2011,2011-11-01,13
201112,3.28,211408,287,01-12-2011,01-12-2011,2011-12-01,13
201201,3.28,211408,288,01-01-2012,01-01-2012,2012-01-01,13
201202,3.3900001,211408,289,01-02-2012,01-02-2012,2012-02-01,13
201203,3.0899999,211408,290,01-03-2012,01-03-2012,2012-03-01,13
201205,3.3900001,211408,292,01-05-2012,01-05-2012,2012-05-01,13
201207,3.3900001,211408,294,01-07-2012,01-07-2012,2012-07-01,13
201208,3,211408,295,01-08-2012,01-08-2012,2012-08-01,13
201209,3,211408,296,01-09-2012,01-09-2012,2012-09-01,13
201211,3.3900001,211408,298,01-11-2012,01-11-2012,2012-11-01,13
201301,4.9899998,211408,300,01-01-2013,01-01-2013,2013-01-01,13
201302,2.49,211408,301,01-02-2013,01-02-2013,2013-02-01,13
201304,2.49,211408,303,01-04-2013,01-04-2013,2013-04-01,13
201305,6,211408,304,01-05-2013,01-05-2013,2013-05-01,13
201307,6,211408,306,01-07-2013,01-07-2013,2013-07-01,13
201308,6,211408,307,01-08-2013,01-08-2013,2013-08-01,13
201310,6,211408,309,01-10-2013,01-10-2013,2013-10-01,13
201311,6,211408,310,01-11-2013,01-11-2013,2013-11-01,13
201312,6,211408,311,01-12-2013,01-12-2013,2013-12-01,13
201401,3,211408,312,01-01-2014,01-01-2014,2014-01-01,13
201402,3,211408,313,01-02-2014,01-02-2014,2014-02-01,13
201403,5.5,211408,314,01-03-2014,01-03-2014,2014-03-01,13
201405,2.75,211408,316,01-05-2014,01-05-2014,2014-05-01,13
201406,5.5,211408,317,01-06-2014,01-06-2014,2014-06-01,13
201407,5.5,211408,318,01-07-2014,01-07-2014,2014-07-01,13
201408,3,211408,319,01-08-2014,01-08-2014,2014-08-01,13
201409,5.5,211408,320,01-09-2014,01-09-2014,2014-09-01,13
201410,4.5,211408,321,01-10-2014,01-10-2014,2014-10-01,13
201411,4.9499998,211408,322,01-11-2014,01-11-2014,2014-11-01,13
201412,4.9499998,211408,323,01-12-2014,01-12-2014,2014-12-01,13
201501,4.9499998,211408,324,01-01-2015,01-01-2015,2015-01-01,13
201503,5.5,211408,326,01-03-2015,01-03-2015,2015-03-01,13
201504,4,211408,327,01-04-2015,01-04-2015,2015-04-01,13
201505,5.5,211408,328,01-05-2015,01-05-2015,2015-05-01,13
201506,5.5,211408,329,01-06-2015,01-06-2015,2015-06-01,13
201507,4,211408,330,01-07-2015,01-07-2015,2015-07-01,13
201508,6.5,211408,331,01-08-2015,01-08-2015,2015-08-01,13
201509,6.5,211408,332,01-09-2015,01-09-2015,2015-09-01,13
201510,4,211408,333,01-10-2015,01-10-2015,2015-10-01,13
201511,6.5,211408,334,01-11-2015,01-11-2015,2015-11-01,13
201512,4,211408,335,01-12-2015,01-12-2015,2015-12-01,13
201601,4,211408,336,01-01-2016,01-01-2016,2016-01-01,13
201602,5,211408,337,01-02-2016,01-02-2016,2016-02-01,13
201603,6.5,211408,338,01-03-2016,01-03-2016,2016-03-01,13
201604,4.5,211408,339,01-04-2016,01-04-2016,2016-04-01,13
201605,6.5,211408,340,01-05-2016,01-05-2016,2016-05-01,13
201606,6.5,211408,341,01-06-2016,01-06-2016,2016-06-01,13
201607,4,211408,342,01-07-2016,01-07-2016,2016-07-01,13
201608,6.5,211408,343,01-08-2016,01-08-2016,2016-08-01,13
201609,4,211408,344,01-09-2016,01-09-2016,2016-09-01,13
201610,6.5,211408,345,01-10-2016,01-10-2016,2016-10-01,13
201611,4,211408,346,01-11-2016,01-11-2016,2016-11-01,13
201612,4,211408,347,01-12-2016,01-12-2016,2016-12-01,13
201701,6.5,211408,348,01-01-2017,01-01-2017,2017-01-01,13
201702,6.5,211408,349,01-02-2017,01-02-2017,2017-02-01,13
201703,6.5,211408,350,01-03-2017,01-03-2017,2017-03-01,13
201704,6.5,211408,351,01-04-2017,01-04-2017,2017-04-01,13
201705,6.5,211408,352,01-05-2017,01-05-2017,2017-05-01,13
201706,6.5,211408,353,01-06-2017,01-06-2017,2017-06-01,13
201707,6.5,211408,354,01-07-2017,01-07-2017,2017-07-01,13
201708,6.5,211408,355,01-08-2017,01-08-2017,2017-08-01,13
201709,5,211408,356,01-09-2017,01-09-2017,2017-09-01,13
201710,6.9899998,211408,357,01-10-2017,01-10-2017,2017-10-01,13
201711,6.9899998,211408,358,01-11-2017,01-11-2017,2017-11-01,13
201712,5,211408,359,01-12-2017,01-12-2017,2017-12-01,13
201801,6.9899998,211408,360,01-01-2018,01-01-2018,2018-01-01,13
201802,6.9899998,211408,361,01-02-2018,01-02-2018,2018-02-01,13
201803,5,211408,362,01-03-2018,01-03-2018,2018-03-01,13
201804,5,211408,363,01-04-2018,01-04-2018,2018-04-01,13
201805,6.9899998,211408,364,01-05-2018,01-05-2018,2018-05-01,13
201806,5,211408,365,01-06-2018,01-06-2018,2018-06-01,13
201807,6.9899998,211408,366,01-07-2018,01-07-2018,2018-07-01,13
201808,6.9899998,211408,367,01-08-2018,01-08-2018,2018-08-01,13
201809,4.5,211408,368,01-09-2018,01-09-2018,2018-09-01,13
201810,6.9899998,211408,369,01-10-2018,01-10-2018,2018-10-01,13
201811,6.9899998,211408,370,01-11-2018,01-11-2018,2018-11-01,13
201812,4,211408,371,01-12-2018,01-12-2018,2018-12-01,13
201901,6.9899998,211408,372,01-01-2019,01-01-2019,2019-01-01,13
201902,4.5,211408,373,01-02-2019,01-02-2019,2019-02-01,13
201903,4.5,211408,374,01-03-2019,01-03-2019,2019-03-01,13
201904,6.9899998,211408,375,01-04-2019,01-04-2019,2019-04-01,13
201905,7,211408,376,01-05-2019,01-05-2019,2019-05-01,13
201906,4.5,211408,377,01-06-2019,01-06-2019,2019-06-01,13
201907,7,211408,378,01-07-2019,01-07-2019,2019-07-01,13
201908,7,211408,379,01-08-2019,01-08-2019,2019-08-01,13
201909,7,211408,380,01-09-2019,01-09-2019,2019-09-01,13
201910,5,211408,381,01-10-2019,01-10-2019,2019-10-01,13
201911,5,211408,382,01-11-2019,01-11-2019,2019-11-01,13
201912,5,211408,383,01-12-2019,01-12-2019,2019-12-01,13
202001,5,211408,384,01-01-2020,01-01-2020,2020-01-01,13
202002,5,211408,385,01-02-2020,01-02-2020,2020-02-01,13
202003,5,211408,386,01-03-2020,01-03-2020,2020-03-01,13
202004,5,211408,387,01-04-2020,01-04-2020,2020-04-01,13
202006,5,211408,389,01-06-2020,01-06-2020,2020-06-01,13
202007,5,211408,390,01-07-2020,01-07-2020,2020-07-01,13
202008,5,211408,391,01-08-2020,01-08-2020,2020-08-01,13
202009,4.5,211408,392,01-09-2020,01-09-2020,2020-09-01,13
202010,4.5,211408,393,01-10-2020,01-10-2020,2020-10-01,13
202011,4.5,211408,394,01-11-2020,01-11-2020,2020-11-01,13
202012,4.5,211408,395,01-12-2020,01-12-2020,2020-12-01,13
202101,4.5,211408,396,01-01-2021,01-01-2021,2021-01-01,13
202102,4.5,211408,397,01-02-2021,01-02-2021,2021-02-01,13
202103,4.5,211408,398,01-03-2021,01-03-2021,2021-03-01,13
202104,4.5,211408,399,01-04-2021,01-04-2021,2021-04-01,13
202105,4.5,211408,400,01-05-2021,01-05-2021,2021-05-01,13
202106,4.5,211408,401,01-06-2021,01-06-2021,2021-06-01,13
202107,4.5,211408,402,01-07-2021,01-07-2021,2021-07-01,13
202108,4.5,211408,403,01-08-2021,01-08-2021,2021-08-01,13
202109,4.5,211408,404,01-09-2021,01-09-2021,2021-09-01,13
202110,4.5,211408,405,01-10-2021,01-10-2021,2021-10-01,13
202111,4.5,211408,406,01-11-2021,01-11-2021,2021-11-01,13
202112,4.5,211408,407,01-12-2021,01-12-2021,2021-12-01,13
202201,4.5,211408,408,01-01-2022,01-01-2022,2022-01-01,13
202202,5,211408,409,01-02-2022,01-02-2022,2022-02-01,13
202203,5,211408,410,01-03-2022,01-03-2022,2022-03-01,13
202204,6.5,211408,411,01-04-2022,01-04-2022,2022-04-01,13
202205,6.5,211408,412,01-05-2022,01-05-2022,2022-05-01,13
202206,6.8000002,211408,413,01-06-2022,01-06-2022,2022-06-01,13
202207,6.8000002,211408,414,01-07-2022,01-07-2022,2022-07-01,13
202208,6.8000002,211408,415,01-08-2022,01-08-2022,2022-08-01,13
202209,7,211408,416,01-09-2022,01-09-2022,2022-09-01,13
202210,7,211408,417,01-10-2022,01-10-2022,2022-10-01,13
202211,7,211408,418,01-11-2022,01-11-2022,2022-11-01,13
202212,7,211408,419,01-12-2022,01-12-2022,2022-12-01,13
202301,7,211408,420,01-01-2023,01-01-2023,2023-01-01,13
202302,7,211408,421,01-02-2023,01-02-2023,2023-02-01,13
202303,8,211408,422,01-03-2023,01-03-2023,2023-03-01,13
202304,7.5,211408,423,01-04-2023,01-04-2023,2023-04-01,13
202305,7.5,211408,424,01-05-2023,01-05-2023,2023-05-01,13
202306,7.5,211408,425,01-06-2023,01-06-2023,2023-06-01,13
202307,8.5,211408,426,01-07-2023,01-07-2023,2023-07-01,13
202308,8.5,211408,427,01-08-2023,01-08-2023,2023-08-01,13
202309,8.5,211408,428,01-09-2023,01-09-2023,2023-09-01,13
202310,8.5,211408,429,01-10-2023,01-10-2023,2023-10-01,13
202311,9.75,211408,430,01-11-2023,01-11-2023,2023-11-01,13
202312,9.75,211408,431,01-12-2023,01-12-2023,2023-12-01,13
202401,9.75,211408,432,01-01-2024,01-01-2024,2024-01-01,13
202402,9.75,211408,433,01-02-2024,01-02-2024,2024-02-01,13
202403,9.75,211408,434,01-03-2024,01-03-2024,2024-03-01,13
202404,13,211408,435,01-04-2024,01-04-2024,2024-04-01,13
202405,13,211408,436,01-05-2024,01-05-2024,2024-05-01,13
202406,13,211408,437,01-06-2024,01-06-2024,2024-06-01,13
202407,13,211408,438,01-07-2024,01-07-2024,2024-07-01,13
202408,13,211408,439,01-08-2024,01-08-2024,2024-08-01,13
202409,13,211408,440,01-09-2024,01-09-2024,2024-09-01,13
202410,13,211408,441,01-10-2024,01-10-2024,2024-10-01,13
202411,13,211408,442,01-11-2024,01-11-2024,2024-11-01,13
202412,13,211408,443,01-12-2024,01-12-2024,2024-12-01,13
202501,13,211408,444,01-01-2025,01-01-2025,2025-01-01,13
202502,13,211408,445,01-02-2025,01-02-2025,2025-02-01,13
202503,13,211408,446,01-03-2025,01-03-2025,2025-03-01,13
202504,13,211408,447,01-04-2025,01-04-2025,2025-04-01,13
202505,11.5,211408,448,01-05-2025,01-05-2025,2025-05-01,13
202506,11.5,211408,449,01-06-2025,01-06-2025,2025-06-01,13
202507,11.5,211408,450,01-07-2025,01-07-2025,2025-07-01,13
202508,11.5,211408,451,01-08-2025,01-08-2025,2025-08-01,13
202509,11.5,211408,452,01-09-2025,01-09-2025,2025-09-01,13
200702,5.4899998,211408,229,01-02-2007,01-02-2007,2007-02-01,14
200703,5.4899998,211408,230,01-03-2007,01-03-2007,2007-03-01,14
200704,5.4899998,211408,231,01-04-2007,01-04-2007,2007-04-01,14
200705,5.4899998,211408,232,01-05-2007,01-05-2007,2007-05-01,14
200706,5.4899998,211408,233,01-06-2007,01-06-2007,2007-06-01,14
200707,5.4899998,211408,234,01-07-2007,01-07-2007,2007-07-01,14
200708,5.4899998,211408,235,01-08-2007,01-08-2007,2007-08-01,14
200709,5.4899998,211408,236,01-09-2007,01-09-2007,2007-09-01,14
200710,5.4899998,211408,237,01-10-2007,01-10-2007,2007-10-01,14
200711,4.79,211408,238,01-11-2007,01-11-2007,2007-11-01,14
200712,4.79,211408,239,01-12-2007,01-12-2007,2007-12-01,14
200801,2.3900001,211408,240,01-01-2008,01-01-2008,2008-01-01,14
200802,4.79,211408,241,01-02-2008,01-02-2008,2008-02-01,14
200803,5.4899998,211408,242,01-03-2008,01-03-2008,2008-03-01,14
200804,4.79,211408,243,01-04-2008,01-04-2008,2008-04-01,14
200805,5.4899998,211408,244,01-05-2008,01-05-2008,2008-05-01,14
200806,5.4899998,211408,245,01-06-2008,01-06-2008,2008-06-01,14
200807,5.4899998,211408,246,01-07-2008,01-07-2008,2008-07-01,14
200808,5.4899998,211408,247,01-08-2008,01-08-2008,2008-08-01,14
200809,5.4899998,211408,248,01-09-2008,01-09-2008,2008-09-01,14
200810,5.4899998,211408,249,01-10-2008,01-10-2008,2008-10-01,14
200811,5.4899998,211408,250,01-11-2008,01-11-2008,2008-11-01,14
200812,5.4899998,211408,251,01-12-2008,01-12-2008,2008-12-01,14
200901,2.74,211408,252,01-01-2009,01-01-2009,2009-01-01,14
200902,5.7600002,211408,253,01-02-2009,01-02-2009,2009-02-01,14
200903,5.7600002,211408,254,01-03-2009,01-03-2009,2009-03-01,14
200904,5.7600002,211408,255,01-04-2009,01-04-2009,2009-04-01,14
200905,5.7600002,211408,256,01-05-2009,01-05-2009,2009-05-01,14
200906,5.7600002,211408,257,01-06-2009,01-06-2009,2009-06-01,14
200907,5.7600002,211408,258,01-07-2009,01-07-2009,2009-07-01,14
200908,5.7600002,211408,259,01-08-2009,01-08-2009,2009-08-01,14
200909,5.7600002,211408,260,01-09-2009,01-09-2009,2009-09-01,14
200910,5.7600002,211408,261,01-10-2009,01-10-2009,2009-10-01,14
200911,5.7600002,211408,262,01-11-2009,01-11-2009,2009-11-01,14
200912,5.7600002,211408,263,01-12-2009,01-12-2009,2009-12-01,14
201001,5.7600002,211408,264,01-01-2010,01-01-2010,2010-01-01,14
201002,5.7600002,211408,265,01-02-2010,01-02-2010,2010-02-01,14
201003,5.7600002,211408,266,01-03-2010,01-03-2010,2010-03-01,14
201004,5.7600002,211408,267,01-04-2010,01-04-2010,2010-04-01,14
201005,5.7600002,211408,268,01-05-2010,01-05-2010,2010-05-01,14
201006,3,211408,269,01-06-2010,01-06-2010,2010-06-01,14
201007,5.7600002,211408,270,01-07-2010,01-07-2010,2010-07-01,14
201008,5.7600002,211408,271,01-08-2010,01-08-2010,2010-08-01,14
201009,5.7600002,211408,272,01-09-2010,01-09-2010,2010-09-01,14
201010,5.7600002,211408,273,01-10-2010,01-10-2010,2010-10-01,14
201011,5.7600002,211408,274,01-11-2010,01-11-2010,2010-11-01,14
201012,5.7600002,211408,275,01-12-2010,01-12-2010,2010-12-01,14
201101,2.8800001,211408,276,01-01-2011,01-01-2011,2011-01-01,14
201102,5.7600002,211408,277,01-02-2011,01-02-2011,2011-02-01,14
201103,4.3200002,211408,278,01-03-2011,01-03-2011,2011-03-01,14
201104,5.7600002,211408,279,01-04-2011,01-04-2011,2011-04-01,14
201105,5.1999998,211408,280,01-05-2011,01-05-2011,2011-05-01,14
201106,5.1999998,211408,281,01-06-2011,01-06-2011,2011-06-01,14
201107,5.1999998,211408,282,01-07-2011,01-07-2011,2011-07-01,14
201108,5.5799999,211408,283,01-08-2011,01-08-2011,2011-08-01,14
201109,5.5799999,211408,284,01-09-2011,01-09-2011,2011-09-01,14
201110,5.5799999,211408,285,01-10-2011,01-10-2011,2011-10-01,14
201111,5.5799999,211408,286,01-11-2011,01-11-2011,2011-11-01,14
201112,5.5799999,211408,287,01-12-2011,01-12-2011,2011-12-01,14
201201,2.79,211408,288,01-01-2012,01-01-2012,2012-01-01,14
201202,5.5799999,211408,289,01-02-2012,01-02-2012,2012-02-01,14
201203,5.5799999,211408,290,01-03-2012,01-03-2012,2012-03-01,14
201204,5.5799999,211408,291,01-04-2012,01-04-2012,2012-04-01,14
201205,5.5799999,211408,292,01-05-2012,01-05-2012,2012-05-01,14
201206,3.99,211408,293,01-06-2012,01-06-2012,2012-06-01,14
201207,5.5799999,211408,294,01-07-2012,01-07-2012,2012-07-01,14
201208,5.5799999,211408,295,01-08-2012,01-08-2012,2012-08-01,14
201209,5.5799999,211408,296,01-09-2012,01-09-2012,2012-09-01,14
201210,5.8899999,211408,297,01-10-2012,01-10-2012,2012-10-01,14
201211,5.8899999,211408,298,01-11-2012,01-11-2012,2012-11-01,14
201212,5.8899999,211408,299,01-12-2012,01-12-2012,2012-12-01,14
201301,2.9400001,211408,300,01-01-2013,01-01-2013,2013-01-01,14
201302,5.8899999,211408,301,01-02-2013,01-02-2013,2013-02-01,14
201303,5.8899999,211408,302,01-03-2013,01-03-2013,2013-03-01,14
201304,6.9899998,211408,303,01-04-2013,01-04-2013,2013-04-01,14
201305,6.9899998,211408,304,01-05-2013,01-05-2013,2013-05-01,14
201306,6.4499998,211408,305,01-06-2013,01-06-2013,2013-06-01,14
201307,6.4499998,211408,306,01-07-2013,01-07-2013,2013-07-01,14
201308,6.4499998,211408,307,01-08-2013,01-08-2013,2013-08-01,14
201309,6.4499998,211408,308,01-09-2013,01-09-2013,2013-09-01,14
201310,6.4499998,211408,309,01-10-2013,01-10-2013,2013-10-01,14
201311,6.4499998,211408,310,01-11-2013,01-11-2013,2013-11-01,14
201312,6.4499998,211408,311,01-12-2013,01-12-2013,2013-12-01,14
201401,6.4499998,211408,312,01-01-2014,01-01-2014,2014-01-01,14
201402,6.8000002,211408,313,01-02-2014,01-02-2014,2014-02-01,14
201403,6.8000002,211408,314,01-03-2014,01-03-2014,2014-03-01,14
201404,6.8000002,211408,315,01-04-2014,01-04-2014,2014-04-01,14
201405,6.8000002,211408,316,01-05-2014,01-05-2014,2014-05-01,14
201406,6,211408,317,01-06-2014,01-06-2014,2014-06-01,14
201407,6,211408,318,01-07-2014,01-07-2014,2014-07-01,14
201408,5.9000001,211408,319,01-08-2014,01-08-2014,2014-08-01,14
201409,5.9000001,211408,320,01-09-2014,01-09-2014,2014-09-01,14
201410,5.9000001,211408,321,01-10-2014,01-10-2014,2014-10-01,14
201411,5.9000001,211408,322,01-11-2014,01-11-2014,2014-11-01,14
201412,5.9000001,211408,323,01-12-2014,01-12-2014,2014-12-01,14
201501,5.9000001,211408,324,01-01-2015,01-01-2015,2015-01-01,14
201502,5.9000001,211408,325,01-02-2015,01-02-2015,2015-02-01,14
201503,5.9000001,211408,326,01-03-2015,01-03-2015,2015-03-01,14
201504,5.9000001,211408,327,01-04-2015,01-04-2015,2015-04-01,14
201505,5.9000001,211408,328,01-05-2015,01-05-2015,2015-05-01,14
201506,6.4000001,211408,329,01-06-2015,01-06-2015,2015-06-01,14
201507,6.4000001,211408,330,01-07-2015,01-07-2015,2015-07-01,14
201508,6.4000001,211408,331,01-08-2015,01-08-2015,2015-08-01,14
201509,6.4000001,211408,332,01-09-2015,01-09-2015,2015-09-01,14
201510,6.4000001,211408,333,01-10-2015,01-10-2015,2015-10-01,14
201511,6.4000001,211408,334,01-11-2015,01-11-2015,2015-11-01,14
201512,4.5,211408,335,01-12-2015,01-12-2015,2015-12-01,14
201601,6.4000001,211408,336,01-01-2016,01-01-2016,2016-01-01,14
201602,6.4000001,211408,337,01-02-2016,01-02-2016,2016-02-01,14
201603,6.4000001,211408,338,01-03-2016,01-03-2016,2016-03-01,14
201604,6.4000001,211408,339,01-04-2016,01-04-2016,2016-04-01,14
201605,6.4000001,211408,340,01-05-2016,01-05-2016,2016-05-01,14
201606,6.4000001,211408,341,01-06-2016,01-06-2016,2016-06-01,14
201607,6.4000001,211408,342,01-07-2016,01-07-2016,2016-07-01,14
201608,5,211408,343,01-08-2016,01-08-2016,2016-08-01,14
201609,6.4000001,211408,344,01-09-2016,01-09-2016,2016-09-01,14
201610,6.4000001,211408,345,01-10-2016,01-10-2016,2016-10-01,14
201611,6.4000001,211408,346,01-11-2016,01-11-2016,2016-11-01,14
201612,6.4000001,211408,347,01-12-2016,01-12-2016,2016-12-01,14
201701,6.4000001,211408,348,01-01-2017,01-01-2017,2017-01-01,14
201702,6.25,211408,349,01-02-2017,01-02-2017,2017-02-01,14
201703,6.25,211408,350,01-03-2017,01-03-2017,2017-03-01,14
201704,6,211408,351,01-04-2017,01-04-2017,2017-04-01,14
201705,6.25,211408,352,01-05-2017,01-05-2017,2017-05-01,14
201706,6.25,211408,353,01-06-2017,01-06-2017,2017-06-01,14
201707,6.25,211408,354,01-07-2017,01-07-2017,2017-07-01,14
201708,6.25,211408,355,01-08-2017,01-08-2017,2017-08-01,14
201712,4.25,211408,359,01-12-2017,01-12-2017,2017-12-01,14
201801,5.9499998,211408,360,01-01-2018,01-01-2018,2018-01-01,14
201802,5.9499998,211408,361,01-02-2018,01-02-2018,2018-02-01,14
201803,5.9499998,211408,362,01-03-2018,01-03-2018,2018-03-01,14
201804,5.9499998,211408,363,01-04-2018,01-04-2018,2018-04-01,14
201805,5.9499998,211408,364,01-05-2018,01-05-2018,2018-05-01,14
201806,4.5,211408,365,01-06-2018,01-06-2018,2018-06-01,14
201807,4.5,211408,366,01-07-2018,01-07-2018,2018-07-01,14
201808,4.5,211408,367,01-08-2018,01-08-2018,2018-08-01,14
201809,4.5,211408,368,01-09-2018,01-09-2018,2018-09-01,14
201810,4.5,211408,369,01-10-2018,01-10-2018,2018-10-01,14
201811,4.5,211408,370,01-11-2018,01-11-2018,2018-11-01,14
201812,5.9499998,211408,371,01-12-2018,01-12-2018,2018-12-01,14
201901,5.9499998,211408,372,01-01-2019,01-01-2019,2019-01-01,14
201902,5.9499998,211408,373,01-02-2019,01-02-2019,2019-02-01,14
201903,3.5,211408,374,01-03-2019,01-03-2019,2019-03-01,14
201904,3.5,211408,375,01-04-2019,01-04-2019,2019-04-01,14
201905,5.9499998,211408,376,01-05-2019,01-05-2019,2019-05-01,14
201906,5.9499998,211408,377,01-06-2019,01-06-2019,2019-06-01,14
201907,5.9499998,211408,378,01-07-2019,01-07-2019,2019-07-01,14
201908,5.9499998,211408,379,01-08-2019,01-08-2019,2019-08-01,14
201909,5.9499998,211408,380,01-09-2019,01-09-2019,2019-09-01,14
201910,5.9499998,211408,381,01-10-2019,01-10-2019,2019-10-01,14
201911,5.9499998,211408,382,01-11-2019,01-11-2019,2019-11-01,14
201912,3.5,211408,383,01-12-2019,01-12-2019,2019-12-01,14
202001,5.96,211408,384,01-01-2020,01-01-2020,2020-01-01,14
202002,5.9499998,211408,385,01-02-2020,01-02-2020,2020-02-01,14
202003,2.97,211408,386,01-03-2020,01-03-2020,2020-03-01,14
202004,5.9499998,211408,387,01-04-2020,01-04-2020,2020-04-01,14
202005,5.9499998,211408,388,01-05-2020,01-05-2020,2020-05-01,14
202006,5.9499998,211408,389,01-06-2020,01-06-2020,2020-06-01,14
202007,5.9499998,211408,390,01-07-2020,01-07-2020,2020-07-01,14
202008,5.9499998,211408,391,01-08-2020,01-08-2020,2020-08-01,14
202009,5.9499998,211408,392,01-09-2020,01-09-2020,2020-09-01,14
202010,5.9499998,211408,393,01-10-2020,01-10-2020,2020-10-01,14
202011,5.9499998,211408,394,01-11-2020,01-11-2020,2020-11-01,14
202012,3.5,211408,395,01-12-2020,01-12-2020,2020-12-01,14
202101,5.9499998,211408,396,01-01-2021,01-01-2021,2021-01-01,14
202102,5.9499998,211408,397,01-02-2021,01-02-2021,2021-02-01,14
202103,3.5,211408,398,01-03-2021,01-03-2021,2021-03-01,14
202104,5.9499998,211408,399,01-04-2021,01-04-2021,2021-04-01,14
202105,5.9499998,211408,400,01-05-2021,01-05-2021,2021-05-01,14
202106,5.9499998,211408,401,01-06-2021,01-06-2021,2021-06-01,14
202107,5.9499998,211408,402,01-07-2021,01-07-2021,2021-07-01,14
202108,5.9499998,211408,403,01-08-2021,01-08-2021,2021-08-01,14
202109,4.5,211408,404,01-09-2021,01-09-2021,2021-09-01,14
202110,5.9499998,211408,405,01-10-2021,01-10-2021,2021-10-01,14
202111,5.9499998,211408,406,01-11-2021,01-11-2021,2021-11-01,14
202112,4.5,211408,407,01-12-2021,01-12-2021,2021-12-01,14
202201,6.1999998,211408,408,01-01-2022,01-01-2022,2022-01-01,14
202202,6.1999998,211408,409,01-02-2022,01-02-2022,2022-02-01,14
202203,4.5,211408,410,01-03-2022,01-03-2022,2022-03-01,14
202204,6.1999998,211408,411,01-04-2022,01-04-2022,2022-04-01,14
202205,6.1999998,211408,412,01-05-2022,01-05-2022,2022-05-01,14
202206,6.1999998,211408,413,01-06-2022,01-06-2022,2022-06-01,14
202207,6.1999998,211408,414,01-07-2022,01-07-2022,2022-07-01,14
202208,6.9000001,211408,415,01-08-2022,01-08-2022,2022-08-01,14
202209,5,211408,416,01-09-2022,01-09-2022,2022-09-01,14
202210,6.9000001,211408,417,01-10-2022,01-10-2022,2022-10-01,14
202211,5,211408,418,01-11-2022,01-11-2022,2022-11-01,14
202212,6.9000001,211408,419,01-12-2022,01-12-2022,2022-12-01,14
202301,6.9000001,211408,420,01-01-2023,01-01-2023,2023-01-01,14
202302,6.75,211408,421,01-02-2023,01-02-2023,2023-02-01,14
202303,8.9499998,211408,422,01-03-2023,01-03-2023,2023-03-01,14
202304,6.75,211408,423,01-04-2023,01-04-2023,2023-04-01,14
202305,8.9499998,211408,424,01-05-2023,01-05-2023,2023-05-01,14
202306,8.9499998,211408,425,01-06-2023,01-06-2023,2023-06-01,14
202307,8.9499998,211408,426,01-07-2023,01-07-2023,2023-07-01,14
202308,10.35,211408,427,01-08-2023,01-08-2023,2023-08-01,14
202309,10.35,211408,428,01-09-2023,01-09-2023,2023-09-01,14
202310,10.35,211408,429,01-10-2023,01-10-2023,2023-10-01,14
202311,10.35,211408,430,01-11-2023,01-11-2023,2023-11-01,14
202312,10.35,211408,431,01-12-2023,01-12-2023,2023-12-01,14
202401,10.35,211408,432,01-01-2024,01-01-2024,2024-01-01,14
202402,10.35,211408,433,01-02-2024,01-02-2024,2024-02-01,14
202403,10.35,211408,434,01-03-2024,01-03-2024,2024-03-01,14
202404,11.9,211408,435,01-04-2024,01-04-2024,2024-04-01,14
202405,11.9,211408,436,01-05-2024,01-05-2024,2024-05-01,14
202406,11.9,211408,437,01-06-2024,01-06-2024,2024-06-01,14
202407,11.9,211408,438,01-07-2024,01-07-2024,2024-07-01,14
202408,9.9499998,211408,439,01-08-2024,01-08-2024,2024-08-01,14
202409,9.9499998,211408,440,01-09-2024,01-09-2024,2024-09-01,14
202410,9.9499998,211408,441,01-10-2024,01-10-2024,2024-10-01,14
202411,9.9499998,211408,442,01-11-2024,01-11-2024,2024-11-01,14
202412,8.9499998,211408,443,01-12-2024,01-12-2024,2024-12-01,14
202501,8.9499998,211408,444,01-01-2025,01-01-2025,2025-01-01,14
202502,8.9499998,211408,445,01-02-2025,01-02-2025,2025-02-01,14
202503,8.9499998,211408,446,01-03-2025,01-03-2025,2025-03-01,14
202504,8.9499998,211408,447,01-04-2025,01-04-2025,2025-04-01,14
202505,8,211408,448,01-05-2025,01-05-2025,2025-05-01,14
202506,8,211408,449,01-06-2025,01-06-2025,2025-06-01,14
202507,8,211408,450,01-07-2025,01-07-2025,2025-07-01,14
202508,8,211408,451,01-08-2025,01-08-2025,2025-08-01,14
202509,8,211408,452,01-09-2025,01-09-2025,2025-09-01,14
200702,4.1500001,211408,229,01-02-2007,01-02-2007,2007-02-01,15
200703,4.1500001,211408,230,01-03-2007,01-03-2007,2007-03-01,15
200704,4.1500001,211408,231,01-04-2007,01-04-2007,2007-04-01,15
200705,4.1500001,211408,232,01-05-2007,01-05-2007,2007-05-01,15
200706,4.1500001,211408,233,01-06-2007,01-06-2007,2007-06-01,15
200707,4.1500001,211408,234,01-07-2007,01-07-2007,2007-07-01,15
200708,4.1500001,211408,235,01-08-2007,01-08-2007,2007-08-01,15
200709,4.1500001,211408,236,01-09-2007,01-09-2007,2007-09-01,15
200710,4.1500001,211408,237,01-10-2007,01-10-2007,2007-10-01,15
200711,4.1500001,211408,238,01-11-2007,01-11-2007,2007-11-01,15
200712,4.1500001,211408,239,01-12-2007,01-12-2007,2007-12-01,15
200801,4.1500001,211408,240,01-01-2008,01-01-2008,2008-01-01,15
200802,4.1500001,211408,241,01-02-2008,01-02-2008,2008-02-01,15
200803,4.1500001,211408,242,01-03-2008,01-03-2008,2008-03-01,15
200804,4.1500001,211408,243,01-04-2008,01-04-2008,2008-04-01,15
200805,4.1500001,211408,244,01-05-2008,01-05-2008,2008-05-01,15
200806,4.1500001,211408,245,01-06-2008,01-06-2008,2008-06-01,15
200807,4.1500001,211408,246,01-07-2008,01-07-2008,2008-07-01,15
200808,4.1500001,211408,247,01-08-2008,01-08-2008,2008-08-01,15
200809,4.1500001,211408,248,01-09-2008,01-09-2008,2008-09-01,15
200810,4.1500001,211408,249,01-10-2008,01-10-2008,2008-10-01,15
200811,4.1500001,211408,250,01-11-2008,01-11-2008,2008-11-01,15
200812,4.1500001,211408,251,01-12-2008,01-12-2008,2008-12-01,15
200901,4.1500001,211408,252,01-01-2009,01-01-2009,2009-01-01,15
200902,4.1500001,211408,253,01-02-2009,01-02-2009,2009-02-01,15
200903,4.1500001,211408,254,01-03-2009,01-03-2009,2009-03-01,15
200904,4.1500001,211408,255,01-04-2009,01-04-2009,2009-04-01,15
200905,4.0500002,211408,256,01-05-2009,01-05-2009,2009-05-01,15
200906,4.1500001,211408,257,01-06-2009,01-06-2009,2009-06-01,15
200907,4.0999999,211408,258,01-07-2009,01-07-2009,2009-07-01,15
200908,4.0999999,211408,259,01-08-2009,01-08-2009,2009-08-01,15
200909,4.1500001,211408,260,01-09-2009,01-09-2009,2009-09-01,15
200910,4.1500001,211408,261,01-10-2009,01-10-2009,2009-10-01,15
200911,4.1500001,211408,262,01-11-2009,01-11-2009,2009-11-01,15
200912,4.1500001,211408,263,01-12-2009,01-12-2009,2009-12-01,15
201002,5.7600002,211408,265,01-02-2010,01-02-2010,2010-02-01,15
201003,5.7600002,211408,266,01-03-2010,01-03-2010,2010-03-01,15
201004,5.7600002,211408,267,01-04-2010,01-04-2010,2010-04-01,15
201005,5.7600002,211408,268,01-05-2010,01-05-2010,2010-05-01,15
201006,5.7600002,211408,269,01-06-2010,01-06-2010,2010-06-01,15
201007,5.7600002,211408,270,01-07-2010,01-07-2010,2010-07-01,15
201008,5.7600002,211408,271,01-08-2010,01-08-2010,2010-08-01,15
201009,5.7600002,211408,272,01-09-2010,01-09-2010,2010-09-01,15
201010,4.6100001,211408,273,01-10-2010,01-10-2010,2010-10-01,15
201011,5.7600002,211408,274,01-11-2010,01-11-2010,2010-11-01,15
201012,5.7600002,211408,275,01-12-2010,01-12-2010,2010-12-01,15
201101,5.7600002,211408,276,01-01-2011,01-01-2011,2011-01-01,15
201102,5.7600002,211408,277,01-02-2011,01-02-2011,2011-02-01,15
201103,5.7600002,211408,278,01-03-2011,01-03-2011,2011-03-01,15
201104,5.1999998,211408,279,01-04-2011,01-04-2011,2011-04-01,15
201105,5.1999998,211408,280,01-05-2011,01-05-2011,2011-05-01,15
201106,5,211408,281,01-06-2011,01-06-2011,2011-06-01,15
201107,5.5799999,211408,282,01-07-2011,01-07-2011,2011-07-01,15
201108,5.5799999,211408,283,01-08-2011,01-08-2011,2011-08-01,15
201109,5.5799999,211408,284,01-09-2011,01-09-2011,2011-09-01,15
201110,5.5799999,211408,285,01-10-2011,01-10-2011,2011-10-01,15
201111,5.5799999,211408,286,01-11-2011,01-11-2011,2011-11-01,15
201112,5.5799999,211408,287,01-12-2011,01-12-2011,2011-12-01,15
201201,2.79,211408,288,01-01-2012,01-01-2012,2012-01-01,15
201202,5.8899999,211408,289,01-02-2012,01-02-2012,2012-02-01,15
201203,5.8899999,211408,290,01-03-2012,01-03-2012,2012-03-01,15
201204,5.8899999,211408,291,01-04-2012,01-04-2012,2012-04-01,15
201205,5.8899999,211408,292,01-05-2012,01-05-2012,2012-05-01,15
201206,5.8899999,211408,293,01-06-2012,01-06-2012,2012-06-01,15
201207,5.8899999,211408,294,01-07-2012,01-07-2012,2012-07-01,15
201208,5.8899999,211408,295,01-08-2012,01-08-2012,2012-08-01,15
201209,2.9400001,211408,296,01-09-2012,01-09-2012,2012-09-01,15
201210,2.9400001,211408,297,01-10-2012,01-10-2012,2012-10-01,15
201211,2.9400001,211408,298,01-11-2012,01-11-2012,2012-11-01,15
201212,5.8899999,211408,299,01-12-2012,01-12-2012,2012-12-01,15
201301,2.9400001,211408,300,01-01-2013,01-01-2013,2013-01-01,15
201302,5.8899999,211408,301,01-02-2013,01-02-2013,2013-02-01,15
201303,4.3899999,211408,302,01-03-2013,01-03-2013,2013-03-01,15
201304,6.9899998,211408,303,01-04-2013,01-04-2013,2013-04-01,15
201305,6.9899998,211408,304,01-05-2013,01-05-2013,2013-05-01,15
201306,7.25,211408,305,01-06-2013,01-06-2013,2013-06-01,15
201307,7.25,211408,306,01-07-2013,01-07-2013,2013-07-01,15
201308,7.25,211408,307,01-08-2013,01-08-2013,2013-08-01,15
201309,3.75,211408,308,01-09-2013,01-09-2013,2013-09-01,15
201310,7.5,211408,309,01-10-2013,01-10-2013,2013-10-01,15
201311,7.25,211408,310,01-11-2013,01-11-2013,2013-11-01,15
201312,7.25,211408,311,01-12-2013,01-12-2013,2013-12-01,15
201401,3.6199999,211408,312,01-01-2014,01-01-2014,2014-01-01,15
201402,7.25,211408,313,01-02-2014,01-02-2014,2014-02-01,15
201403,3,211408,314,01-03-2014,01-03-2014,2014-03-01,15
201404,6,211408,315,01-04-2014,01-04-2014,2014-04-01,15
201405,5.7600002,211408,316,01-05-2014,01-05-2014,2014-05-01,15
201406,6,211408,317,01-06-2014,01-06-2014,2014-06-01,15
201407,6,211408,318,01-07-2014,01-07-2014,2014-07-01,15
201408,6,211408,319,01-08-2014,01-08-2014,2014-08-01,15
201409,6.25,211408,320,01-09-2014,01-09-2014,2014-09-01,15
201410,5.9000001,211408,321,01-10-2014,01-10-2014,2014-10-01,15
201411,5.9000001,211408,322,01-11-2014,01-11-2014,2014-11-01,15
201412,5.9000001,211408,323,01-12-2014,01-12-2014,2014-12-01,15
201501,5.9000001,211408,324,01-01-2015,01-01-2015,2015-01-01,15
201502,5.9000001,211408,325,01-02-2015,01-02-2015,2015-02-01,15
201503,2.95,211408,326,01-03-2015,01-03-2015,2015-03-01,15
201504,5.9000001,211408,327,01-04-2015,01-04-2015,2015-04-01,15
201505,5.9000001,211408,328,01-05-2015,01-05-2015,2015-05-01,15
201506,3.9300001,211408,329,01-06-2015,01-06-2015,2015-06-01,15
201507,6.8000002,211408,330,01-07-2015,01-07-2015,2015-07-01,15
201508,6.8000002,211408,331,01-08-2015,01-08-2015,2015-08-01,15
201509,6.8000002,211408,332,01-09-2015,01-09-2015,2015-09-01,15
201510,6.8000002,211408,333,01-10-2015,01-10-2015,2015-10-01,15
201511,6.8000002,211408,334,01-11-2015,01-11-2015,2015-11-01,15
201512,6.8000002,211408,335,01-12-2015,01-12-2015,2015-12-01,15
201601,6.8000002,211408,336,01-01-2016,01-01-2016,2016-01-01,15
201602,6.8000002,211408,337,01-02-2016,01-02-2016,2016-02-01,15
201603,4.5300002,211408,338,01-03-2016,01-03-2016,2016-03-01,15
201604,4.5300002,211408,339,01-04-2016,01-04-2016,2016-04-01,15
201605,6.8000002,211408,340,01-05-2016,01-05-2016,2016-05-01,15
201606,6.9000001,211408,341,01-06-2016,01-06-2016,2016-06-01,15
201607,5,211408,342,01-07-2016,01-07-2016,2016-07-01,15
201608,6.9000001,211408,343,01-08-2016,01-08-2016,2016-08-01,15
201609,6.9000001,211408,344,01-09-2016,01-09-2016,2016-09-01,15
201610,6.9000001,211408,345,01-10-2016,01-10-2016,2016-10-01,15
201611,5.1700001,211408,346,01-11-2016,01-11-2016,2016-11-01,15
201612,6.9000001,211408,347,01-12-2016,01-12-2016,2016-12-01,15
201701,6.9000001,211408,348,01-01-2017,01-01-2017,2017-01-01,15
201702,6.9000001,211408,349,01-02-2017,01-02-2017,2017-02-01,15
201703,6.9000001,211408,350,01-03-2017,01-03-2017,2017-03-01,15
201704,6.9000001,211408,351,01-04-2017,01-04-2017,2017-04-01,15
201705,5.1700001,211408,352,01-05-2017,01-05-2017,2017-05-01,15
201706,6.9000001,211408,353,01-06-2017,01-06-2017,2017-06-01,15
201707,6.9000001,211408,354,01-07-2017,01-07-2017,2017-07-01,15
201708,6.9000001,211408,355,01-08-2017,01-08-2017,2017-08-01,15
201709,6.9000001,211408,356,01-09-2017,01-09-2017,2017-09-01,15
201710,6.9000001,211408,357,01-10-2017,01-10-2017,2017-10-01,15
201711,6.9000001,211408,358,01-11-2017,01-11-2017,2017-11-01,15
201712,6.9000001,211408,359,01-12-2017,01-12-2017,2017-12-01,15
201801,7.0999999,211408,360,01-01-2018,01-01-2018,2018-01-01,15
201802,7.0999999,211408,361,01-02-2018,01-02-2018,2018-02-01,15
201803,7.0999999,211408,362,01-03-2018,01-03-2018,2018-03-01,15
201804,7.0999999,211408,363,01-04-2018,01-04-2018,2018-04-01,15
201805,7.0999999,211408,364,01-05-2018,01-05-2018,2018-05-01,15
201806,7.0999999,211408,365,01-06-2018,01-06-2018,2018-06-01,15
201807,7.0999999,211408,366,01-07-2018,01-07-2018,2018-07-01,15
201808,7.0999999,211408,367,01-08-2018,01-08-2018,2018-08-01,15
201809,7.0999999,211408,368,01-09-2018,01-09-2018,2018-09-01,15
201810,5.3200002,211408,369,01-10-2018,01-10-2018,2018-10-01,15
201811,7.0999999,211408,370,01-11-2018,01-11-2018,2018-11-01,15
201812,7.0999999,211408,371,01-12-2018,01-12-2018,2018-12-01,15
201901,7.0999999,211408,372,01-01-2019,01-01-2019,2019-01-01,15
201902,7.0999999,211408,373,01-02-2019,01-02-2019,2019-02-01,15
201903,7.0999999,211408,374,01-03-2019,01-03-2019,2019-03-01,15
201904,7.0999999,211408,375,01-04-2019,01-04-2019,2019-04-01,15
201905,7.0999999,211408,376,01-05-2019,01-05-2019,2019-05-01,15
201906,7.0999999,211408,377,01-06-2019,01-06-2019,2019-06-01,15
201907,7.0999999,211408,378,01-07-2019,01-07-2019,2019-07-01,15
201908,7.0999999,211408,379,01-08-2019,01-08-2019,2019-08-01,15
201909,8,211408,380,01-09-2019,01-09-2019,2019-09-01,15
201910,8,211408,381,01-10-2019,01-10-2019,2019-10-01,15
201911,8,211408,382,01-11-2019,01-11-2019,2019-11-01,15
201912,6,211408,383,01-12-2019,01-12-2019,2019-12-01,15
202001,8,211408,384,01-01-2020,01-01-2020,2020-01-01,15
202002,8,211408,385,01-02-2020,01-02-2020,2020-02-01,15
202003,8,211408,386,01-03-2020,01-03-2020,2020-03-01,15
202004,8,211408,387,01-04-2020,01-04-2020,2020-04-01,15
202005,8,211408,388,01-05-2020,01-05-2020,2020-05-01,15
202006,8,211408,389,01-06-2020,01-06-2020,2020-06-01,15
202007,5.3299999,211408,390,01-07-2020,01-07-2020,2020-07-01,15
202008,8,211408,391,01-08-2020,01-08-2020,2020-08-01,15
202009,8,211408,392,01-09-2020,01-09-2020,2020-09-01,15
202010,8,211408,393,01-10-2020,01-10-2020,2020-10-01,15
202011,8,211408,394,01-11-2020,01-11-2020,2020-11-01,15
202012,8,211408,395,01-12-2020,01-12-2020,2020-12-01,15
202101,5.3299999,211408,396,01-01-2021,01-01-2021,2021-01-01,15
202102,8,211408,397,01-02-2021,01-02-2021,2021-02-01,15
202103,8,211408,398,01-03-2021,01-03-2021,2021-03-01,15
202104,8,211408,399,01-04-2021,01-04-2021,2021-04-01,15
202105,8,211408,400,01-05-2021,01-05-2021,2021-05-01,15
202106,8,211408,401,01-06-2021,01-06-2021,2021-06-01,15
202107,8,211408,402,01-07-2021,01-07-2021,2021-07-01,15
202108,8,211408,403,01-08-2021,01-08-2021,2021-08-01,15
202109,8,211408,404,01-09-2021,01-09-2021,2021-09-01,15
202110,8,211408,405,01-10-2021,01-10-2021,2021-10-01,15
202111,8,211408,406,01-11-2021,01-11-2021,2021-11-01,15
202112,5.5,211408,407,01-12-2021,01-12-2021,2021-12-01,15
202201,8,211408,408,01-01-2022,01-01-2022,2022-01-01,15
202202,8.3500004,211408,409,01-02-2022,01-02-2022,2022-02-01,15
202203,8.3500004,211408,410,01-03-2022,01-03-2022,2022-03-01,15
202204,5.5,211408,411,01-04-2022,01-04-2022,2022-04-01,15
202205,8.75,211408,412,01-05-2022,01-05-2022,2022-05-01,15
202206,8.75,211408,413,01-06-2022,01-06-2022,2022-06-01,15
202207,8.75,211408,414,01-07-2022,01-07-2022,2022-07-01,15
202208,8.75,211408,415,01-08-2022,01-08-2022,2022-08-01,15
202209,8.75,211408,416,01-09-2022,01-09-2022,2022-09-01,15
202210,8.75,211408,417,01-10-2022,01-10-2022,2022-10-01,15
202211,8.75,211408,418,01-11-2022,01-11-2022,2022-11-01,15
202212,6,211408,419,01-12-2022,01-12-2022,2022-12-01,15
202301,10,211408,420,01-01-2023,01-01-2023,2023-01-01,15
202302,10,211408,421,01-02-2023,01-02-2023,2023-02-01,15
202303,10,211408,422,01-03-2023,01-03-2023,2023-03-01,15
202304,10.9,211408,423,01-04-2023,01-04-2023,2023-04-01,15
202305,10.9,211408,424,01-05-2023,01-05-2023,2023-05-01,15
202306,10.9,211408,425,01-06-2023,01-06-2023,2023-06-01,15
202307,8.75,211408,426,01-07-2023,01-07-2023,2023-07-01,15
202308,12.65,211408,427,01-08-2023,01-08-2023,2023-08-01,15
202309,12.65,211408,428,01-09-2023,01-09-2023,2023-09-01,15
202310,10.5,211408,429,01-10-2023,01-10-2023,2023-10-01,15
202311,12.65,211408,430,01-11-2023,01-11-2023,2023-11-01,15
202312,12.65,211408,431,01-12-2023,01-12-2023,2023-12-01,15
202401,13.75,211408,432,01-01-2024,01-01-2024,2024-01-01,15
202402,13.75,211408,433,01-02-2024,01-02-2024,2024-02-01,15
202403,13.75,211408,434,01-03-2024,01-03-2024,2024-03-01,15
202404,11,211408,435,01-04-2024,01-04-2024,2024-04-01,15
202405,15.95,211408,436,01-05-2024,01-05-2024,2024-05-01,15
202406,15.95,211408,437,01-06-2024,01-06-2024,2024-06-01,15
202410,13.65,211408,441,01-10-2024,01-10-2024,2024-10-01,15
202411,12.25,211408,442,01-11-2024,01-11-2024,2024-11-01,15
202412,12.25,211408,443,01-12-2024,01-12-2024,2024-12-01,15
202501,8.9499998,211408,444,01-01-2025,01-01-2025,2025-01-01,15
202502,12.25,211408,445,01-02-2025,01-02-2025,2025-02-01,15
202503,12.25,211408,446,01-03-2025,01-03-2025,2025-03-01,15
202504,12.25,211408,447,01-04-2025,01-04-2025,2025-04-01,15
202505,7,211408,448,01-05-2025,01-05-2025,2025-05-01,15
202506,12.25,211408,449,01-06-2025,01-06-2025,2025-06-01,15
202507,12.25,211408,450,01-07-2025,01-07-2025,2025-07-01,15
202508,12.25,211408,451,01-08-2025,01-08-2025,2025-08-01,15
202509,6.5,211408,452,01-09-2025,01-09-2025,2025-09-01,15
